,Date,News Headline,Article Link,Source
0,2022-01-20 15:02,Byline Bancorp (BY) Earnings Expected to Grow: What to Know Ahead of Next Week's Release,https://finance.yahoo.com/news/byline-bancorp-earnings-expected-grow-200208872.html,Zacks
1,2022-01-07 07:45,"Byline Bancorp, Inc. to Announce Fourth Quarter 2021 Financial Results on Thursday, January 27",https://finance.yahoo.com/news/byline-bancorp-inc-announce-fourth-124500978.html,Business Wire
2,2022-01-02 07:16,"With EPS Growth And More, Byline Bancorp (NYSE:BY) Is Interesting",https://finance.yahoo.com/news/eps-growth-more-byline-bancorp-121620920.html,Simply Wall St.
3,2021-12-10 17:01,Byline Bank Announces Plan to Consolidate Six Branches and Disposition of Real Estate,https://finance.yahoo.com/news/byline-bank-announces-plan-consolidate-220100457.html,Business Wire
4,2021-11-16 08:23,Top 10 Stock Picks of Anton Schutzs Mendon Capital,https://finance.yahoo.com/news/top-10-stock-picks-anton-132303693.html,Insider Monkey
5,2021-11-13 08:49,Anton Schutzs Mendon Capital Advisors Portfolio: Top 10 Finance Stocks,https://finance.yahoo.com/news/anton-schutz-mendon-capital-advisors-134955740.html,Insider Monkey
6,2021-11-03 06:14,"Four Days Left To Buy Byline Bancorp, Inc. (NYSE:BY) Before The Ex-Dividend Date",https://finance.yahoo.com/news/four-days-left-buy-byline-101407538.html,Simply Wall St.
7,2021-10-28 19:15,Byline Bancorp (BY) Beats Q3 Earnings and Revenue Estimates,https://finance.yahoo.com/news/byline-bancorp-beats-q3-earnings-231511718.html,Zacks
8,2021-10-28 16:15,"Byline Bancorp, Inc. Reports Third Quarter 2021 Financial Results",https://finance.yahoo.com/news/byline-bancorp-inc-reports-third-201500774.html,Business Wire
9,2021-10-21 15:02,Byline Bancorp (BY) Reports Next Week: Wall Street Expects Earnings Growth,https://finance.yahoo.com/news/byline-bancorp-reports-next-week-190207893.html,Zacks
10,2021-10-08 07:25,"Byline Bancorp, Inc. to Announce Third Quarter 2021 Financial Results on Thursday, October 28",https://finance.yahoo.com/news/byline-bancorp-inc-announce-third-112500340.html,Business Wire
11,2021-10-03 09:25,"Could The Byline Bancorp, Inc. (NYSE:BY) Ownership Structure Tell Us Something Useful?",https://finance.yahoo.com/news/could-byline-bancorp-inc-nyse-132505128.html,Simply Wall St.
12,2021-09-30 06:57,"Zacks.com featured highlights include: AutoNation, Byline Bancorp, Kinder Morgan and Echo Global Logistics",https://finance.yahoo.com/news/zacks-com-featured-highlights-autonation-105710792.html,Zacks
13,2021-09-29 08:23,4 Top-Ranked Momentum Picks Using Driehaus Strategy,https://finance.yahoo.com/news/4-top-ranked-momentum-picks-122312432.html,Zacks
14,2021-09-28 12:45,Byline Bancorp (BY) is an Incredible Growth Stock: 3 Reasons Why,https://finance.yahoo.com/news/byline-bancorp-incredible-growth-stock-164504274.html,Zacks
15,2021-09-28 12:00,Byline Bancorp (BY) Is Up 3.7% in One Week: What You Should Know,https://finance.yahoo.com/news/byline-bancorp-3-7-one-160004306.html,Zacks
16,2021-09-23 12:00,Byline Bancorp (BY) Moves to Strong Buy: Rationale Behind the Upgrade,https://finance.yahoo.com/news/byline-bancorp-moves-strong-buy-160004825.html,Zacks
17,2021-09-10 10:52,New Strong Buy Stocks for September 10th,https://finance.yahoo.com/news/strong-buy-stocks-september-10th-145202922.html,Zacks
18,2021-09-09 12:45,3 Reasons Why Growth Investors Shouldn't Overlook Byline Bancorp (BY),https://finance.yahoo.com/news/3-reasons-why-growth-investors-164504540.html,Zacks
19,2021-08-20 12:00,Are You Looking for a Top Momentum Pick? Why Byline Bancorp (BY) is a Great Choice,https://finance.yahoo.com/news/looking-top-momentum-pick-why-160004184.html,Zacks
20,2021-08-10 12:20,Earnings Estimates Moving Higher for Byline Bancorp (BY): Time to Buy?,https://finance.yahoo.com/news/earnings-estimates-moving-higher-byline-162004268.html,Zacks
21,2021-08-09 09:13,Top Ranked Momentum Stocks to Buy for August 9th,https://finance.yahoo.com/news/top-ranked-momentum-stocks-buy-131301713.html,Zacks
22,2021-08-04 12:00,Are You Looking for a Top Momentum Pick? Why Byline Bancorp (BY) is a Great Choice,https://finance.yahoo.com/news/looking-top-momentum-pick-why-160004088.html,Zacks
23,2021-08-04 01:17,"Byline Bancorp, Inc. (NYSE:BY) Goes Ex-Dividend Soon",https://finance.yahoo.com/news/byline-bancorp-inc-nyse-goes-051737419.html,Simply Wall St.
24,2021-07-29 19:55,Byline Bancorp (BY) Q2 Earnings and Revenues Surpass Estimates,https://finance.yahoo.com/news/byline-bancorp-q2-earnings-revenues-235511112.html,Zacks
25,2021-07-29 16:15,"Byline Bancorp, Inc. Reports Second Quarter 2021 Financial Results",https://finance.yahoo.com/news/byline-bancorp-inc-reports-second-201500478.html,Business Wire
26,2021-07-22 15:03,Byline Bancorp (BY) Earnings Expected to Grow: Should You Buy?,https://finance.yahoo.com/news/byline-bancorp-earnings-expected-grow-190307388.html,Zacks
27,2021-07-09 02:28,Here's Why We Think Byline Bancorp (NYSE:BY) Is Well Worth Watching,https://finance.yahoo.com/news/heres-why-think-byline-bancorp-062848136.html,Simply Wall St.
28,2021-07-08 08:00,"Byline Bancorp, Inc. to Announce Second Quarter 2021 Financial Results on Thursday, July 29",https://finance.yahoo.com/news/byline-bancorp-inc-announce-second-120000571.html,Business Wire
29,2021-06-28 11:40,BY or SBNY: Which Is the Better Value Stock Right Now?,https://finance.yahoo.com/news/sbny-better-value-stock-now-154003886.html,Zacks
30,2021-06-11 11:40,BY vs. SBNY: Which Stock Is the Better Value Option?,https://finance.yahoo.com/news/vs-sbny-stock-better-value-154003411.html,Zacks
31,2021-06-08 08:50,Why You Shouldn't Bet Against Byline Bancorp (BY) Stock,https://finance.yahoo.com/news/why-shouldnt-bet-against-byline-125012759.html,Zacks
32,2021-05-19 12:20,Earnings Estimates Moving Higher for Byline Bancorp (BY): Time to Buy?,https://finance.yahoo.com/news/earnings-estimates-moving-higher-byline-162004627.html,Zacks
33,2021-05-05 01:29,"Just Four Days Till Byline Bancorp, Inc. (NYSE:BY) Will Be Trading Ex-Dividend",https://finance.yahoo.com/news/just-four-days-till-byline-052939471.html,Simply Wall St.
34,2021-04-29 18:50,Byline Bancorp (BY) Q1 Earnings and Revenues Surpass Estimates,https://finance.yahoo.com/news/byline-bancorp-q1-earnings-revenues-225010679.html,Zacks
35,2021-04-29 16:05,"Byline Bancorp, Inc. Reports First Quarter 2021 Financial Results",https://finance.yahoo.com/news/byline-bancorp-inc-reports-first-200500903.html,Business Wire
36,2021-04-22 12:33,Byline Bancorp (BY) Earnings Expected to Grow: Should You Buy?,https://finance.yahoo.com/news/byline-bancorp-earnings-expected-grow-163304157.html,Zacks
37,2021-04-07 08:00,"Byline Bancorp, Inc. to Announce First Quarter 2021 Financial Results on Thursday, April 29",https://finance.yahoo.com/news/byline-bancorp-inc-announce-first-120000091.html,Business Wire
38,2021-03-31 09:50,Is Byline Bancorp (BY) a Suitable Pick for Value Investors?,https://finance.yahoo.com/news/byline-bancorp-suitable-pick-value-135001837.html,Zacks
39,2021-03-19 01:39,"Is Byline Bancorp, Inc. (NYSE:BY) Popular Amongst Insiders?",https://finance.yahoo.com/news/byline-bancorp-inc-nyse-popular-053952919.html,Simply Wall St.
40,2021-03-12 08:42,How Byline Bancorp (BY) Stock Stands Out in a Strong Industry,https://finance.yahoo.com/news/byline-bancorp-stock-stands-strong-134201398.html,Zacks
41,2021-02-12 12:00,What Makes Byline Bancorp (BY) a New Strong Buy Stock,https://finance.yahoo.com/news/makes-byline-bancorp-strong-buy-170005741.html,Zacks
42,2021-02-09 12:06,Will Byline Bancorp (BY) Continue to Surge Higher?,https://finance.yahoo.com/news/byline-bancorp-continue-surge-higher-170605799.html,Zacks
43,2021-02-05 10:15,Ex-Dividend Date Insight: Byline Bancorp,https://finance.yahoo.com/news/ex-dividend-date-insight-byline-151515574.html,Benzinga
44,2021-02-03 12:20,Will Byline Bancorp (BY) Gain on Rising Earnings Estimates?,https://finance.yahoo.com/news/byline-bancorp-gain-rising-earnings-172005439.html,Zacks
45,2021-01-29 08:15,"Byline Bancorp, Inc. to Host Earnings Call",https://finance.yahoo.com/news/byline-bancorp-inc-host-earnings-131500018.html,ACCESSWIRE
46,2021-01-28 18:15,Byline Bancorp (BY) Q4 Earnings and Revenues Top Estimates,https://finance.yahoo.com/news/byline-bancorp-q4-earnings-revenues-231511266.html,Zacks
47,2021-01-28 17:28,Recap: Byline Bancorp Q4 Earnings,https://finance.yahoo.com/news/recap-byline-bancorp-q4-earnings-222846170.html,Benzinga
48,2021-01-28 16:48,"Byline Bancorp, Inc. Reports Full Year and Fourth Quarter 2020 Financial Results",https://finance.yahoo.com/news/byline-bancorp-inc-reports-full-214800392.html,Business Wire
49,2021-01-27 11:40,BY vs. PGC: Which Stock Is the Better Value Option?,https://finance.yahoo.com/news/vs-pgc-stock-better-value-164004884.html,Zacks
50,2021-01-27 10:18,Preview: Byline Bancorp's Earnings,https://finance.yahoo.com/news/preview-byline-bancorps-earnings-151821469.html,Benzinga
51,2021-01-06 08:00,"Byline Bancorp, Inc. to Announce Fourth Quarter 2020 Financial Results on Thursday, January 28",https://finance.yahoo.com/news/byline-bancorp-inc-announce-fourth-130000929.html,Business Wire
52,2020-12-23 08:46,Independent Bank (IBCP) to Buy Back Shares: Is it Worth a Look?,https://finance.yahoo.com/news/independent-bank-ibcp-buy-back-134601874.html,Zacks
53,2020-12-19 01:59,How Is Byline Bancorp's (NYSE:BY) CEO Paid Relative To Peers?,https://finance.yahoo.com/news/byline-bancorps-nyse-ceo-paid-065947617.html,Simply Wall St.
54,2020-12-18 10:12,Analyzing Byline Bancorp's Ex-Dividend Date,https://finance.yahoo.com/news/analyzing-byline-bancorps-ex-dividend-151223611.html,Benzinga
55,2020-12-14 09:13,Byline Bancorp (BY) Rewards Shareholders With New Buyback Plan,https://finance.yahoo.com/news/byline-bancorp-rewards-shareholders-buyback-141302035.html,Zacks
56,2020-12-11 08:00,Byline Bancorp Announces Approval of New Stock Repurchase Program,https://finance.yahoo.com/news/byline-bancorp-announces-approval-stock-130000992.html,Business Wire
57,2020-12-10 17:46,Byline Bancorp Declares Cash Dividend,https://finance.yahoo.com/news/byline-bancorp-declares-cash-dividend-224600797.html,Business Wire
58,2020-12-04 08:33,Is Byline Bancorp (BY) A Good Stock To Buy Now?,https://finance.yahoo.com/news/byline-bancorp-good-stock-buy-133320096.html,Insider Monkey
59,2020-10-23 18:00,"Byline Bancorp, Inc. (BY) Q3 2020 Earnings Call Transcript",https://www.fool.com/earnings/call-transcripts/2020/10/23/byline-bancorp-inc-by-q3-2020-earnings-call-transc/?source=eptyholnk0000202&utm_source=yahoo-host&utm_medium=feed&utm_campaign=article,Motley Fool
60,2020-10-22 17:55,Byline Bancorp (BY) Q3 Earnings and Revenues Top Estimates,https://finance.yahoo.com/news/byline-bancorp-q3-earnings-revenues-215509413.html,Zacks
61,2020-10-22 16:56,Recap: Byline Bancorp Q3 Earnings,https://finance.yahoo.com/news/recap-byline-bancorp-q3-earnings-205638003.html,Benzinga
62,2020-10-22 16:27,"Byline Bancorp, Inc. Reports Third Quarter 2020 Financial Results",https://finance.yahoo.com/news/byline-bancorp-inc-reports-third-202700503.html,Business Wire
63,2020-10-15 12:31,Earnings Preview: Byline Bancorp (BY) Q3 Earnings Expected to Decline,https://finance.yahoo.com/news/earnings-preview-byline-bancorp-q3-163104032.html,Zacks
64,2020-10-09 16:15,"Byline Bancorp, Inc. to Announce Third Quarter 2020 Financial Results on Thursday, October 22",https://finance.yahoo.com/news/byline-bancorp-inc-announce-third-201500229.html,Business Wire
65,2020-09-21 09:19,Byline Bancorp to Consolidate Branches Amid Digitalization Shift,https://finance.yahoo.com/news/byline-bancorp-consolidate-branches-amid-131901129.html,Zacks
66,2020-09-18 16:05,Byline Bank Announces Continuation of Strategic Branch Consolidations,https://finance.yahoo.com/news/byline-bank-announces-continuation-strategic-200500379.html,Business Wire
67,2020-09-16 06:13,"Just Four Days Till Byline Bancorp, Inc. (NYSE:BY) Will Be Trading Ex-Dividend",https://finance.yahoo.com/news/just-four-days-till-byline-101358297.html,Simply Wall St.
68,2020-09-09 16:05,Byline Bancorp Declares Cash Dividend,https://finance.yahoo.com/news/byline-bancorp-declares-cash-dividend-200500444.html,Business Wire
69,2020-08-02 08:13,"Independent Director Phillip Cabrera Just Bought 172% More Shares In Byline Bancorp, Inc. (NYSE:BY)",https://finance.yahoo.com/news/independent-director-phillip-cabrera-just-121352930.html,Simply Wall St.
70,2020-07-30 18:43,Byline Bancorp Announces Pricing of Offering of Additional Subordinated Notes,https://finance.yahoo.com/news/byline-bancorp-announces-pricing-offering-224300410.html,Business Wire
71,2020-07-24 17:30,"Byline Bancorp, Inc. (BY) Q2 2020 Earnings Call Transcript",https://www.fool.com/earnings/call-transcripts/2020/07/24/byline-bancorp-inc-by-q2-2020-earnings-call-transc.aspx?source=eptyholnk0000202&utm_source=yahoo-host&utm_medium=feed&utm_campaign=article,Motley Fool
72,2020-07-23 18:25,Byline Bancorp (BY) Surpasses Q2 Earnings and Revenue Estimates,https://finance.yahoo.com/news/byline-bancorp-surpasses-q2-earnings-222510248.html,Zacks
73,2020-07-23 17:16,Byline Bancorp Announces Retirement of Owen Beacom and Appointment of Mark Fucinato as Chief Credit Officer,https://finance.yahoo.com/news/byline-bancorp-announces-retirement-owen-211600150.html,Business Wire
74,2020-07-23 17:08,"Byline Bancorp, Inc. Reports Second Quarter 2020 Financial Results",https://finance.yahoo.com/news/byline-bancorp-inc-reports-second-210800081.html,Business Wire
75,2020-07-16 12:31,Byline Bancorp (BY) Expected to Beat Earnings Estimates: Can the Stock Move Higher?,https://finance.yahoo.com/news/byline-bancorp-expected-beat-earnings-163104569.html,Zacks
76,2020-07-14 12:22,"Is Byline Bancorp, Inc.'s (NYSE:BY) Shareholder Ownership Skewed Towards Insiders?",https://finance.yahoo.com/news/byline-bancorp-inc-nyse-shareholder-162213953.html,Simply Wall St.
77,2020-07-08 16:30,"Byline Bancorp, Inc. to Announce Second Quarter 2020 Financial Results on Thursday, July 23",https://finance.yahoo.com/news/byline-bancorp-inc-announce-second-203000808.html,Business Wire
78,2020-07-03 18:32,"Byline Bancorp, Inc. (BY): Hedge Funds In Wait-and-See Mode",https://finance.yahoo.com/news/byline-bancorp-inc-hedge-funds-223255608.html,Insider Monkey
79,2020-07-01 09:16,New Strong Sell Stocks for July 1st,https://finance.yahoo.com/news/strong-sell-stocks-july-1st-131601310.html,Zacks
80,2020-06-22 18:35,Byline Bancorp Announces Pricing of Subordinated Notes Offering,https://finance.yahoo.com/news/byline-bancorp-announces-pricing-subordinated-223500442.html,Business Wire
81,2020-06-17 04:30,"Announcement from the Danish Transport, Construction and Housing Authority",https://finance.yahoo.com/news/announcement-danish-transport-construction-housing-083000720.html,GlobeNewswire
82,2020-06-11 17:34,Byline Bancorp Declares Cash Dividend,https://finance.yahoo.com/news/byline-bancorp-declares-cash-dividend-213400184.html,Business Wire
83,2020-06-04 08:30,"Byline Bancorp, Inc. Provides Additional Information on How to Access the Virtual 2020 Annual Meeting of Stockholders",https://finance.yahoo.com/news/byline-bancorp-inc-provides-additional-123000349.html,Business Wire
84,2020-05-29 17:10,"Byline Bancorp, Inc. Announces Virtual 2020 Annual Meeting of Stockholders",https://finance.yahoo.com/news/byline-bancorp-inc-announces-virtual-211000726.html,Business Wire
85,2020-05-12 08:33,New Strong Sell Stocks for May 12th,https://finance.yahoo.com/news/strong-sell-stocks-may-12th-123312356.html,Zacks
86,2020-05-01 18:00,"Byline Bancorp, Inc. (BY) Q1 2020 Earnings Call Transcript",https://www.fool.com/earnings/call-transcripts/2020/05/01/byline-bancorp-inc-by-q1-2020-earnings-call-transc.aspx?source=eptyholnk0000202&utm_source=yahoo-host&utm_medium=feed&utm_campaign=article,Motley Fool
87,2020-05-01 06:41,New Strong Sell Stocks for May 1st,https://finance.yahoo.com/news/strong-sell-stocks-may-1st-104110822.html,Zacks
88,2020-04-30 16:15,"Byline Bancorp, Inc. Reports First Quarter 2020 Financial Results",https://finance.yahoo.com/news/byline-bancorp-inc-reports-first-201500927.html,Business Wire
89,2020-04-29 07:00,"Is Byline Bancorp, Inc. (NYSE:BY) A Smart Pick For Income Investors?",https://finance.yahoo.com/news/byline-bancorp-inc-nyse-smart-110040185.html,Simply Wall St.
90,2020-04-23 12:32,Earnings Preview: Byline Bancorp (BY) Q1 Earnings Expected to Decline,https://finance.yahoo.com/news/earnings-preview-byline-bancorp-q1-163204082.html,Zacks
91,2020-04-15 18:48,"Byline Bancorp, Inc. Announces the Death of its Director Jaime Ruiz Sacristán",https://finance.yahoo.com/news/byline-bancorp-inc-announces-death-224800308.html,Business Wire
92,2020-04-14 16:05,"Byline Bancorp, Inc. to Announce First Quarter 2020 Financial Results on Thursday, April 30",https://finance.yahoo.com/news/byline-bancorp-inc-announce-first-200500679.html,Business Wire
93,2020-04-14 08:19,New Strong Sell Stocks for April 14th,https://finance.yahoo.com/news/strong-sell-stocks-april-14th-121912002.html,Zacks
94,2020-03-31 10:21,New Strong Sell Stocks for March 31st,https://finance.yahoo.com/news/strong-sell-stocks-march-31st-142102268.html,Zacks
95,2020-03-24 07:03,"A Sliding Share Price Has Us Looking At Byline Bancorp, Inc.'s (NYSE:BY) P/E Ratio",https://finance.yahoo.com/news/sliding-share-price-us-looking-110344983.html,Simply Wall St.
96,2020-03-18 06:03,"Byline Bancorp, Inc. (NYSE:BY) Goes Ex-Dividend In 4 Days",https://finance.yahoo.com/news/byline-bancorp-inc-nyse-goes-100352342.html,Simply Wall St.
97,2020-03-13 08:00,Byline Bancorp Declares Cash Dividend,https://finance.yahoo.com/news/byline-bancorp-declares-cash-dividend-120000271.html,Business Wire
98,2020-03-10 07:02,"A Sliding Share Price Has Us Looking At Byline Bancorp, Inc.'s (NYSE:BY) P/E Ratio",https://finance.yahoo.com/news/sliding-share-price-us-looking-110237776.html,Simply Wall St.
99,2020-02-17 06:28,"Why Byline Bancorp, Inc.'s (NYSE:BY) High P/E Ratio Isn't Necessarily A Bad Thing",https://finance.yahoo.com/news/why-byline-bancorp-inc-nyse-112840657.html,Simply Wall St.
