,Date,News Headline,Article Link,Source
0,2022-02-28 12:59,"Zio® by iRhythm Shows Significantly Higher Documentation of Atrial Fibrillation and Atrial Flutter Compared to Holter Monitors, Event Monitors",https://finance.yahoo.com/news/zio-irhythm-shows-significantly-higher-175900762.html,GlobeNewswire
1,2022-02-28 12:00,iRhythm Technologies (IRTC) Upgraded to Buy: What Does It Mean for the Stock?,https://finance.yahoo.com/news/irhythm-technologies-irtc-upgraded-buy-170005074.html,Zacks
2,2022-02-27 22:56,Is iRhythm Technologies (IRTC) A Smart Long-Term Buy?,https://finance.yahoo.com/news/irhythm-technologies-irtc-smart-long-035606378.html,Insider Monkey
3,2022-02-23 17:25,"IRhythm Technologies (IRTC) Reports Q4 Loss, Tops Revenue Estimates",https://finance.yahoo.com/news/irhythm-technologies-irtc-reports-q4-222510395.html,Zacks
4,2022-02-23 16:05,iRhythm Technologies Announces Fourth Quarter and Full Year 2021 Financial Results,https://finance.yahoo.com/news/irhythm-technologies-announces-fourth-quarter-210500663.html,GlobeNewswire
5,2022-02-09 16:05,"iRhythm Technologies to Report Fourth Quarter and Full Year 2021 Financial Results on February 23, 2022",https://finance.yahoo.com/news/irhythm-technologies-report-fourth-quarter-210500476.html,GlobeNewswire
6,2022-01-11 07:14,Strength Seen in iRhythm Technologies (IRTC): Can Its 27.6% Jump Turn into More Strength?,https://finance.yahoo.com/news/strength-seen-irhythm-technologies-irtc-121412685.html,Zacks
7,2022-01-10 18:29,iRhythm Technologies Comments on Medicare Administrative Contractor 2022 Rate Update,https://finance.yahoo.com/news/irhythm-technologies-comments-medicare-administrative-232900809.html,GlobeNewswire
8,2022-01-10 13:19,IRTC Stock: 17 Things to Know About iRhythm as Shares Rocket Higher Today,https://finance.yahoo.com/news/irtc-stock-17-things-know-181931002.html,InvestorPlace
9,2022-01-10 06:25,"While shareholders of iRhythm Technologies (NASDAQ:IRTC) are in the black over 5 years, those who bought a week ago aren't so fortunate",https://finance.yahoo.com/news/while-shareholders-irhythm-technologies-nasdaq-112503699.html,Simply Wall St.
10,2021-12-29 16:05,iRhythm® Technologies to Present at the 40th Annual J.P. Morgan Healthcare Conference,https://finance.yahoo.com/news/irhythm-technologies-present-40th-annual-210500725.html,GlobeNewswire
11,2021-12-25 11:38,"Sit Mid Cap Growth Fund Buys Darling Ingredients Inc, CommScope Holding Co Inc, Encompass ...",https://finance.yahoo.com/news/sit-mid-cap-growth-fund-163802674.html,GuruFocus.com
12,2021-12-11 14:43,"Hedge Funds Have Never Been This Bullish On iRhythm Technologies, Inc. (IRTC)",https://finance.yahoo.com/news/hedge-funds-never-bullish-irhythm-194354553.html,Insider Monkey
13,2021-11-04 20:56,"IRhythm Technologies (IRTC) Reports Q3 Loss, Tops Revenue Estimates",https://finance.yahoo.com/news/irhythm-technologies-irtc-reports-q3-005612908.html,Zacks
14,2021-11-04 16:05,iRhythm Technologies Announces Third Quarter 2021 Financial Results,https://finance.yahoo.com/news/irhythm-technologies-announces-third-quarter-200500750.html,GlobeNewswire
15,2021-11-03 16:03,Why iRhythm Technologies Stock Skyrocketed Today,https://www.fool.com/investing/2021/11/03/why-irhythm-technologies-stock-skyrocketed-today/?source=eptyholnk0000202&utm_source=yahoo-host&utm_medium=feed&utm_campaign=article,Motley Fool
16,2021-11-02 21:37,iRhythm Technologies Comments on Centers for Medicare and Medicaid Services 2022 Medicare Physician Fee Schedule Final Rule,https://finance.yahoo.com/news/irhythm-technologies-comments-centers-medicare-013700748.html,GlobeNewswire
17,2021-10-25 14:52,"Is iRhythm Technologies, Inc. (IRTC) A Good Stock To Buy?",https://finance.yahoo.com/news/irhythm-technologies-inc-irtc-good-185236891.html,Insider Monkey
18,2021-10-21 16:05,"iRhythm Technologies to Report Third Quarter 2021 Financial Results on November 4, 2021",https://finance.yahoo.com/news/irhythm-technologies-report-third-quarter-200500351.html,GlobeNewswire
19,2021-10-12 16:05,iRhythm® Technologies Announces Changes to Its Board of Directors,https://finance.yahoo.com/news/irhythm-technologies-announces-changes-board-200500661.html,GlobeNewswire
20,2021-10-12 08:17,iRhythm Technologies (NASDAQ:IRTC) Has Debt But No Earnings; Should You Worry?,https://finance.yahoo.com/news/irhythm-technologies-nasdaq-irtc-debt-121735293.html,Simply Wall St.
21,2021-10-05 16:05,mSToPS Clinical Trial Demonstrates Zio by iRhythm Significantly Improves Health Outcomes for At-Risk Patient Populations,https://finance.yahoo.com/news/mstops-clinical-trial-demonstrates-zio-200500390.html,GlobeNewswire
22,2021-09-14 07:58,IRHYTHM TECH (IRTC) Moves 35% Higher: Will This Strength Last?,https://finance.yahoo.com/news/irhythm-tech-irtc-moves-35-115811121.html,Zacks
23,2021-09-13 12:58,Here's Why iRhythm Technologies Stock Is Making Big Gains Today,https://www.fool.com/investing/2021/09/13/heres-why-irhythm-technologies-is-making-big-gains/?source=eptyholnk0000202&utm_source=yahoo-host&utm_medium=feed&utm_campaign=article,Motley Fool
24,2021-09-13 08:15,iRhythm® Technologies Names Quentin Blackford President and Chief Executive Officer,https://finance.yahoo.com/news/irhythm-technologies-names-quentin-blackford-121500516.html,GlobeNewswire
25,2021-09-06 13:19,Should You Now Sell Your iRhythm Technologies (IRTC) Position?,https://finance.yahoo.com/news/now-sell-irhythm-technologies-irtc-171933822.html,Insider Monkey
26,2021-09-06 13:06,"Artisan Partners Trimmed its iRhythm Technologies (IRTC) Stake, Heres Why",https://finance.yahoo.com/news/artisan-partners-trimmed-irhythm-technologies-170613818.html,Insider Monkey
27,2021-08-26 16:05,iRhythm® Technologies to Present at the 19th Annual Morgan Stanley Global Healthcare Conference,https://finance.yahoo.com/news/irhythm-technologies-present-19th-annual-200500625.html,GlobeNewswire
28,2021-08-05 17:55,"IRHYTHM TECH (IRTC) Reports Q2 Loss, Tops Revenue Estimates",https://finance.yahoo.com/news/irhythm-tech-irtc-reports-q2-215509841.html,Zacks
29,2021-08-05 16:05,iRhythm Technologies Announces Second Quarter 2021 Financial Results,https://finance.yahoo.com/news/irhythm-technologies-announces-second-quarter-200500198.html,GlobeNewswire
30,2021-07-29 16:05,iRhythm® Technologies to Present at the 41st Annual Canaccord Genuity Global Growth Conference,https://finance.yahoo.com/news/irhythm-technologies-present-41st-annual-200500628.html,GlobeNewswire
31,2021-07-29 15:05,Analysts Estimate IRHYTHM TECH (IRTC) to Report a Decline in Earnings: What to Look Out for,https://finance.yahoo.com/news/analysts-estimate-irhythm-tech-irtc-190507134.html,Zacks
32,2021-07-22 16:05,"iRhythm Technologies to Report Second Quarter 2021 Financial Results on August 5, 2021",https://finance.yahoo.com/news/irhythm-technologies-report-second-quarter-200500047.html,GlobeNewswire
33,2021-07-21 05:17,"iRhythm Technologies, Inc. (IRTC): Hedge Fund Sentiment Unchanged",https://finance.yahoo.com/news/irhythm-technologies-inc-irtc-hedge-091705865.html,Insider Monkey
34,2021-07-14 06:00,iRhythm® Technologies Comments on the Centers for Medicare and Medicaid Services 2022 Proposed Medicare Physician Fee Schedule,https://finance.yahoo.com/news/irhythm-technologies-comments-centers-medicare-100000134.html,GlobeNewswire
35,2021-07-14 03:31,Reflecting on iRhythm Technologies' (NASDAQ:IRTC) Share Price Returns Over The Last Year,https://finance.yahoo.com/news/reflecting-irhythm-technologies-nasdaq-irtc-073142986.html,Simply Wall St.
36,2021-07-08 09:00,iRhythm® Technologies and the National Association of Managed Care Physicians Partner to Study the Value of Ambulatory Cardiac Monitoring Solutions,https://finance.yahoo.com/news/irhythm-technologies-national-association-managed-130000538.html,GlobeNewswire
37,2021-07-06 15:52,Why Did iRhythm Technologies Fall 16% in June?,https://www.fool.com/investing/2021/07/06/why-did-irhythm-technologies-fall-16-in-june/?source=eptyholnk0000202&utm_source=yahoo-host&utm_medium=feed&utm_campaign=article,Motley Fool
38,2021-06-02 08:41,IRhythm Drops as CEO's Exit Surprises Analysts,https://www.thestreet.com/investing/irhythm-drops-as-ceo-resigns-surprising-wall-street?puc=yahoo&cm_ven=YAHOO,TheStreet.com
39,2021-06-01 16:05,iRhythm® Technologies Announces Leadership Transition,https://finance.yahoo.com/news/irhythm-technologies-announces-leadership-transition-200500041.html,GlobeNewswire
40,2021-05-28 18:19,iRhythm Technologies to Present at the 41st Annual William Blair Growth Stock Conference,https://finance.yahoo.com/news/irhythm-technologies-present-41st-annual-221900987.html,GlobeNewswire
41,2021-05-26 09:05,New Strong Sell Stocks for May 26th,https://finance.yahoo.com/news/strong-sell-stocks-may-26th-130501396.html,Zacks
42,2021-05-24 16:39,iRhythm® Technologies Continues to Fuel Innovation in Cardiac Monitoring and Unveils Two FDA Clearances for Superior Patient Care,https://finance.yahoo.com/news/irhythm-technologies-continues-fuel-innovation-203900218.html,GlobeNewswire
43,2021-05-14 09:06,New Strong Sell Stocks for May 14th,https://finance.yahoo.com/news/strong-sell-stocks-may-14th-130601033.html,Zacks
44,2021-05-06 18:05,"IRHYTHM TECH (IRTC) Reports Q1 Loss, Tops Revenue Estimates",https://finance.yahoo.com/news/irhythm-tech-irtc-reports-q1-220510435.html,Zacks
45,2021-05-06 13:09,"Artisan Partners Trimmed its iRhythm Technologies (IRTC) Position, Should You Do the Same?",https://finance.yahoo.com/news/artisan-partners-trimmed-irhythm-technologies-170939528.html,Insider Monkey
46,2021-04-29 17:04,Analysts Estimate IRHYTHM TECH (IRTC) to Report a Decline in Earnings: What to Look Out for,https://finance.yahoo.com/news/analysts-estimate-irhythm-tech-irtc-210409573.html,Zacks
47,2021-04-22 16:05,"iRhythm Technologies to Report First Quarter 2021 Financial Results on May 6, 2021",https://finance.yahoo.com/news/irhythm-technologies-report-first-quarter-200500069.html,GlobeNewswire
48,2021-04-15 02:12,"iRhythm Technologies, Inc. (NASDAQ:IRTC) Analysts Just Cut Their EPS Forecasts Substantially",https://finance.yahoo.com/news/irhythm-technologies-inc-nasdaq-irtc-061243599.html,Simply Wall St.
49,2021-04-12 12:12,Why iRhythm Technologies Stock Is Crashing Today,https://www.fool.com/investing/2021/04/12/why-irhythm-technologies-stock-is-crashing-today/?source=eptyholnk0000202&utm_source=yahoo-host&utm_medium=feed&utm_campaign=article,Motley Fool
50,2021-04-12 07:31,iRhythm Plunges as Novitas Updates Medicare Reimbursement Rate,https://www.thestreet.com/investing/irhythm-drops-on-new-novitas-reimbursement-rates?puc=yahoo&cm_ven=YAHOO,TheStreet.com
51,2021-04-12 07:00,iRhythm® Technologies Provides Statement on Medicare Administrative Contractor (MAC) Novitass Updated Rate Publication and Provides Commentary on Results for the First Quarter 2021,https://finance.yahoo.com/news/irhythm-technologies-provides-statement-medicare-110000660.html,GlobeNewswire
52,2021-04-10 14:20,iRhythm® Technologies Announces Conference Call to Discuss Medicare Administrative Contractor (MAC) Novitass Updated Rate Publication,https://finance.yahoo.com/news/irhythm-technologies-announces-conference-call-182000006.html,GlobeNewswire
53,2021-04-02 10:45,"LAWSUITS FILED AGAINST IRTC, NEPT and VRM - Jakubowitz Law Pursues Shareholders Claims",https://finance.yahoo.com/news/lawsuits-filed-against-irtc-nept-144500919.html,ACCESSWIRE
54,2021-04-02 10:25,"DEADLINE TODAY: The Schall Law Firm Reminds Investors of Class Action Lawsuit Against iRhythm Technologies, Inc. and Encourages Investors with Losses in Excess of $100,000 to Contact the Firm",https://finance.yahoo.com/news/deadline-today-schall-law-firm-142500456.html,Newsfile
55,2021-04-02 09:30,"CLASS ACTION UPDATE for IRTC, CYDY and ROOT: Levi & Korsinsky, LLP Reminds Investors of Class Actions on Behalf of Shareholders",https://finance.yahoo.com/news/class-action-irtc-cydy-root-133000902.html,ACCESSWIRE
56,2021-04-02 09:22,"IRTC FINAL DEADLINE TODAY: ROSEN, TRUSTED NATIONAL TRIAL COUNSEL, Encourages iRhythm Technologies, Inc. Investors to Secure Counsel Before Important April 2 Deadline in Securities Class Action  IRTC",https://finance.yahoo.com/news/irtc-final-deadline-today-rosen-132200789.html,GlobeNewswire
57,2021-04-02 09:00,"IRTC Deadline: Bronstein, Gewirtz & Grossman, LLC Notifies iRhythm Technologies, Inc. Shareholders of Class Action and Lead Plaintiff Deadline: April 2, 2021",https://finance.yahoo.com/news/irtc-deadline-bronstein-gewirtz-grossman-130000884.html,GlobeNewswire
58,2021-04-01 22:52,"IRHYTHM 24 HOUR DEADLINE ALERT: Former Louisiana Attorney General and Kahn Swick & Foti, LLC Remind Investors with Losses in Excess of $100,000 of Deadline in Class Action Lawsuit Against iRhythm Technologies - IRTC",https://finance.yahoo.com/news/irhythm-24-hour-deadline-alert-025200001.html,PR Newswire
59,2021-04-01 13:00,"The Klein Law Firm Reminds Investors of Class Actions on Behalf of Shareholders of IRTC, REGI and VRM",https://finance.yahoo.com/news/klein-law-firm-reminds-investors-170000325.html,ACCESSWIRE
60,2021-04-01 11:41,"IRTC Final Alert: Rosen, Top Ranked Global Investor Counsel, Encourages iRhythm Technologies, Inc. Investors to Secure Counsel Before Important Friday Deadline in Securities Class Action - IRTC",https://finance.yahoo.com/news/irtc-final-alert-rosen-top-154100815.html,Newsfile
61,2021-04-01 11:16,"Kessler Topaz Meltzer & Check, LLP: Final Deadline Reminder for iRhythm Technologies, Inc. Investors  IRTC",https://finance.yahoo.com/news/kessler-topaz-meltzer-check-llp-151600628.html,GlobeNewswire
62,2021-04-01 11:00,"CLASS ACTION UPDATE for IRTC, CLOV and ATNX: Levi & Korsinsky, LLP Reminds Investors of Class Actions on Behalf of Shareholders",https://finance.yahoo.com/news/class-action-irtc-clov-atnx-150000391.html,ACCESSWIRE
63,2021-04-01 10:25,"DEADLINE TOMORROW: The Schall Law Firm Reminds Investors of Class Action Lawsuit Against iRhythm Technologies, Inc. and Encourages Investors with Losses in Excess of $100,000 to Contact the Firm",https://finance.yahoo.com/news/deadline-tomorrow-schall-law-firm-142500880.html,Newsfile
64,2021-04-01 10:00,"IRTC Deadline: Bronstein, Gewirtz & Grossman, LLC Notifies iRhythm Technologies, Inc. Shareholders of Class Action and Lead Plaintiff Deadline: April 2, 2021",https://finance.yahoo.com/news/irtc-deadline-bronstein-gewirtz-grossman-140000502.html,Newsfile
65,2021-04-01 06:11,"SHAREHOLDER ALERT: Levi & Korsinsky, LLP Notifies Shareholders of iRhythm Technologies, Inc. of a Class Action Lawsuit and a Lead Plaintiff Deadline of April 2, 2021 - IRTC",https://finance.yahoo.com/news/shareholder-alert-levi-korsinsky-llp-101100760.html,Newsfile
66,2021-03-31 22:50,"SHAREHOLDER ALERT: CLAIMSFILER REMINDS CLOV, IRTC INVESTORS of Lead Plaintiff Deadline in Class Action Lawsuits",https://finance.yahoo.com/news/shareholder-alert-claimsfiler-reminds-clov-025000627.html,GlobeNewswire
67,2021-03-31 22:50,"IRHYTHM 48 HOUR DEADLINE ALERT: Former Louisiana Attorney General and Kahn Swick & Foti, LLC Remind Investors with Losses in Excess of $100,000 of Deadline in Class Action Lawsuit Against iRhythm Technologies - IRTC",https://finance.yahoo.com/news/irhythm-48-hour-deadline-alert-025000556.html,Newsfile
68,2021-03-31 19:49,"IRTC FINAL DEADLINE: ROSEN, A LEADING LAW FIRM, Encourages iRhythm Technologies, Inc. Investors With Losses in Excess of $100K to Secure Counsel Before Important Friday Deadline in Securities Class Action - IRTC",https://finance.yahoo.com/news/irtc-final-deadline-rosen-leading-234900204.html,PR Newswire
69,2021-03-31 12:10,"LAWSUITS FILED AGAINST IRTC, CLOV and EBIX - Jakubowitz Law Pursues Shareholders Claims",https://finance.yahoo.com/news/lawsuits-filed-against-irtc-clov-161000207.html,ACCESSWIRE
70,2021-03-31 12:05,"IRTC APRIL 2 DEADLINE: Zhang Investor Law Alerts Investors of Deadline in Securities Class Action Lawsuit Against iRhythm Technologies, Inc. IRTC",https://finance.yahoo.com/news/irtc-april-2-deadline-zhang-160500596.html,GlobeNewswire
71,2021-03-31 11:00,"IRTC & TSN Deadlines: Bronstein, Gewirtz & Grossman LLC Reminds Shareholders of Class Actions and Encourages Investors to Contact the Firm",https://finance.yahoo.com/news/irtc-tsn-deadlines-bronstein-gewirtz-150000866.html,ACCESSWIRE
72,2021-03-31 10:45,SHAREHOLDER ALERT: IRTC VRM KRMD: The Law Offices of Vincent Wong Reminds Investors of Important Class Action Deadlines,https://finance.yahoo.com/news/shareholder-alert-irtc-vrm-krmd-144500134.html,ACCESSWIRE
73,2021-03-31 10:11,"FRIDAY DEADLINE NOTICE: The Schall Law Firm Reminds Investors of Class Action Lawsuit Against iRhythm Technologies, Inc. and Encourages Investors with Losses in Excess of $100,000 to Contact the Firm",https://finance.yahoo.com/news/friday-deadline-notice-schall-law-141100108.html,Newsfile
74,2021-03-31 10:03,"DEADLINE ALERT: Kessler Topaz Meltzer & Check, LLP Announces Two Days Until Deadline in Securities Fraud Class Action Lawsuit Filed Against iRhythm Technologies, Inc. (IRTC)",https://finance.yahoo.com/news/deadline-alert-kessler-topaz-meltzer-140300016.html,Newsfile
75,2021-03-31 06:30,"The Klein Law Firm Reminds Investors of Class Actions on Behalf of Shareholders of IRTC, VLDR and ROOT",https://finance.yahoo.com/news/klein-law-firm-reminds-investors-103000012.html,ACCESSWIRE
76,2021-03-30 22:50,"IRHYTHM 72 HOUR DEADLINE ALERT: Former Louisiana Attorney General and Kahn Swick & Foti, LLC Remind Investors With Losses in Excess of $100,000 of Deadline in Class Action Lawsuit Against iRhythm Technologies - IRTC",https://finance.yahoo.com/news/irhythm-72-hour-deadline-alert-025000216.html,Business Wire
77,2021-03-30 22:50,FILING DEADLINE--Kuznicki Law PLLC Announces Class Actions on Behalf of Shareholders of CLOV and IRTC,https://finance.yahoo.com/news/filing-deadline-kuznicki-law-pllc-025000948.html,GlobeNewswire
78,2021-03-30 19:24,"IRTC ALERT: The Klein Law Firm Announces a Lead Plaintiff Deadline of April 2, 2021 in the Class Action Filed on Behalf of iRhythm Technologies, Inc. Limited Shareholders",https://finance.yahoo.com/news/irtc-alert-klein-law-firm-232400716.html,Newsfile
79,2021-03-30 17:55,"Investor Reminder:  Kessler Topaz Meltzer & Check, LLP Reminds Shareholders of Securities Fraud Class Action Lawsuit Filed Against iRhythm Technologies, Inc. - IRTC",https://finance.yahoo.com/news/investor-reminder-kessler-topaz-meltzer-215500582.html,PR Newswire
80,2021-03-30 11:45,"The Gross Law Firm Announces Class Actions on Behalf of Shareholders of IRTC, FUBO and APA",https://finance.yahoo.com/news/gross-law-firm-announces-class-154500783.html,ACCESSWIRE
81,2021-03-30 11:00,"IRTC & TSN Upcoming Deadlines: Bronstein, Gewirtz & Grossman LLC Reminds Shareholders of Class Actions and Encourages Investors to Contact the Firm",https://finance.yahoo.com/news/irtc-tsn-upcoming-deadlines-bronstein-150000311.html,ACCESSWIRE
82,2021-03-30 10:10,"FRIDAY DEADLINE REMINDER: The Schall Law Firm Reminds Investors of Class Action Lawsuit Against iRhythm Technologies, Inc. and Encourages Investors with Losses in Excess of $100,000 to Contact the Firm",https://finance.yahoo.com/news/friday-deadline-reminder-schall-law-141000666.html,Newsfile
83,2021-03-30 09:35,"SHAREHOLDER ALERT: Levi & Korsinsky, LLP Notifies Shareholders of iRhythm Technologies, Inc. of a Class Action Lawsuit and a Lead Plaintiff Deadline of April 2, 2021 - IRTC",https://finance.yahoo.com/news/shareholder-alert-levi-korsinsky-llp-133500130.html,Newsfile
84,2021-03-30 08:00,"The Law Offices of Frank R. Cruz Announces the Filing of a Securities Class Action on Behalf of iRhythm Technologies, Inc. (IRTC) Investors",https://finance.yahoo.com/news/law-offices-frank-r-cruz-120000488.html,PR Newswire
85,2021-03-29 23:10,"CLASS ACTION UPDATE for BLUE, IRTC and VLDR: Levi & Korsinsky, LLP Reminds Investors of Class Actions on Behalf of Shareholders",https://finance.yahoo.com/news/class-action-blue-irtc-vldr-031000798.html,ACCESSWIRE
86,2021-03-29 22:46,"SHAREHOLDER ALERT BY FORMER LOUISIANA ATTORNEY GENERAL: KSF REMINDS CLOV, IRTC INVESTORS of Lead Plaintiff Deadline in Class Action Lawsuits",https://finance.yahoo.com/news/shareholder-alert-former-louisiana-attorney-024600165.html,GlobeNewswire
87,2021-03-29 22:06,"The Gross Law Firm Announces Class Actions on Behalf of Shareholders of IRTC, FUBO and VLDR",https://finance.yahoo.com/news/gross-law-firm-announces-class-020600868.html,ACCESSWIRE
88,2021-03-29 21:00,"DEADLINE ALERT: Bragar Eagel & Squire, P.C. Reminds Investors That a Class Action Lawsuit Has Been Filed Against iRhythm Technologies, Inc. and Encourages Investors to Contact the Firm",https://finance.yahoo.com/news/deadline-alert-bragar-eagel-squire-010000727.html,GlobeNewswire
89,2021-03-29 16:57,"IRTC SHAREHOLDER FILING DEADLINE: Bernstein Liebhard LLP Reminds Investors of the Deadline to File a Lead Plaintiff Motion in a Securities Class Action Lawsuit Against iRhythm Technologies, Inc.",https://finance.yahoo.com/news/irtc-shareholder-filing-deadline-bernstein-205700596.html,GlobeNewswire
90,2021-03-29 11:00,"DEADLINE ALERT for IRTC, TSN, and CLOV: The Law Offices of Frank R. Cruz Reminds Investors of Class Actions on Behalf of Shareholders",https://finance.yahoo.com/news/deadline-alert-irtc-tsn-clov-150000858.html,GlobeNewswire
91,2021-03-29 10:06,"FRIDAY DEADLINE ALERT: The Schall Law Firm Reminds Investors of Class Action Lawsuit Against iRhythm Technologies, Inc. and Encourages Investors with Losses in Excess of $100,000 to Contact the Firm",https://finance.yahoo.com/news/friday-deadline-alert-schall-law-140600172.html,Newsfile
92,2021-03-29 09:30,"Final Deadline Approaching on April 2, 2021:  Kessler Topaz Meltzer & Check, LLP Reminds iRhythm Technologies, Inc. Investors of Class Action Lawsuit Deadline",https://finance.yahoo.com/news/final-deadline-approaching-april-2-133000908.html,Business Wire
93,2021-03-29 08:00,"IMMINENT SHAREHOLDER DEADLINE: Block & Leviton LLP Reminds Investors that it Has Filed a Lawsuit Against iRhythm Technologies, Inc. for Securities Fraud; Investors Who Lost Money Should Contact the Firm",https://finance.yahoo.com/news/imminent-shareholder-deadline-block-leviton-120000126.html,Newsfile
94,2021-03-28 22:30,"SHAREHOLDER ALERT: Pomerantz Law Firm Investigates Claims  On Behalf of Investors of iRhythm Technologies, Inc. - IRTC",https://finance.yahoo.com/news/shareholder-alert-pomerantz-law-firm-023000383.html,ACCESSWIRE
95,2021-03-28 15:12,"Investor Deadline Approaching: Kessler Topaz Meltzer & Check, LLP Reminds Investors of One Week Deadline in Securities Fraud Class Action Lawsuit Filed Against iRhythm Technologies, Inc. (IRTC)",https://finance.yahoo.com/news/investor-deadline-approaching-kessler-topaz-191200966.html,Newsfile
96,2021-03-28 11:14,"ROSEN, RESPECTED INVESTOR COUNSEL, Encourages iRhythm Technologies, Inc. Investors to Secure Counsel Before Important April 2 Deadline in Securities Class Action  IRTC",https://finance.yahoo.com/news/rosen-respected-investor-counsel-encourages-151400581.html,Business Wire
97,2021-03-27 14:41,"Class Action Lawsuit Deadline:  Kessler Topaz Meltzer & Check, LLP Reminds Investors of One Week Deadline in Securities Fraud Class Action Lawsuit Filed Against iRhythm Technologies, Inc.",https://finance.yahoo.com/news/class-action-lawsuit-deadline-kessler-184100208.html,ACCESSWIRE
98,2021-03-26 22:50,"SHAREHOLDER ALERT: CLAIMSFILER REMINDS CLOV, IRTC INVESTORS of Lead Plaintiff Deadline in Class Action Lawsuits",https://finance.yahoo.com/news/shareholder-alert-claimsfiler-reminds-clov-025000153.html,GlobeNewswire
99,2021-03-26 15:40,"Lawsuits Filed Against Irtc, Clov and Mpln - Jakubowitz Law Pursues Shareholders Claims",https://finance.yahoo.com/news/lawsuits-filed-against-irtc-clov-194000411.html,ACCESSWIRE
