,Date,News Headline,Article Link,Source
0,2022-02-28 11:29,"ISG to Publish Report on SAP Ecosystem Providers Supporting Cloud Migrations, S/4HANA Transitions",https://finance.yahoo.com/news/isg-publish-report-sap-ecosystem-162900693.html,Business Wire
1,2022-02-24 19:20,Huron Consulting (HURN) Surpasses Q4 Earnings and Revenue Estimates,https://finance.yahoo.com/news/huron-consulting-hurn-surpasses-q4-002012730.html,Zacks
2,2022-02-24 09:09,ISG to Publish Study on the Google Cloud Ecosystem,https://finance.yahoo.com/news/isg-publish-study-google-cloud-140900215.html,Business Wire
3,2022-02-23 09:06,ISG to Publish Study on Providers of IoT-Related Services,https://finance.yahoo.com/news/isg-publish-study-providers-iot-140600121.html,Business Wire
4,2022-02-22 09:15,ISG to Publish Study on Payroll Solutions and Services for Multinational and U.S. Enterprises,https://finance.yahoo.com/news/isg-publish-study-payroll-solutions-141500516.html,Business Wire
5,2022-02-17 11:30,ISG to Publish Comprehensive Study on Cybersecurity Products and Services,https://finance.yahoo.com/news/isg-publish-comprehensive-study-cybersecurity-163000407.html,Business Wire
6,2022-02-17 09:39,"ISG Leader Tells NASSCOM Forum Convergence Requires Consistency of Process, Technology, Data and Culture",https://finance.yahoo.com/news/isg-leader-tells-nasscom-forum-143900691.html,Business Wire
7,2022-02-15 11:07,"How Much Of Information Services Group, Inc. (NASDAQ:III) Do Insiders Own?",https://finance.yahoo.com/news/much-information-services-group-inc-160742105.html,Simply Wall St.
8,2022-02-11 11:05,ISG to Announce Fourth-Quarter Financial Results,https://finance.yahoo.com/news/isg-announce-fourth-quarter-financial-160500088.html,Business Wire
9,2022-02-09 09:04,"Technology That Enhances Employee Experience Will Be Key to Workplace Success in 2022, ISG Says",https://finance.yahoo.com/news/technology-enhances-employee-experience-key-140400316.html,Business Wire
10,2022-02-04 09:11,ISG to Publish Study on Digital Banking Platform Providers,https://finance.yahoo.com/news/isg-publish-study-digital-banking-141100509.html,Business Wire
11,2022-02-03 11:05,Rackspace Technology Named a Top 15 Sourcing Standout by ISG,https://finance.yahoo.com/news/rackspace-technology-named-top-15-160500874.html,GlobeNewswire
12,2022-02-03 11:00,ISG to Publish Report on Marketing Technology Providers Helping Firms Compete in New Customer Landscape,https://finance.yahoo.com/news/isg-publish-report-marketing-technology-160000456.html,Business Wire
13,2022-02-03 04:00,European Life Sciences Companies Look to Enhance Analytics Capabilities,https://finance.yahoo.com/news/european-life-sciences-companies-look-090000937.html,Business Wire
14,2022-02-02 09:06,U.S. Life Sciences Industry Digitizing to Meet Pandemic-Related Demands,https://finance.yahoo.com/news/u-life-sciences-industry-digitizing-140600593.html,Business Wire
15,2022-01-31 09:00,"ISG to Publish Report on SDN Services and Solutions as Pandemic Hikes Demand for Flexible, Secure Networks",https://finance.yahoo.com/news/isg-publish-report-sdn-services-140000371.html,Business Wire
16,2022-01-27 13:38,"Relyea Zuckerberg Hanson LLC Buys Vanguard Value ETF, Apple Inc, iShares Core MSCI ...",https://finance.yahoo.com/news/relyea-zuckerberg-hanson-llc-buys-183820203.html,GuruFocus.com
17,2022-01-26 09:00,Life Sciences Companies Worldwide Go Digital to Meet Pandemic Challenges,https://finance.yahoo.com/news/life-sciences-companies-worldwide-digital-140000668.html,Business Wire
18,2022-01-25 13:38,"Bowling Portfolio Management LLC Buys Coterra Energy Inc, VMware Inc, Celanese Corp, Sells US ...",https://finance.yahoo.com/news/bowling-portfolio-management-llc-buys-183814655.html,GuruFocus.com
19,2022-01-25 08:00,ISG Launches Market Intelligence Platform for Executive Decision-Making,https://finance.yahoo.com/news/isg-launches-market-intelligence-platform-130000590.html,Business Wire
20,2022-01-24 10:00,"U.S. Manufacturers Embracing Digital Transformation to Meet Changing Demands, Challenges",https://finance.yahoo.com/news/u-manufacturers-embracing-digital-transformation-150000337.html,Business Wire
21,2022-01-24 04:00,European Manufacturers Embrace the Cloud to Improve Their Agility,https://finance.yahoo.com/news/european-manufacturers-embrace-cloud-improve-090000189.html,Business Wire
22,2022-01-23 18:00,"Pandemic Accelerates Australian Digital Transformations, Leading More Firms to Seek Out AWS Provider Partners",https://finance.yahoo.com/news/pandemic-accelerates-australian-digital-transformations-230000487.html,Business Wire
23,2022-01-21 04:00,Healthcare Providers in Germany Look to Expand Digital Services in Response to Pandemic,https://finance.yahoo.com/news/healthcare-providers-germany-look-expand-090000686.html,Business Wire
24,2022-01-20 10:26,U.S. Healthcare Industry Seeks Digital Transformation in Response to COVID-19,https://finance.yahoo.com/news/u-healthcare-industry-seeks-digital-152600876.html,Business Wire
25,2022-01-20 06:47,"Is Weakness In Information Services Group, Inc. (NASDAQ:III) Stock A Sign That The Market Could be Wrong Given Its Strong Financial Prospects?",https://finance.yahoo.com/news/weakness-information-services-group-inc-114700690.html,Simply Wall St.
26,2022-01-20 05:00,U.K. Banks Seek Technology Updates to Hold Off New Competitors,https://finance.yahoo.com/news/u-k-banks-seek-technology-100000728.html,Business Wire
27,2022-01-20 04:00,Nordic Banks Move to Digital Services for Competitive Edge,https://finance.yahoo.com/news/nordic-banks-move-digital-services-090000300.html,Business Wire
28,2022-01-19 10:00,Growing AWS Partner Ecosystem Helps U.S. Enterprises Leverage Cloud to Meet Pandemic-Era Challenges,https://finance.yahoo.com/news/growing-aws-partner-ecosystem-helps-150000391.html,Business Wire
29,2022-01-19 08:00,AWS Ecosystem Partners Help Meet Brazils Growing Demand for Public Cloud Services,https://finance.yahoo.com/news/aws-ecosystem-partners-help-meet-130000413.html,Business Wire
30,2022-01-18 04:00,Cloud-Native Trend in Germany Boosting Demand for AWS and its Ecosystem Partners,https://finance.yahoo.com/news/cloud-native-trend-germany-boosting-090000063.html,Business Wire
31,2022-01-17 18:00,COVID-19 Crisis Supercharges Australias Digital Push as Enterprises Seek Competitive Advantage,https://finance.yahoo.com/news/covid-19-crisis-supercharges-australia-230000730.html,Business Wire
32,2022-01-17 09:12,Brazilian Firms Act on Digital Transformation Plans in Response to Pandemic Disruptions,https://finance.yahoo.com/news/brazilian-firms-act-digital-transformation-141200138.html,Business Wire
33,2022-01-14 09:07,ISG to Conduct Study on Private and Hybrid Cloud Providers,https://finance.yahoo.com/news/isg-conduct-study-private-hybrid-140700232.html,Business Wire
34,2022-01-13 11:00,ISG to Publish Two Reports Focused on Digital Transformation of the Retail Industry,https://finance.yahoo.com/news/isg-publish-two-reports-focused-160000355.html,Business Wire
35,2022-01-13 09:00,U.S. Public Sector Organizations Seek Support to Transform Workplaces and Embrace Digital Tools,https://finance.yahoo.com/news/u-public-sector-organizations-seek-140000494.html,Business Wire
36,2022-01-12 18:01,"Asia Pacifics IT, Business Services Market at Record High for 2021, Even with Q4 Sequential Slowdown, ISG Index® Finds",https://finance.yahoo.com/news/asia-pacific-business-services-market-230100132.html,Business Wire
37,2022-01-12 11:01,7 Stocks to Buy Under $10 in January,https://finance.yahoo.com/news/7-stocks-buy-under-10-160116880.html,InvestorPlace
38,2022-01-12 10:47,"U.S. Banks Turn to Technology Providers to Transform Business, Compete Against FinTechs",https://finance.yahoo.com/news/u-banks-turn-technology-providers-154700085.html,Business Wire
39,2022-01-12 08:00,"Enterprises Look to Intelligent Automation for Flexibility, Competitiveness in a Rebounding Brazilian Economy",https://finance.yahoo.com/news/enterprises-look-intelligent-automation-flexibility-130000907.html,Business Wire
40,2022-01-12 04:00,"Europes Spending on IT, Business Services Hits Record in 2021, Amid Signs of Slowing Demand in Q4, ISG Index Finds",https://finance.yahoo.com/news/europe-spending-business-services-hits-090000973.html,Business Wire
41,2022-01-11 12:18,"As Manufacturers Modernize Operational Technology, Closing Security Holes is a Growing Priority",https://finance.yahoo.com/news/manufacturers-modernize-operational-technology-closing-171800629.html,Business Wire
42,2022-01-11 08:00,"Americas IT, Business Services Market Hits Record in 2021, But Demand Flattens Sequentially in Q4, ISG Index® Finds",https://finance.yahoo.com/news/americas-business-services-market-hits-130000399.html,Business Wire
43,2022-01-11 04:00,"Disrupted by COVID-19, German Enterprises Speed Up Digital Transformation to Compete Under New Conditions",https://finance.yahoo.com/news/disrupted-covid-19-german-enterprises-090000835.html,Business Wire
44,2022-01-10 10:00,"Global Market for IT and Business Services Turns in Record 2021, Even as Pace Slows in Q4, ISG Index Finds",https://finance.yahoo.com/news/global-market-business-services-turns-150000782.html,Business Wire
45,2022-01-07 10:00,Pandemic Speeds Up Digital Transformation Plans as Enterprises Mount Responses to Rapid Changes,https://finance.yahoo.com/news/pandemic-speeds-digital-transformation-plans-150000346.html,Business Wire
46,2022-01-07 04:00,Nordic Enterprises Prove Digital Leadership With Transformations to Compete in Post-Pandemic World,https://finance.yahoo.com/news/nordic-enterprises-prove-digital-leadership-090000363.html,Business Wire
47,2022-01-06 05:00,"U.K. Companies Hammered by Pandemic, Brexit Bounce Back with Fast Digital Business Rollouts",https://finance.yahoo.com/news/u-k-companies-hammered-pandemic-100000441.html,Business Wire
48,2022-01-05 11:00,"Pandemic Changes Boost U.S. Demand for Digital Business Services to Improve Operations, Customer Engagement",https://finance.yahoo.com/news/pandemic-changes-boost-u-demand-160000206.html,Business Wire
49,2022-01-05 09:00,ISG Partners With Soroco to Offer Process Discovery for Automation Clients,https://finance.yahoo.com/news/isg-partners-soroco-offer-process-140000827.html,Business Wire
50,2022-01-04 09:00,ISG Advisors Recognized as 2021 HRO Today Superstars for Sparking Innovation Amid the Pandemic,https://finance.yahoo.com/news/isg-advisors-recognized-2021-hro-140000650.html,Business Wire
51,2021-12-29 09:40,Is Avis Budget Group (CAR) Stock Outpacing Its Business Services Peers This Year?,https://finance.yahoo.com/news/avis-budget-group-car-stock-144002410.html,Zacks
52,2021-12-25 07:33,Information Services Group's (NASDAQ:III) investors will be pleased with their impressive 157% return over the last year,https://finance.yahoo.com/news/information-services-groups-nasdaq-iii-123341717.html,Simply Wall St.
53,2021-12-24 11:40,III or ACN: Which Is the Better Value Stock Right Now?,https://finance.yahoo.com/news/iii-acn-better-value-stock-164004019.html,Zacks
54,2021-12-23 09:40,Are These Business Services Stocks a Great Value Stocks Right Now?,https://finance.yahoo.com/news/business-services-stocks-great-value-144002804.html,Zacks
55,2021-12-20 05:00,"U.K. Companies Turning to Intelligent Automation to Solve Business Challenges from Pandemic, Brexit",https://finance.yahoo.com/news/u-k-companies-turning-intelligent-100000308.html,Business Wire
56,2021-12-20 04:00,German Firms Expand Use of Intelligent Automation After Pandemic Shakes Up Ways of Doing Business,https://finance.yahoo.com/news/german-firms-expand-intelligent-automation-090000044.html,Business Wire
57,2021-12-17 04:00,Use of Intelligent Automation Expanding in Nordics After Helping Enterprises Meet Pandemic Challenges,https://finance.yahoo.com/news/intelligent-automation-expanding-nordics-helping-090000297.html,Business Wire
58,2021-12-16 12:53,"ISG Presents 2021 ISG Star of Excellence Awards to Hexaware, Infosys and Rackspace Technology",https://finance.yahoo.com/news/isg-presents-2021-isg-star-175300584.html,Business Wire
59,2021-12-16 10:15,Enterprises Change Approach to Digital Workplace Solutions in Response to Pandemic,https://finance.yahoo.com/news/enterprises-change-approach-digital-workplace-151500485.html,Business Wire
60,2021-12-15 09:45,"U.S. Companies Lead in Adopting Intelligent Automation to Improve Operations, Customer Service During Pandemic",https://finance.yahoo.com/news/u-companies-lead-adopting-intelligent-144500086.html,Business Wire
61,2021-12-15 08:00,Navisite Named a Rising Star in the 2021 ISG Provider Lens Public Cloud Services & Solutions U.S. Report,https://finance.yahoo.com/news/navisite-named-rising-star-2021-130000073.html,PR Newswire
62,2021-12-14 09:53,"Brazil Leaps into Data Analytics with Notable Projects, But Broad Adoption Still in Early Stages",https://finance.yahoo.com/news/brazil-leaps-data-analytics-notable-145300521.html,Business Wire
63,2021-12-13 09:40,Is Avis Budget Group (CAR) Outperforming Other Business Services Stocks This Year?,https://finance.yahoo.com/news/avis-budget-group-car-outperforming-144002739.html,Zacks
64,2021-12-13 04:00,Nine in 10 Insurance Leaders in Europe Say Customer Experience is the Top Driver of Digital Transformation,https://finance.yahoo.com/news/nine-10-insurance-leaders-europe-090000652.html,Business Wire
65,2021-12-10 04:00,Germany Slowly Joins Europe in Adopting Data Analytics,https://finance.yahoo.com/news/germany-slowly-joins-europe-adopting-090000994.html,Business Wire
66,2021-12-09 09:05,"U.S. Demand for Analytics Intensifies as Enterprises Democratize Access to Data, Tools",https://finance.yahoo.com/news/u-demand-analytics-intensifies-enterprises-140500314.html,Business Wire
67,2021-12-08 11:40,III or ACN: Which Is the Better Value Stock Right Now?,https://finance.yahoo.com/news/iii-acn-better-value-stock-164004951.html,Zacks
68,2021-12-08 08:00,ISG to Ring Nasdaq Opening Bell,https://finance.yahoo.com/news/isg-ring-nasdaq-opening-bell-130000218.html,Business Wire
69,2021-12-07 12:17,ISG to Publish Study on Digital Engineering Services Providers,https://finance.yahoo.com/news/isg-publish-study-digital-engineering-171700631.html,Business Wire
70,2021-12-06 11:07,Finalists Named for 2021 ISG Star of Excellence Awards,https://finance.yahoo.com/news/finalists-named-2021-isg-star-160700131.html,Business Wire
71,2021-12-06 07:21,"French Government Pushes for Cloud Adoption, and Many Enterprises Follow Suit",https://finance.yahoo.com/news/french-government-pushes-cloud-adoption-122100269.html,Business Wire
72,2021-12-03 10:02,Enterprises Across the Globe Embrace Multicloud Installations in Response to Pandemic,https://finance.yahoo.com/news/enterprises-across-globe-embrace-multicloud-150200867.html,Business Wire
73,2021-12-02 08:00,Enterprises in Brazil Embrace the Cloud as Part of Digital Transformations,https://finance.yahoo.com/news/enterprises-brazil-embrace-cloud-part-130000779.html,Business Wire
74,2021-12-02 04:30,Enterprises in Switzerland See the Cloud Enabling Digital Transformation,https://finance.yahoo.com/news/enterprises-switzerland-see-cloud-enabling-093000434.html,Business Wire
75,2021-12-02 04:00,Enterprises in Germany Turn to the Public Cloud to Enable the Remote Workforce,https://finance.yahoo.com/news/enterprises-germany-turn-public-cloud-090000990.html,Business Wire
76,2021-12-01 04:00,Nordic Enterprises Embrace Cloud Services to Improve Customer Experience,https://finance.yahoo.com/news/nordic-enterprises-embrace-cloud-services-090000243.html,Business Wire
77,2021-11-30 09:01,Experts at ISG Digital Business Summit Predict 2022 Will Be the Year of the Value Chain,https://finance.yahoo.com/news/experts-isg-digital-business-summit-140100096.html,Business Wire
78,2021-11-30 08:38,U.K. Enterprises Seek Help with Cloud-First Approach,https://finance.yahoo.com/news/u-k-enterprises-seek-help-133800172.html,Business Wire
79,2021-11-29 09:37,Enterprises in the U.S. Embracing Multicloud Environments,https://finance.yahoo.com/news/enterprises-u-embracing-multicloud-environments-143700139.html,Business Wire
80,2021-11-29 04:11,"Is It Smart To Buy Information Services Group, Inc. (NASDAQ:III) Before It Goes Ex-Dividend?",https://finance.yahoo.com/news/smart-buy-information-services-group-091151554.html,Simply Wall St.
81,2021-11-24 09:57,Has CRA International (CRAI) Outpaced Other Business Services Stocks This Year?,https://finance.yahoo.com/news/cra-international-crai-outpaced-other-145702845.html,Zacks
82,2021-11-23 14:31,ISG Says Digital Transformation Reaching Critical Mass in U.S. Public Sector,https://finance.yahoo.com/news/isg-says-digital-transformation-reaching-193100059.html,Business Wire
83,2021-11-22 11:40,III vs. ACN: Which Stock Is the Better Value Option?,https://finance.yahoo.com/news/iii-vs-acn-stock-better-164004331.html,Zacks
84,2021-11-22 11:37,ISG to Publish Study on Broad-Ranging ServiceNow Ecosystem,https://finance.yahoo.com/news/isg-publish-study-broad-ranging-163700881.html,Business Wire
85,2021-11-22 08:50,Here's What Could Help ISG (III) Maintain Its Recent Price Strength,https://finance.yahoo.com/news/heres-could-help-isg-iii-135001720.html,Zacks
86,2021-11-20 07:58,"A Information Services Group, Inc. (NASDAQ:III) insider increased their holdings by 5.7% last year",https://finance.yahoo.com/news/information-services-group-inc-nasdaq-125817599.html,Simply Wall St.
87,2021-11-19 09:04,U.S. Enterprises Turn to Contact Center-as-a-Service Providers to Meet New Consumer Expectations,https://finance.yahoo.com/news/u-enterprises-turn-contact-center-140400129.html,Business Wire
88,2021-11-18 11:14,ISG Announces Major Expansion of ISG Provider Lens Research with 10 New Studies,https://finance.yahoo.com/news/isg-announces-major-expansion-isg-161400103.html,Business Wire
89,2021-11-17 12:00,Information Services Group (III) Is Up 6.58% in One Week: What You Should Know,https://finance.yahoo.com/news/information-services-group-iii-6-170005891.html,Zacks
90,2021-11-17 04:00,Enterprises in Europe and the U.K. Turn to Contact Center-as-a-Service Providers to Keep Up with Customer Demand,https://finance.yahoo.com/news/enterprises-europe-u-k-turn-090000227.html,Business Wire
91,2021-11-16 11:07,Enterprises Turn to Contact Center Providers to Help with Increasing Consumer Expectations,https://finance.yahoo.com/news/enterprises-turn-contact-center-providers-160700253.html,Business Wire
92,2021-11-16 09:02,"Demand for IT and Business Services in the Americas Climbs to Record High in Q3, ISG Index® Finds",https://finance.yahoo.com/news/demand-business-services-americas-climbs-140200191.html,Business Wire
93,2021-11-15 11:52,Enterprises Across the Globe Embrace Contact-Center-as-a-Service to Meet Customer Needs,https://finance.yahoo.com/news/enterprises-across-globe-embrace-contact-165200508.html,Business Wire
94,2021-11-12 04:00,"European, UK Contact Centers Adopt Remote Work, Omnichannel Customer Experiences for Post-COVID World",https://finance.yahoo.com/news/european-uk-contact-centers-adopt-090000719.html,Business Wire
95,2021-11-11 11:05,Rackspace Technology Named a Top 15 Sourcing Standout by ISG,https://finance.yahoo.com/news/rackspace-technology-named-top-15-160500660.html,GlobeNewswire
96,2021-11-11 10:00,ISG to Publish Study on the Evolving Enterprise Service Management Market,https://finance.yahoo.com/news/isg-publish-study-evolving-enterprise-150000125.html,Business Wire
97,2021-11-10 20:00,Asia Pacific Sourcing Market Driven by Cloud Services in Q3,https://finance.yahoo.com/news/asia-pacific-sourcing-market-driven-010000686.html,Business Wire
98,2021-11-10 09:06,ISG to Publish Study on Microsoft Partner Ecosystem,https://finance.yahoo.com/news/isg-publish-study-microsoft-partner-140600156.html,Business Wire
99,2021-11-09 18:00,"Australian Enterprises Embrace Workplace Innovation as Pandemic Disrupts Job Markets, Employee Expectations",https://finance.yahoo.com/news/australian-enterprises-embrace-workplace-innovation-230000426.html,Business Wire
