,Date,News Headline,Article Link,Source
0,2022-02-24 15:28,Top Financial Stocks for March 2022,https://www.investopedia.com/top-financial-stocks-4582168?utm_campaign=quote-yahoo&utm_source=yahoo&utm_medium=referral,Investopedia
1,2022-02-23 08:30,"If You Invested $1000 in Signature Bank a Decade Ago, This is How Much It'd Be Worth Now",https://finance.yahoo.com/news/invested-1000-signature-bank-decade-133001998.html,Zacks
2,2022-02-23 05:00,Signature Bank Ranks on Forbes Blockchain 50 2022 List for Fourth Consecutive Year,https://finance.yahoo.com/news/signature-bank-ranks-forbes-blockchain-100000476.html,Business Wire
3,2022-02-17 11:30,Signature Bank (SBNY) Down 0.5% Since Last Earnings Report: Can It Rebound?,https://finance.yahoo.com/news/signature-bank-sbny-down-0-163004409.html,Zacks
4,2022-02-14 09:04,Raging Inflation Ups Chances of Bigger Rate Hike: 3 Bank Picks,https://finance.yahoo.com/news/raging-inflation-ups-chances-bigger-140402466.html,Zacks
5,2022-02-11 07:00,Hot T. Rowe Price Mutual Fund Finds Clever Crypto Bet,https://www.investors.com/etfs-and-funds/mutual-funds/best-mutual-funds-t-rowe-price-portfolio-one-of-thanks-to-30-stock-pickers/?src=A00220,Investor's Business Daily
6,2022-02-09 09:40,Is Signature Bank (SBNY) Outperforming Other Finance Stocks This Year?,https://finance.yahoo.com/news/signature-bank-sbny-outperforming-other-144002660.html,Zacks
7,2022-02-08 13:38,"Swiss National Bank Buys Canadian Pacific Railway, VMware Inc, Airbnb Inc, Sells JD. ...",https://finance.yahoo.com/news/swiss-national-bank-buys-canadian-183824467.html,GuruFocus.com
8,2022-02-07 13:38,"Full18 Capital LLC Buys Bank of New York Mellon Corp, Nuvei Corp, Goldman Sachs Group Inc, ...",https://finance.yahoo.com/news/full18-capital-llc-buys-bank-183833681.html,GuruFocus.com
9,2022-02-07 09:38,"Delta Investment Management, LLC Buys PowerShares QQQ Trust Ser 1, JPMorgan Equity Premium ...",https://finance.yahoo.com/news/delta-investment-management-llc-buys-143814135.html,GuruFocus.com
10,2022-02-07 09:38,"Mitsubishi UFJ Kokusai Asset Management Co., Ltd. ...",https://finance.yahoo.com/news/mitsubishi-ufj-kokusai-asset-management-143810980.html,GuruFocus.com
11,2022-02-07 09:38,"Fort Washington Investment Advisors Inc  Buys Visa Inc, Airbnb Inc, Biomarin Pharmaceutical ...",https://finance.yahoo.com/news/fort-washington-investment-advisors-inc-143803657.html,GuruFocus.com
12,2022-02-06 12:08,Were Hedge Funds Right About Signature Bank (SBNY)?,https://finance.yahoo.com/news/were-hedge-funds-signature-bank-170813010.html,Insider Monkey
13,2022-02-04 17:38,"Kentucky Retirement Systems Insurance Trust Fund Buys EPAM Systems Inc, Signature Bank, FactSet ...",https://finance.yahoo.com/news/kentucky-retirement-systems-insurance-trust-223826268.html,GuruFocus.com
14,2022-02-02 13:38,"MV Capital Management, Inc. Buys Abbott Laboratories, AbbVie Inc, Fidelity Blue Chip Growth ...",https://finance.yahoo.com/news/mv-capital-management-inc-buys-183834047.html,GuruFocus.com
15,2022-02-02 09:38,"Sumitomo Mitsui Trust Holdings, Inc. Buys Roku Inc, Zoom Video Communications Inc, Robinhood ...",https://finance.yahoo.com/news/sumitomo-mitsui-trust-holdings-inc-143809733.html,GuruFocus.com
16,2022-01-31 21:38,"Chevy Chase Trust Holdings, Inc. Buys EPAM Systems Inc, FactSet Research Systems Inc, Signature ...",https://finance.yahoo.com/news/chevy-chase-trust-holdings-inc-023803520.html,GuruFocus.com
17,2022-01-31 13:38,"Toth Financial Advisory Corp Buys First Trust Preferred Securities and Income ETF, Aflac Inc, ...",https://finance.yahoo.com/news/toth-financial-advisory-corp-buys-183833514.html,GuruFocus.com
18,2022-01-31 05:00,Signature Bank and Brooklyn Legal Services Corporation A Collaborate to Provide Funding Through Federal Home Loan Bank of New Yorks Small Business Recovery Grant Program,https://finance.yahoo.com/news/signature-bank-brooklyn-legal-services-100000048.html,Business Wire
19,2022-01-28 13:38,"Bellwether Advisors, LLC Buys Financial Select Sector SPDR, Consumer Discretionary Select ...",https://finance.yahoo.com/news/bellwether-advisors-llc-buys-financial-183820778.html,GuruFocus.com
20,2022-01-28 10:18,3 Strong Buy Stocks That Are Poised to Benefit From the Coming Rate Hikes,https://finance.yahoo.com/news/3-strong-buy-stocks-poised-151847808.html,TipRanks
21,2022-01-27 10:40,Is Signature Bank (SBNY) A Great Investment Choice?,https://finance.yahoo.com/news/signature-bank-sbny-great-investment-154037295.html,Insider Monkey
22,2022-01-25 17:38,"Tran Capital Management, L.p. Buys Block Inc, Signature Bank, PayPal Holdings Inc, Sells Fiserv ...",https://finance.yahoo.com/news/tran-capital-management-l-p-223826279.html,GuruFocus.com
23,2022-01-24 12:11,The total return for Signature Bank (NASDAQ:SBNY) investors has risen faster than earnings growth over the last three years,https://finance.yahoo.com/news/total-return-signature-bank-nasdaq-171110996.html,Simply Wall St.
24,2022-01-24 08:55,Crypto Bank Battle: Signature Bank Appears to Be Gaining on Silvergate Capital,https://www.fool.com/investing/2022/01/24/crypto-bank-battle-signature-bank-appears-to-be-ma/?source=eptyholnk0000202&utm_source=yahoo-host&utm_medium=feed&utm_campaign=article,Motley Fool
25,2022-01-24 07:29,Best Momentum Stocks to Buy for January 24th,https://finance.yahoo.com/news/best-momentum-stocks-buy-january-122912689.html,Zacks
26,2022-01-20 19:38,"FPA Crescent Fund Buys Activision Blizzard Inc, Amazon. ...",https://finance.yahoo.com/news/fpa-crescent-fund-buys-activision-003802404.html,GuruFocus.com
27,2022-01-20 13:20,Signature Bank -- Moody's announces completion of a periodic review of ratings of Signature Bank,https://finance.yahoo.com/news/signature-bank-moodys-announces-completion-182006681.html,Moody's
28,2022-01-20 09:38,"Sumitomo Mitsui DS Asset Management Company, Ltd Buys Vanguard Emerging Markets Government Bond ...",https://finance.yahoo.com/news/sumitomo-mitsui-ds-asset-management-143803697.html,GuruFocus.com
29,2022-01-19 13:38,"New Mexico Educational Retirement Board Buys Alcoa Corp, EPAM Systems Inc, Bruker Corp, Sells ...",https://finance.yahoo.com/news/mexico-educational-retirement-board-buys-183803791.html,GuruFocus.com
30,2022-01-18 22:35,Signature Bank Announces Pricing of Public Stock Offering,https://finance.yahoo.com/news/signature-bank-announces-pricing-public-033500101.html,Business Wire
31,2022-01-18 18:00,Signature Bank (SBNY) Q4 2021 Earnings Call Transcript,https://www.fool.com/earnings/call-transcripts/2022/01/18/signature-bank-sbny-q4-2021-earnings-call-transcri/?source=eptyholnk0000202&utm_source=yahoo-host&utm_medium=feed&utm_campaign=article,Motley Fool
32,2022-01-18 16:13,Signature Bank Announces Public Stock Offering,https://finance.yahoo.com/news/signature-bank-announces-public-stock-211300876.html,Business Wire
33,2022-01-18 13:52,Signature Bank (SBNY) Q4 Earnings Beat on Higher Revenues,https://finance.yahoo.com/news/signature-bank-sbny-q4-earnings-185206681.html,Zacks
34,2022-01-18 07:05,Signature Bank (SBNY) Surpasses Q4 Earnings and Revenue Estimates,https://finance.yahoo.com/news/signature-bank-sbny-surpasses-q4-120512301.html,Zacks
35,2022-01-18 05:00,Signature Bank Reports 2021 Fourth Quarter and Year-End Results,https://finance.yahoo.com/news/signature-bank-reports-2021-fourth-100000196.html,Business Wire
36,2022-01-14 17:38,"Farmers & Merchants Investments Inc Buys Berkshire Hathaway Inc, VMware Inc, Exxon Mobil ...",https://finance.yahoo.com/news/farmers-merchants-investments-inc-buys-223811976.html,GuruFocus.com
37,2022-01-13 10:32,Key Factors to Impact Signature Bank's (SBNY) Q4 Earnings,https://finance.yahoo.com/news/key-factors-impact-signature-banks-153203224.html,Zacks
38,2022-01-12 05:00,Signature Bank to Host 2021 Fourth Quarter and Year-end Results Conference Call,https://finance.yahoo.com/news/signature-bank-host-2021-fourth-100000561.html,Business Wire
39,2021-12-30 18:31,The 2 Most Surprising Stock Winners of 2021,https://www.fool.com/investing/2021/12/30/the-2-most-surprising-stock-winners-of-2021/?source=eptyholnk0000202&utm_source=yahoo-host&utm_medium=feed&utm_campaign=article,Motley Fool
40,2021-12-29 13:44,4 Bank Stocks That More Than Doubled in 2021,https://finance.yahoo.com/news/4-bank-stocks-more-doubled-184406107.html,Zacks
41,2021-12-19 05:38,"Timothy Plan Aggressive Growth Fund Buys Palo Alto Networks Inc, Maravai LifeSciences Holdings ...",https://finance.yahoo.com/news/timothy-plan-aggressive-growth-fund-103801088.html,GuruFocus.com
42,2021-12-17 21:38,"Mfs Variable Insurance Trust Iii Buys Phillips Edison Inc, First Interstate BancSystem Inc, ...",https://finance.yahoo.com/news/mfs-variable-insurance-trust-iii-023802047.html,GuruFocus.com
43,2021-12-16 16:38,"Invesco Main Street Small Cap Fund Buys Chesapeake Energy Corp, Paycor HCM Inc, Acadia ...",https://finance.yahoo.com/news/invesco-main-street-small-cap-213803748.html,GuruFocus.com
44,2021-12-13 18:38,"ON AB Mid Cap Core Portfolio Buys Dynatrace Inc, Chart Industries Inc, ON Semiconductor Corp, ...",https://finance.yahoo.com/news/ab-mid-cap-core-portfolio-233803772.html,GuruFocus.com
45,2021-12-13 16:38,"Invesco V.I. Main Street Small Cap Fund Buys Chesapeake Energy Corp, Paycor HCM Inc, Acadia ...",https://finance.yahoo.com/news/invesco-v-main-street-small-213811831.html,GuruFocus.com
46,2021-12-13 16:38,Invesco V.I. Main Street Fund Buys Salesforce. ...,https://finance.yahoo.com/news/invesco-v-main-street-fund-213810430.html,GuruFocus.com
47,2021-12-11 00:38,"Optimum Fund Trust Buys Everbridge Inc, BJ's Wholesale Club Holdings Inc, Herc Holdings Inc, ...",https://finance.yahoo.com/news/optimum-fund-trust-buys-everbridge-053803171.html,GuruFocus.com
48,2021-12-10 11:38,"Parnassus Funds Buys Synopsys Inc, Ball Corp, Signature Bank, Sells Clorox Co, Grocery Outlet ...",https://finance.yahoo.com/news/parnassus-funds-buys-synopsys-inc-163805221.html,GuruFocus.com
49,2021-12-07 14:30,Hedge Funds Are Flocking Into Signature Bank (SBNY),https://finance.yahoo.com/news/hedge-funds-flocking-signature-bank-193043445.html,Insider Monkey
50,2021-12-03 19:51,"Signature Bank, SolarEdge Technologies and FactSet Research Systems Set to Join S&P 500; Others to Join S&P MidCap 400 and S&P SmallCap 600",https://finance.yahoo.com/news/signature-bank-solaredge-technologies-factset-005100244.html,PR Newswire
51,2021-12-01 05:00,Signature Bank to Participate in the Goldman Sachs 2021 US Financial Services Conference,https://finance.yahoo.com/news/signature-bank-participate-goldman-sachs-100000674.html,Business Wire
52,2021-11-30 16:10,Top Stocks for December 2021,https://www.investopedia.com/top-stocks-4581225?utm_campaign=quote-yahoo&utm_source=yahoo&utm_medium=referral,Investopedia
53,2021-11-22 07:40,Want to Beat Wall Street? Buy and Hold This Growth Stock,https://www.fool.com/investing/2021/11/22/want-to-beat-wall-street-buy-and-hold-this-growth/?source=eptyholnk0000202&utm_source=yahoo-host&utm_medium=feed&utm_campaign=article,Motley Fool
54,2021-11-18 11:30,Signature Bank (SBNY) Up 4.4% Since Last Earnings Report: Can It Continue?,https://finance.yahoo.com/news/signature-bank-sbny-4-4-163004317.html,Zacks
55,2021-11-09 08:15,2 Crypto Stocks That Could Hedge Inflation Better Than Bitcoin,https://www.fool.com/investing/2021/11/09/2-crypto-stocks-that-could-hedge-inflation-better/?source=eptyholnk0000202&utm_source=yahoo-host&utm_medium=feed&utm_campaign=article,Motley Fool
56,2021-11-03 05:00,Signature Bank to Participate in the BofA Securities 2021 Banking and Financials Virtual Conference,https://finance.yahoo.com/news/signature-bank-participate-bofa-securities-090000353.html,Business Wire
57,2021-10-29 10:20,Battle of the Crypto Banks: Silvergate Capital vs. Signature Bank,https://www.fool.com/investing/2021/10/29/battle-of-the-crypto-banks-silvergate-capital-vs-s/?source=eptyholnk0000202&utm_source=yahoo-host&utm_medium=feed&utm_campaign=article,Motley Fool
58,2021-10-28 09:02,Will Record Earnings Become the Norm at Signature Bank?,https://www.fool.com/investing/2021/10/28/will-record-earnings-become-the-norm-at-signature/?source=eptyholnk0000202&utm_source=yahoo-host&utm_medium=feed&utm_campaign=article,Motley Fool
59,2021-10-21 11:03,Does Signature Bank (NASDAQ:SBNY) Deserve A Spot On Your Watchlist?,https://finance.yahoo.com/news/does-signature-bank-nasdaq-sbny-150320451.html,Simply Wall St.
60,2021-10-20 14:45,Signature Bank Stock Earns Membership In 95-Plus Composite Rating Club,https://www.investors.com/research/signature-bank-earns-membership-in-95-plus-composite-rating-club/?src=A00220,Investor's Business Daily
61,2021-10-20 11:34,Signature Bank (SBNY) Shares Dip 3.8% Despite Q3 Earnings Beat,https://finance.yahoo.com/news/signature-bank-sbny-shares-dip-153403726.html,Zacks
62,2021-10-19 15:15,Why New York venture banks are finding traction in Durham,https://www.bizjournals.com/triangle/news/2021/10/19/new-york-venture-banks-build-presence-in-durham.html?ana=yahoo,American City Business Journals
63,2021-10-19 14:30,Signature Bank (SBNY) Q3 2021 Earnings Call Transcript,https://www.fool.com/earnings/call-transcripts/2021/10/19/signature-bank-sbny-q3-2021-earnings-call-transcri/?source=eptyholnk0000202&utm_source=yahoo-host&utm_medium=feed&utm_campaign=article,Motley Fool
64,2021-10-19 10:01,Investor who almost doubled the return of her index says these three midcap stocks are ripe for the economic recovery,https://www.marketwatch.com/story/investor-who-almost-doubled-the-return-of-her-index-says-these-three-mid-cap-stocks-are-ripe-for-the-economic-recovery-11634652108?siteid=yhoof2,MarketWatch
65,2021-10-19 07:05,Signature Bank (SBNY) Beats Q3 Earnings Estimates,https://finance.yahoo.com/news/signature-bank-sbny-beats-q3-110511977.html,Zacks
66,2021-10-19 05:00,Signature Bank Reports 2021 Third Quarter Results,https://finance.yahoo.com/news/signature-bank-reports-2021-third-090000261.html,Business Wire
67,2021-10-13 12:35,Signature Bank to Host 2021 Third Quarter Results Conference Call,https://finance.yahoo.com/news/signature-bank-host-2021-third-163500182.html,Business Wire
68,2021-10-12 15:00,Signature Bank (SBNY) to Report Q3 Results: Wall Street Expects Earnings Growth,https://finance.yahoo.com/news/signature-bank-sbny-report-q3-190007914.html,Zacks
69,2021-10-12 09:51,15 Best Bank Stocks To Buy Now,https://finance.yahoo.com/news/15-best-bank-stocks-buy-135136319.html,Insider Monkey
70,2021-10-05 11:29,Hedge Funds Are Piling Into Signature Bank (SBNY),https://finance.yahoo.com/news/hedge-funds-piling-signature-bank-152947963.html,Insider Monkey
71,2021-09-28 05:15,Signature Bank (SBNY) Moves 6.1% Higher: Will This Strength Last?,https://finance.yahoo.com/news/signature-bank-sbny-moves-6-091509159.html,Zacks
72,2021-09-27 13:31,Is Signature Bank (SBNY) A Smart Long-Term Buy?,https://finance.yahoo.com/news/signature-bank-sbny-smart-long-173118646.html,Insider Monkey
73,2021-09-20 10:00,"Signature Bank Named Number One in Three Categories of New York Law Journals 12th Annual ""Best of"" Survey",https://finance.yahoo.com/news/signature-bank-named-number-one-140000142.html,Business Wire
74,2021-09-03 11:53,Why Signature Bank Stock Jumped 14.3% in August,https://www.fool.com/investing/2021/09/03/why-signature-bank-stock-jumped-143-in-august/?source=eptyholnk0000202&utm_source=yahoo-host&utm_medium=feed&utm_campaign=article,Motley Fool
75,2021-08-25 05:00,Signature Bank Releases 2020 Social Impact Report,https://finance.yahoo.com/news/signature-bank-releases-2020-social-090000291.html,Business Wire
76,2021-07-23 02:01,Signature Bank (NASDAQ:SBNY) Is Due To Pay A Dividend Of US$0.56,https://finance.yahoo.com/news/signature-bank-nasdaq-sbny-due-060132747.html,Simply Wall St.
77,2021-07-21 14:26,Fetch Package Gets $60M To Expand Deliveries To Multifamily Housing,https://finance.yahoo.com/news/fetch-package-gets-60m-expand-182627064.html,Benzinga
78,2021-07-21 10:50,Signature Bank (SBNY) Rises 3.4% as Q2 Earnings Top Estimates,https://finance.yahoo.com/news/signature-bank-sbny-rises-3-145002226.html,Zacks
79,2021-07-20 23:03,Signature Bank Announces Upsize and Pricing of Public Stock Offering,https://finance.yahoo.com/news/signature-bank-announces-upsize-pricing-030300254.html,Business Wire
80,2021-07-20 17:10,Signature Bank Announces Public Stock Offering,https://finance.yahoo.com/news/signature-bank-announces-public-stock-211000230.html,Business Wire
81,2021-07-20 15:00,Signature Bank (SBNY) Q2 2021 Earnings Call Transcript,https://www.fool.com/earnings/call-transcripts/2021/07/20/signature-bank-sbny-q2-2021-earnings-call-transcri/?source=eptyholnk0000202&utm_source=yahoo-host&utm_medium=feed&utm_campaign=article,Motley Fool
82,2021-07-20 07:05,Signature Bank (SBNY) Tops Q2 Earnings and Revenue Estimates,https://finance.yahoo.com/news/signature-bank-sbny-tops-q2-110511676.html,Zacks
83,2021-07-20 05:00,Signature Bank Reports 2021 Second Quarter Results,https://finance.yahoo.com/news/signature-bank-reports-2021-second-090000816.html,Business Wire
84,2021-07-14 05:00,Signature Bank to Host 2021 Second Quarter Results Conference Call,https://finance.yahoo.com/news/signature-bank-host-2021-second-090000960.html,Business Wire
85,2021-07-13 15:00,Signature Bank (SBNY) Earnings Expected to Grow: Should You Buy?,https://finance.yahoo.com/news/signature-bank-sbny-earnings-expected-190007142.html,Zacks
86,2021-06-28 09:55,Hedge Funds Have Never Been This Bullish On Signature Bank (SBNY),https://finance.yahoo.com/news/hedge-funds-never-bullish-signature-135528974.html,Insider Monkey
87,2021-06-09 05:00,"Signature Bank to Present at the Virtual 2021 Morgan Stanley US Financials, Payments and CRE Conference",https://finance.yahoo.com/news/signature-bank-present-virtual-2021-090000249.html,Business Wire
88,2021-06-02 12:18,Should You Consider Investing in Signature Bank (SBNY)?,https://finance.yahoo.com/news/consider-investing-signature-bank-sbny-161841416.html,Insider Monkey
89,2021-06-01 08:51,Signature Bank Is Doing Really Well. And It's Going to Do a Whole Lot Better,https://www.fool.com/investing/2021/06/01/signature-bank-is-doing-really-well-and-its-going/?source=eptyholnk0000202&utm_source=yahoo-host&utm_medium=feed&utm_campaign=article,Motley Fool
90,2021-05-21 11:30,Signature Bank (SBNY) Down 1.5% Since Last Earnings Report: Can It Rebound?,https://finance.yahoo.com/news/signature-bank-sbny-down-1-153003357.html,Zacks
91,2021-05-19 07:35,Buy This Stock Before It Hits Wall Street's Radar,https://www.fool.com/investing/2021/05/19/buy-this-stock-before-it-hits-wall-streets-radar/?source=eptyholnk0000202&utm_source=yahoo-host&utm_medium=feed&utm_campaign=article,Motley Fool
92,2021-05-14 10:21,Signature Bank to Participate in the Wells Fargo Securities Virtual Financial Services Investor Conference,https://finance.yahoo.com/news/signature-bank-participate-wells-fargo-142100492.html,Business Wire
93,2021-05-12 16:26,"Signature Bank, IBD Stock Of The Day, Near Buy Point Amid Strong Earnings, Bitcoin Growth",https://www.investors.com/research/ibd-stock-of-the-day/sbny-stock-near-buy-point-amid-strong-earnings-bitcoin-business-growth/?src=A00220,Investor's Business Daily
94,2021-04-26 12:18,"Signature Bank Moves Higher, Is Volume An Issue?",https://finance.yahoo.com/video/signature-bank-moves-higher-volume-161836603.html,Investor's Business Daily Video
95,2021-04-25 03:20,Here's What We Like About Signature Bank's (NASDAQ:SBNY) Upcoming Dividend,https://finance.yahoo.com/news/heres-signature-banks-nasdaq-sbny-072042406.html,Simply Wall St.
96,2021-04-23 05:00,Signature Bank Announces Both Executive and Senior Management Appointments,https://finance.yahoo.com/news/signature-bank-announces-both-executive-090000766.html,Business Wire
97,2021-04-22 23:00,Is SBNY Stock A Buy or Sell?,https://finance.yahoo.com/news/sbny-stock-buy-sell-030016515.html,Insider Monkey
98,2021-04-22 07:09,Signature Bank (SBNY) Up 9.1% as Q1 Earnings Beat Estimates,https://finance.yahoo.com/news/signature-bank-sbny-9-1-110911277.html,Zacks
99,2021-04-22 01:16,Signature Bank Shares Soar on Upbeat Q1 Earnings; Stock Has Over 25% Upside Potential,https://finance.yahoo.com/news/signature-bank-shares-soar-upbeat-051625047.html,FX Empire
