,Date,News Headline,Article Link,Source
0,2022-02-28 08:00,Iveric Bio to Present at the Cowen 42nd Annual Health Care Conference,https://finance.yahoo.com/news/iveric-bio-present-cowen-42nd-130000232.html,Business Wire
1,2022-02-24 18:00,"IVERIC bio, Inc. (ISEE) Q4 2021 Earnings Call Transcript",https://www.fool.com/earnings/call-transcripts/2022/02/24/iveric-bio-inc-isee-q4-2021-earnings-call-transcri/?source=eptyholnk0000202&utm_source=yahoo-host&utm_medium=feed&utm_campaign=article,Motley Fool
2,2022-02-24 06:30,Iveric Bio Reports Fourth Quarter and Full Year 2021 Operational Highlights and Financial Results,https://finance.yahoo.com/news/iveric-bio-reports-fourth-quarter-113000313.html,Business Wire
3,2022-02-17 08:00,"Iveric Bio to Report Fourth Quarter and Full Year 2021 Financial Results and Host Conference Call on Thursday, February 24, 2022",https://finance.yahoo.com/news/iveric-bio-report-fourth-quarter-130000990.html,Business Wire
4,2022-02-17 02:38,Top 10 Stock Picks of Srini Akkaraju and Michael Dybbs Samsara BioCapital,https://finance.yahoo.com/news/top-10-stock-picks-srini-073811188.html,Insider Monkey
5,2022-02-11 08:00,Iveric Bio Announces Foveal Anatomy Post-Hoc Analysis from GATHER1 Clinical Trial of Zimura® in Patients with Geographic Atrophy,https://finance.yahoo.com/news/iveric-bio-announces-foveal-anatomy-130000304.html,Business Wire
6,2022-02-07 08:00,"Iveric Bio Announces New Post-Hoc Analyses of Zimura® from GATHER1 Clinical Trial to Be Presented at Angiogenesis, Exudation, and Degeneration 2022",https://finance.yahoo.com/news/iveric-bio-announces-post-hoc-130000482.html,Business Wire
7,2022-02-05 15:07,"Were Hedge Funds Right About IVERIC bio, Inc. (ISEE)?",https://finance.yahoo.com/news/were-hedge-funds-iveric-bio-200702923.html,Insider Monkey
8,2022-02-02 08:00,Iveric Bio Reports Inducement Grants Under Nasdaq Listing Rule 5635(c)(4),https://finance.yahoo.com/news/iveric-bio-reports-inducement-grants-130000793.html,Business Wire
9,2022-01-06 08:00,"Iveric Bio Announces the Addition of Global Pharmaceutical Veteran, Christine Ann Miller, to its Board of Directors",https://finance.yahoo.com/news/iveric-bio-announces-addition-global-130000911.html,Business Wire
10,2022-01-04 16:35,Iveric Bio Reports Inducement Grants Under Nasdaq Listing Rule 5635(c)(4),https://finance.yahoo.com/news/iveric-bio-reports-inducement-grants-213500052.html,Business Wire
11,2022-01-04 08:00,Iveric Bio to Present at the H.C. Wainwright BioConnect Virtual Conference,https://finance.yahoo.com/news/iveric-bio-present-h-c-130000101.html,Business Wire
12,2021-12-30 07:06,"IVERIC bio, Inc. (NASDAQ:ISEE) insider upped their holding by 77% earlier this year",https://finance.yahoo.com/news/iveric-bio-inc-nasdaq-isee-120631904.html,Simply Wall St.
13,2021-12-28 09:19,BridgeBio (BBIO) Tumbles on Cardiomyopathy Candidate Failure,https://finance.yahoo.com/news/bridgebio-bbio-tumbles-cardiomyopathy-candidate-141902789.html,Zacks
14,2021-12-28 09:15,"Iveric Bio Inc (ISEE) CEO Glenn Sblendorio Sold $980,058 of Shares",https://finance.yahoo.com/news/iveric-bio-inc-isee-ceo-141502901.html,GuruFocus.com
15,2021-12-23 23:15,"Iveric Bio Inc (ISEE) SVP, CFO and Treasurer David Francis Carroll Sold $898,188 of Shares",https://finance.yahoo.com/news/iveric-bio-inc-isee-svp-041501924.html,GuruFocus.com
16,2021-12-23 08:50,"IVERIC bio (ISEE) is on the Move, Here's Why the Trend Could be Sustainable",https://finance.yahoo.com/news/iveric-bio-isee-move-heres-135001600.html,Zacks
17,2021-12-21 12:18,Glaxo (GSK) Gets FDA Nod for HIV Preventive Injectable Drug,https://finance.yahoo.com/news/glaxo-gsk-gets-fda-nod-171805183.html,Zacks
18,2021-12-20 10:31,bluebird's (BLUE) BLA for CALD Therapy Gets Priority Review,https://finance.yahoo.com/news/bluebirds-blue-bla-cald-therapy-153103836.html,Zacks
19,2021-12-20 10:20,Novavax (NVAX) COVID Jab Gets WHO Nod for Emergency Use Listing,https://finance.yahoo.com/news/novavax-nvax-covid-jab-gets-152003872.html,Zacks
20,2021-12-17 09:44,Biogen (BIIB) to Begin Aduhelm Confirmatory Study in 2022,https://finance.yahoo.com/news/biogen-biib-begin-aduhelm-confirmatory-144402694.html,Zacks
21,2021-12-16 10:26,Jazz (JAZZ) Enrols First Patient in Essential Tremor Study,https://finance.yahoo.com/news/jazz-jazz-enrols-first-patient-152603050.html,Zacks
22,2021-12-14 17:19,Bellus (BLU) Stock Surges on Data From Chronic Cough Study,https://finance.yahoo.com/news/bellus-blu-stock-surges-data-221910853.html,Zacks
23,2021-12-14 17:17,Intellia (NTLA) Begins Dosing in Hereditary Angioedema Study,https://finance.yahoo.com/news/intellia-ntla-begins-dosing-hereditary-221710925.html,Zacks
24,2021-12-13 17:08,Iveric Bio Appoints Tony Gibney as Executive Vice President and Chief Business and Strategy Officer,https://finance.yahoo.com/news/iveric-bio-appoints-tony-gibney-220800605.html,Business Wire
25,2021-12-09 11:18,Reata (RETA) Falls on Negative Advisory Committee Outcome,https://finance.yahoo.com/news/reata-reta-falls-negative-advisory-161804118.html,Zacks
26,2021-12-09 10:38,Affimed (AFMD) Starts AFM24-102 Study With Roche's Tecentriq,https://finance.yahoo.com/news/affimed-afmd-starts-afm24-102-153803184.html,Zacks
27,2021-12-08 11:14,"Hedge Funds Are Crazy About IVERIC bio, Inc. (ISEE)",https://finance.yahoo.com/news/hedge-funds-crazy-iveric-bio-161414269.html,Insider Monkey
28,2021-12-07 10:26,Reata (RETA) Plunges on FDA Concerns for Kidney Failure Drug,https://finance.yahoo.com/news/reata-reta-plunges-fda-concerns-152603879.html,Zacks
29,2021-12-03 11:58,7 A-Rated Biotechs to Buy for the Long Run,https://finance.yahoo.com/news/7-rated-biotechs-buy-long-165848493.html,InvestorPlace
30,2021-12-02 10:13,Vertex (VRTX) Up on Kidney Disease Drug's Success in Phase II,https://finance.yahoo.com/news/vertex-vrtx-kidney-disease-drugs-151303973.html,Zacks
31,2021-12-02 08:00,Iveric Bio Reports Inducement Grants Under Nasdaq Listing Rule 5635(c)(4),https://finance.yahoo.com/news/iveric-bio-reports-inducement-grants-130000517.html,Business Wire
32,2021-12-01 13:52,AbbVie (ABBV) Files for Skyrizi to Treat Crohn's Disease in EU,https://finance.yahoo.com/news/abbvie-abbv-files-skyrizi-treat-185206429.html,Zacks
33,2021-12-01 13:38,Jazz (JAZZ) Begins Zepzelca Combo Study for First-Line SCLC,https://finance.yahoo.com/news/jazz-jazz-begins-zepzelca-combo-183806261.html,Zacks
34,2021-11-30 16:01,Adagene (ADAG) Gets FDA Nod to Begin Solid Tumor Antibody Study,https://finance.yahoo.com/news/adagene-adag-gets-fda-nod-210109448.html,Zacks
35,2021-11-29 10:25,Novavax (NVAX) Stock Up YTD on COVID-19 Vaccine Potential,https://finance.yahoo.com/news/novavax-nvax-stock-ytd-covid-152503270.html,Zacks
36,2021-11-25 09:08,Takeda (TAK) CMV Infection Drug Livtencity Gets FDA Approval,https://finance.yahoo.com/news/takeda-tak-cmv-infection-drug-140802969.html,Zacks
37,2021-11-24 10:31,Amryt (AMYT) Skin Disorder NDA Review Gets 3 Months Extension,https://finance.yahoo.com/news/amryt-amyt-skin-disorder-nda-153103213.html,Zacks
38,2021-11-22 11:23,"BioMarin's (BMRN) Dwarfism Drug Gets FDA's Nod, Stock Up",https://finance.yahoo.com/news/biomarins-bmrn-dwarfism-drug-gets-162304207.html,Zacks
39,2021-11-10 08:00,Iveric Bio to Participate in the Stifel 2021 Virtual Healthcare Conference,https://finance.yahoo.com/news/iveric-bio-participate-stifel-2021-130000758.html,Business Wire
40,2021-11-09 21:01,"IVERIC bio, Inc. (ISEE) Q3 2021 Earnings Call Transcript",https://www.fool.com/earnings/call-transcripts/2021/11/09/iveric-bio-inc-isee-q3-2021-earnings-call-transcri/?source=eptyholnk0000202&utm_source=yahoo-host&utm_medium=feed&utm_campaign=article,Motley Fool
41,2021-11-09 06:30,Iveric Bio Reports Third Quarter 2021 Operational Highlights and Financial Results,https://finance.yahoo.com/news/iveric-bio-reports-third-quarter-113000877.html,Business Wire
42,2021-11-03 08:30,Iveric Bio to Participate in the Credit Suisse 30th Annual Virtual Healthcare Conference,https://finance.yahoo.com/news/iveric-bio-participate-credit-suisse-123000951.html,Business Wire
43,2021-11-02 08:15,Iveric Bio Reports Inducement Grants Under Nasdaq Listing Rule 5635(c)(4),https://finance.yahoo.com/news/iveric-bio-reports-inducement-grants-121500177.html,Business Wire
44,2021-11-02 08:00,"Iveric Bio to Report Third Quarter 2021 Financial Results and Host Conference Call on Tuesday, November 9, 2021",https://finance.yahoo.com/news/iveric-bio-report-third-quarter-120000582.html,Business Wire
45,2021-10-21 20:30,Iveric Bio Announces Pricing of Upsized Public Offering of Common Stock,https://finance.yahoo.com/news/iveric-bio-announces-pricing-upsized-003000567.html,Business Wire
46,2021-10-19 10:33,"Do Hedge Funds Love IVERIC bio, Inc. (ISEE)?",https://finance.yahoo.com/news/hedge-funds-love-iveric-bio-143358749.html,Insider Monkey
47,2021-10-14 06:57,10 Pharmaceutical Stocks to Buy According to Timothy Lynchs Stonepine Capital,https://finance.yahoo.com/news/10-pharmaceutical-stocks-buy-according-105706011.html,Insider Monkey
48,2021-10-04 08:00,Iveric Bio Reports Inducement Grants Under Nasdaq Listing Rule 5635(c)(4),https://finance.yahoo.com/news/iveric-bio-reports-inducement-grants-120000566.html,Business Wire
49,2021-09-30 10:14,"Are Investors Undervaluing IVERIC bio, Inc. (NASDAQ:ISEE) By 36%?",https://finance.yahoo.com/news/investors-undervaluing-iveric-bio-inc-141430852.html,Simply Wall St.
50,2021-09-29 08:47,15 Biotech Stocks to Buy Now According to Srini Akkaraju and Michael Dybbs Samsara BioCapital,https://finance.yahoo.com/news/15-biotech-stocks-buy-now-124733451.html,Insider Monkey
51,2021-09-13 05:07,60 Biggest Movers From Friday,https://finance.yahoo.com/news/60-biggest-movers-friday-090711755.html,Benzinga
52,2021-09-10 16:05,Iveric Bio to Present at the H.C. Wainwright 23rd Annual Global Investment Conference,https://finance.yahoo.com/news/iveric-bio-present-h-c-200500278.html,Business Wire
53,2021-09-10 12:23,41 Stocks Moving In Friday's Mid-Day Session,https://finance.yahoo.com/news/41-stocks-moving-fridays-mid-162323054.html,Benzinga
54,2021-09-10 11:39,Here's Why Iveric Bio Stock Is Rocketing Higher Today,https://www.fool.com/investing/2021/09/10/heres-why-iveric-bio-stock-is-rocketing-higher-tod/?source=eptyholnk0000202&utm_source=yahoo-host&utm_medium=feed&utm_campaign=article,Motley Fool
55,2021-09-10 10:58,ISEE Stock: Why Rival Eye Drug Developers Disappointment Is a Boon to IVERIC bio,https://finance.yahoo.com/news/isee-stock-why-rival-eye-145805479.html,InvestorPlace
56,2021-09-10 10:40,Why IVERIC Bio Shares Are Soaring Today,https://finance.yahoo.com/news/why-iveric-bio-shares-soaring-144034435.html,Benzinga
57,2021-09-10 07:02,20 Stocks Moving in Friday's Pre-Market Session,https://finance.yahoo.com/news/20-stocks-moving-fridays-pre-110230083.html,Benzinga
58,2021-09-02 08:00,Iveric Bio Reports Inducement Grants Under Nasdaq Listing Rule 5635(c)(4),https://finance.yahoo.com/news/iveric-bio-reports-inducement-grants-120000935.html,Business Wire
59,2021-08-18 08:40,Implied Volatility Surging for IVERIC bio (ISEE) Stock Options,https://finance.yahoo.com/news/implied-volatility-surging-iveric-bio-124012527.html,Zacks
60,2021-08-10 08:00,Iveric Bio to Present at the H.C. Wainwright Ophthalmology Virtual Conference,https://finance.yahoo.com/news/iveric-bio-present-h-c-120000029.html,Business Wire
61,2021-08-04 16:05,"Iveric Bio to Participate in the 2021 Wedbush PacGrow Healthcare Virtual Conference on August 11, 2021",https://finance.yahoo.com/news/iveric-bio-participate-2021-wedbush-200500754.html,Business Wire
62,2021-08-04 06:30,Iveric Bio Reports Second Quarter 2021 Operational Highlights and Financial Results,https://finance.yahoo.com/news/iveric-bio-reports-second-quarter-103000577.html,Business Wire
63,2021-08-03 08:00,Iveric Bio Reports Inducement Grants under Nasdaq Listing Rule 5635(c)(4),https://finance.yahoo.com/news/iveric-bio-reports-inducement-grants-120000488.html,Business Wire
64,2021-08-01 05:36,"How Much Of IVERIC bio, Inc. (NASDAQ:ISEE) Do Institutions Own?",https://finance.yahoo.com/news/much-iveric-bio-inc-nasdaq-093639909.html,Simply Wall St.
65,2021-07-28 08:00,"Iveric Bio to Report Second Quarter 2021 Financial Results and Host Conference Call on Wednesday, August 4, 2021",https://finance.yahoo.com/news/iveric-bio-report-second-quarter-120000784.html,Business Wire
66,2021-07-26 07:30,Iveric Bio Completes Patient Enrollment of GATHER2 Pivotal Clinical Trial of Zimura® Ahead of Schedule,https://finance.yahoo.com/news/iveric-bio-completes-patient-enrollment-113000138.html,Business Wire
67,2021-07-19 07:30,Iveric Bio Appoints Christopher Simms as Chief Commercial Officer,https://finance.yahoo.com/news/iveric-bio-appoints-christopher-simms-113000963.html,Business Wire
68,2021-07-14 06:20,IVERIC bio (ISEE) Enters Overbought Territory,https://finance.yahoo.com/news/iveric-bio-isee-enters-overbought-102010399.html,Zacks
69,2021-07-13 07:17,Iveric Bio Raises $100M Via Equity To Fund Zimura Development In Geographic Atrophy,https://finance.yahoo.com/news/iveric-bio-raises-100m-via-111709957.html,Benzinga
70,2021-07-12 22:09,"IVERIC bio, Inc. Announces Pricing of $100 Million Public Offering of Common Stock",https://finance.yahoo.com/news/iveric-bio-inc-announces-pricing-020900620.html,Business Wire
71,2021-07-12 16:07,"IVERIC bio, Inc. Announces Proposed Offering of Common Stock",https://finance.yahoo.com/news/iveric-bio-inc-announces-proposed-200700487.html,Business Wire
72,2021-07-12 15:21,"Hedge Funds Are Selling IVERIC bio, Inc. (ISEE)",https://finance.yahoo.com/news/hedge-funds-selling-iveric-bio-192126707.html,Insider Monkey
73,2021-07-12 08:34,Do Options Traders Know Something About IVERIC bio (ISEE) Stock We Don't?,https://finance.yahoo.com/news/options-traders-know-something-iveric-123412332.html,Zacks
74,2021-07-06 07:29,Iveric Bio Stock Jumps Higher On SPA Agreement From FDA For Zimura Study In Geographic Atrophy,https://finance.yahoo.com/news/iveric-bio-stock-jumps-higher-112952243.html,Benzinga
75,2021-07-06 06:00,Iveric Bio Receives FDA Agreement Under Special Protocol Assessment (SPA) for GATHER2 Phase 3 Clinical Trial of Zimura® in Geographic Atrophy Secondary to Age-Related Macular Degeneration,https://finance.yahoo.com/news/iveric-bio-receives-fda-agreement-100000450.html,Business Wire
76,2021-06-18 09:26,Iveric Bio Reveals Positive Post-Hoc Analyses Of Zimura In Dry Age-Related Macular Degeneration,https://finance.yahoo.com/news/iveric-bio-reveals-positive-post-132635435.html,Benzinga
77,2021-06-18 07:00,Iveric Bio to Present Zimura® GATHER2 Enrollment and Retention Updates and New GATHER1 Post-Hoc Analyses Today at its Dry Age-Related Macular Degeneration Virtual Symposium for Investors,https://finance.yahoo.com/news/iveric-bio-present-zimura-gather2-110000490.html,Business Wire
78,2021-06-09 07:30,"Iveric Bio to Host Investor Symposium on Dry Age-Related Macular Degeneration on June 18, 2021",https://finance.yahoo.com/news/iveric-bio-host-investor-symposium-113000286.html,Business Wire
79,2021-05-05 23:01,"IVERIC bio, Inc. (ISEE) Q1 2021 Earnings Call Transcript",https://www.fool.com/earnings/call-transcripts/2021/05/05/iveric-bio-inc-isee-q1-2021-earnings-call-transcri/?source=eptyholnk0000202&utm_source=yahoo-host&utm_medium=feed&utm_campaign=article,Motley Fool
80,2021-05-05 06:30,Iveric Bio Reports First Quarter 2021 Operational Highlights and Financial Results,https://finance.yahoo.com/news/iveric-bio-reports-first-quarter-103000479.html,Business Wire
81,2021-05-05 06:15,"IVERIC bio, Inc. to Host Earnings Call",https://finance.yahoo.com/news/iveric-bio-inc-host-earnings-101500165.html,ACCESSWIRE
82,2021-05-04 08:00,Iveric Bio Reports Inducement Grants Under Nasdaq Listing Rule 5635(c)(4),https://finance.yahoo.com/news/iveric-bio-reports-inducement-grants-120000130.html,Business Wire
83,2021-05-02 05:39,IVERIC bio (NASDAQ:ISEE) Is In A Good Position To Deliver On Growth Plans,https://finance.yahoo.com/news/iveric-bio-nasdaq-isee-good-093912387.html,Simply Wall St.
84,2021-04-28 08:00,"Iveric Bio to Report First Quarter 2021 Financial Results and Host Conference Call on Wednesday, May 5, 2021",https://finance.yahoo.com/news/iveric-bio-report-first-quarter-120000585.html,Business Wire
85,2021-04-19 15:23,Is ISEE Stock A Buy or Sell?,https://finance.yahoo.com/news/isee-stock-buy-sell-192322541.html,Insider Monkey
86,2021-04-06 11:16,New Strong Sell Stocks for April 6th,https://finance.yahoo.com/news/strong-sell-stocks-april-6th-151603866.html,Zacks
87,2021-04-05 06:45,"David R. Guyer, MD to Step Down from Iveric Bio Board to Rejoin Venture Fund",https://finance.yahoo.com/news/david-r-guyer-md-step-104500871.html,Business Wire
88,2021-04-01 17:30,Iveric Bio Reports Inducement Grants Under Nasdaq Listing Rule 5635(c)(4),https://finance.yahoo.com/news/iveric-bio-reports-inducement-grants-213000028.html,Business Wire
89,2021-03-16 08:00,Iveric Bio Reports Inducement Grants Under Nasdaq Listing Rule 5635(c)(4),https://finance.yahoo.com/news/iveric-bio-reports-inducement-grants-120000642.html,Business Wire
90,2021-03-11 08:17,New Strong Sell Stocks for March 11th,https://finance.yahoo.com/news/strong-sell-stocks-march-11th-131701582.html,Zacks
91,2021-03-03 13:00,"IVERIC bio, Inc. (ISEE) Q4 2020 Earnings Call Transcript",https://www.fool.com/earnings/call-transcripts/2021/03/03/iveric-bio-inc-isee-q4-2020-earnings-call-transcri/?source=eptyholnk0000202&utm_source=yahoo-host&utm_medium=feed&utm_campaign=article,Motley Fool
92,2021-03-03 06:30,Iveric Bio Reports Fourth Quarter and Year End 2020 Operational Highlights and Financial Results,https://finance.yahoo.com/news/iveric-bio-reports-fourth-quarter-113000770.html,Business Wire
93,2021-03-03 06:15,"IVERIC bio, Inc. to Host Earnings Call",https://finance.yahoo.com/news/iveric-bio-inc-host-earnings-111500371.html,ACCESSWIRE
94,2021-03-02 08:00,Iveric Bio Reports Inducement Grants Under Nasdaq Listing Rule 5635(c)(4),https://finance.yahoo.com/news/iveric-bio-reports-inducement-grants-130000383.html,Business Wire
95,2021-02-25 08:00,Iveric Bio to Present at the Cowen 41st Annual Health Care Conference,https://finance.yahoo.com/news/iveric-bio-present-cowen-41st-130000139.html,Business Wire
96,2021-02-24 08:00,"Iveric Bio to Report Fourth Quarter and Full Year 2020 Financial Results and Host Conference Call on Wednesday, March 3, 2021",https://finance.yahoo.com/news/iveric-bio-report-fourth-quarter-130000441.html,Business Wire
97,2021-02-16 13:27,15 Best Micro-Cap Stocks to Buy Now,https://finance.yahoo.com/news/15-best-micro-cap-stocks-182706589.html,Insider Monkey
98,2021-02-08 10:11,10 Best Small-Cap Biotech Stocks Under $10 in 2021,https://finance.yahoo.com/news/10-best-small-cap-biotech-151111576.html,Insider Monkey
99,2021-01-05 08:00,IVERIC bio Reports Inducement Grants under Nasdaq Listing Rule 5635(c)(4),https://finance.yahoo.com/news/iveric-bio-reports-inducement-grants-130000816.html,Business Wire
