,Date,News Headline,Article Link,Source
0,2022-02-21 17:30,"Black Stone Minerals, L.P. Announces Fourth Quarter and Full Year 2021 Results; Provides Guidance for 2022",https://finance.yahoo.com/news/black-stone-minerals-l-p-223000257.html,Business Wire
1,2022-02-08 14:38,"O'Brien Greene & Co. Inc Buys iShares Core S&P Small-Cap ETF, Medtronic PLC, Lumen ...",https://finance.yahoo.com/news/obrien-greene-co-inc-buys-193814607.html,GuruFocus.com
2,2022-02-02 17:00,"Black Stone Minerals, L.P. Announces Distribution Increase and Schedules Earnings Call to Discuss Fourth Quarter and Full-Year 2021 Results",https://finance.yahoo.com/news/black-stone-minerals-l-p-220000724.html,Business Wire
3,2022-02-02 09:40,Is Black Stone Minerals (BSM) Outperforming Other Oils-Energy Stocks This Year?,https://finance.yahoo.com/news/black-stone-minerals-bsm-outperforming-144002770.html,Zacks
4,2022-01-14 17:38,"Mraz, Amerine & Associates, Inc. Buys Vanguard Short-Term Inflation-Protected Securities, ...",https://finance.yahoo.com/news/mraz-amerine-associates-inc-buys-223807946.html,GuruFocus.com
5,2022-01-07 09:53,2 Big Dividend Stocks Yielding at Least 7%; Wells Fargo Says Buy,https://finance.yahoo.com/news/2-big-dividend-stocks-yielding-145309802.html,TipRanks
6,2021-12-08 10:46,Why Black Stone (BSM) Stock Might be a Great Pick,https://finance.yahoo.com/news/why-black-stone-bsm-stock-154603910.html,Zacks
7,2021-12-02 09:40,10 Dividend Stocks to Buy According to Murray Stahls Horizon Asset Management,https://finance.yahoo.com/news/10-dividend-stocks-buy-according-144026204.html,Insider Monkey
8,2021-11-02 14:31,"Black Stone Minerals, LP (BSM) Q3 2021 Earnings Call Transcript",https://www.fool.com/earnings/call-transcripts/2021/11/02/black-stone-minerals-lp-bsm-q3-2021-earnings-call/?source=eptyholnk0000202&utm_source=yahoo-host&utm_medium=feed&utm_campaign=article,Motley Fool
9,2021-11-01 17:00,"Black Stone Minerals, L.P. Reports Third Quarter Results and Updates Full-Year 2021 Guidance",https://finance.yahoo.com/news/black-stone-minerals-l-p-210000667.html,Business Wire
10,2021-10-27 17:00,"Black Stone Minerals, L.P. Declares Third Quarter 2021 Distribution for Common Units",https://finance.yahoo.com/news/black-stone-minerals-l-p-210000092.html,Business Wire
11,2021-10-27 09:46,Best Momentum Stocks to Buy for October 27th,https://finance.yahoo.com/news/best-momentum-stocks-buy-october-134601933.html,Zacks
12,2021-10-27 08:33,Best Income Stocks to Buy for October 27th,https://finance.yahoo.com/news/best-income-stocks-buy-october-123312515.html,Zacks
13,2021-10-21 17:00,"Black Stone Minerals, L.P. Announces Dates for Third Quarter 2021 Distribution and Earnings Releases, and Information for the Third Quarter 2021 Conference Call",https://finance.yahoo.com/news/black-stone-minerals-l-p-210000624.html,Business Wire
14,2021-10-05 05:24,10 Stocks to Invest In: Adam Petersons Magnolia Capital Fund Portfolio,https://finance.yahoo.com/news/10-stocks-invest-adam-peterson-092408567.html,Insider Monkey
15,2021-08-03 14:30,"Black Stone Minerals, LP (BSM) Q2 2021 Earnings Call Transcript",https://www.fool.com/earnings/call-transcripts/2021/08/03/black-stone-minerals-lp-bsm-q2-2021-earnings-call/?source=eptyholnk0000202&utm_source=yahoo-host&utm_medium=feed&utm_campaign=article,Motley Fool
16,2021-08-02 16:45,"Black Stone Minerals, L.P. Reports Second Quarter Results",https://finance.yahoo.com/news/black-stone-minerals-l-p-204500584.html,Business Wire
17,2021-07-30 08:41,Why Earnings Season Could Be Great for Black Stone Minerals (BSM),https://finance.yahoo.com/news/why-earnings-season-could-great-124112211.html,Zacks
18,2021-07-26 16:30,"Black Stone Minerals, L.P. Announces Distribution Increase, New Sustainability Initiative, and Timing of Earnings Call to Discuss Second Quarter 2021 Results",https://finance.yahoo.com/news/black-stone-minerals-l-p-203000606.html,Business Wire
19,2021-06-30 16:30,"Black Stone Minerals, L.P. Announces Hiring of Carrie Clark as Senior Vice President, Land & Legal",https://finance.yahoo.com/news/black-stone-minerals-l-p-203000785.html,Business Wire
20,2021-06-24 12:00,Black Stone Minerals (BSM) Upgraded to Buy: What Does It Mean for the Stock?,https://finance.yahoo.com/news/black-stone-minerals-bsm-upgraded-160004119.html,Zacks
21,2021-06-21 17:48,Should I Avoid Black Stone Minerals LP (BSM)?,https://finance.yahoo.com/news/avoid-black-stone-minerals-lp-214836613.html,Insider Monkey
22,2021-06-01 10:13,2 Big Dividend Stocks Yielding 7%; Analysts Say Buy,https://finance.yahoo.com/news/2-big-dividend-stocks-yielding-141337315.html,TipRanks
23,2021-05-12 08:29,4 Affordable Breakout Stocks for Stunning Returns,https://finance.yahoo.com/news/4-affordable-breakout-stocks-stunning-122912918.html,Zacks
24,2021-05-11 16:00,"Black Stone Minerals, L.P. Announces Participation in Upcoming Investor Relations Event",https://finance.yahoo.com/news/black-stone-minerals-l-p-200000127.html,Business Wire
25,2021-05-04 22:00,Black Stone Minerals LP (BSM) Q1 2021 Earnings Call Transcript,https://www.fool.com/earnings/call-transcripts/2021/05/04/black-stone-minerals-lp-bsm-q1-2021-earnings-call/?source=eptyholnk0000202&utm_source=yahoo-host&utm_medium=feed&utm_campaign=article,Motley Fool
26,2021-05-04 07:45,Black Stone Minerals LP to Host Earnings Call,https://finance.yahoo.com/news/black-stone-minerals-lp-host-114500440.html,ACCESSWIRE
27,2021-05-04 03:18,"Black Stone Minerals, L.P. Reports First Quarter Results and Announces Multiple New Development Agreements",https://finance.yahoo.com/news/black-stone-minerals-l-p-071800713.html,Business Wire
28,2021-04-30 08:22,Why Black Stone Minerals (BSM) Might Surprise This Earnings Season,https://finance.yahoo.com/news/why-black-stone-minerals-bsm-122212332.html,Zacks
29,2021-04-21 17:00,"Black Stone Minerals, L.P. Declares Distribution for Common Units and Schedules Earnings Call to Discuss First Quarter 2021 Results",https://finance.yahoo.com/news/black-stone-minerals-l-p-210000656.html,Business Wire
30,2021-04-15 11:30,Black Stone Minerals (BSM) Soars 8.1%: Is Further Upside Left in the Stock?,https://finance.yahoo.com/news/black-stone-minerals-bsm-soars-153003233.html,Zacks
31,2021-04-01 09:02,Cushing® Asset Management and Swank Capital Announce Rebalancing of the Cushing® MLP High Income Index,https://finance.yahoo.com/news/cushing-asset-management-swank-capital-130200891.html,PR Newswire
32,2021-02-23 15:30,Black Stone Minerals LP (BSM) Q4 2020 Earnings Call Transcript,https://www.fool.com/earnings/call-transcripts/2021/02/23/black-stone-minerals-lp-bsm-q4-2020-earnings-call/?source=eptyholnk0000202&utm_source=yahoo-host&utm_medium=feed&utm_campaign=article,Motley Fool
33,2021-02-23 07:45,Black Stone Minerals LP to Host Earnings Call,https://finance.yahoo.com/news/black-stone-minerals-lp-host-124500226.html,ACCESSWIRE
34,2021-02-22 17:15,"Black Stone Minerals, L.P. Announces Fourth Quarter and Full Year 2020 Results; Provides Guidance for 2021",https://finance.yahoo.com/news/black-stone-minerals-l-p-221500696.html,Business Wire
35,2021-02-19 10:05,Earnings Outlook For Black Stone Minerals,https://finance.yahoo.com/news/earnings-outlook-black-stone-minerals-150518319.html,Benzinga
36,2021-02-19 09:02,Cushing® Asset Management and Swank Capital Announce a Constituent Change to The Cushing® MLP Market Cap Index,https://finance.yahoo.com/news/cushing-asset-management-swank-capital-140200712.html,PR Newswire
37,2021-02-03 17:30,"Black Stone Minerals, L.P. Declares Increased Distribution for Common Units and Schedules Earnings Call to Discuss Fourth Quarter 2020 Results",https://finance.yahoo.com/news/black-stone-minerals-l-p-223000746.html,Business Wire
38,2020-11-29 20:12,Is Black Stone Minerals (BSM) Stock A Good Investment?,https://finance.yahoo.com/news/black-stone-minerals-bsm-stock-011253916.html,Insider Monkey
39,2020-11-03 19:00,Black Stone Minerals LP (BSM) Q3 2020 Earnings Call Transcript,https://www.fool.com/earnings/call-transcripts/2020/11/03/black-stone-minerals-lp-bsm-q3-2020-earnings-call/?source=eptyholnk0000202&utm_source=yahoo-host&utm_medium=feed&utm_campaign=article,Motley Fool
40,2020-11-03 08:15,Black Stone Minerals LP to Host Earnings Call,https://finance.yahoo.com/news/black-stone-minerals-lp-host-131500461.html,ACCESSWIRE
41,2020-11-02 17:00,"Black Stone Minerals, L.P. Reports Third Quarter Results",https://finance.yahoo.com/news/black-stone-minerals-l-p-220000849.html,Business Wire
42,2020-10-30 11:04,Earnings Outlook for Black Stone Minerals,https://finance.yahoo.com/news/earnings-outlook-black-stone-minerals-150427248.html,Benzinga
43,2020-10-29 08:36,Why Earnings Season Could Be Great for Black Stone Minerals (BSM),https://finance.yahoo.com/news/why-earnings-season-could-great-123612368.html,Zacks
44,2020-10-21 16:45,"Black Stone Minerals, L.P. Declares Distribution for Common Units and Schedules Earnings Call to Discuss Third Quarter 2020 Results",https://finance.yahoo.com/news/black-stone-minerals-l-p-204500462.html,Business Wire
45,2020-09-18 09:02,Cushing® Asset Management and Swank Capital Announce Constituent Changes to The Cushing® MLP High Income Index,https://finance.yahoo.com/news/cushing-asset-management-swank-capital-130200853.html,PR Newswire
46,2020-09-16 15:41,Top Oil and Gas Stocks for Q4 2020,https://www.investopedia.com/investing/oil-stocks/?utm_campaign=quote-yahoo&utm_source=yahoo&utm_medium=referral,Investopedia
47,2020-08-05 12:35,3 Big Dividend Stocks Yielding Over 8%; Raymond James Says Buy,https://finance.yahoo.com/news/3-big-dividend-stocks-yielding-163557603.html,TipRanks
48,2020-08-04 18:00,Black Stone Minerals LP (BSM) Q2 2020 Earnings Call Transcript,https://www.fool.com/earnings/call-transcripts/2020/08/04/black-stone-minerals-lp-bsm-q2-2020-earnings-call.aspx?source=eptyholnk0000202&utm_source=yahoo-host&utm_medium=feed&utm_campaign=article,Motley Fool
49,2020-08-03 17:00,"Black Stone Minerals, L.P. Reports Second Quarter Results",https://finance.yahoo.com/news/black-stone-minerals-l-p-210000914.html,Business Wire
50,2020-07-27 16:45,"Black Stone Minerals, L.P. Announces Update on Previously Announced Asset Sales, Declares Distribution for Common Units, and Schedules Earnings Call to Discuss Second Quarter 2020 Results",https://finance.yahoo.com/news/black-stone-minerals-l-p-204500999.html,Business Wire
51,2020-07-02 10:30,Cushing® Asset Management and Swank Capital Announce Rebalancing of the Cushing® MLP High Income Index [CORRECTED],https://finance.yahoo.com/news/cushing-asset-management-swank-capital-143000786.html,PR Newswire
52,2020-07-02 09:02,Cushing® Asset Management and Swank Capital Announce Rebalancing of the Cushing® MLP High Income Index,https://finance.yahoo.com/news/cushing-asset-management-swank-capital-130200968.html,PR Newswire
53,2020-06-16 07:39,"Black Stone Minerals, XTO Ink Shelby Trough Agreement",https://finance.yahoo.com/news/black-stone-minerals-xto-ink-113953101.html,Rigzone.com
54,2020-06-11 17:00,"Black Stone Minerals, L.P. Announces Additional Shelby Trough Operational Update",https://finance.yahoo.com/news/black-stone-minerals-l-p-210000938.html,Business Wire
55,2020-06-04 11:54,Edited Transcript of BSM earnings conference call or presentation 5-May-20 2:00pm GMT,https://finance.yahoo.com/news/edited-transcript-bsm-earnings-conference-122911558.html,Thomson Reuters StreetEvents
56,2020-06-04 08:00,"Black Stone Minerals, L.P. Announces Asset Sales Totaling $155 million, Further Strengthening Balance Sheet and Liquidity Position",https://finance.yahoo.com/news/black-stone-minerals-l-p-120000466.html,Business Wire
57,2020-05-28 16:30,"Black Stone Minerals, L.P. Announces Participation in Upcoming Investor Relations Events",https://finance.yahoo.com/news/black-stone-minerals-l-p-203000590.html,Business Wire
58,2020-05-27 18:51,Hedge Funds Never Been Less Bullish On Black Stone Minerals LP (BSM),https://finance.yahoo.com/news/hedge-funds-never-less-bullish-225146235.html,Insider Monkey
59,2020-05-25 11:50,Should Value Investors Buy Black Stone Minerals (BSM) Stock?,https://finance.yahoo.com/news/value-investors-buy-black-stone-155003199.html,Zacks
60,2020-05-05 15:01,Black Stone Minerals LP (BSM) Q1 2020 Earnings Call Transcript,https://www.fool.com/earnings/call-transcripts/2020/05/05/black-stone-minerals-lp-bsm-q1-2020-earnings-call.aspx?source=eptyholnk0000202&utm_source=yahoo-host&utm_medium=feed&utm_campaign=article,Motley Fool
61,2020-05-05 07:30,"Black Stone Minerals, L.P. Announces Agreement with Aethon Energy to Restart Development of Shelby Trough Acreage",https://finance.yahoo.com/news/black-stone-minerals-l-p-113000897.html,Business Wire
62,2020-05-04 19:04,"Black Stone Minerals, L.P. Reports First Quarter Results",https://finance.yahoo.com/news/black-stone-minerals-l-p-230400984.html,Business Wire
63,2020-04-30 09:03,Should You Buy Black Stone Minerals (BSM) Ahead of Earnings?,https://finance.yahoo.com/news/buy-black-stone-minerals-bsm-130301931.html,Zacks
64,2020-04-29 07:00,Mayo Clinics Energy Investment Has Plunged in Value,https://www.barrons.com/articles/mayo-clinics-energy-investment-has-plunged-in-value-51588158019?siteid=yhoof2,Barrons.com
65,2020-04-22 16:45,"Black Stone Minerals, L.P. Declares Distribution for Common Units and Schedules Earnings Call to Discuss First Quarter 2020 Results",https://finance.yahoo.com/news/black-stone-minerals-l-p-204500728.html,Business Wire
66,2020-04-12 18:34,These 3 Graham-Style Stocks Appear Fairly Priced,https://finance.yahoo.com/news/3-graham-style-stocks-appear-223426372.html,GuruFocus.com
67,2020-04-08 12:10,Black Stone Minerals LP (BSM): Are Hedge Funds Right About This Stock?,https://finance.yahoo.com/news/black-stone-minerals-lp-bsm-161035173.html,Insider Monkey
68,2020-03-10 13:00,"Black Stone Minerals, L.P. Announces 2019 K-1 Tax Packages Are Now Available",https://finance.yahoo.com/news/black-stone-minerals-l-p-170000755.html,Business Wire
69,2020-03-09 21:48,Edited Transcript of BSM earnings conference call or presentation 25-Feb-20 3:00pm GMT,https://finance.yahoo.com/news/edited-transcript-bsm-earnings-conference-200740819.html,Thomson Reuters StreetEvents
70,2020-02-25 08:29,New Strong Sell Stocks for February 25th,https://finance.yahoo.com/news/strong-sell-stocks-february-25th-132901422.html,Zacks
71,2020-02-24 17:00,"Black Stone Minerals, L.P. Announces Fourth Quarter and Full Year 2019 Results; Provides Guidance for 2020",https://finance.yahoo.com/news/black-stone-minerals-l-p-220000272.html,Business Wire
72,2020-02-14 09:21,New Strong Sell Stocks for February 14th,https://finance.yahoo.com/news/strong-sell-stocks-february-14th-142102460.html,Zacks
73,2020-02-13 09:01,Piper Sandler: These 3 High-Yield Dividend Stocks Have Plenty of Growth Ahead,https://finance.yahoo.com/news/piper-sandler-3-high-yield-140131987.html,TipRanks
74,2020-02-07 09:02,Cushing® Asset Management and Swank Capital Announce a Constituent Change to The Cushing® MLP Market Cap Index,https://finance.yahoo.com/news/cushing-asset-management-swank-capital-140200769.html,PR Newswire
75,2020-02-07 09:02,Cushing® Asset Management and Swank Capital Announce a Constituent Change to The Cushing® MLP High Income Index,https://finance.yahoo.com/news/cushing-asset-management-swank-capital-140200495.html,PR Newswire
76,2020-02-05 16:45,"Black Stone Minerals, L.P. Declares Distribution for Common Units and Schedules Earnings Call to Discuss Fourth Quarter and Full Year 2019 Results",https://finance.yahoo.com/news/black-stone-minerals-l-p-214500828.html,Business Wire
77,2020-01-28 07:23,New Strong Sell Stocks for January 28th,https://finance.yahoo.com/news/strong-sell-stocks-january-28th-122312306.html,Zacks
78,2020-01-22 12:55,"Oil & Gas Mineral Stocks Are Lower-Risk Way To Invest In Commodities, KeyBanc Says",https://finance.yahoo.com/news/oil-gas-mineral-stocks-lower-175558312.html,Benzinga
79,2019-12-17 16:06,Should You Buy Black Stone Minerals LP (BSM)?,https://finance.yahoo.com/news/buy-black-stone-minerals-lp-210627420.html,Insider Monkey
80,2019-11-22 07:10,Edited Transcript of BSM earnings conference call or presentation 5-Nov-19 3:00pm GMT,https://finance.yahoo.com/news/edited-transcript-bsm-earnings-conference-213607942.html,Thomson Reuters StreetEvents
81,2019-11-05 10:03,3 Buy-Rated Stocks with Over 11% Dividend Yield,https://finance.yahoo.com/news/3-buy-rated-stocks-over-150301607.html,TipRanks
82,2019-11-04 16:35,"Black Stone Minerals, L.P. Reports Third Quarter Results",https://finance.yahoo.com/news/black-stone-minerals-l-p-213500463.html,Business Wire
83,2019-11-04 10:59,52-Week Company Lows,https://finance.yahoo.com/news/52-week-company-lows-155923490.html,GuruFocus.com
84,2019-10-24 15:48,Is Black Stone Minerals LP (BSM) Going To Burn These Hedge Funds ?,https://finance.yahoo.com/news/black-stone-minerals-lp-bsm-194856291.html,Insider Monkey
85,2019-10-23 17:33,"Black Stone Minerals, L.P. Declares Distribution for Common Units and Schedules Earnings Call to Discuss Third Quarter 2019 Results",https://finance.yahoo.com/news/black-stone-minerals-l-p-213300508.html,Business Wire
86,2019-10-18 10:14,Top Ranked Income Stocks to Buy for October 18th,https://finance.yahoo.com/news/top-ranked-income-stocks-buy-141402035.html,Zacks
87,2019-10-09 12:15,Top Ranked Income Stocks to Buy for October 9th,https://finance.yahoo.com/news/top-ranked-income-stocks-buy-161504846.html,Zacks
88,2019-10-04 11:10,Top Ranked Income Stocks to Buy for October 4th,https://finance.yahoo.com/news/top-ranked-income-stocks-buy-151003064.html,Zacks
89,2019-09-17 17:28,"Black Stone Minerals, L.P. Announces Participation in Upcoming Investor Relations Events",https://finance.yahoo.com/news/black-stone-minerals-l-p-212800471.html,Business Wire
90,2019-08-19 19:38,"Johns Hopkins University Buys Black Stone Minerals LP, Dropbox Inc",https://finance.yahoo.com/news/johns-hopkins-university-buys-black-233808365.html,GuruFocus.com
91,2019-08-13 13:26,Edited Transcript of BSM earnings conference call or presentation 6-Aug-19 2:00pm GMT,https://finance.yahoo.com/news/edited-transcript-bsm-earnings-conference-033825989.html,Thomson Reuters StreetEvents
92,2019-08-06 14:38,"Northwestern University Buys Black Stone Minerals LP, Plains All American Pipeline LP",https://finance.yahoo.com/news/northwestern-university-buys-black-stone-183810770.html,GuruFocus.com
93,2019-08-06 13:23,Black Stone Minerals LP (BSM) Q2 2019 Earnings Call Transcript,https://finance.yahoo.com/news/black-stone-minerals-lp-bsm-172331650.html,Motley Fool
94,2019-08-05 16:30,"Black Stone Minerals, L.P. Reports Second Quarter Results; Raises Production Guidance for 2019",https://finance.yahoo.com/news/black-stone-minerals-l-p-203000193.html,Business Wire
95,2019-07-31 13:04,Public & Private Oil & Gas Companies Scheduled for The Oil & Gas Conference® Represent $158 Billion in Energy Industry Market Capitalization,https://finance.yahoo.com/news/public-private-oil-gas-companies-170400478.html,PR Newswire
96,2019-07-25 17:16,"Black Stone Minerals, L.P. Declares Distribution for Common Units And Schedules Earnings Call to Discuss Second Quarter 2019 Results",https://finance.yahoo.com/news/black-stone-minerals-l-p-211600334.html,Business Wire
97,2019-07-22 09:02,Cushing® Asset Management and Swank Capital Announce a Constituent Change to The Cushing® MLP Market Cap Index,https://finance.yahoo.com/news/cushing-asset-management-swank-capital-130200088.html,PR Newswire
98,2019-07-07 19:13,52-Week Company Lows,https://finance.yahoo.com/news/52-week-company-lows-231358654.html,GuruFocus.com
99,2019-07-05 09:02,Cushing® Asset Management and Swank Capital Announce Rebalancing of the Cushing® MLP High Income Index,https://finance.yahoo.com/news/cushing-asset-management-swank-capital-130200158.html,PR Newswire
