,Date,News Headline,Article Link,Source
0,2022-01-13 11:14,Here's Why Macy's (M) Appears a Solid Investment Bet for 2022,https://finance.yahoo.com/news/heres-why-macys-m-appears-161404770.html,Zacks
1,2022-01-12 19:17,A third of commodity-hungry firms have no deforestation policy - report,https://finance.yahoo.com/news/third-commodity-hungry-firms-no-001745131.html,Reuters
2,2022-01-12 19:01,A third of commodity-hungry firms have no deforestation policy - report,https://finance.yahoo.com/news/third-commodity-hungry-firms-no-000100462.html,Reuters
3,2022-01-12 18:00,Capri Holdings (CPRI) Stock Sinks As Market Gains: What You Should Know,https://finance.yahoo.com/news/capri-holdings-cpri-stock-sinks-230011427.html,Zacks
4,2022-01-12 11:52,American Eagle (AEO) Lifts '23 Financial Goals on Growth Plans,https://finance.yahoo.com/news/american-eagle-aeo-lifts-23-165204025.html,Zacks
5,2022-01-12 08:30,Capri Holdings Limited Announces Reporting Date for Third Quarter Fiscal 2022 Financial Results,https://finance.yahoo.com/news/capri-holdings-limited-announces-reporting-133000355.html,Business Wire
6,2022-01-11 18:19,Abercrombie (ANF) Slashes Q4 Sales View on Supply-Chain Woes,https://finance.yahoo.com/news/abercrombie-anf-slashes-q4-sales-231911450.html,Zacks
7,2022-01-11 17:34,"Zumiez (ZUMZ) Reports Holiday Sales, Sees Comps Rise 6%",https://finance.yahoo.com/news/zumiez-zumz-reports-holiday-sales-223410788.html,Zacks
8,2022-01-11 09:27,"Tilly's (TLYS) Posts Stellar Holiday Sales, Comps Tick Up 14.1%",https://finance.yahoo.com/news/tillys-tlys-posts-stellar-holiday-142702439.html,Zacks
9,2022-01-11 09:26,"Five Below (FIVE) Posts Stellar Holiday Sales, Comps Jump 7.7%",https://finance.yahoo.com/news/five-below-five-posts-stellar-142602525.html,Zacks
10,2022-01-10 10:48,Solid Demand & Other Efforts Aid Rite Aid (RAD) Amid Cost Woes,https://finance.yahoo.com/news/solid-demand-other-efforts-aid-154803777.html,Zacks
11,2022-01-10 10:05,Albertsons Companies (ACI) to Post Q3 Earnings: Factors to Note,https://finance.yahoo.com/news/albertsons-companies-aci-post-q3-150503506.html,Zacks
12,2022-01-10 10:02,Tapestry (TPR) Likely to Sustain Bull Run in 2022: Here's Why,https://finance.yahoo.com/news/tapestry-tpr-likely-sustain-bull-150203465.html,Zacks
13,2022-01-10 09:40,Are These Retail-Wholesale Stocks Undervalued Right Now?,https://finance.yahoo.com/news/retail-wholesale-stocks-undervalued-now-144002821.html,Zacks
14,2022-01-07 11:40,CPRI vs. FIGS: Which Stock Is the Better Value Option?,https://finance.yahoo.com/news/cpri-vs-figs-stock-better-164004460.html,Zacks
15,2022-01-07 11:31,Bed Bath & Beyond (BBBY) Lags Q3 Earnings & Sales Estimates,https://finance.yahoo.com/news/bed-bath-beyond-bbby-lags-163104807.html,Zacks
16,2022-01-06 09:30,Should Value Investors Pick Capri Holdings (CPRI) Now?,https://finance.yahoo.com/news/value-investors-pick-capri-holdings-143002551.html,Zacks
17,2022-01-05 12:10,Why the Earnings Surprise Streak Could Continue for Capri Holdings (CPRI),https://finance.yahoo.com/news/why-earnings-surprise-streak-could-171005809.html,Zacks
18,2022-01-03 18:00,Capri Holdings (CPRI) Outpaces Stock Market Gains: What You Should Know,https://finance.yahoo.com/news/capri-holdings-cpri-outpaces-stock-230011199.html,Zacks
19,2022-01-03 10:35,Hibbett (HIBB) Up More Than 58% in a Year: What You Should Know,https://finance.yahoo.com/news/hibbett-hibb-more-58-know-153503195.html,Zacks
20,2022-01-03 10:03,Here's Why Capri Holdings (CPRI) Marching Ahead of Industry,https://finance.yahoo.com/news/heres-why-capri-holdings-cpri-150303286.html,Zacks
21,2021-12-30 18:15,Capri Holdings (CPRI) Gains As Market Dips: What You Should Know,https://finance.yahoo.com/news/capri-holdings-cpri-gains-market-231511943.html,Zacks
22,2021-12-30 10:27,American Eagle (AEO) Quiet Logistics Buyout Bolsters Logistics,https://finance.yahoo.com/news/american-eagle-aeo-quiet-logistics-152703113.html,Zacks
23,2021-12-29 09:59,Here's Why Abercrombie (ANF) is Marching Ahead of the Industry,https://finance.yahoo.com/news/heres-why-abercrombie-anf-marching-145902509.html,Zacks
24,2021-12-29 09:40,Is Capri Holdings (CPRI) Outperforming Other Retail-Wholesale Stocks This Year?,https://finance.yahoo.com/news/capri-holdings-cpri-outperforming-other-144002741.html,Zacks
25,2021-12-28 09:27,Aerie & Online Strength Aid American Eagle (AEO) Amid Cost Woes,https://finance.yahoo.com/news/aerie-online-strength-aid-american-142702334.html,Zacks
26,2021-12-27 10:26,"Forget Gap (GPS), Buy These 3 Apparel Retail Stocks in 2022",https://finance.yahoo.com/news/forget-gap-gps-buy-3-152603006.html,Zacks
27,2021-12-27 10:00,Wall Street Analysts Predict a 26% Upside in Capri Holdings (CPRI): Here's What You Should Know,https://finance.yahoo.com/news/wall-street-analysts-predict-26-150003982.html,Zacks
28,2021-12-25 12:38,"Usgi Global Luxury Goods Fund Buys Christian Dior SE, Goldman Sachs Group Inc, Starbucks Corp, ...",https://finance.yahoo.com/news/usgi-global-luxury-goods-fund-173802036.html,GuruFocus.com
29,2021-12-24 18:00,Capri Holdings (CPRI) Gains But Lags Market: What You Should Know,https://finance.yahoo.com/news/capri-holdings-cpri-gains-lags-230011236.html,Zacks
30,2021-12-23 06:30,"The Zacks Analyst Blog Highlights: The Children's Place, Capri Holdings, Boot Barn and Tapestry",https://finance.yahoo.com/news/zacks-analyst-blog-highlights-childrens-113011986.html,Zacks
31,2021-12-22 21:38,"Goldentree Asset Management Lp Buys Capri Holdings, Popular Inc, Tenet Healthcare Corp, Sells ...",https://finance.yahoo.com/news/goldentree-asset-management-lp-buys-023802061.html,GuruFocus.com
32,2021-12-22 18:15,Capri Holdings (CPRI) Gains But Lags Market: What You Should Know,https://finance.yahoo.com/news/capri-holdings-cpri-gains-lags-231511190.html,Zacks
33,2021-12-22 11:40,CPRI or FIGS: Which Is the Better Value Stock Right Now?,https://finance.yahoo.com/news/cpri-figs-better-value-stock-164004126.html,Zacks
34,2021-12-22 11:00,Year in Review: C-suite Changes Shake Up the Industry,https://finance.yahoo.com/news/review-c-suite-changes-shake-160037291.html,WWD
35,2021-12-22 10:54,"Rite Aid (RAD) Q3 Earnings Beat Estimates, Revenues Lag",https://finance.yahoo.com/news/rite-aid-rad-q3-earnings-155403072.html,Zacks
36,2021-12-22 08:25,4 Apparel Stocks Poised to Continue Winning Streak in 2022,https://finance.yahoo.com/news/4-apparel-stocks-poised-continue-132501443.html,Zacks
37,2021-12-20 11:09,"Zegna CEO details public debut via SPAC, luxury fashion, and sustainability from sheep to shop",https://finance.yahoo.com/video/zegna-ceo-details-public-debut-160949555.html,Yahoo Finance Video
38,2021-12-20 09:54,Will DICK'S Sporting's (DKS) Upside Story Continue Despite Woes?,https://finance.yahoo.com/news/dicks-sportings-dks-upside-story-145402380.html,Zacks
39,2021-12-17 10:04,U.S. Retail Sales Tick Up for 4 Straight Months: 5 Top Picks,https://finance.yahoo.com/news/u-retail-sales-tick-4-150403676.html,Zacks
40,2021-12-17 10:03,Amazon (AMZN) to Boost Grocery Initiatives With New Plans,https://finance.yahoo.com/news/amazon-amzn-boost-grocery-initiatives-150303253.html,Zacks
41,2021-12-16 10:31,New Strong Buy Stocks for December 16th,https://finance.yahoo.com/news/strong-buy-stocks-december-16th-153103992.html,Zacks
42,2021-12-16 08:00,Capri Holdings 2021 Corporate Social Responsibility Report Tracks Companys Progress,https://finance.yahoo.com/news/capri-holdings-2021-corporate-social-130019723.html,WWD
43,2021-12-16 07:57,Best Growth Stocks to Buy for December 16th,https://finance.yahoo.com/news/best-growth-stocks-buy-december-125712179.html,Zacks
44,2021-12-15 21:38,"Goldentree Asset Management Lp Buys Capri Holdings, Popular Inc, Tenet Healthcare Corp, Sells ...",https://finance.yahoo.com/news/goldentree-asset-management-lp-buys-023801096.html,GuruFocus.com
45,2021-12-15 18:00,Capri Holdings (CPRI) Gains But Lags Market: What You Should Know,https://finance.yahoo.com/news/capri-holdings-cpri-gains-lags-230011457.html,Zacks
46,2021-12-15 14:22,Capri Holdings Looks Attractive,https://finance.yahoo.com/news/capri-holdings-looks-attractive-192243524.html,GuruFocus.com
47,2021-12-15 08:00,Capri Holdings Releases 2021 Corporate Social Responsibility Report,https://finance.yahoo.com/news/capri-holdings-releases-2021-corporate-130000122.html,Business Wire
48,2021-12-15 01:30,Isabel Marant Said in Play Again: Sources,https://finance.yahoo.com/news/isabel-marant-said-play-again-063057325.html,WWD
49,2021-12-14 12:38,"Goldentree Asset Management Lp Buys Capri Holdings, Popular Inc, Tenet Healthcare Corp, Sells ...",https://finance.yahoo.com/news/goldentree-asset-management-lp-buys-173803069.html,GuruFocus.com
50,2021-12-14 10:34,"MercadoLibre (MELI) Acquires Redelcom, Boosts Payment Solution",https://finance.yahoo.com/news/mercadolibre-meli-acquires-redelcom-boosts-153403704.html,Zacks
51,2021-12-14 07:39,Best Growth Stocks to Buy for December 14th,https://finance.yahoo.com/news/best-growth-stocks-buy-december-123912979.html,Zacks
52,2021-12-13 09:40,Has Capri Holdings (CPRI) Outpaced Other Retail-Wholesale Stocks This Year?,https://finance.yahoo.com/news/capri-holdings-cpri-outpaced-other-144002346.html,Zacks
53,2021-12-13 09:38,Store Initiatives Aid Dollar Tree (DLTR) Amid Cost Woes,https://finance.yahoo.com/news/store-initiatives-aid-dollar-tree-143802039.html,Zacks
54,2021-12-12 07:31,Has Capri Holdings Limited's (NYSE:CPRI) Impressive Stock Performance Got Anything to Do With Its Fundamentals?,https://finance.yahoo.com/news/capri-holdings-limiteds-nyse-cpri-123108678.html,Simply Wall St.
55,2021-12-10 10:58,2022 will be the year of the wedding: Brilliant Earth CEO,https://finance.yahoo.com/video/2022-wedding-brilliant-earth-ceo-155837851.html,Yahoo Finance Video
56,2021-12-10 09:42,New Strong Buy Stocks for December 10th,https://finance.yahoo.com/news/strong-buy-stocks-december-10th-144202888.html,Zacks
57,2021-12-09 18:00,Capri Holdings (CPRI) Gains As Market Dips: What You Should Know,https://finance.yahoo.com/news/capri-holdings-cpri-gains-market-230011691.html,Zacks
58,2021-12-09 12:22,3 Luxury Goods Stocks to Buy to Pamper Your Portfolio in 2022,https://finance.yahoo.com/news/3-luxury-goods-stocks-buy-172201739.html,InvestorPlace
59,2021-12-08 08:00,Capri Holdings Foundation for the Advancement of Diversity in Fashion Announces Scholarship Program,https://finance.yahoo.com/news/capri-holdings-foundation-advancement-diversity-130000725.html,Business Wire
60,2021-12-08 00:01,Capri Holdings Foundation Sets Scholarship Program,https://finance.yahoo.com/news/capri-holdings-foundation-sets-scholarship-050152984.html,WWD
61,2021-12-07 14:30,Hedge Funds Are Buying Capri Holdings Limited (CPRI),https://finance.yahoo.com/news/hedge-funds-buying-capri-holdings-193046925.html,Insider Monkey
62,2021-12-07 12:00,Capri Holdings (CPRI) Moves to Strong Buy: Rationale Behind the Upgrade,https://finance.yahoo.com/news/capri-holdings-cpri-moves-strong-170005716.html,Zacks
63,2021-12-07 08:38,Nordstrom (JWN) Dips More Than 24% in 3 Months: Can It Revive?,https://finance.yahoo.com/news/nordstrom-jwn-dips-more-24-133801907.html,Zacks
64,2021-12-07 07:30,Best Growth Stocks to Buy for December 7th,https://finance.yahoo.com/news/best-growth-stocks-buy-december-123012190.html,Zacks
65,2021-12-06 11:40,CPRI vs. FIGS: Which Stock Should Value Investors Buy Now?,https://finance.yahoo.com/news/cpri-vs-figs-stock-value-164004716.html,Zacks
66,2021-12-06 09:49,"Hibbett (HIBB) Beats Q3 Earnings & Sales Estimates, Lifts View",https://finance.yahoo.com/news/hibbett-hibb-beats-q3-earnings-144902321.html,Zacks
67,2021-12-03 11:31,Capri Holdings (CPRI) Down 5.3% Since Last Earnings Report: Can It Rebound?,https://finance.yahoo.com/news/capri-holdings-cpri-down-5-163104078.html,Zacks
68,2021-12-03 09:25,New Strong Buy Stocks for December 3rd,https://finance.yahoo.com/news/strong-buy-stocks-december-3rd-142502723.html,Zacks
69,2021-12-03 08:03,Best Growth Stocks to Buy for December 3rd,https://finance.yahoo.com/news/best-growth-stocks-buy-december-130301633.html,Zacks
70,2021-11-30 09:40,"eBay (EBAY) Buys Sneaker Con Digital, Offers Verified Sneakers",https://finance.yahoo.com/news/ebay-ebay-buys-sneaker-con-144002816.html,Zacks
71,2021-11-29 12:35,Cyber Monday: Shoppers splurge before the big online shopping day,https://finance.yahoo.com/news/cyber-monday-shoppers-splurge-before-the-big-online-shopping-day-173551605.html,Yahoo Finance
72,2021-11-29 10:00,Does Capri Holdings (CPRI) Have the Potential to Rally 26% as Wall Street Analysts Expect?,https://finance.yahoo.com/news/does-capri-holdings-cpri-potential-150003230.html,Zacks
73,2021-11-25 10:10,Is Capri Holdings (CPRI) Outperforming Other Retail-Wholesale Stocks This Year?,https://finance.yahoo.com/news/capri-holdings-cpri-outperforming-other-151003191.html,Zacks
74,2021-11-24 09:51,American Eagle (AEO) Q3 Earnings and Revenues Top Estimates,https://finance.yahoo.com/news/american-eagle-aeo-q3-earnings-145102649.html,Zacks
75,2021-11-24 09:00,Capri Holdings Limited Announces Participation in the Morgan Stanley Global Consumer & Retail Conference,https://finance.yahoo.com/news/capri-holdings-limited-announces-participation-140000973.html,Business Wire
76,2021-11-18 15:29,Tradesy CEO: Younger generations are transforming fashion and we're here for it,https://finance.yahoo.com/video/tradesy-ceo-younger-generations-transforming-202940417.html,Yahoo Finance Video
77,2021-11-18 11:40,CPRI vs. FIGS: Which Stock Should Value Investors Buy Now?,https://finance.yahoo.com/news/cpri-vs-figs-stock-value-164004742.html,Zacks
78,2021-11-17 09:00,Versace Appoints Cedric Wilmotte as Interim Chief Executive Officer,https://finance.yahoo.com/news/versace-appoints-cedric-wilmotte-interim-140000100.html,Business Wire
79,2021-11-17 07:34,5 Stocks to Buy on Impressive October Retail Sales Report,https://finance.yahoo.com/news/5-stocks-buy-impressive-october-123412491.html,Zacks
80,2021-11-12 07:28,"The Zacks Analyst Blog Highlights: Levi Strauss, Boot Barn, Capri Holdings and Canada Goose",https://finance.yahoo.com/news/zacks-analyst-blog-highlights-levi-122812960.html,Zacks
81,2021-11-11 10:44,"Tapestry's (TPR) Q1 Earnings Beat, Digital Sales Rise, View Up",https://finance.yahoo.com/news/tapestrys-tpr-q1-earnings-beat-154403210.html,Zacks
82,2021-11-11 08:31,4 Apparel Stocks to Buy Ahead of the Holiday Season,https://finance.yahoo.com/news/4-apparel-stocks-buy-ahead-133101927.html,Zacks
83,2021-11-09 11:37,Best Momentum Stocks to Buy for November 9th,https://finance.yahoo.com/news/best-momentum-stocks-buy-november-163704362.html,Zacks
84,2021-11-09 11:30,Is Capri Holdings (CPRI) Stock Outpacing Its Retail-Wholesale Peers This Year?,https://finance.yahoo.com/news/capri-holdings-cpri-stock-outpacing-163004354.html,Zacks
85,2021-11-08 10:32,"Michael Kors is bouncing back and Versace is in vogue, driving optimism for Capri",https://www.marketwatch.com/story/michael-kors-is-bouncing-back-and-versace-is-in-vogue-driving-optimism-for-capri-11636385568?siteid=yhoof2,MarketWatch
86,2021-11-08 08:00,"In Fashion: State of Retail, From Ralph Lauren to Lee Jeans",https://finance.yahoo.com/news/fashion-state-retail-ralph-lauren-130050768.html,WWD
87,2021-11-05 15:34,Why Capri Holdings Stock Jumped 23.2% This Week,https://www.fool.com/investing/2021/11/05/why-capri-holdings-stock-jumped-this-week/?source=eptyholnk0000202&utm_source=yahoo-host&utm_medium=feed&utm_campaign=article,Motley Fool
88,2021-11-05 11:48,3 Big Takeaways From a Strong Earnings Week in Footwear & Fashion,https://finance.yahoo.com/news/three-major-takeaways-week-earnings-154800806.html,Footwear News
89,2021-11-04 10:19,"Michael Kors, Versace, Jimmy Choo parent Capri raises forecast after better-than-expected Q2",https://www.bizjournals.com/bizwomen/news/latest-news/2021/11/michael-kors-versace-parent.html?ana=yahoo,American City Business Journals
90,2021-11-04 07:36,10 Best Clothing Stocks To Buy Now,https://finance.yahoo.com/news/10-best-clothing-stocks-buy-113607337.html,Insider Monkey
91,2021-11-04 05:23,"Capri Holdings Stock Climbs on Earnings Beat, Analyst Upgrades",https://www.thestreet.com/investing/capri-holdings-stock-climbs-on-earnings-beat-analyst-upgrades?puc=yahoo&cm_ven=YAHOO,TheStreet.com
92,2021-11-04 04:45,"Premarket Movers Thursday - Roku, Moderna, Qualcomm",https://www.thestreet.com/investing/premarket-movers-thursday-roku-moderna-qualcomm?puc=yahoo&cm_ven=YAHOO,TheStreet.com
93,2021-11-03 19:30,Capri Holdings Limited (CPRI) Q2 2022 Earnings Call Transcript,https://www.fool.com/earnings/call-transcripts/2021/11/03/capri-holdings-limited-cpri-q2-2022-earnings-call/?source=eptyholnk0000202&utm_source=yahoo-host&utm_medium=feed&utm_campaign=article,Motley Fool
94,2021-11-03 15:04,Capri Powering Through Supply Chain Woes,https://finance.yahoo.com/news/capri-powering-supply-chain-woes-190431244.html,WWD
95,2021-11-03 12:03,Allbirds co-founder: We want to be a brand that transcends over the next couple of decades,https://finance.yahoo.com/news/allbirds-co-founder-we-want-to-be-a-brand-that-transcends-over-the-next-couple-of-decades-160355223.html,Yahoo Finance
96,2021-11-03 10:53,Why Capri Holdings Stock Jumped Wednesday,https://www.fool.com/investing/2021/11/03/why-capri-holdings-stock-jumped-wednesday/?source=eptyholnk0000202&utm_source=yahoo-host&utm_medium=feed&utm_campaign=article,Motley Fool
97,2021-11-03 10:47,"Capri Holdings' (CPRI) Q2 Earnings Top Estimates, FY22 View Up",https://finance.yahoo.com/news/capri-holdings-cpri-q2-earnings-144702990.html,Zacks
98,2021-11-03 10:16,"Capri Holdings Shares Surge On Q2 Beat, Upbeat Outlook",https://finance.yahoo.com/news/capri-holdings-shares-surge-q2-141649647.html,Benzinga
99,2021-11-03 09:02,Michael Kors Parent Capri Boost Its Outlook. The Stock Is Surging.,https://www.barrons.com/articles/capri-michael-kors-earnings-guidance-51635944522?siteid=yhoof2,Barrons.com
