,Date,News Headline,Article Link,Source
0,2022-01-12 16:15,Synaptics Appoints YY Lee to Board of Directors,https://finance.yahoo.com/news/synaptics-appoints-yy-lee-board-211500381.html,GlobeNewswire
1,2022-01-11 18:00,Synaptics (SYNA) Outpaces Stock Market Gains: What You Should Know,https://finance.yahoo.com/news/synaptics-syna-outpaces-stock-market-230011068.html,Zacks
2,2022-01-07 16:24,Chip Shortage Likely To Last Through 2022,https://www.investors.com/news/technology/chip-shortage-likely-to-last-through-2022/?src=A00220,Investor's Business Daily
3,2022-01-07 10:52,"Synaptics Launches S9A0H SoC to Enable Larger, Smarter, and Industrys Most Secure Haptic Touchpads",https://finance.yahoo.com/news/synaptics-launches-s9a0h-soc-enable-155200088.html,GlobeNewswire
4,2022-01-06 13:46,Synaptics Introduces Spyder Family of Video Protocol Converters to Seamlessly Connect USB Type-C Devices to HDMI 2.1 High-Performance Displays,https://finance.yahoo.com/news/synaptics-introduces-spyder-family-video-184600416.html,GlobeNewswire
5,2022-01-03 18:00,Synaptics (SYNA) Stock Sinks As Market Gains: What You Should Know,https://finance.yahoo.com/news/synaptics-syna-stock-sinks-market-230011980.html,Zacks
6,2022-01-03 16:45,Synaptics VS680 Multimedia SoC Powers AI-Enriched Display and Vision  Features in Askey OmniEdge Smart Signage,https://finance.yahoo.com/news/synaptics-vs680-multimedia-soc-powers-214500940.html,GlobeNewswire
7,2022-01-03 16:30,Lenovo Selects Synaptics Katana Ultra-Low-Power AI Solution for Yoga Tab 11,https://finance.yahoo.com/news/lenovo-selects-synaptics-katana-ultra-213000933.html,GlobeNewswire
8,2022-01-03 12:00,Synaptics (SYNA) Upgraded to Strong Buy: Here's What You Should Know,https://finance.yahoo.com/news/synaptics-syna-upgraded-strong-buy-170005632.html,Zacks
9,2022-01-03 11:17,"Synaptics to Participate at Upcoming Investor Conferences Wednesday, January 5, 2022, and Wednesday, January 12, 2022",https://finance.yahoo.com/news/synaptics-participate-upcoming-investor-conferences-161700476.html,GlobeNewswire
10,2022-01-03 09:39,New Strong Buy Stocks for January 3rd,https://finance.yahoo.com/news/strong-buy-stocks-january-3rd-143902592.html,Zacks
11,2021-12-30 08:20,3 Unstoppable Growth Stocks to Buy if There's a Stock Market Sell-Off,https://www.fool.com/investing/2021/12/30/unstoppable-growth-stocks-buy-market-sell-off/?source=eptyholnk0000202&utm_source=yahoo-host&utm_medium=feed&utm_campaign=article,Motley Fool
12,2021-12-29 09:14,5 Top-Notch Tech Stocks to Beat Nasdaq in 2022,https://finance.yahoo.com/news/5-top-notch-tech-stocks-141402745.html,Zacks
13,2021-12-28 06:22,"The Zacks Analyst Blog Highlights: Clearfield, SiTime, Synaptics, Perficient and NVIDIA",https://finance.yahoo.com/news/zacks-analyst-blog-highlights-clearfield-112211691.html,Zacks
14,2021-12-27 11:23,Is Synaptics Incorporated's (NASDAQ:SYNA) Stock's Recent Performance Being Led By Its Attractive Financial Prospects?,https://finance.yahoo.com/news/synaptics-incorporateds-nasdaq-syna-stocks-162303501.html,Simply Wall St.
15,2021-12-27 10:45,5 Tech Stocks That Outperformed Bitcoin in 2021,https://finance.yahoo.com/news/5-tech-stocks-outperformed-bitcoin-154503762.html,Zacks
16,2021-12-27 08:38,Why You Shouldn't Bet Against Synaptics (SYNA) Stock,https://finance.yahoo.com/news/why-shouldnt-bet-against-synaptics-133801408.html,Zacks
17,2021-12-23 07:38,"MainStay VP Wellington Mid Cap Portfolio Buys Icon PLC, Digital Turbine Inc, Integra ...",https://finance.yahoo.com/news/mainstay-vp-wellington-mid-cap-123801532.html,GuruFocus.com
18,2021-12-23 05:38,"MainStay VP Wellington Small Cap Portfolio Buys iShares Russell 2000 Growth ETF, United Natural ...",https://finance.yahoo.com/news/mainstay-vp-wellington-small-cap-103802457.html,GuruFocus.com
19,2021-12-22 10:00,Here's Why Synaptics (SYNA) Could be Great Choice for a Bottom Fisher,https://finance.yahoo.com/news/heres-why-synaptics-syna-could-150003351.html,Zacks
20,2021-12-22 09:09,5 Tech Stocks That Have Crushed MAMAA in 2021,https://finance.yahoo.com/news/5-tech-stocks-crushed-mamaa-140902255.html,Zacks
21,2021-12-22 06:55,"The Zacks Analyst Blog Highlights: Alpha & Omega Semiconductor, Axcelis Tech, Synaptics, Transcat and Perficient",https://finance.yahoo.com/news/zacks-analyst-blog-highlights-alpha-115511228.html,Zacks
22,2021-12-22 06:00,7 of the Best Tech Stocks for 2022 to Buy Now,https://finance.yahoo.com/news/7-best-tech-stocks-2022-110042118.html,InvestorPlace
23,2021-12-21 11:40,ASX vs. SYNA: Which Stock Should Value Investors Buy Now?,https://finance.yahoo.com/news/asx-vs-syna-stock-value-164004657.html,Zacks
24,2021-12-21 08:04,5 Tech Stocks That Have Crushed Nasdaq in 2021,https://finance.yahoo.com/news/5-tech-stocks-crushed-nasdaq-130401388.html,Zacks
25,2021-12-12 22:42,Hedge Funds Are Selling Synaptics Incorporated (SYNA),https://finance.yahoo.com/news/hedge-funds-selling-synaptics-incorporated-034234485.html,Insider Monkey
26,2021-12-11 00:38,"Optimum Fund Trust Buys Everbridge Inc, BJ's Wholesale Club Holdings Inc, Herc Holdings Inc, ...",https://finance.yahoo.com/news/optimum-fund-trust-buys-everbridge-053803171.html,GuruFocus.com
27,2021-12-10 10:30,Synaptics Wins Analyst Favorite Semiconductor Company at Prestigious GSA Awards,https://finance.yahoo.com/news/synaptics-wins-analyst-favorite-semiconductor-153000681.html,GlobeNewswire
28,2021-12-08 18:38,"Inv Corp Small Cap Value Buys Zuora Inc, Home BancShares Inc, Tegna Inc, Sells Zurn Water ...",https://finance.yahoo.com/news/inv-corp-small-cap-value-233802005.html,GuruFocus.com
29,2021-12-08 18:38,"Inv Corp All America Buys Zuora Inc, Ollie's Bargain Outlet Holdings Inc, Graco Inc, Sells ...",https://finance.yahoo.com/news/inv-corp-america-buys-zuora-233802174.html,GuruFocus.com
30,2021-12-07 16:38,"Mutual of America VIP Small-Cap Value Portfolio Buys Zuora Inc, Home BancShares Inc, BioCryst ...",https://finance.yahoo.com/news/mutual-america-vip-small-cap-213804660.html,GuruFocus.com
31,2021-12-07 16:38,"Mutual of America VIP Small-Cap Growth Portfolio Buys Zuora Inc, Ollie's Bargain Outlet ...",https://finance.yahoo.com/news/mutual-america-vip-small-cap-213802599.html,GuruFocus.com
32,2021-12-03 06:40,3 Unstoppable Stocks That Could Crush the Market Again in 2022 -- and Beyond,https://www.fool.com/investing/2021/12/03/3-unstoppable-stocks-that-could-crush-the-market-a/?source=eptyholnk0000202&utm_source=yahoo-host&utm_medium=feed&utm_campaign=article,Motley Fool
33,2021-12-02 16:05,Synaptics Completes Acquisition of DSP Group and Updates Current Guidance,https://finance.yahoo.com/news/synaptics-completes-acquisition-dsp-group-210500958.html,GlobeNewswire
34,2021-12-02 11:40,SIMO vs. SYNA: Which Stock Should Value Investors Buy Now?,https://finance.yahoo.com/news/simo-vs-syna-stock-value-164004315.html,Zacks
35,2021-12-02 09:10,Is Synaptics (SYNA) A Great Buy?,https://finance.yahoo.com/news/synaptics-syna-great-buy-141050607.html,Insider Monkey
36,2021-11-29 12:20,Surging Earnings Estimates Signal Upside for Synaptics (SYNA) Stock,https://finance.yahoo.com/news/surging-earnings-estimates-signal-upside-172005580.html,Zacks
37,2021-11-24 18:51,Bruker BioSciences Set to Join S&P MidCap 400; Others to Join S&P SmallCap 600,https://finance.yahoo.com/news/bruker-biosciences-set-join-p-235100889.html,PR Newswire
38,2021-11-23 09:20,"Synaptics to Participate at Upcoming Investor Conferences Tuesday, November 30, 2021, Wednesday, December 1, 2021, and Tuesday, December 7, 2021",https://finance.yahoo.com/news/synaptics-participate-upcoming-investor-conferences-142000183.html,GlobeNewswire
39,2021-11-18 09:15,"Synaptics (SYNA) Soars to 52-Week High, Time to Cash Out?",https://finance.yahoo.com/news/synaptics-syna-soars-52-week-141502529.html,Zacks
40,2021-11-17 12:00,Synaptics (SYNA) is a Great Momentum Stock: Should You Buy?,https://finance.yahoo.com/news/synaptics-syna-great-momentum-stock-170005828.html,Zacks
41,2021-11-16 11:40,SIMO vs. SYNA: Which Stock Should Value Investors Buy Now?,https://finance.yahoo.com/news/simo-vs-syna-stock-value-164004093.html,Zacks
42,2021-11-16 06:03,This Explosive Growth Stock Is a Buy Even After 160% Gains,https://www.fool.com/investing/2021/11/16/this-explosive-growth-stock-is-a-buy-even-after-16/?source=eptyholnk0000202&utm_source=yahoo-host&utm_medium=feed&utm_campaign=article,Motley Fool
43,2021-11-12 11:34,Does This Valuation Of Synaptics Incorporated (NASDAQ:SYNA) Imply Investors Are Overpaying?,https://finance.yahoo.com/news/does-valuation-synaptics-incorporated-nasdaq-163431591.html,Simply Wall St.
44,2021-11-11 11:22,Notable Synaptics Insider Makes $4.0M Sale,https://finance.yahoo.com/news/notable-synaptics-insider-makes-4-162237866.html,Benzinga
45,2021-11-05 16:24,These Semiconductor Stocks Are Surging On Upbeat Earnings News,https://www.investors.com/news/technology/semiconductor-stocks-surging-on-upbeat-earnings-news/?src=A00220,Investor's Business Daily
46,2021-11-05 15:51,Analysts Bump Up Price Targets On Synaptics On Q1 Beat,https://finance.yahoo.com/news/analysts-bump-price-targets-synaptics-195111322.html,Benzinga
47,2021-11-04 22:32,Synaptics Inc (SYNA) Q1 2022 Earnings Call Transcript,https://www.fool.com/earnings/call-transcripts/2021/11/04/synaptics-inc-syna-q1-2022-earnings-call-transcrip/?source=eptyholnk0000202&utm_source=yahoo-host&utm_medium=feed&utm_campaign=article,Motley Fool
48,2021-11-04 17:35,Synaptics (SYNA) Q1 Earnings and Revenues Surpass Estimates,https://finance.yahoo.com/news/synaptics-syna-q1-earnings-revenues-213509610.html,Zacks
49,2021-11-04 17:06,"Synaptics Stock Jumps As Chipmaker Beats Quarterly Goals, Guides Up",https://www.investors.com/news/technology/syna-stock-synaptics-beats-quarterly-goals/?src=A00220,Investor's Business Daily
50,2021-11-04 16:05,Synaptics Reports First Quarter Fiscal 2022 Results,https://finance.yahoo.com/news/synaptics-reports-first-quarter-fiscal-200500785.html,GlobeNewswire
51,2021-11-04 12:22,Unity Software (U) to Post Q3 Earnings: What's in the Cards?,https://finance.yahoo.com/news/unity-software-u-post-q3-162204871.html,Zacks
52,2021-11-03 12:17,The Trade Desk (TTD) to Report Q3 Earnings: What's in Store?,https://finance.yahoo.com/news/trade-desk-ttd-report-q3-161704259.html,Zacks
53,2021-11-03 11:58,Here's What to Expect Ahead of Citrix's (CTXS) Q3 Earnings,https://finance.yahoo.com/news/heres-expect-ahead-citrixs-ctxs-155803053.html,Zacks
54,2021-11-03 08:50,How to Boost Your Portfolio with Top Computer and Technology Stocks Set to Beat Earnings,https://finance.yahoo.com/news/boost-portfolio-top-computer-technology-125012221.html,Zacks
55,2021-11-02 10:57,Here's What You Should Know Ahead of PTC's Q4 Earnings Release,https://finance.yahoo.com/news/heres-know-ahead-ptcs-q4-145702679.html,Zacks
56,2021-11-02 09:48,Diodes (DIOD) to Report Q3 Earnings: What's in the Cards?,https://finance.yahoo.com/news/diodes-diod-report-q3-earnings-134801415.html,Zacks
57,2021-10-29 10:20,"The Zacks Analyst Blog Highlights: Carter's, Ralph Lauren, Synaptics, Chemours and Cushman & Wakefield",https://finance.yahoo.com/news/zacks-analyst-blog-highlights-carters-142002348.html,Zacks
58,2021-10-29 09:15,"Synaptics (SYNA) Soars to 52-Week High, Time to Cash Out?",https://finance.yahoo.com/news/synaptics-syna-soars-52-week-131501452.html,Zacks
59,2021-10-29 08:30,"This Stock Has Doubled in a Year, and It Is About to Fly Higher",https://www.fool.com/investing/2021/10/29/this-stock-has-doubled-in-a-year-and-it-is-about-t/?source=eptyholnk0000202&utm_source=yahoo-host&utm_medium=feed&utm_campaign=article,Motley Fool
60,2021-10-28 17:29,Earnings Season Target: Synaptics Stock Nears Buy Zone With Quarterly Report Due,https://www.investors.com/news/technology/earnings-season-preview-synaptics-near-buy-zone-with-quarterly-report-due/?src=A00220,Investor's Business Daily
61,2021-10-28 15:05,Synaptics (SYNA) Earnings Expected to Grow: Should You Buy?,https://finance.yahoo.com/news/synaptics-syna-earnings-expected-grow-190507599.html,Zacks
62,2021-10-28 11:40,SIMO vs. SYNA: Which Stock Is the Better Value Option?,https://finance.yahoo.com/news/simo-vs-syna-stock-better-154003470.html,Zacks
63,2021-10-28 06:40,5 Mid-Cap Growth Picks Ahead of Earnings for Long-Term Gain,https://finance.yahoo.com/news/5-mid-cap-growth-picks-104010028.html,Zacks
64,2021-10-21 12:10,Why the Earnings Surprise Streak Could Continue for Synaptics (SYNA),https://finance.yahoo.com/news/why-earnings-surprise-streak-could-161004846.html,Zacks
65,2021-10-18 08:00,Synaptics Announces AudioSmart Edge AI Headset Platform with Industrys Best Power and Performance,https://finance.yahoo.com/news/synaptics-announces-audiosmart-edge-ai-120000319.html,GlobeNewswire
66,2021-10-18 06:16,Synaptics Incorporated (SYNA): Hedge Funds Are Buying,https://finance.yahoo.com/news/synaptics-incorporated-syna-hedge-funds-101601572.html,Insider Monkey
67,2021-10-12 11:40,SIMO or SYNA: Which Is the Better Value Stock Right Now?,https://finance.yahoo.com/news/simo-syna-better-value-stock-154003630.html,Zacks
68,2021-10-11 16:05,"Synaptics to Report First Quarter Fiscal 2022 Results on November 4, 2021",https://finance.yahoo.com/news/synaptics-report-first-quarter-fiscal-200500334.html,GlobeNewswire
69,2021-10-07 11:01,Those who invested in Synaptics (NASDAQ:SYNA) three years ago are up 387%,https://finance.yahoo.com/news/those-invested-synaptics-nasdaq-syna-150136233.html,Simply Wall St.
70,2021-10-01 18:05,"Bragar Eagel & Squire, P.C. Announces that it is Investigating the Boards of Directors of Diversicare, DSP Group, ADTRAN, and Hill-Rom on behalf of Stockholders and Encourages Investors to Contact the Firm",https://finance.yahoo.com/news/bragar-eagel-squire-p-c-220500252.html,GlobeNewswire
71,2021-09-29 08:00,Synaptics Accelerates Low Power Edge AI Deployment with Edge Impulse Partnership,https://finance.yahoo.com/news/synaptics-accelerates-low-power-edge-120000081.html,GlobeNewswire
72,2021-09-23 06:40,"Market Sell-Off Fears: Where to Invest $1,000 Right Now",https://www.fool.com/investing/2021/09/23/september-sell-off-where-to-invest-1000-right-now/?source=eptyholnk0000202&utm_source=yahoo-host&utm_medium=feed&utm_campaign=article,Motley Fool
73,2021-09-17 11:40,ASX vs. SYNA: Which Stock Should Value Investors Buy Now?,https://finance.yahoo.com/news/asx-vs-syna-stock-value-154003916.html,Zacks
74,2021-09-08 10:10,Buy These 2 Stocks Before Apple Releases the Next iPhone,https://www.fool.com/investing/2021/09/08/buy-these-stocks-before-apple-releases-next-iphone/?source=eptyholnk0000202&utm_source=yahoo-host&utm_medium=feed&utm_campaign=article,Motley Fool
75,2021-09-03 19:30,Why Caterpillar Stock Is Likely to Keep Plowing Ahead,https://www.barrons.com/articles/why-caterpillar-stock-is-likely-to-keep-plowing-ahead-51630711839?siteid=yhoof2,Barrons.com
76,2021-09-02 09:15,"Synaptics (SYNA) Soars to 52-Week High, Time to Cash Out?",https://finance.yahoo.com/news/synaptics-syna-soars-52-week-131501269.html,Zacks
77,2021-08-31 10:30,"SHAREHOLDER ALERT: Rigrodsky Law, P.A. Announces Investigation of DSP Group, Inc. Buyout",https://finance.yahoo.com/news/shareholder-alert-rigrodsky-law-p-143000809.html,GlobeNewswire
78,2021-08-30 18:45,"SHAREHOLDER ALERT: WeissLaw LLP Investigates DSP Group, Inc.",https://finance.yahoo.com/news/shareholder-alert-weisslaw-llp-investigates-224500929.html,PR Newswire
79,2021-08-30 17:30,"Synaptics to Participate at Upcoming Investor Conferences Tuesday, August 31, 2021, Thursday, September 9, 2021, and Friday September 10, 2021",https://finance.yahoo.com/news/synaptics-participate-upcoming-investor-conferences-213000413.html,GlobeNewswire
80,2021-08-30 16:05,Internet Of Things Chipmaker Synaptics Snaps Up DSP In Diversification Push,https://www.investors.com/news/technology/syna-stock-chipmaker-synaptics-snaps-up-dsp-group/?src=A00220,Investor's Business Daily
81,2021-08-30 13:15,Why Shares of DSP Group Soared 17.5% Today,https://www.fool.com/investing/2021/08/30/why-shares-of-dsp-group-soared-175-today/?source=eptyholnk0000202&utm_source=yahoo-host&utm_medium=feed&utm_campaign=article,Motley Fool
82,2021-08-30 11:42,"DSP GROUP ALERT: Bragar Eagel & Squire, P.C. Investigates Sale of DSPG and Encourages Investors to Contact the Firm",https://finance.yahoo.com/news/dsp-group-alert-bragar-eagel-154200397.html,GlobeNewswire
83,2021-08-30 09:42,Synaptics To Acquire DSP Group At 18% Premium,https://finance.yahoo.com/news/synaptics-acquire-dsp-group-18-134204972.html,Benzinga
84,2021-08-30 08:10,"Synaptics to Acquire DSP Group, Expanding Leadership in Low Power AI Technology",https://finance.yahoo.com/news/synaptics-acquire-dsp-group-expanding-121000275.html,GlobeNewswire
85,2021-08-30 08:00,"Synaptics to Acquire DSP Group, Expanding Leadership in Low Power AI Technology",https://finance.yahoo.com/news/synaptics-acquire-dsp-group-expanding-120000904.html,GlobeNewswire
86,2021-08-27 12:20,Earnings Estimates Rising for Synaptics (SYNA): Will It Gain?,https://finance.yahoo.com/news/earnings-estimates-rising-synaptics-syna-162004188.html,Zacks
87,2021-08-25 11:40,UMC or SYNA: Which Is the Better Value Stock Right Now?,https://finance.yahoo.com/news/umc-syna-better-value-stock-154003613.html,Zacks
88,2021-08-23 12:18,Is There Now An Opportunity In Synaptics Incorporated (NASDAQ:SYNA)?,https://finance.yahoo.com/news/now-opportunity-synaptics-incorporated-nasdaq-161804566.html,Simply Wall St.
89,2021-08-20 10:00,"Synaptics to Participate at Upcoming Investor Conferences Tuesday, August 24, 2021 and Wednesday August 25, 2021",https://finance.yahoo.com/news/synaptics-participate-upcoming-investor-conferences-140000774.html,GlobeNewswire
90,2021-08-17 09:15,"Synaptics (SYNA) Soars to 52-Week High, Time to Cash Out?",https://finance.yahoo.com/news/synaptics-syna-soars-52-week-131501232.html,Zacks
91,2021-08-16 14:15,Up 78% This Year: Why This Tech Stock Still Looks Like a Buy,https://www.fool.com/investing/2021/08/16/up-78-this-year-why-this-tech-stock-still-looks-li/?source=eptyholnk0000202&utm_source=yahoo-host&utm_medium=feed&utm_campaign=article,Motley Fool
92,2021-08-12 12:00,What Makes Synaptics (SYNA) a Strong Momentum Stock: Buy Now?,https://finance.yahoo.com/news/makes-synaptics-syna-strong-momentum-160004311.html,Zacks
93,2021-08-06 10:10,"Synaptics Stock Surges on Earnings Beat, Price-Target Boosts",https://www.thestreet.com/investing/synaptics-stock-surges-on-fourth-quarter-earnings-beat?puc=yahoo&cm_ven=YAHOO,TheStreet.com
94,2021-08-06 08:00,"Synaptics to Participate at Upcoming Investor Conferences Tuesday, August 10, 2021 and Wednesday August 11, 2021",https://finance.yahoo.com/news/synaptics-participate-upcoming-investor-conferences-120000065.html,GlobeNewswire
95,2021-08-05 23:31,Synaptics Inc (SYNA) Q4 2021 Earnings Call Transcript,https://www.fool.com/earnings/call-transcripts/2021/08/05/synaptics-inc-syna-q4-2021-earnings-call-transcrip/?source=eptyholnk0000202&utm_source=yahoo-host&utm_medium=feed&utm_campaign=article,Motley Fool
96,2021-08-05 18:25,Synaptics (SYNA) Q4 Earnings and Revenues Surpass Estimates,https://finance.yahoo.com/news/synaptics-syna-q4-earnings-revenues-222510201.html,Zacks
97,2021-08-05 16:05,Synaptics Reports Fourth Quarter Fiscal 2021 Results,https://finance.yahoo.com/news/synaptics-reports-fourth-quarter-fiscal-200500045.html,GlobeNewswire
98,2021-07-29 16:05,Synaptics Appoints Patricia Kummrow to Board of Directors,https://finance.yahoo.com/news/synaptics-appoints-patricia-kummrow-board-200500088.html,GlobeNewswire
99,2021-07-29 15:05,Synaptics (SYNA) Earnings Expected to Grow: Should You Buy?,https://finance.yahoo.com/news/synaptics-syna-earnings-expected-grow-190507055.html,Zacks
