,Date,News Headline,Article Link,Source
0,2021-12-07 06:26,"Here's What Huadi International Group Co., Ltd.'s (NASDAQ:HUDI) Shareholder Ownership Structure Looks Like",https://finance.yahoo.com/news/heres-huadi-international-group-co-112642942.html,Simply Wall St.
1,2021-11-23 12:50,Top IPOs Of 2021 So Far,https://www.thestreet.com/investing/top-ipos-of-2021?puc=yahoo&cm_ven=YAHOO,TheStreet.com
2,2021-11-10 08:00,"Huadi International Group Co., Ltd. Announces Cooperation Agreement for the Development and Manufacturing of High-Pressure Hydrogen Storage Tank Stainless Steel Pipe",https://finance.yahoo.com/news/huadi-international-group-co-ltd-130000286.html,GlobeNewswire
3,2021-11-03 03:33,71 Biggest Movers From Yesterday,https://finance.yahoo.com/news/71-biggest-movers-yesterday-073344887.html,Benzinga
4,2021-11-01 08:00,"Huadi International Group Co., Ltd. Awarded $3.26 Million Stainless Steel Seamless Pipe Order Contracts from a U.S. Client",https://finance.yahoo.com/news/huadi-international-group-co-ltd-120000893.html,GlobeNewswire
5,2021-10-25 13:26,"What To Watch For In Last Week's Biggest Gainers: Digital World, Phunware And More",https://finance.yahoo.com/news/watch-last-weeks-biggest-gainers-172614231.html,Benzinga
6,2021-09-08 08:46,"Should We Be Cautious About Huadi International Group Co., Ltd.'s (NASDAQ:HUDI) ROE Of 13%?",https://finance.yahoo.com/news/cautious-huadi-international-group-co-124654470.html,Simply Wall St.
7,2021-08-26 07:30,"Huadi International Group Co., Ltd. Announces Half-Year 2021 Financial Results",https://finance.yahoo.com/news/huadi-international-group-co-ltd-113000503.html,GlobeNewswire
8,2021-06-25 02:45,"A Look At The Intrinsic Value Of Huadi International Group Co., Ltd. (NASDAQ:HUDI)",https://finance.yahoo.com/news/look-intrinsic-value-huadi-international-064545668.html,Simply Wall St.
9,2021-04-26 03:30,"Benign Growth For Huadi International Group Co., Ltd. (NASDAQ:HUDI) Underpins Its Share Price",https://finance.yahoo.com/news/benign-growth-huadi-international-group-073014809.html,Simply Wall St.
10,2021-04-09 07:30,"Huadi International Group Co., Ltd. Awarded RMB 20.7 Million Stainless Steel Seamless Pipe Order Contracts",https://finance.yahoo.com/news/huadi-international-group-co-ltd-113000026.html,GlobeNewswire
11,2021-03-30 16:30,"Huadi International Group Co., Ltd. Announces Fiscal Year 2020 Financial Results",https://finance.yahoo.com/news/huadi-international-group-co-ltd-203000736.html,GlobeNewswire
12,2021-03-17 08:30,"Huadi International Group Co., Ltd. Awarded $1.6 Million Stainless Steel Seamless Pipe Order Contracts",https://finance.yahoo.com/news/huadi-international-group-co-ltd-123000888.html,GlobeNewswire
13,2021-03-03 08:30,"Huadi International Group Co., Ltd. Awarded $1.95 Million Stainless Pipe Order Contracts",https://finance.yahoo.com/news/huadi-international-group-co-ltd-133000758.html,GlobeNewswire
14,2021-02-14 19:00,Euronext/Brexit: the Italian job,"http://www.ft.com/cms/s/581a3ed2-3b91-4220-802e-3bf663ade005,s01=1.html?ftcamp=traffic/partner/feed_headline/us_yahoo/auddev",Financial Times
15,2021-02-01 08:00,"Huadi International Group Co, Ltd. Announces Closing of $25 Million Initial Public Offering",https://finance.yahoo.com/news/huadi-international-group-co-ltd-130000832.html,GlobeNewswire
16,2021-01-22 08:30,"Huadi International Group Co, Ltd. Announces Pricing of $25 Million Initial Public Offering",https://finance.yahoo.com/news/huadi-international-group-co-ltd-133000247.html,GlobeNewswire
