,Date,News Headline,Article Link,Source
0,2022-01-13 06:15,Is Enovix Corporation (NASDAQ:ENVX) Popular Amongst Insiders?,https://finance.yahoo.com/news/enovix-corporation-nasdaq-envx-popular-111507159.html,Simply Wall St.
1,2022-01-04 07:30,Enovix to Participate in Upcoming Investor Conferences,https://finance.yahoo.com/news/enovix-participate-upcoming-investor-conferences-123000267.html,GlobeNewswire
2,2021-12-28 02:38,"Destra Investment Trust Buys ThredUp Inc, Etsy Inc, Riskified, Sells , , 2U Inc",https://finance.yahoo.com/news/destra-investment-trust-buys-thredup-073806453.html,GuruFocus.com
3,2021-12-20 16:01,Enovix to Showcase Award-Winning Battery Technology at CES 2022,https://finance.yahoo.com/news/enovix-showcase-award-winning-battery-210100258.html,GlobeNewswire
4,2021-12-07 07:30,Enovix Executives Provide Update to EV Program at the 21st Advanced Automotive Battery Conference in San Diego,https://finance.yahoo.com/news/enovix-executives-ev-program-21st-123000154.html,GlobeNewswire
5,2021-12-07 07:30,Enovix Announces Redemption of Public Warrants,https://finance.yahoo.com/news/enovix-announces-redemption-public-warrants-123000479.html,GlobeNewswire
6,2021-12-01 07:30,Enovix to Present at Raymond James 2021 Technology Investors Conference,https://finance.yahoo.com/news/enovix-present-raymond-james-2021-123000326.html,GlobeNewswire
7,2021-11-25 10:03,3 Top Stocks to Be Thankful for This Year,https://finance.yahoo.com/news/3-top-stocks-thankful-150319296.html,TipRanks
8,2021-11-18 16:01,Enovix Executives to Speak at 21st Advanced Automotive Battery Conference in San Diego,https://finance.yahoo.com/news/enovix-executives-speak-21st-advanced-210100984.html,GlobeNewswire
9,2021-11-15 10:09,All but these 7 Bay Area company stocks from 2021 SPAC mergers are in the red,https://www.bizjournals.com/sanjose/news/2021/11/15/here-are-7-bay-area-spac-merger-stocks-that-are-up.html?ana=yahoo,American City Business Journals
10,2021-11-10 17:40,Enovix Named as CES 2022 Innovation Awards Honoree,https://finance.yahoo.com/news/enovix-named-ces-2022-innovation-224000815.html,GlobeNewswire
11,2021-11-08 16:01,"Technology Executive, Pegah Ebrahimi, Appointed to Enovix Board of Directors",https://finance.yahoo.com/news/technology-executive-pegah-ebrahimi-appointed-210100760.html,GlobeNewswire
12,2021-11-08 16:01,Enovix Announces Third Quarter 2021 Financial Results,https://finance.yahoo.com/news/enovix-announces-third-quarter-2021-210100809.html,GlobeNewswire
13,2021-10-25 07:30,"Enovix to Release Third Quarter 2021 Financial Results on November 8, 2021",https://finance.yahoo.com/news/enovix-release-third-quarter-2021-113000697.html,GlobeNewswire
14,2021-10-15 07:41,Enovix Corporation (NASDAQ:ENVX) may have lost US$219m in value but insiders who invested last year have seen gains of around US$134k to date,https://finance.yahoo.com/news/enovix-corporation-nasdaq-envx-may-114134899.html,Simply Wall St.
15,2021-09-22 07:30,Enovix Achieves Major Milestones: U.S.-Based Factory Produces First Battery Cells Off Its Automated Manufacturing Line and Ships Custom Design for AR Glasses,https://finance.yahoo.com/news/enovix-achieves-major-milestones-u-113000821.html,GlobeNewswire
16,2021-09-02 07:30,Enovix to Participate in Upcoming Investor Conferences,https://finance.yahoo.com/news/enovix-participate-upcoming-investor-conferences-113000442.html,GlobeNewswire
17,2021-08-24 15:53,"Investing in These 3 Stocks Could Double Your Money, Says Oppenheimer",https://finance.yahoo.com/news/investing-3-stocks-could-double-195355284.html,TipRanks
18,2021-08-10 16:01,"Enovix Continues Momentum, Achieves Key Manufacturing Facility Milestone and Books Order in the Wearable Device Space",https://finance.yahoo.com/news/enovix-continues-momentum-achieves-key-200100339.html,GlobeNewswire
19,2021-08-10 16:01,Enovix Announces Second Quarter 2021 Financial Results,https://finance.yahoo.com/news/enovix-announces-second-quarter-2021-200100084.html,GlobeNewswire
20,2021-08-02 07:30,"Enovix to Present at Oppenheimer 24th Annual Technology, Internet & Communications Conference",https://finance.yahoo.com/news/enovix-present-oppenheimer-24th-annual-113000534.html,GlobeNewswire
21,2021-07-27 16:01,"Enovix to Release Second Quarter 2021 Financial Results on August 10, 2021",https://finance.yahoo.com/news/enovix-release-second-quarter-2021-200100579.html,GlobeNewswire
