,Date,News Headline,Article Link,Source
0,2022-01-13 11:29,"Masimo (MASI) Provides FY22 View, Preliminary FY21 Results Solid",https://finance.yahoo.com/news/masimo-masi-provides-fy22-view-162904697.html,Zacks
1,2022-01-13 09:34,"Bio Rad's (BIO) Product Launches Aid, Forex Woes Persist",https://finance.yahoo.com/news/bio-rads-bio-product-launches-143402698.html,Zacks
2,2022-01-13 09:14,Quest Diagnostics (DGX) Posts Preliminary Q4 & 2021 Results,https://finance.yahoo.com/news/quest-diagnostics-dgx-posts-preliminary-141402969.html,Zacks
3,2022-01-13 08:55,"Zacks.com featured highlights include: Accenture plc, Builders FirstSource, Inc. and AMN Healthcare Services, Inc.",https://finance.yahoo.com/news/zacks-com-featured-highlights-accenture-135501164.html,Zacks
4,2022-01-13 06:59,Integra (IART) Announces Preliminary Q4 & '21 Sales Results,https://finance.yahoo.com/news/integra-iart-announces-preliminary-q4-115911024.html,Zacks
5,2022-01-13 06:52,Here's Why You Should Retain Thermo Fisher (TMO) Stock for Now,https://finance.yahoo.com/news/heres-why-retain-thermo-fisher-115211065.html,Zacks
6,2022-01-12 11:51,Here's Why You Should Retain Abiomed (ABMD) Stock For Now,https://finance.yahoo.com/news/heres-why-retain-abiomed-abmd-165104769.html,Zacks
7,2022-01-12 11:01,Inogen's (INGN) Preliminary Q4 Revenues Solid Amid Challenges,https://finance.yahoo.com/news/inogens-ingn-preliminary-q4-revenues-160104052.html,Zacks
8,2022-01-12 10:44,Cardiovascular Systems (CSII) Coronary Sales Up Amid COVID Woe,https://finance.yahoo.com/news/cardiovascular-systems-csii-coronary-sales-154403949.html,Zacks
9,2022-01-12 10:35,Hologic (HOLX) Up on Preliminary Q1 Organic Sales Growth,https://finance.yahoo.com/news/hologic-holx-preliminary-q1-organic-153503206.html,Zacks
10,2022-01-12 10:00,Here's Why AMN Healthcare (AMN) Could be Great Choice for a Bottom Fisher,https://finance.yahoo.com/news/heres-why-amn-healthcare-amn-150003944.html,Zacks
11,2022-01-12 09:15,3 Stocks With Momentum Anomaly to Create a Winning Portfolio,https://finance.yahoo.com/news/3-stocks-momentum-anomaly-create-141502820.html,Zacks
12,2022-01-12 08:05,Here's Why You Should Hold on to Align Technology (ALGN) Now,https://finance.yahoo.com/news/heres-why-hold-align-technology-130501460.html,Zacks
13,2022-01-12 08:03,Medtronic (MDT) Gets MHLW Approval for Micra AV Sale in Japan,https://finance.yahoo.com/news/medtronic-mdt-gets-mhlw-approval-130301521.html,Zacks
14,2022-01-11 18:34,"Illumina (ILMN) Announces Preliminary Q4 Sales, Issues '22 View",https://finance.yahoo.com/news/illumina-ilmn-announces-preliminary-q4-233411267.html,Zacks
15,2022-01-11 18:15,AMN Healthcare Services (AMN) Gains But Lags Market: What You Should Know,https://finance.yahoo.com/news/amn-healthcare-services-amn-gains-231511260.html,Zacks
16,2022-01-11 12:25,Here's Why You Should Retain BD (BDX) Stock in Your Portfolio,https://finance.yahoo.com/news/heres-why-retain-bd-bdx-172505936.html,Zacks
17,2022-01-11 10:10,Quidel Corporation (QDEL) Reports Solid Preliminary Q4 Revenues,https://finance.yahoo.com/news/quidel-corporation-qdel-reports-solid-151003626.html,Zacks
18,2022-01-11 09:39,"IDEXX's (IDXX) Low LPD Sales, Rise in Expenses Dampen Growth",https://finance.yahoo.com/news/idexxs-idxx-low-lpd-sales-143902248.html,Zacks
19,2022-01-11 09:30,DexCom (DXCM) Posts Solid Preliminary Q4 and 2021 Revenues,https://finance.yahoo.com/news/dexcom-dxcm-posts-solid-preliminary-143002822.html,Zacks
20,2022-01-11 09:28,Here's Why You Should Retain AmerisourceBergen (ABC) Stock,https://finance.yahoo.com/news/heres-why-retain-amerisourcebergen-abc-142802115.html,Zacks
21,2022-01-11 09:24,"Medtronic (MDT) to Buy Affera, Expand in Electrophysiology",https://finance.yahoo.com/news/medtronic-mdt-buy-affera-expand-142402698.html,Zacks
22,2022-01-10 10:19,Here's Why You Should Retain Intuitive Surgical (ISRG) Stock,https://finance.yahoo.com/news/heres-why-retain-intuitive-surgical-151903036.html,Zacks
23,2022-01-10 10:17,PacBio's (PACB) Sequel IIe Boosts Radboudumc's Sequencing Ability,https://finance.yahoo.com/news/pacbios-pacb-sequel-iie-boosts-151703509.html,Zacks
24,2022-01-10 10:15,"BD (BDX) Product Gets FDA Nod, Patient Outcome to Get a Boost",https://finance.yahoo.com/news/bd-bdx-product-gets-fda-151503050.html,Zacks
25,2022-01-10 10:11,Here's Why You Should Retain CVS Health (CVS) Stock for Now,https://finance.yahoo.com/news/heres-why-retain-cvs-health-151103625.html,Zacks
26,2022-01-10 10:08,NuVasive (NUVA) Gets FDA Nod for Attrax Putty Expanded Use,https://finance.yahoo.com/news/nuvasive-nuva-gets-fda-nod-150803207.html,Zacks
27,2022-01-10 08:30,AMN Healthcare Announces Preliminary Fourth Quarter 2021 Revenue; To Present at J.P. Morgan Healthcare Conference,https://finance.yahoo.com/news/amn-healthcare-announces-preliminary-fourth-133000370.html,Business Wire
28,2022-01-07 11:58,Thermo Fisher (TMO) Completes Buyout of PeproTech for $1.85B,https://finance.yahoo.com/news/thermo-fisher-tmo-completes-buyout-165804529.html,Zacks
29,2022-01-07 11:23,Here's Why You Should Retain Baxter (BAX) Stock For Now,https://finance.yahoo.com/news/heres-why-retain-baxter-bax-162304403.html,Zacks
30,2022-01-07 10:51,"AngioDynamics (ANGO) Q2 Earnings Lag Estimates, Revenues Top",https://finance.yahoo.com/news/angiodynamics-ango-q2-earnings-lag-155103983.html,Zacks
31,2022-01-07 09:30,Illumina (ILMN)-SomaLogic Ink Deal to Advance Proteomics,https://finance.yahoo.com/news/illumina-ilmn-somalogic-ink-deal-143002341.html,Zacks
32,2022-01-06 13:15,Hologic's (HOLX) GAI Program to Include Aptima SARS-CoV-2 Assay,https://finance.yahoo.com/news/hologics-holx-gai-program-aptima-181506430.html,Zacks
33,2022-01-05 18:00,AMN Healthcare Services (AMN) Stock Moves -1.68%: What You Should Know,https://finance.yahoo.com/news/amn-healthcare-services-amn-stock-230011595.html,Zacks
34,2022-01-05 11:35,STERIS (STE) Hits a New 52-Week High: What's Driving It?,https://finance.yahoo.com/news/steris-ste-hits-52-week-163504238.html,Zacks
35,2022-01-05 11:07,3 Reasons to Retain Integer Holdings (ITGR) Stock For Now,https://finance.yahoo.com/news/3-reasons-retain-integer-holdings-160704205.html,Zacks
36,2022-01-05 07:59,Here's Why You Should Retain Phibro (PAHC) Stock for Now,https://finance.yahoo.com/news/heres-why-retain-phibro-pahc-125912610.html,Zacks
37,2022-01-05 07:57,Omnicell (OMCL) to Expand EnlivenHealth Division With New Buyout,https://finance.yahoo.com/news/omnicell-omcl-expand-enlivenhealth-division-125712118.html,Zacks
38,2022-01-04 18:15,AMN Healthcare Services (AMN) Dips More Than Broader Markets: What You Should Know,https://finance.yahoo.com/news/amn-healthcare-services-amn-dips-231511204.html,Zacks
39,2022-01-03 10:30,3 Reasons to Add Accuray (ARAY) Stock to Your Portfolio,https://finance.yahoo.com/news/3-reasons-add-accuray-aray-153003811.html,Zacks
40,2022-01-03 08:36,Fretting Over Market Volatility? Bet on These 4 Low-Beta Stocks,https://finance.yahoo.com/news/fretting-over-market-volatility-bet-133601657.html,Zacks
41,2021-12-31 14:56,Why Should You Hold Universal Health (UHS) in Your Portfolio?,https://finance.yahoo.com/news/why-hold-universal-health-uhs-195607773.html,Zacks
42,2021-12-31 10:05,3 Reasons to Add McKesson (MCK) Stock to Your Portfolio,https://finance.yahoo.com/news/3-reasons-add-mckesson-mck-150503447.html,Zacks
43,2021-12-30 11:07,Quidel's (QDEL) Antigen Tests Successful in Omicron Detection,https://finance.yahoo.com/news/quidels-qdel-antigen-tests-successful-160704055.html,Zacks
44,2021-12-30 08:27,"Forget DaVita (DVA), Buy These 3 Lucrative Medical Care Stocks",https://finance.yahoo.com/news/forget-davita-dva-buy-3-132701914.html,Zacks
45,2021-12-29 11:05,PacBio's (PACB) New Surveillance Kit Successful Against Omicron,https://finance.yahoo.com/news/pacbios-pacb-surveillance-kit-successful-160504597.html,Zacks
46,2021-12-29 09:00,AMN Survey: Respiratory Therapists Top List of Most In-Demand Temporary Allied Healthcare Professionals,https://finance.yahoo.com/news/amn-survey-respiratory-therapists-top-140000581.html,Business Wire
47,2021-12-28 10:38,Phillips' (PHG) Partner Base Expansion Drives Prospects,https://finance.yahoo.com/news/phillips-phg-partner-expansion-drives-153803330.html,Zacks
48,2021-12-28 10:04,AMN Healthcare (AMN) Hits 52-Week High: What's Behind It?,https://finance.yahoo.com/news/amn-healthcare-amn-hits-52-150403805.html,Zacks
49,2021-12-28 09:15,AMN Healthcare (AMN) Hits Fresh High: Is There Still Room to Run?,https://finance.yahoo.com/news/amn-healthcare-amn-hits-fresh-141502242.html,Zacks
50,2021-12-28 04:26,AMN Healthcare Services (NYSE:AMN) stock performs better than its underlying earnings growth over last five years,https://finance.yahoo.com/news/amn-healthcare-services-nyse-amn-092606975.html,Simply Wall St.
51,2021-12-27 11:20,AmerisourceBergen (ABC) Hits 52-Week High: What's Aiding It?,https://finance.yahoo.com/news/amerisourcebergen-abc-hits-52-week-162004880.html,Zacks
52,2021-12-27 11:07,OPKO's (OPK) RAYALDEE Favored by Trial Data for COVID Patients,https://finance.yahoo.com/news/opkos-opk-rayaldee-favored-trial-160704787.html,Zacks
53,2021-12-27 10:59,HCA Healthcare (HCA) Up 53.3% in a Year: More Room to Run?,https://finance.yahoo.com/news/hca-healthcare-hca-53-3-155903560.html,Zacks
54,2021-12-24 13:38,"VP Disciplined Core Value Fund Buys Alphabet Inc, Kimberly-Clark Corp, T. ...",https://finance.yahoo.com/news/vp-disciplined-core-value-fund-183804037.html,GuruFocus.com
55,2021-12-24 02:38,"Disciplined Core Value Fund Buys Alphabet Inc, Kimberly-Clark Corp, T. ...",https://finance.yahoo.com/news/disciplined-core-value-fund-buys-073803224.html,GuruFocus.com
56,2021-12-23 13:10,Tenet Healthcare (THC) Soars 95.8% YTD: More Room to Run?,https://finance.yahoo.com/news/tenet-healthcare-thc-soars-95-181006960.html,Zacks
57,2021-12-23 10:46,BD's (BDX) Latest Buyout to Enhance its Digital Capabilities,https://finance.yahoo.com/news/bds-bdx-latest-buyout-enhance-154603788.html,Zacks
58,2021-12-23 10:26,Here's Why You Should Retain Merit Medical (MMSI) Stock For Now,https://finance.yahoo.com/news/heres-why-retain-merit-medical-152603562.html,Zacks
59,2021-12-22 11:08,Here's Why You Should Retain Masimo (MASI) Stock For Now,https://finance.yahoo.com/news/heres-why-retain-masimo-masi-160804053.html,Zacks
60,2021-12-22 09:40,Is AMN Healthcare Services (AMN) Outperforming Other Medical Stocks This Year?,https://finance.yahoo.com/news/amn-healthcare-services-amn-outperforming-144002080.html,Zacks
61,2021-12-21 14:30,Acadia Healthcare (ACHC) Buys Real Estate to Expand in Chicago,https://finance.yahoo.com/news/acadia-healthcare-achc-buys-real-193007440.html,Zacks
62,2021-12-21 09:00,AMN Healthcare CEO Susan Salka Recognized as One of 100 Most Influential People by Modern Healthcare,https://finance.yahoo.com/news/amn-healthcare-ceo-susan-salka-140000479.html,Business Wire
63,2021-12-20 11:00,Ensign Group (ENSG) Hikes Dividend to Share More Profits,https://finance.yahoo.com/news/ensign-group-ensg-hikes-dividend-160004751.html,Zacks
64,2021-12-20 10:57,Here's Why You Should Retain DexCom (DXCM) Stock For Now,https://finance.yahoo.com/news/heres-why-retain-dexcom-dxcm-155703126.html,Zacks
65,2021-12-17 15:00,Here's Why You Should Retain Catalent (CTLT) Stock for Now,https://finance.yahoo.com/news/heres-why-retain-catalent-ctlt-200008609.html,Zacks
66,2021-12-17 08:01,Here's Why You Should Hold on to NEOGEN (NEOG) Stock for Now,https://finance.yahoo.com/news/heres-why-hold-neogen-neog-130101465.html,Zacks
67,2021-12-16 14:41,FDA Approves Intuitive Surgical's (ISRG) Latest SureForm Stapler,https://finance.yahoo.com/news/fda-approves-intuitive-surgicals-isrg-194107416.html,Zacks
68,2021-12-16 09:51,Boston Scientific (BSX) New Buyouts Aid Amid COVID Resurgence,https://finance.yahoo.com/news/boston-scientific-bsx-buyouts-aid-145102385.html,Zacks
69,2021-12-16 07:35,Alcon (ALC) on Track With Successful Global PRECISION1 Rollout,https://finance.yahoo.com/news/alcon-alc-track-successful-global-123512490.html,Zacks
70,2021-12-15 13:55,Veeva's (VEEV) Data Cloud to Aid PharmaEssentia's New Product,https://finance.yahoo.com/news/veevas-veev-data-cloud-aid-185506335.html,Zacks
71,2021-12-15 07:22,Quest Diagnostics (DGX) Hits a 52-Week High: What's Driving It?,https://finance.yahoo.com/news/quest-diagnostics-dgx-hits-52-122212209.html,Zacks
72,2021-12-14 16:57,AMN Healthcare Names Jorge Caballero to Board of Directors,https://finance.yahoo.com/news/amn-healthcare-names-jorge-caballero-215700022.html,Business Wire
73,2021-12-14 16:55,Here's Why You Should Retain Veeva Systems (VEEV) Stock for Now,https://finance.yahoo.com/news/heres-why-retain-veeva-systems-215509580.html,Zacks
74,2021-12-14 16:39,Study Favors Masimo's (MASI) SedLine for Better Patient Outcome,https://finance.yahoo.com/news/study-favors-masimos-masi-sedline-213909426.html,Zacks
75,2021-12-14 09:04,CVS Health (CVS) Scales a 52-Week High: What's Driving It?,https://finance.yahoo.com/news/cvs-health-cvs-scales-52-140402109.html,Zacks
76,2021-12-14 09:03,Hologic (HOLX) Reports New Findings on Breast Cancer Index,https://finance.yahoo.com/news/hologic-holx-reports-findings-breast-140302096.html,Zacks
77,2021-12-13 17:28,McKesson (MCK) Hits 52-Week High: What's Aiding the Stock?,https://finance.yahoo.com/news/mckesson-mck-hits-52-week-222810689.html,Zacks
78,2021-12-13 16:49,PerkinElmer's (PKI) Latest Kit to Boost COVID-19 Surveillance,https://finance.yahoo.com/news/perkinelmers-pki-latest-kit-boost-214909728.html,Zacks
79,2021-12-13 08:20,Thermo Fisher (TMO) Completes Acquisition of Leading CRO,https://finance.yahoo.com/news/thermo-fisher-tmo-completes-acquisition-132001808.html,Zacks
80,2021-12-13 08:20,Here's Why You Should Hold on to Insulet (PODD) Stock for Now,https://finance.yahoo.com/news/heres-why-hold-insulet-podd-132001808.html,Zacks
81,2021-12-12 21:37,Hedge Funds Are Piling Into AMN Healthcare Services Inc (AMN),https://finance.yahoo.com/news/hedge-funds-piling-amn-healthcare-023714431.html,Insider Monkey
82,2021-12-10 13:33,Here's Why Investors Should Hold Onto Ensign Group (ENSG),https://finance.yahoo.com/news/heres-why-investors-hold-onto-183306260.html,Zacks
83,2021-12-10 10:19,BD's (BDX) Tissuemed Buyout to Boost its Surgical Solutions Arm,https://finance.yahoo.com/news/bds-bdx-tissuemed-buyout-boost-151903269.html,Zacks
84,2021-12-09 12:32,PacBio (PACB)-UCLA Health Tie Up for Rare Diseases' WGS Research,https://finance.yahoo.com/news/pacbio-pacb-ucla-health-tie-173205816.html,Zacks
85,2021-12-09 09:00,"AMN Named Among Top Corporate Boards in Diversity, Equity, and Inclusion Awards",https://finance.yahoo.com/news/amn-named-among-top-corporate-140000504.html,Business Wire
86,2021-12-08 10:42,Here's Why You Should Retain BD (BDX) Stock in Your Portfolio,https://finance.yahoo.com/news/heres-why-retain-bd-bdx-154203720.html,Zacks
87,2021-12-07 11:49,Here's Why You Should Retain Baxter (BAX) Stock For Now,https://finance.yahoo.com/news/heres-why-retain-baxter-bax-164904904.html,Zacks
88,2021-12-07 11:05,"HealthEquity (HQY) Q3 Earnings Beat, FY 2022 View Lowered",https://finance.yahoo.com/news/healthequity-hqy-q3-earnings-beat-160504599.html,Zacks
89,2021-12-06 15:20,AMN Healthcare Board Members Sylvia Trent-Adams and Daphne E. Jones Named to Savoy Magazines Most Influential Black Corporate Directors,https://finance.yahoo.com/news/amn-healthcare-board-members-sylvia-140000988.html,Business Wire
90,2021-12-06 11:15,Here's Why You Should Retain Abiomed (ABMD) Stock for Now,https://finance.yahoo.com/news/heres-why-retain-abiomed-abmd-161504271.html,Zacks
91,2021-12-06 10:49,BD's (BDX) Buyout of Venclose to Improve Patient Outcome,https://finance.yahoo.com/news/bds-bdx-buyout-venclose-improve-154903069.html,Zacks
92,2021-12-03 11:31,3 Reasons to Add Accuray (ARAY) Stock to Your Portfolio,https://finance.yahoo.com/news/3-reasons-add-accuray-aray-163104291.html,Zacks
93,2021-12-03 10:11,"Cooper Companies (COO) Q4 Earnings Lag Estimates, Margins Up",https://finance.yahoo.com/news/cooper-companies-coo-q4-earnings-151103298.html,Zacks
94,2021-12-03 09:58,Has AMN Healthcare Services (AMN) Outpaced Other Medical Stocks This Year?,https://finance.yahoo.com/news/amn-healthcare-services-amn-outpaced-145802066.html,Zacks
95,2021-12-02 09:55,Here's Why You Should Retain Allscripts (MDRX) Stock For Now,https://finance.yahoo.com/news/heres-why-retain-allscripts-mdrx-145502577.html,Zacks
96,2021-12-02 09:40,"Veeva Systems (VEEV) Q3 Earnings Beat Estimates, '22 View Up",https://finance.yahoo.com/news/veeva-systems-veev-q3-earnings-144002242.html,Zacks
97,2021-12-02 08:54,Can AMN Healthcare (AMN) Stock Continue to Grow Earnings?,https://finance.yahoo.com/news/amn-healthcare-amn-stock-continue-135401458.html,Zacks
98,2021-12-02 08:45,Bet on These 3 Low-Beta Stocks to Combat Market Volatility,https://finance.yahoo.com/news/bet-3-low-beta-stocks-134501744.html,Zacks
99,2021-12-01 09:29,Fresenius Medical's (FMS) New Dialyzer to Boost Patient Outcome,https://finance.yahoo.com/news/fresenius-medicals-fms-dialyzer-boost-142902645.html,Zacks
