,Date,News Headline,Article Link,Source
0,2022-01-13 18:01,"WHO recommends Eli Lilly, GSK-Vir's drugs, widening COVID-19 treatment pool",https://finance.yahoo.com/news/recommends-eli-lilly-gsk-virs-230101154.html,Reuters
1,2022-01-13 17:38,"Northern Capital Management, Inc. Buys McDonald's Corp, Duke Energy Corp, AbbVie Inc",https://finance.yahoo.com/news/northern-capital-management-inc-buys-223806543.html,GuruFocus.com
2,2022-01-13 13:38,"Stock Yards Bank & Trust Co Buys Eli Lilly and Co, Churchill Downs Inc, Anthem Inc, Sells ...",https://finance.yahoo.com/news/stock-yards-bank-trust-co-183823169.html,GuruFocus.com
3,2022-01-13 13:38,"Orrstown Financial Services Inc Buys iShares MSCI Emerging Markets ETF, Vanguard Small Cap ETF, ...",https://finance.yahoo.com/news/orrstown-financial-services-inc-buys-183805697.html,GuruFocus.com
4,2022-01-13 11:34,How to reduce health care costs when planning for retirement,https://finance.yahoo.com/video/reduce-health-care-costs-planning-163424912.html,Yahoo Finance Video
5,2022-01-12 19:09,Top Pharmaceutical Stocks for Q1 2022,https://www.investopedia.com/investing/pharmaceutical-stocks/?utm_campaign=quote-yahoo&utm_source=yahoo&utm_medium=referral,Investopedia
6,2022-01-12 16:14,"Stocks in focus: DiDi, GrubHub, Exxon Mobile, Eli Lilly",https://finance.yahoo.com/video/stocks-focus-didi-grubhub-exxon-211443805.html,Yahoo Finance Video
7,2022-01-12 16:06,Biogen Stock Tumbles As Medicare Delivers Another Obstacle To Its Alzheimer's Drug,https://www.investors.com/news/technology/biogen-stock-tumbles-after-medicare-limits-aduhelm-coverage/?src=A00220,Investor's Business Daily
8,2022-01-12 14:42,US STOCKS-Wall Street gains as inflation data supports Fed bets,https://finance.yahoo.com/news/us-stocks-wall-street-gains-194234870.html,Reuters
9,2022-01-12 13:31,Jumpstart Nova launches with $55 million fund to invest in Black-founded health care companies,https://www.bizjournals.com/nashville/inno/stories/inno-insights/2022/01/12/jumpstart-nova-launches-with-55-million-fund.html?ana=yahoo,American City Business Journals
10,2022-01-12 11:39,Veru (VERU) Up on FDA's Fast Track Tag for Breast Cancer Drug,https://finance.yahoo.com/news/veru-veru-fdas-fast-track-163904161.html,Zacks
11,2022-01-12 11:01,"Centene vice chairman talks CMS changes, the Alzheimers drug, and COVID-19 hospitalizations",https://finance.yahoo.com/video/centene-vice-chairman-talks-cms-160154172.html,Yahoo Finance Video
12,2022-01-12 10:34,Biogen (BIIB) Down on Medicare Draft Ruling for Alzheimer's Drugs,https://finance.yahoo.com/news/biogen-biib-down-medicare-draft-153403239.html,Zacks
13,2022-01-12 10:00,Eli Lilly (LLY) Recently Broke Out Above the 50-Day Moving Average,https://finance.yahoo.com/news/eli-lilly-lly-recently-broke-150003374.html,Zacks
14,2022-01-12 09:48,Glaxo (GSK) & Vir to Supply More COVID Antibody Doses in US,https://finance.yahoo.com/news/glaxo-gsk-vir-supply-more-144802145.html,Zacks
15,2022-01-12 09:44,Biogens stock tumbles after the U.S. proposes restricting access to its Alzheimers disease drug,https://www.marketwatch.com/story/biogens-stock-tumbles-after-the-u-s-proposes-restricting-access-to-its-alzheimers-disease-drug-11641998657?siteid=yhoof2,MarketWatch
16,2022-01-12 09:33,"Biogen Got Bad News on Its Alzheimers Drug. Why It Hurt Eli Lilly, Too.",https://www.barrons.com/articles/biogen-eli-lilly-stock-aduhelm-medicare-51641997831?siteid=yhoof2,Barrons.com
17,2022-01-11 17:45,Eli Lilly (LLY) Gains But Lags Market: What You Should Know,https://finance.yahoo.com/news/eli-lilly-lly-gains-lags-224510927.html,Zacks
18,2022-01-11 16:46,"Here are 4 of Jim Cramer's top stock picks for 2022  if you're a risk-averse investor but still want solid growth, these might be for you",https://finance.yahoo.com/news/4-jim-cramers-top-stock-214600603.html,MoneyWise
19,2022-01-10 15:07,COVID SCIENCE-Experimental Lilly drug neutralizes Omicron in lab; slightly higher risk of diabetes seen in kids after COVID,https://finance.yahoo.com/news/covid-science-experimental-lilly-drug-200722684.html,Reuters
20,2022-01-10 10:21,"The Zacks Analyst Blog Highlights: Pfizer, AbbVie, Eli Lilly and J&J",https://finance.yahoo.com/news/zacks-analyst-blog-highlights-pfizer-152103831.html,Zacks
21,2022-01-10 08:34,"Lots of Deals, but No Blockbuster M&A, to Start Years Biggest Healthcare Conference",https://www.barrons.com/articles/jpmorgan-healthcare-conference-mergers-51641821531?siteid=yhoof2,Barrons.com
22,2022-01-10 06:00,ALX Oncology Provides Corporate Update and Highlights Key Milestones in 2022,https://finance.yahoo.com/news/alx-oncology-provides-corporate-highlights-110000720.html,GlobeNewswire
23,2022-01-09 06:24,3 Big FDA Approvals to Watch For in Q1 2022,https://www.fool.com/investing/2022/01/09/3-big-fda-approvals-to-watch-in-q1-2022/?source=eptyholnk0000202&utm_source=yahoo-host&utm_medium=feed&utm_campaign=article,Motley Fool
24,2022-01-07 11:40,Lilly (LLY) Inks Deal for Multiple Neurologic Indications,https://finance.yahoo.com/news/lilly-lly-inks-deal-multiple-164004989.html,Zacks
25,2022-01-07 11:17,"Pharma Stock Roundup: FDA Nod to PFE Booster for Age 12-15, Breakthrough Tag to ABBV Drug",https://finance.yahoo.com/news/pharma-stock-roundup-fda-nod-161704850.html,Zacks
26,2022-01-06 14:00,Lilly to Participate in the J.P. Morgan Healthcare Conference,https://finance.yahoo.com/news/lilly-participate-j-p-morgan-190000608.html,PR Newswire
27,2022-01-06 07:56,7 Pharmaceutical Stocks That Could Make You Rich,https://finance.yahoo.com/news/7-pharmaceutical-stocks-could-rich-125630507.html,InvestorPlace
28,2022-01-06 06:45,Lilly and Entos Pharmaceuticals Enter into Research and Collaboration Agreement to Support the Development of Innovative Therapies in Multiple Neurologic Indications,https://finance.yahoo.com/news/lilly-entos-pharmaceuticals-enter-research-114500980.html,PR Newswire
29,2022-01-05 15:40,Jim Cramer: 2022 is the year to invest in companies that actually make money  like these 3 stocks,https://finance.yahoo.com/news/jim-cramer-2022-invest-companies-204000651.html,MoneyWise
30,2022-01-04 10:28,Eli Lilly (NYSE:LLY) Is Increasing Its Dividend To US$0.98,https://finance.yahoo.com/news/eli-lilly-nyse-lly-increasing-152833975.html,Simply Wall St.
31,2022-01-03 21:38,"Cacti Asset Management Llc Buys Eli Lilly and Co, Organon, General Electric Co, Sells Gates ...",https://finance.yahoo.com/news/cacti-asset-management-llc-buys-023805204.html,GuruFocus.com
32,2022-01-03 17:45,Eli Lilly (LLY) Stock Sinks As Market Gains: What You Should Know,https://finance.yahoo.com/news/eli-lilly-lly-stock-sinks-224510834.html,Zacks
33,2022-01-03 15:43,Top Healthcare Stocks for January 2022,https://www.investopedia.com/investing/top-healthcare-stocks/?utm_campaign=quote-yahoo&utm_source=yahoo&utm_medium=referral,Investopedia
34,2022-01-02 05:55,22 Top Dividend Stocks to Buy and Hold in 2022,https://www.fool.com/investing/2022/01/02/22-top-dividend-stocks-to-buy-and-hold-in-2022/?source=eptyholnk0000202&utm_source=yahoo-host&utm_medium=feed&utm_campaign=article,Motley Fool
35,2021-12-31 17:50,Eli Lilly (LLY) Dips More Than Broader Markets: What You Should Know,https://finance.yahoo.com/news/eli-lilly-lly-dips-more-225010688.html,Zacks
36,2021-12-30 13:18,Biogen (BIIB) Surges Amid Rumors of Acquisition by Samsung,https://finance.yahoo.com/news/biogen-biib-surges-amid-rumors-181806176.html,Zacks
37,2021-12-30 09:00,Bank of America predicts an S&P 500 slump in 2022  but it still believes in these 3 sectors,https://finance.yahoo.com/news/bank-america-predicts-p-500-140000118.html,MoneyWise
38,2021-12-28 18:00,Eli Lilly (LLY) Dips More Than Broader Markets: What You Should Know,https://finance.yahoo.com/news/eli-lilly-lly-dips-more-230011500.html,Zacks
39,2021-12-26 05:55,3 Dividend Stocks That Soared More Than 50% in 2021 and Are Still Great Buys,https://www.fool.com/investing/2021/12/26/3-dividend-stocks-that-soared-more-than-50-in-2021/?source=eptyholnk0000202&utm_source=yahoo-host&utm_medium=feed&utm_campaign=article,Motley Fool
40,2021-12-25 13:38,"Pioneer Series Trust Xi Buys Progressive Corp, The Walt Disney Co, Autodesk Inc, Sells Meta ...",https://finance.yahoo.com/news/pioneer-series-trust-xi-buys-183802884.html,GuruFocus.com
41,2021-12-24 12:38,Merck's (MRK) COVID Pill Gets FDA Nod for Emergency Use,https://finance.yahoo.com/news/mercks-mrk-covid-pill-gets-173805213.html,Zacks
42,2021-12-24 12:22,Biogen's (BIIB) Alzheimer's Disease Drug Gets FDA Fast Track Tag,https://finance.yahoo.com/news/biogens-biib-alzheimers-disease-drug-172205110.html,Zacks
43,2021-12-24 08:00,U.S. Halts Distribution of Regeneron and Eli Lilly Covid Antibody Drugs Over Omicron Efficacy Concerns,https://www.barrons.com/articles/u-s-halts-distribution-of-regeneron-and-eli-lilly-covid-antibody-drugs-over-omicron-efficacy-concerns-51640350799?siteid=yhoof2,Barrons.com
44,2021-12-24 07:38,"Putnam VT Large Cap Value Fund Buys McKesson Corp, AstraZeneca PLC, Stanley Black & Decker ...",https://finance.yahoo.com/news/putnam-vt-large-cap-value-123801367.html,GuruFocus.com
45,2021-12-24 06:38,"Putnam Variable Trust Buys Intuit Inc, Bank of America Corp, Advanced Micro Devices Inc, Sells ...",https://finance.yahoo.com/news/putnam-variable-trust-buys-intuit-113802345.html,GuruFocus.com
46,2021-12-23 13:44,"U.S. pauses allocation of Regeneron, Lilly COVID-19 antibodies",https://finance.yahoo.com/news/u-pauses-allocation-regeneron-lilly-184413608.html,Reuters
47,2021-12-23 11:15,3 Unstoppable Stocks to Buy for 2022,https://www.fool.com/investing/2021/12/23/3-unstoppable-stocks-to-buy-for-2022/?source=eptyholnk0000202&utm_source=yahoo-host&utm_medium=feed&utm_campaign=article,Motley Fool
48,2021-12-23 10:30,Pfizer (PFE) Gets FDA's Emergency Use Nod for COVID Pill,https://finance.yahoo.com/news/pfizer-pfe-gets-fdas-emergency-153003708.html,Zacks
49,2021-12-23 08:38,"MainStay VP Wellington U.S. Equity Portfolio Buys VF Corp, Seagen Inc, Sells Under Armour Inc, ...",https://finance.yahoo.com/news/mainstay-vp-wellington-u-equity-133802230.html,GuruFocus.com
50,2021-12-23 06:04,"The Zacks Analyst Blog Highlights: Microsoft, Broadcom, Eli Lilly, Intuitive Surgical and MetLife",https://finance.yahoo.com/news/zacks-analyst-blog-highlights-microsoft-110411685.html,Zacks
51,2021-12-22 12:17,"Top Research Reports for Microsoft, Broadcom & Eli Lilly",https://finance.yahoo.com/news/top-research-reports-microsoft-broadcom-171705239.html,Zacks
52,2021-12-22 11:30,COVID SCIENCE-Common health issues raise risk for severe COVID-19; sudden food aversion in toddlers may be due to COVID,https://finance.yahoo.com/news/covid-science-common-health-issues-163000459.html,Reuters
53,2021-12-22 10:27,Lilly's (LLY) Eczema Study on Lebrikizumab Combo Meets Goal,https://finance.yahoo.com/news/lillys-lly-eczema-study-lebrikizumab-152703905.html,Zacks
54,2021-12-22 08:56,Will Lilly and Pfizer be Top Pharma Stocks Again in 2022?,https://finance.yahoo.com/news/lilly-pfizer-top-pharma-stocks-135601816.html,Zacks
55,2021-12-21 12:16,Biogen (BIIB) to Cut Alzheimer's Drug Aduhelm Price by 50%,https://finance.yahoo.com/news/biogen-biib-cut-alzheimers-drug-171605844.html,Zacks
56,2021-12-21 10:15,Eli Lilly's (NYSE:LLY) Shareholders Will Receive A Bigger Dividend Than Last Year,https://finance.yahoo.com/news/eli-lillys-nyse-lly-shareholders-151507118.html,Simply Wall St.
57,2021-12-21 00:01,Lilly's lebrikizumab demonstrated significant skin improvement and itch relief when combined with topical corticosteroids in people with atopic dermatitis in third Phase 3 study,https://finance.yahoo.com/news/lillys-lebrikizumab-demonstrated-significant-skin-050100713.html,PR Newswire
58,2021-12-20 17:50,Eli Lilly (LLY) Dips More Than Broader Markets: What You Should Know,https://finance.yahoo.com/news/eli-lilly-lly-dips-more-225010981.html,Zacks
59,2021-12-20 16:17,Biogen Slashes Alzheimer's Treatment Price Amid Launch 'Gone Awry',https://www.investors.com/news/technology/biogen-stock-aduhelm-price-tag-slashed-amid-launch-gone-arwy/?src=A00220,Investor's Business Daily
60,2021-12-20 10:15,"Market check: Stocks open lower, yield curve steepens, oil under pressure",https://finance.yahoo.com/video/market-check-stocks-open-lower-151559239.html,Yahoo Finance Video
61,2021-12-20 02:39,Novo Nordisk Tumbles as Contractor Issues Hit U.S. Obesity Drug Supply,https://finance.yahoo.com/news/novo-nordisk-tumbles-contractor-issues-073918615.html,Investing.com
62,2021-12-19 11:30,3 Biotech Stocks That Soared in 2021 and Could Go Even Higher in 2022,https://www.fool.com/investing/2021/12/19/3-biotech-stocks-that-soared-in-2021-and-could-go/?source=eptyholnk0000202&utm_source=yahoo-host&utm_medium=feed&utm_campaign=article,Motley Fool
63,2021-12-19 08:38,"Putnam Asset Allocation Funds Buys Anthem Inc, Moderna Inc, Target Corp, Sells Procter & ...",https://finance.yahoo.com/news/putnam-asset-allocation-funds-buys-133802289.html,GuruFocus.com
64,2021-12-19 06:22,Will Eli Lilly Be a Top Pharma Stock Again in 2022?,https://www.fool.com/investing/2021/12/19/will-eli-lilly-be-a-top-pharma-stock-again-in-2022/?source=eptyholnk0000202&utm_source=yahoo-host&utm_medium=feed&utm_campaign=article,Motley Fool
65,2021-12-17 15:29,The Funded: A court fight over Johnson & Johnson's $3.4B Auris Health acquisition is going forward,https://www.bizjournals.com/sanjose/news/2021/12/17/court-fight-over-jnj-auris-health-buy-goes-forward.html?ana=yahoo,American City Business Journals
66,2021-12-17 11:06,"Stock Market Rallies After Fed Meeting, But Not For Long; Adobe, Rivian, Eli Lilly In Focus: Weekly Review",https://www.investors.com/news/stock-market-rallies-after-fed-meeting-not-for-long-adobe-rivian-eli-lilly-in-focus/?src=A00220,Investor's Business Daily
67,2021-12-17 10:09,"Pharma Stock Roundup: PFE Announces Arena Buyout, LLY Ups 2021 View & More",https://finance.yahoo.com/news/pharma-stock-roundup-pfe-announces-150903880.html,Zacks
68,2021-12-17 09:44,Biogen (BIIB) to Begin Aduhelm Confirmatory Study in 2022,https://finance.yahoo.com/news/biogen-biib-begin-aduhelm-confirmatory-144402694.html,Zacks
69,2021-12-17 06:44,"Here's Why Shares of Bristol Myers Squibb, Eli Lilly, and Pfizer Rocketed Higher This Week",https://www.fool.com/investing/2021/12/17/heres-why-shares-of-bristol-myers-squibb-eli-lilly/?source=eptyholnk0000202&utm_source=yahoo-host&utm_medium=feed&utm_campaign=article,Motley Fool
70,2021-12-16 11:32,2 Pharma Names Throwing Off Big Dividend Increases,https://finance.yahoo.com/news/2-pharma-names-throwing-off-163206934.html,GuruFocus.com
71,2021-12-16 10:33,"With Improved Guidance, Eli Lilly and Company (NYSE:LLY) Appears to be Trading at the Right Price",https://finance.yahoo.com/news/improved-guidance-eli-lilly-company-153304116.html,Simply Wall St.
72,2021-12-16 10:00,Eli Lilly (LLY) Just Reclaimed the 50-Day Moving Average,https://finance.yahoo.com/news/eli-lilly-lly-just-reclaimed-150003958.html,Zacks
73,2021-12-16 10:00,Eli Lilly (LLY) Just Reclaimed the 20-Day Moving Average,https://finance.yahoo.com/news/eli-lilly-lly-just-reclaimed-150003706.html,Zacks
74,2021-12-16 09:41,"Company News for Dec 16, 2021",https://finance.yahoo.com/news/company-news-dec-16-2021-144102382.html,Zacks
75,2021-12-16 08:36,"Lilly (LLY) Stock Up on Raised 2021 View, Upbeat 2022 Guidance",https://finance.yahoo.com/news/lilly-lly-stock-raised-2021-133601514.html,Zacks
76,2021-12-16 08:14,"Dow Jones Futures Rise After Market Roars On Fed Move; AMD, Nvidia, Lilly Flash Buy Signals",https://www.investors.com/market-trend/stock-market-today/dow-jones-futures-market-roars-on-fed-move-amd-nvidia-lilly-flash-buy-signals/?src=A00220,Investor's Business Daily
77,2021-12-16 03:38,"Securian Funds Trust Buys VF Corp, Sells Eli Lilly and Co",https://finance.yahoo.com/news/securian-funds-trust-buys-vf-083801158.html,GuruFocus.com
78,2021-12-16 03:17,Lilly (LLY) Stock Jumps 10.4%: Will It Continue to Soar?,https://finance.yahoo.com/news/lilly-lly-stock-jumps-10-081708678.html,Zacks
79,2021-12-15 16:38,Eli Lilly Quietly Invests in Technology to Harness Human-Cell Messaging,https://finance.yahoo.com/news/eli-lilly-quietly-invests-technology-200536737.html,Bloomberg
80,2021-12-15 16:13,Eli Lilly Pops On Boosted 2021 Outlook As Covid Brings In $2.1 Billion,https://www.investors.com/news/technology/eli-lilly-stock-pops-on-boosted-outlook-covid-sales/?src=A00220,Investor's Business Daily
81,2021-12-15 12:46,Why Eli Lilly Stock Is Jumping Today,https://www.fool.com/investing/2021/12/15/why-eli-lilly-stock-is-jumping-today/?source=eptyholnk0000202&utm_source=yahoo-host&utm_medium=feed&utm_campaign=article,Motley Fool
82,2021-12-15 12:23,Eli Lilly Stock Is Jumping Because Its Revenue Forecast Looks Strong,https://www.barrons.com/articles/eli-lilly-stock-price-revenue-guidance-51639572715?siteid=yhoof2,Barrons.com
83,2021-12-15 11:29,"Eli Lilly stock soars on revenue, profit forecast boost",https://finance.yahoo.com/video/eli-lilly-stock-soars-revenue-162915575.html,Yahoo Finance Video
84,2021-12-15 11:10,S&P 500 Rallies on Tech Turnaround After Fed Speeds Up Taper,https://finance.yahoo.com/news/p-500-rallies-tech-turnaround-161042518.html,Investing.com
85,2021-12-15 10:44,Why Eli Lilly Stock Is Up By 8% Today,https://finance.yahoo.com/news/why-eli-lilly-stock-8-154423520.html,FX Empire
86,2021-12-15 10:01,Lilly (LLY) Phase III Study in Ulcerative Colitis Meets Goal,https://finance.yahoo.com/news/lilly-lly-phase-iii-study-150103513.html,Zacks
87,2021-12-15 09:59,"S&P 500 Cut Losses as Fed Speeds Up Taper, Signals Three Hikes in 2022",https://finance.yahoo.com/news/p-500-cut-losses-fed-145915239.html,Investing.com
88,2021-12-15 09:50,"Stocks: Eli Lilly rises, Nucor declines, Dominoes slides on analyst downgrade",https://finance.yahoo.com/video/stocks-eli-lilly-rises-nucor-145022032.html,Yahoo Finance Video
89,2021-12-15 09:19,"Lilly Looks Healthy, but This Unsung Semiconductor Stock Is Wednesday's Big Winner",https://www.fool.com/investing/2021/12/15/lilly-looks-healthy-but-this-unsung-semiconductor/?source=eptyholnk0000202&utm_source=yahoo-host&utm_medium=feed&utm_campaign=article,Motley Fool
90,2021-12-15 08:51,Eli Lilly Boosts 2021 Guidance and Issues a Strong 2022 Forecast. The Stock Jumps.,https://www.barrons.com/articles/eli-lilly-lly-stock-revenue-guidance-51639572715?siteid=yhoof2,Barrons.com
91,2021-12-15 08:27,Eli Lilly Shares Jump Over 5% After It Raises Profit Estimates; Target Price $311 in Best Case,https://finance.yahoo.com/news/eli-lilly-shares-jump-over-132706919.html,FX Empire
92,2021-12-15 07:57,5 Top Stock Gainers for Wednesday Before Fed's Key Policy Update,https://www.thestreet.com/investing/5-top-stock-gainers-for-wednesday-before-feds-key-policy-update?puc=yahoo&cm_ven=YAHOO,TheStreet.com
93,2021-12-15 07:20,UPDATE 1-Eli Lilly raises 2021 profit forecast,https://finance.yahoo.com/news/1-eli-lilly-raises-2021-122005296.html,Reuters
94,2021-12-15 07:04,Lilly sees 2022 profit above estimates on boost from potential new drugs,https://finance.yahoo.com/news/eli-lilly-raises-2021-profit-120422305.html,Reuters
95,2021-12-15 07:02,Eli Lilly raises 2021 profit forecast,https://finance.yahoo.com/news/eli-lilly-raises-2021-profit-120202420.html,Reuters
96,2021-12-15 07:00,Eli Lilly shares jump 5% premarket after company raises guidance in update on pipeline,https://www.marketwatch.com/story/eli-lilly-shares-jump-5-premarket-after-company-raises-guidance-in-update-on-pipeline-2021-12-15?siteid=yhoof2,MarketWatch
97,2021-12-15 06:45,Lilly Highlights Innovation-based Growth Strategy and Pipeline Developments; Announces 2022 Financial Guidance at Investment Community Meeting,https://finance.yahoo.com/news/lilly-highlights-innovation-based-growth-114500883.html,PR Newswire
98,2021-12-15 03:43,"Eli Lilly Jumps on Lifting 2021 Guidance, Being Positive Next Year",https://finance.yahoo.com/news/eli-lilly-jumps-lifting-2021-084323866.html,Investing.com
99,2021-12-15 03:36,Premarket Movers Wednesday Ahead of Fed Meeting,https://www.thestreet.com/investing/premarket-movers-wednesday-ahead-of-fed-meeting?puc=yahoo&cm_ven=YAHOO,TheStreet.com
