,Date,News Headline,Article Link,Source
0,2021-12-03 07:00,Enochian BioSciences Announces Scientific Presentation at World Vaccine Conference on Promising Human and Laboratory Data to Potentially Treat Solid Tumors,https://finance.yahoo.com/news/enochian-biosciences-announces-scientific-presentation-120000142.html,GlobeNewswire
1,2021-10-18 07:00,Enochian BioSciences Announces the Successful Completion of an FDA Pre-IND for a Potential Cure for HIV: The Second Pre-IND in 1 month,https://finance.yahoo.com/news/enochian-biosciences-announces-successful-completion-110000602.html,GlobeNewswire
2,2021-10-15 18:00,Scientific Advisory Board Member Resigns Due to Conflict with Responsibilities with Important Public Sector Entity,https://finance.yahoo.com/news/scientific-advisory-board-member-resigns-220000771.html,GlobeNewswire
3,2021-10-12 18:00,"Fireside Chat with Enochian BioSciences CEO, Dr. Mark Dybul at H.C. Wainwright 2nd Annual Hepatitis B Virus (HBV) Conference",https://finance.yahoo.com/news/fireside-chat-enochian-biosciences-ceo-220000956.html,GlobeNewswire
4,2021-09-27 07:00,Enochian BioSciences Announces Its Successful Completion of FDA Pre-IND for a Potential Cure for Hepatitis B Virus Infection,https://finance.yahoo.com/news/enochian-biosciences-announces-successful-completion-110000139.html,GlobeNewswire
5,2021-09-26 10:42,Is Enochian Biosciences (NASDAQ:ENOB) Using Debt In A Risky Way?,https://finance.yahoo.com/news/enochian-biosciences-nasdaq-enob-using-144204766.html,Simply Wall St.
6,2021-09-13 07:00,Enochian BioSciences to Present to Investors at the H.C. Wainwright 23rd Annual Investment Conference,https://finance.yahoo.com/news/enochian-biosciences-present-investors-h-110000688.html,GlobeNewswire
7,2021-08-30 07:00,Distinguished Scientific and Public Health Leaders to Join Enochian BioSciences Scientific Advisory Board for Potential Inhaled Treatment and Prevention of All COVID-19 and Influenza Variants,https://finance.yahoo.com/news/distinguished-scientific-public-health-leaders-110000092.html,GlobeNewswire
8,2021-08-23 10:18,Distinguished Scientific and Clinical Leader to Join Enochian BioSciences Hepatitis B Cure Scientific Advisory Board,https://finance.yahoo.com/news/distinguished-scientific-clinical-leader-join-141800735.html,GlobeNewswire
9,2021-07-20 07:00,Enochian BioSciences Names The Hon. Dr. Mark Dybul as Chief Executive Officer,https://finance.yahoo.com/news/enochian-biosciences-names-hon-dr-110000935.html,GlobeNewswire
10,2021-07-12 08:37,Enochian Stock Is Trading Higher On FDA Acceptance of Pre-IND Request For Hepatitis B Program,https://finance.yahoo.com/news/enochian-stock-trading-higher-fda-123748743.html,Benzinga
11,2021-07-12 07:00,Enochian BioSciences Announces FDA Acceptance of Pre-IND Request  For Potential Cure for Hepatitis B Virus Infection,https://finance.yahoo.com/news/enochian-biosciences-announces-fda-acceptance-110000334.html,GlobeNewswire
12,2021-07-12 05:37,Enochian Gains As FDA Agrees To Give View On Potential Cure For Hepatitis B,https://finance.yahoo.com/news/enochian-gains-fda-agrees-view-093719269.html,Investing.com
13,2021-06-30 07:00,Enochian BioSciences Announces Scientific Presentation of Elimination of HBV in Mice with No Evident Toxicity,https://finance.yahoo.com/news/enochian-biosciences-announces-scientific-presentation-110000947.html,GlobeNewswire
14,2021-06-21 17:31,Why Enochian BioSciences Was a Winner on Monday,https://www.fool.com/investing/2021/06/21/why-enochian-biosciences-was-a-winner-on-monday/?source=eptyholnk0000202&utm_source=yahoo-host&utm_medium=feed&utm_campaign=article,Motley Fool
15,2021-06-21 08:03,"Enochian BioSciences Stock Is Trading Higher After In-Licensing COVID-19, Influenza Inhaled Treatment Technology",https://finance.yahoo.com/news/enochian-biosciences-stock-trading-higher-120301818.html,Benzinga
16,2021-06-21 07:00,Enochian BioSciences Announces Acquisition of Exclusive License for Potential Pan-Coronavirus and Pan-Influenza Inhaled Treatment and Prevention Technology,https://finance.yahoo.com/news/enochian-biosciences-announces-acquisition-exclusive-110000233.html,GlobeNewswire
17,2021-06-15 09:05,Pioneering Research Institute In Los Angeles Moves One Step Closer To Finding A Cure For HIV,https://finance.yahoo.com/news/pioneering-research-institute-los-angeles-130500128.html,PR Newswire
18,2021-06-14 15:15,Here's Why Enochian BioSciences Stock Skyrocketed Today,https://www.fool.com/investing/2021/06/14/heres-why-enochian-biosciences-stock-skyrocketed-t/?source=eptyholnk0000202&utm_source=yahoo-host&utm_medium=feed&utm_campaign=article,Motley Fool
19,2021-06-14 14:53,Enochian BioSciences Announces $29 Million Registered Direct Offering Priced At-the-Market Under Nasdaq Rules,https://finance.yahoo.com/news/enochian-biosciences-announces-29-million-185300718.html,GlobeNewswire
20,2021-06-14 08:42,Mondays Pre-Market: Heres What You Need to Know Before the Market Opens,https://finance.yahoo.com/news/monday-pre-market-know-market-124222026.html,TipRanks
21,2021-06-14 07:00,Enochian BioSciences Announces FDA Acceptance of Pre-IND Request For Potential HIV Cure,https://finance.yahoo.com/news/enochian-biosciences-announces-fda-acceptance-110000386.html,GlobeNewswire
22,2021-05-12 16:29,Enochian BioSciences announces Scientific Presentation of a Person with HIV Exhibiting Controlled Blood Levels of Virus for 255 Days Following Treatment with a Novel Cellular Therapy,https://finance.yahoo.com/news/enochian-biosciences-announces-scientific-presentation-202900456.html,GlobeNewswire
23,2021-05-12 08:05,"A Promising Approach To HIV Cell Therapy, With Exciting Preliminary Results, Was Presented Recently At The Leading Conference On Gene And Cell Therapy",https://finance.yahoo.com/news/promising-approach-hiv-cell-therapy-120500700.html,PR Newswire
24,2021-05-12 08:00,Enochian BioSciences announces Scientific Presentation of a Person with HIV Exhibiting Controlled Blood Levels of Virus for 255 Days Following Treatment with a Novel Cellular Therapy,https://finance.yahoo.com/news/enochian-biosciences-announces-scientific-presentation-120000697.html,GlobeNewswire
25,2021-04-30 03:42,"Is Enochian Biosciences, Inc.'s (NASDAQ:ENOB) Shareholder Ownership Skewed Towards Insiders?",https://finance.yahoo.com/news/enochian-biosciences-inc-nasdaq-enob-074215061.html,Simply Wall St.
26,2021-03-24 18:00,Seraph Research Institute and Enochian BioSciences Publish a Case Report of Complete Remission of Recurrent Glioblastoma with Innovative Therapy,https://finance.yahoo.com/news/seraph-research-institute-enochian-biosciences-220000142.html,GlobeNewswire
27,2021-02-22 17:15,Enochian BioSciences to Present to Investors at the H.C. Wainwright Global Life Sciences Conference,https://finance.yahoo.com/news/enochian-biosciences-present-investors-h-221500129.html,GlobeNewswire
28,2020-11-01 09:35,"What You Need To Know About Enochian Biosciences, Inc.'s (NASDAQ:ENOB) Investor Composition",https://finance.yahoo.com/news/know-enochian-biosciences-inc-nasdaq-143501954.html,Simply Wall St.
29,2020-09-10 00:50,Enochian BioSciences to Present to Investors at 22nd Annual H.C. Wainwright Global Investment Conference,https://finance.yahoo.com/news/enochian-biosciences-present-investors-22nd-045000597.html,GlobeNewswire
30,2020-07-27 08:00,Distinguished Scientific Leaders to Join Enochian BioSciences Hepatitis B Scientific Advisory Board,https://finance.yahoo.com/news/distinguished-scientific-leaders-join-enochian-120000122.html,GlobeNewswire
31,2020-06-08 07:30,Enochian BioSciences Announces Its Successful Completion of FDA INTERACT Meeting for a Potential Cure for HIV,https://finance.yahoo.com/news/enochian-biosciences-announces-successful-completion-113010514.html,GlobeNewswire
32,2020-05-14 09:50,"Company News for May 14, 2020",https://finance.yahoo.com/news/company-news-may-14-2020-135001441.html,Zacks
33,2020-05-13 08:00,Enochian Biosciences Announces Three Scientific Presentations on Potential HIV and HBV Cures,https://finance.yahoo.com/news/enochian-biosciences-announces-three-scientific-120010637.html,GlobeNewswire
34,2020-04-23 07:00,Is Enochian Biosciences (NASDAQ:ENOB) In A Good Position To Deliver On Growth Plans?,https://finance.yahoo.com/news/enochian-biosciences-nasdaq-enob-good-110017401.html,Simply Wall St.
35,2020-04-09 10:00,Enochian Biosciences Announces Scientific Presentations at the American Society of Cell and Gene Therapy (ASCGT) Annual Meeting,https://finance.yahoo.com/news/enochian-biosciences-announces-scientific-presentations-140010024.html,GlobeNewswire
36,2020-02-24 07:30,Enochian Biosciences Announces FDA INTERACT Meeting for a Potential Cure for HIV,https://finance.yahoo.com/news/enochian-biosciences-announces-fda-interact-123010901.html,GlobeNewswire
37,2020-02-03 07:30,Enochian Biosciences Acquires an Exclusive License for a Novel Hepatitis B Virus Potential Treatment or Cure,https://finance.yahoo.com/news/enochian-biosciences-acquires-exclusive-license-123010791.html,GlobeNewswire
38,2020-01-06 07:30,"Enochian Biosciences, a company focused on gene-modified cellular therapy in infectious disease and cancer, announces the appointment of two board members:",https://finance.yahoo.com/news/enochian-biosciences-company-focused-gene-123010879.html,GlobeNewswire
39,2019-12-10 07:00,Enochian Biosciences Announces Scientific Presentation of a Novel Approach to Potentially Cure Hepatitis B Virus,https://finance.yahoo.com/news/enochian-biosciences-announces-scientific-presentation-120010967.html,GlobeNewswire
40,2019-11-25 07:00,Enochian Biosciences Expands its Infectious Disease Pipeline by Entering into an Agreement in Principle to Acquire an Exclusive License for a Novel Hepatitis B Virus Treatment,https://finance.yahoo.com/news/enochian-biosciences-expands-infectious-disease-120010339.html,GlobeNewswire
41,2019-11-21 10:30,"Enochain Investor Alert: Faruqi & Faruqi, LLP Encourages Investors Who Suffered Losses Exceeding $50,000 Investing In Enochain Biosciences Inc. To Contact The Firm",https://finance.yahoo.com/news/enochain-investor-alert-faruqi-faruqi-153000726.html,Newsfile
42,2019-10-31 16:17,Penny Stocks to Buy Using Technical Analysis for November 2019,https://www.investopedia.com/updates/penny-stocks-buy-technical-analysis/?utm_campaign=quote-yahoo&utm_source=yahoo&utm_medium=referral,Investopedia
43,2019-10-26 10:18,We're Not Very Worried About Enochian Biosciences's (NASDAQ:ENOB) Cash Burn Rate,https://finance.yahoo.com/news/were-not-very-worried-enochian-141858340.html,Simply Wall St.
44,2019-06-03 07:00,Enochian BioSciences Inventor Named to Two Important Scientific Committees,https://finance.yahoo.com/news/enochian-biosciences-inventor-named-two-110000447.html,GlobeNewswire
45,2019-04-29 09:19,Enochian Biosciences (NASDAQ:ENOB) Shareholders Have Enjoyed A 37% Share Price Gain,https://finance.yahoo.com/news/enochian-biosciences-nasdaq-enob-shareholders-131946770.html,Simply Wall St.
46,2019-03-07 12:45,Successful Treatment of London Patient Underscores Clinical Potential of Enochian Biosciences Gene Modified Cellular Therapy for HIV,https://finance.yahoo.com/news/successful-treatment-london-patient-underscores-174500609.html,GlobeNewswire
47,2019-02-01 14:31,4 Healthcare Stocks Looking To Start February Off Strong,https://finance.yahoo.com/news/4-healthcare-stocks-looking-start-193100036.html,ACCESSWIRE
48,2019-01-16 16:00,OTC Markets Group Announces Quarterly Index Performance and Rebalancing,https://finance.yahoo.com/news/otc-markets-group-announces-quarterly-210000965.html,PR Newswire
49,2019-01-07 08:30,Enochian Biosciences Announces Appointment of Dr. Mark Dybul as Executive Vice-Chair,https://finance.yahoo.com/news/enochian-biosciences-announces-appointment-dr-133000041.html,GlobeNewswire
50,2019-01-04 08:00,How Much Of Enochian Biosciences Inc. (NASDAQ:ENOB) Do Insiders Own?,https://finance.yahoo.com/news/much-enochian-biosciences-inc-nasdaq-130012644.html,Simply Wall St.
51,2018-12-05 08:30,Enochian Biosciences Announces Uplisting to Nasdaq Under Symbol ENOB,https://finance.yahoo.com/news/enochian-biosciences-announces-uplisting-nasdaq-133000100.html,GlobeNewswire
52,2018-12-03 08:30,Enochian Biosciences to Present at Biotech Showcase 2019,https://finance.yahoo.com/news/enochian-biosciences-present-biotech-showcase-133000863.html,GlobeNewswire
