,Date,News Headline,Article Link,Source
0,2022-01-13 12:47,Reasons to Hold on to Interpublic Group (IPG) Stock For Now,https://finance.yahoo.com/news/reasons-hold-interpublic-group-ipg-174705372.html,Zacks
1,2022-01-13 11:47,Best Growth Stocks to Buy for January 13th,https://finance.yahoo.com/news/best-growth-stocks-buy-january-164704352.html,Zacks
2,2022-01-13 11:41,Reasons to Retain Rollins (ROL) Stock in Your Portfolio,https://finance.yahoo.com/news/reasons-retain-rollins-rol-stock-164104748.html,Zacks
3,2022-01-11 12:33,Reasons to Add Republic Services (RSG) Stock to Your Portfolio,https://finance.yahoo.com/news/reasons-add-republic-services-rsg-173305440.html,Zacks
4,2022-01-11 09:40,Are These Business Services Stocks a Great Value Stocks Right Now?,https://finance.yahoo.com/news/business-services-stocks-great-value-144002529.html,Zacks
5,2022-01-10 17:50,Avis Budget Group (CAR) Gains As Market Dips: What You Should Know,https://finance.yahoo.com/news/avis-budget-group-car-gains-225010314.html,Zacks
6,2022-01-10 11:30,Reasons to Hold on to ICF International (ICFI) Stock For Now,https://finance.yahoo.com/news/reasons-hold-icf-international-icfi-163004507.html,Zacks
7,2022-01-10 08:12,Best Growth Stocks to Buy for January 10th,https://finance.yahoo.com/news/best-growth-stocks-buy-january-131201832.html,Zacks
8,2022-01-07 13:26,Top Small Cap Stocks for January 2022,https://www.investopedia.com/investing/top-small-cap-stocks/?utm_campaign=quote-yahoo&utm_source=yahoo&utm_medium=referral,Investopedia
9,2022-01-06 14:25,Deutsche Bank Upgrades This Mobility Solutions Provider,https://finance.yahoo.com/news/deutsche-bank-upgrades-mobility-solutions-192557873.html,Benzinga
10,2022-01-06 13:44,Why Avis Budget Stock Stomped on the Gas Today,https://www.fool.com/investing/2022/01/06/why-avis-budget-stock-stomped-on-the-gas-today/?source=eptyholnk0000202&utm_source=yahoo-host&utm_medium=feed&utm_campaign=article,Motley Fool
11,2022-01-06 13:02,Market check: Dow turns positive in intraday trading,https://finance.yahoo.com/video/market-check-dow-turns-positive-180234620.html,Yahoo Finance Video
12,2022-01-05 16:03,The Top 4 Reddit Stocks of 2021,https://finance.yahoo.com/news/top-4-reddit-stocks-2021-210331989.html,InvestorPlace
13,2022-01-05 12:19,Reasons Add LiveRamp Holdings (RAMP) Stock to Your Portfolio,https://finance.yahoo.com/news/reasons-add-liveramp-holdings-ramp-171905711.html,Zacks
14,2022-01-05 12:17,Genpact (G) Buys Up Hoodoo Digital to Boost Experience Business,https://finance.yahoo.com/news/genpact-g-buys-hoodoo-digital-171705364.html,Zacks
15,2022-01-05 09:01,Here's Why Investors Should Buy Accenture (ACN) Stock Now,https://finance.yahoo.com/news/heres-why-investors-buy-accenture-140102197.html,Zacks
16,2022-01-04 17:50,Avis Budget Group (CAR) Gains As Market Dips: What You Should Know,https://finance.yahoo.com/news/avis-budget-group-car-gains-225010426.html,Zacks
17,2022-01-04 10:56,Reasons to Retain Trane Technologies (TT) Stock For Now,https://finance.yahoo.com/news/reasons-retain-trane-technologies-tt-155603627.html,Zacks
18,2022-01-04 09:24,Here's Why You Should Retain Broadridge (BR) in Your Portfolio,https://finance.yahoo.com/news/heres-why-retain-broadridge-br-142402396.html,Zacks
19,2022-01-04 09:16,Paychex (PAYX) Gains on Cash Strength & Investor-Friendly Steps,https://finance.yahoo.com/news/paychex-payx-gains-cash-strength-141602653.html,Zacks
20,2022-01-03 11:42,Reasons to Add Hudson Global (HSON) Stock to Your Portfolio,https://finance.yahoo.com/news/reasons-add-hudson-global-hson-164204737.html,Zacks
21,2022-01-03 10:40,Here's Why You Should Add Booz Allen (BAH) in Your Portfolio,https://finance.yahoo.com/news/heres-why-add-booz-allen-154003768.html,Zacks
22,2022-01-02 07:41,"Calculating The Intrinsic Value Of Avis Budget Group, Inc. (NASDAQ:CAR)",https://finance.yahoo.com/news/calculating-intrinsic-value-avis-budget-124100250.html,Simply Wall St.
23,2021-12-31 10:37,5 Reasons to Add Avis Budget Group (CAR) Stock in Your Portfolio,https://finance.yahoo.com/news/5-reasons-add-avis-budget-153703445.html,Zacks
24,2021-12-31 10:15,Here's Why You Should Retain WEX Stock in Your Portfolio,https://finance.yahoo.com/news/heres-why-retain-wex-stock-151503871.html,Zacks
25,2021-12-30 08:57,Here's Why Investors Should Retain Maximus (MMS) Stock Now,https://finance.yahoo.com/news/heres-why-investors-retain-maximus-135701923.html,Zacks
26,2021-12-29 18:15,Avis Budget Group (CAR) Stock Sinks As Market Gains: What You Should Know,https://finance.yahoo.com/news/avis-budget-group-car-stock-231511379.html,Zacks
27,2021-12-29 11:35,Buy These 3 Stocks With Momentum Anomaly for Higher Returns,https://finance.yahoo.com/news/buy-3-stocks-momentum-anomaly-163504975.html,Zacks
28,2021-12-29 10:26,Reasons to Hold DocuSign (DOCU) Stock in Your Portfolio,https://finance.yahoo.com/news/reasons-hold-docusign-docu-stock-152603751.html,Zacks
29,2021-12-29 09:40,Is Avis Budget Group (CAR) Stock Outpacing Its Business Services Peers This Year?,https://finance.yahoo.com/news/avis-budget-group-car-stock-144002410.html,Zacks
30,2021-12-29 07:42,Best Growth Stocks to Buy for December 29th,https://finance.yahoo.com/news/best-growth-stocks-buy-december-124212410.html,Zacks
31,2021-12-28 09:39,4 Business Services Stocks That More Than Doubled in 2021,https://finance.yahoo.com/news/4-business-services-stocks-more-143902799.html,Zacks
32,2021-12-27 10:26,Here's Why You Should Hold on to Western Union (WU) Now,https://finance.yahoo.com/news/heres-why-hold-western-union-152603923.html,Zacks
33,2021-12-27 09:39,"Stocks: GoDaddy jumps, Avis pops, Moderna declines ahead of market open",https://finance.yahoo.com/video/stocks-godaddy-jumps-avis-pops-143959281.html,Yahoo Finance Video
34,2021-12-24 10:58,Reasons to Hold on to ABM Industries (ABM) Stock For Now,https://finance.yahoo.com/news/reasons-hold-abm-industries-abm-155803317.html,Zacks
35,2021-12-24 10:03,Accenture (ACN) and BBVA Sign 10-Year Collaborative Agreement,https://finance.yahoo.com/news/accenture-acn-bbva-sign-10-150303913.html,Zacks
36,2021-12-24 09:41,Reasons to Retain FLEETCOR Technologies (FLT) in Your Portfolio,https://finance.yahoo.com/news/reasons-retain-fleetcor-technologies-flt-144102300.html,Zacks
37,2021-12-24 09:07,Why Should Investors Bet on CRA International (CRAI) Stock?,https://finance.yahoo.com/news/why-investors-bet-cra-international-140702722.html,Zacks
38,2021-12-24 08:10,5 Momentum Stocks Bargain Hunters Would Love Chasing,https://finance.yahoo.com/news/5-momentum-stocks-bargain-hunters-131001577.html,Zacks
39,2021-12-24 05:33,"Looking to Rent a Car? Expect Higher Prices, Long Waits and Slim Pickings",https://www.wsj.com/articles/looking-to-rent-a-car-expect-higher-prices-long-waits-and-slim-pickings-11640341983?mod=itp_wsj,The Wall Street Journal
40,2021-12-23 11:48,"Holiday travel: 110 million traveling this year amid Omicron, inflation",https://finance.yahoo.com/video/holiday-travel-110-million-traveling-164848029.html,Yahoo Finance Video
41,2021-12-23 09:40,Are These Business Services Stocks a Great Value Stocks Right Now?,https://finance.yahoo.com/news/business-services-stocks-great-value-144002797.html,Zacks
42,2021-12-21 10:04,Here's Why You Should Retain IQVIA Holdings (IQV) Stock For Now,https://finance.yahoo.com/news/heres-why-retain-iqvia-holdings-150403819.html,Zacks
43,2021-12-21 08:44,Here's Why You Should Retain Envestnet (ENV) in Your Portfolio,https://finance.yahoo.com/news/heres-why-retain-envestnet-env-134401121.html,Zacks
44,2021-12-20 08:49,FactSet (FDS) to Report Q1 Earnings: What's in the Cards?,https://finance.yahoo.com/news/factset-fds-report-q1-earnings-134901149.html,Zacks
45,2021-12-17 13:16,Here's Why You Should Retain Equifax (EFX) in Your Portfolio,https://finance.yahoo.com/news/heres-why-retain-equifax-efx-181606672.html,Zacks
46,2021-12-17 11:02,Here's Why You Should Retain Paychex (PAYX) Stock For Now,https://finance.yahoo.com/news/heres-why-retain-paychex-payx-160204743.html,Zacks
47,2021-12-17 10:46,Here's Why Investors Should Hold on to Verisk (VRSK) Stock,https://finance.yahoo.com/news/heres-why-investors-hold-verisk-154603178.html,Zacks
48,2021-12-17 10:14,5 Lucrative PEG Stocks for GARP Investors,https://finance.yahoo.com/news/5-lucrative-peg-stocks-garp-151403617.html,Zacks
49,2021-12-17 09:50,ABM Industries (ABM) Gains From Acquisitions Amid High Costs,https://finance.yahoo.com/news/abm-industries-abm-gains-acquisitions-145002316.html,Zacks
50,2021-12-16 09:59,Here's Why Investors Should Retain Fiserv (FISV) Stock Now,https://finance.yahoo.com/news/heres-why-investors-retain-fiserv-145902406.html,Zacks
51,2021-12-13 13:01,"Stock market: Tesla dips, Facebook up amid red day across the board",https://finance.yahoo.com/video/stock-market-tesla-dips-facebook-180146694.html,Yahoo Finance Video
52,2021-12-13 09:40,Is Avis Budget Group (CAR) Outperforming Other Business Services Stocks This Year?,https://finance.yahoo.com/news/avis-budget-group-car-outperforming-144002739.html,Zacks
53,2021-12-13 08:34,Implied Volatility Surging for Avis Budget (CAR) Stock Options,https://finance.yahoo.com/news/implied-volatility-surging-avis-budget-133401873.html,Zacks
54,2021-12-11 13:52,Where Does The Smart Money Stand On Avis Budget Group Inc. (CAR)?,https://finance.yahoo.com/news/where-does-smart-money-stand-185247880.html,Insider Monkey
55,2021-12-11 05:38,"Penn Series Small Cap Value Fund Buys BJ's Wholesale Club Holdings Inc, Ovintiv Inc, Centennial ...",https://finance.yahoo.com/news/penn-series-small-cap-value-103809025.html,GuruFocus.com
56,2021-12-10 12:54,Ford founders great-grandson spends more than $20 million in new stock purchases,https://finance.yahoo.com/news/ford-founders-great-grandson-spends-more-than-20-million-in-new-stock-purchases-175439370.html,Yahoo Finance
57,2021-12-08 11:40,6 Reasons Why You Should Bet on ICF International (ICFI),https://finance.yahoo.com/news/6-reasons-why-bet-icf-164004977.html,Zacks
58,2021-12-08 11:18,"Clean Harbors (CLH) Benefits From Acquisitions, Debt Ails",https://finance.yahoo.com/news/clean-harbors-clh-benefits-acquisitions-161804580.html,Zacks
59,2021-12-08 05:15,"The Zacks Analyst Blog Highlights: The Interpublic Group of Companies, HeadHunter, Avis Budget Group and Robert Half International",https://finance.yahoo.com/news/zacks-analyst-blog-highlights-interpublic-101510314.html,Zacks
60,2021-12-07 12:30,Reasons to Bet on FactSet Research Systems (FDS) Stock Now,https://finance.yahoo.com/news/reasons-bet-factset-research-systems-173005214.html,Zacks
61,2021-12-07 07:53,4 Stocks to Buy as Services Sector Activity Hits Record High,https://finance.yahoo.com/news/4-stocks-buy-services-sector-125312673.html,Zacks
62,2021-12-06 14:33,"Hertz stock jumps after analysts recommend investors buy, while at the same time saying rival Avis Budget is a sell",https://www.marketwatch.com/story/hertz-stock-jumps-after-analysts-recommend-investors-buy-while-at-the-same-time-saying-rival-avis-budget-is-a-sell-11638819204?siteid=yhoof2,MarketWatch
63,2021-12-06 11:32,DocuSign (DOCU) Gains From eSignature Strength Amid Expense Woes,https://finance.yahoo.com/news/docusign-docu-gains-esignature-strength-163204275.html,Zacks
64,2021-12-06 08:02,Reasons to Retain Insperity (NSP) Stock in Your Portfolio,https://finance.yahoo.com/news/reasons-retain-insperity-nsp-stock-130201008.html,Zacks
65,2021-12-06 04:56,"Goldman, Morgan Stanley Bid to Buy Into India Mapmakers IPO",https://finance.yahoo.com/news/goldman-morgan-stanley-bid-buy-073903227.html,Bloomberg
66,2021-12-03 12:13,"Waste Connections (WCN) Benefits From Acquisitions, Debt Ails",https://finance.yahoo.com/news/waste-connections-wcn-benefits-acquisitions-171305435.html,Zacks
67,2021-12-03 11:55,Omnicom's (OMC) Credera Announces Launch of Atlanta Office,https://finance.yahoo.com/news/omnicoms-omc-credera-announces-launch-165504904.html,Zacks
68,2021-12-03 10:48,"WEX Banks on Buyouts and Product Excellence, Debt Woes Stay",https://finance.yahoo.com/news/wex-banks-buyouts-product-excellence-154803853.html,Zacks
69,2021-12-03 08:41,5 Finest Value Stocks Based on PEG Ratio,https://finance.yahoo.com/news/5-finest-value-stocks-based-134101860.html,Zacks
70,2021-12-02 10:11,TransUnion (TRU) to Gain From Sontiq Buyout: Here's How,https://finance.yahoo.com/news/transunion-tru-gain-sontiq-buyout-151103269.html,Zacks
71,2021-12-01 11:55,"Broadridge (BR) Riding on Recurring Revenues, Debt Woe Stays",https://finance.yahoo.com/news/broadridge-br-riding-recurring-revenues-165504040.html,Zacks
72,2021-12-01 11:30,Why Is Avis Budget (CAR) Down 23.1% Since Last Earnings Report?,https://finance.yahoo.com/news/why-avis-budget-car-down-163004161.html,Zacks
73,2021-12-01 09:02,Five-year Strategy Benefits H&R Block (HRB) Amid High Debt,https://finance.yahoo.com/news/five-strategy-benefits-h-r-140202188.html,Zacks
74,2021-11-30 16:06,Avis Stock Nears Biggest Monthly Gain in 12 Years,https://finance.yahoo.com/news/avis-stock-nears-biggest-monthly-155308895.html,Bloomberg
75,2021-11-30 12:25,"Investor-Friendly Steps Aid MAXIMUS (MMS), High Debt Ails",https://finance.yahoo.com/news/investor-friendly-steps-aid-maximus-172505244.html,Zacks
76,2021-11-30 11:35,"Waste Management (WM) Benefits From Acquisitions, Debt Ails",https://finance.yahoo.com/news/waste-management-wm-benefits-acquisitions-163504282.html,Zacks
77,2021-11-30 10:48,"FTI Consulting (FCN) Up on Global Business, Cash Strength",https://finance.yahoo.com/news/fti-consulting-fcn-global-business-154803455.html,Zacks
78,2021-11-30 05:35,Top 5 Picks to Gain From Wall Street's Omicron-Relief Rally,https://finance.yahoo.com/news/top-5-picks-gain-wall-103510344.html,Zacks
79,2021-11-29 15:15,Electric-Car Fans Are Driving These 2 Unlikely Stocks Higher,https://www.fool.com/investing/2021/11/29/electric-car-fans-are-driving-these-2-unlikely-sto/?source=eptyholnk0000202&utm_source=yahoo-host&utm_medium=feed&utm_campaign=article,Motley Fool
80,2021-11-29 14:43,"Merck stock drops and Tesla pops on news, Avis rises on bullish call",https://finance.yahoo.com/video/merck-stock-drops-tesla-pops-194331071.html,Yahoo Finance Video
81,2021-11-29 14:33,"Avis stock: Pricing power is leading to structurally higher margins, analyst says",https://finance.yahoo.com/video/jefferies-equity-analyst-hamzah-mazari-193324816.html,Yahoo Finance Video
82,2021-11-29 11:45,"Avis stock: Pricing power is leading to structurally higher margins, analyst says",https://finance.yahoo.com/video/avis-stock-pricing-power-leading-164521417.html,Yahoo Finance Video
83,2021-11-28 12:14,10 Reddit Stocks that Tripled in 2021,https://finance.yahoo.com/news/10-reddit-stocks-tripled-2021-171456020.html,Insider Monkey
84,2021-11-27 05:30,Hertz-Tesla Deal Signals Broad Shift to EVs for Rental-Car Companies,https://www.wsj.com/articles/hertz-tesla-deal-signals-broad-shift-to-evs-for-rental-car-companies-11638009000?mod=itp_wsj,The Wall Street Journal
85,2021-11-26 13:21,Why Are Insiders Still Buying Their Own Stocks?,https://finance.yahoo.com/news/why-insiders-still-buying-own-182106940.html,Zacks
86,2021-11-26 08:13,"Insperity (NSP) Up on Worksite Employees Growth, Expenses Ail",https://finance.yahoo.com/news/insperity-nsp-worksite-employees-growth-131301390.html,Zacks
87,2021-11-26 08:04,Time to Buy These 5 Relative Price Strength Stocks,https://finance.yahoo.com/news/time-buy-5-relative-price-130401639.html,Zacks
88,2021-11-25 12:20,Earnings Estimates Rising for Avis Budget (CAR): Will It Gain?,https://finance.yahoo.com/news/earnings-estimates-rising-avis-budget-172005012.html,Zacks
89,2021-11-25 11:18,"Booz Allen (BAH) Gaining From Transformation Moves, Debt Ails",https://finance.yahoo.com/news/booz-allen-bah-gaining-transformation-161804983.html,Zacks
90,2021-11-25 11:09,"Equifax (EFX) Benefits From Buyouts and Innovation, Debt Ails",https://finance.yahoo.com/news/equifax-efx-benefits-buyouts-innovation-160904397.html,Zacks
91,2021-11-25 10:17,Has Avis Budget Group (CAR) Outpaced Other Business Services Stocks This Year?,https://finance.yahoo.com/news/avis-budget-group-car-outpaced-151703832.html,Zacks
92,2021-11-24 14:44,Hertz Deal for Preferred Could Mean a Big Buyback Ahead. The Stock Is Surging.,https://www.barrons.com/articles/hertz-deal-for-preferred-could-mean-a-big-buyback-ahead-the-stock-is-surging-51637783064?siteid=yhoof2,Barrons.com
93,2021-11-24 10:24,Omnicom's (OMC) Credera Announces Acquisition of BrightGen,https://finance.yahoo.com/news/omnicoms-omc-credera-announces-acquisition-152403403.html,Zacks
94,2021-11-24 10:05,"ICF International (ICFI) Up on Global Presence, Expenses Ail",https://finance.yahoo.com/news/icf-international-icfi-global-presence-150503001.html,Zacks
95,2021-11-24 07:06,"The Zacks Analyst Blog Highlights: Dow, Avis Budget Group, Phillips 66, Westlake Chemical and Builders FirstSource",https://finance.yahoo.com/news/zacks-analyst-blog-highlights-dow-120612457.html,Zacks
96,2021-11-23 10:43,Fiserv (FISV) Announces Completion of BentoBox Acquisition,https://finance.yahoo.com/news/fiserv-fisv-announces-completion-bentobox-154303312.html,Zacks
97,2021-11-23 06:52,Powell's Renomination Confirms Fed Policy Continuity: 5 Picks,https://finance.yahoo.com/news/powells-renomination-confirms-fed-policy-115211599.html,Zacks
98,2021-11-22 11:14,"Genpact (G) Up on Strong Clientele & Acquisitions, Debt Ails",https://finance.yahoo.com/news/genpact-g-strong-clientele-acquisitions-161404001.html,Zacks
99,2021-11-22 10:08,Here's Why Investors Should Retain Accenture (ACN) Stock Now,https://finance.yahoo.com/news/heres-why-investors-retain-accenture-150803661.html,Zacks
