,Date,News Headline,Article Link,Source
0,2022-01-13 17:38,"Canandaigua National Corp Buys Amazon.com Inc, American Express Co, S&P Global Inc, Sells ...",https://finance.yahoo.com/news/canandaigua-national-corp-buys-amazon-223806269.html,GuruFocus.com
1,2022-01-06 06:58,"Zacks Industry Outlook Highlights: Lennox International, Inc., The AZEK Company Inc., AAON Inc. and Comfort Systems USA, Inc",https://finance.yahoo.com/news/zacks-industry-outlook-highlights-lennox-115811714.html,Zacks
2,2022-01-05 16:10,Comfort Systems USA Announces Acquisitions,https://finance.yahoo.com/news/comfort-systems-usa-announces-acquisitions-211000934.html,Business Wire
3,2022-01-05 08:00,Those who invested in Comfort Systems USA (NYSE:FIX) five years ago are up 218%,https://finance.yahoo.com/news/those-invested-comfort-systems-usa-130058095.html,Simply Wall St.
4,2021-12-31 11:43,Top 4 Construction Stocks Likely to Maintain Momentum in 2022,https://finance.yahoo.com/news/top-4-construction-stocks-likely-164304731.html,Zacks
5,2021-12-22 06:23,"Zacks Industry Outlook Highlights: Meritage Homes, Toll Brothers, James Hardie Industries, Comfort Systems USA and Altair Engineering",https://finance.yahoo.com/news/zacks-industry-outlook-highlights-meritage-112311468.html,Zacks
6,2021-12-21 10:39,5 Construction Stocks Set to Continue Winning Streak in 2022,https://finance.yahoo.com/news/5-construction-stocks-set-continue-153903501.html,Zacks
7,2021-12-15 00:38,"Tributary Small Company Fund Buys Cambium Networks Corp, Sunstone Hotel Investors Inc, Integer ...",https://finance.yahoo.com/news/tributary-small-company-fund-buys-053804796.html,GuruFocus.com
8,2021-12-10 08:48,"Is It Too Late To Consider Buying Comfort Systems USA, Inc. (NYSE:FIX)?",https://finance.yahoo.com/news/too-consider-buying-comfort-systems-134828068.html,Simply Wall St.
9,2021-12-06 05:38,Comfort Systems USA (FIX) Sees Hammer Chart Pattern: Time to Buy?,https://finance.yahoo.com/news/comfort-systems-usa-fix-sees-103810327.html,Zacks
10,2021-12-01 16:34,Comfort Systems USA Announces Acquisition,https://finance.yahoo.com/news/comfort-systems-usa-announces-acquisition-213400546.html,Business Wire
11,2021-11-18 10:15,Louisiana-Pacific (LPX) Up 95% in a Year: Housing Holds Key,https://finance.yahoo.com/news/louisiana-pacific-lpx-95-housing-151503923.html,Zacks
12,2021-11-17 10:52,Great Lakes (GLDD) to Build First Jones Act Fallpipe Vessel,https://finance.yahoo.com/news/great-lakes-gldd-build-first-155203556.html,Zacks
13,2021-11-17 10:50,"Jacobs (J) Wins $250M IDIQ Contracts From OBO, Aids Backlog",https://finance.yahoo.com/news/jacobs-j-wins-250m-idiq-155003264.html,Zacks
14,2021-11-14 07:56,"Is Comfort Systems USA, Inc.'s (NYSE:FIX) Stock's Recent Performance Being Led By Its Attractive Financial Prospects?",https://finance.yahoo.com/news/comfort-systems-usa-inc-nyse-125650049.html,Simply Wall St.
15,2021-11-12 10:48,"Jacobs (J) Wins Contracts From Czech Republic, Boosts Backlog",https://finance.yahoo.com/news/jacobs-j-wins-contracts-czech-154803672.html,Zacks
16,2021-10-28 20:01,"Comfort Systems USA, inc (FIX) Q3 2021 Earnings Call Transcript",https://www.fool.com/earnings/call-transcripts/2021/10/28/comfort-systems-usa-inc-fix-q3-2021-earnings-call/?source=eptyholnk0000202&utm_source=yahoo-host&utm_medium=feed&utm_campaign=article,Motley Fool
17,2021-10-27 18:15,Comfort Systems (FIX) Surpasses Q3 Earnings and Revenue Estimates,https://finance.yahoo.com/news/comfort-systems-fix-surpasses-q3-221510264.html,Zacks
18,2021-10-27 16:10,Comfort Systems USA Reports Third Quarter 2021 Results,https://finance.yahoo.com/news/comfort-systems-usa-reports-third-201000075.html,Business Wire
19,2021-10-27 16:06,Comfort Systems USA Increases Quarterly Dividend,https://finance.yahoo.com/news/comfort-systems-usa-increases-quarterly-200600917.html,Business Wire
20,2021-10-26 10:19,"Hedge Funds Are Piling Into Comfort Systems USA, Inc. (FIX)",https://finance.yahoo.com/news/hedge-funds-piling-comfort-systems-141916447.html,Insider Monkey
21,2021-10-21 16:26,Comfort Systems USA Announces Third Quarter 2021 Conference Call and Webcast,https://finance.yahoo.com/news/comfort-systems-usa-announces-third-202600600.html,Business Wire
22,2021-10-21 12:58,5 Construction Stocks to Beat Q3 Earnings Estimates,https://finance.yahoo.com/news/5-construction-stocks-beat-q3-165804823.html,Zacks
23,2021-10-21 08:32,Should You Buy Comfort Systems (FIX) Ahead of Earnings?,https://finance.yahoo.com/news/buy-comfort-systems-fix-ahead-123212964.html,Zacks
24,2021-09-21 07:35,Sidoti Fall Virtual Small Cap Investor Conference,https://finance.yahoo.com/news/sidoti-fall-virtual-small-cap-113500755.html,ACCESSWIRE
25,2021-09-19 10:04,If You Like EPS Growth Then Check Out Comfort Systems USA (NYSE:FIX) Before It's Too Late,https://finance.yahoo.com/news/eps-growth-then-check-comfort-140407835.html,Simply Wall St.
26,2021-08-24 08:55,"Estimating The Fair Value Of Comfort Systems USA, Inc. (NYSE:FIX)",https://finance.yahoo.com/news/estimating-fair-value-comfort-systems-125549456.html,Simply Wall St.
27,2021-08-03 17:14,Comfort Systems USA Announces Acquisition,https://finance.yahoo.com/news/comfort-systems-usa-announces-acquisition-211400576.html,Business Wire
28,2021-07-29 15:31,"Comfort Systems USA, inc (FIX) Q2 2021 Earnings Call Transcript",https://www.fool.com/earnings/call-transcripts/2021/07/29/comfort-systems-usa-inc-fix-q2-2021-earnings-call/?source=eptyholnk0000202&utm_source=yahoo-host&utm_medium=feed&utm_campaign=article,Motley Fool
29,2021-07-29 03:51,"If You Had Bought Comfort Systems USA (NYSE:FIX) Stock Five Years Ago, You Could Pocket A 160% Gain Today",https://finance.yahoo.com/news/had-bought-comfort-systems-usa-075146993.html,Simply Wall St.
30,2021-07-28 18:25,Comfort Systems (FIX) Q2 Earnings and Revenues Miss Estimates,https://finance.yahoo.com/news/comfort-systems-fix-q2-earnings-222510517.html,Zacks
31,2021-07-28 16:09,Comfort Systems USA Reports Second Quarter 2021 Results,https://finance.yahoo.com/news/comfort-systems-usa-reports-second-200900099.html,Business Wire
32,2021-07-28 16:07,Comfort Systems USA Increases Quarterly Dividend,https://finance.yahoo.com/news/comfort-systems-usa-increases-quarterly-200700812.html,Business Wire
33,2021-07-22 16:04,Comfort Systems USA Announces Second Quarter 2021 Conference Call and Webcast,https://finance.yahoo.com/news/comfort-systems-usa-announces-second-200400025.html,Business Wire
34,2021-07-21 15:20,"Where Do Hedge Funds Stand On Comfort Systems USA, Inc. (FIX)?",https://finance.yahoo.com/news/where-hedge-funds-stand-comfort-192059486.html,Insider Monkey
35,2021-07-19 15:00,Analysts Estimate Comfort Systems (FIX) to Report a Decline in Earnings: What to Look Out for,https://finance.yahoo.com/news/analysts-estimate-comfort-systems-fix-190007672.html,Zacks
36,2021-07-07 04:53,Top Building Materials Companies in USA,https://finance.yahoo.com/news/top-building-materials-companies-usa-085301989.html,Insider Monkey
37,2021-07-01 11:17,What Makes Comfort Systems a Better Stock Than AAON?,https://finance.yahoo.com/news/makes-comfort-systems-better-stock-151703924.html,Zacks
38,2021-06-30 17:31,Comfort Systems USA Announces Acquisition,https://finance.yahoo.com/news/comfort-systems-usa-announces-acquisition-213100452.html,Business Wire
39,2021-06-07 02:37,"Are Robust Financials Driving The Recent Rally In Comfort Systems USA, Inc.'s (NYSE:FIX) Stock?",https://finance.yahoo.com/news/robust-financials-driving-recent-rally-063731938.html,Simply Wall St.
40,2021-05-12 02:03,"We Take A Look At Why Comfort Systems USA, Inc.'s (NYSE:FIX) CEO Compensation Is Well Earned",https://finance.yahoo.com/news/look-why-comfort-systems-usa-060346338.html,Simply Wall St.
41,2021-05-08 05:40,Returns On Capital At Comfort Systems USA (NYSE:FIX) Have Hit The Brakes,https://finance.yahoo.com/news/returns-capital-comfort-systems-usa-094019310.html,Simply Wall St.
42,2021-04-30 09:15,"Comfort Systems (FIX) Soars to 52-Week High, Time to Cash Out?",https://finance.yahoo.com/news/comfort-systems-fix-soars-52-131501001.html,Zacks
43,2021-04-29 17:31,Comfort Systems USA Inc (FIX) Q1 2021 Earnings Call Transcript,https://www.fool.com/earnings/call-transcripts/2021/04/29/comfort-systems-usa-inc-fix-q1-2021-earnings-call/?source=eptyholnk0000202&utm_source=yahoo-host&utm_medium=feed&utm_campaign=article,Motley Fool
44,2021-04-28 16:06,Comfort Systems USA Reports First Quarter 2021 Results,https://finance.yahoo.com/news/comfort-systems-usa-reports-first-200600837.html,Business Wire
45,2021-04-28 16:04,Comfort Systems USA Declares Quarterly Dividend,https://finance.yahoo.com/news/comfort-systems-usa-declares-quarterly-200400773.html,Business Wire
46,2021-04-21 16:08,Comfort Systems USA Announces First Quarter 2021 Conference Call and Webcast,https://finance.yahoo.com/news/comfort-systems-usa-announces-first-200800748.html,Business Wire
47,2021-04-12 08:06,"Zacks Industry Outlook Highlights: Comfort Systems USA, Watsco, Lennox International and The AZEK Company",https://finance.yahoo.com/news/zacks-industry-outlook-highlights-comfort-120612215.html,Zacks
48,2021-04-12 03:23,Does Comfort Systems USA (NYSE:FIX) Deserve A Spot On Your Watchlist?,https://finance.yahoo.com/news/does-comfort-systems-usa-nyse-072320408.html,Simply Wall St.
49,2021-04-09 10:33,Air Conditioner & Heating Industry to Thrive: 4 Stocks in Focus,https://finance.yahoo.com/news/air-conditioner-heating-industry-thrive-143302792.html,Zacks
50,2021-04-05 10:43,New Strong Buy Stocks for April 5th,https://finance.yahoo.com/news/strong-buy-stocks-april-5th-144302246.html,Zacks
51,2021-03-26 08:52,Surging Earnings Estimates Signal Good News for Comfort Systems (FIX),https://finance.yahoo.com/news/surging-earnings-estimates-signal-good-125212298.html,Zacks
52,2021-03-23 19:30,Sidoti Virtual Investor Conference,https://finance.yahoo.com/news/sidoti-virtual-investor-conference-233000986.html,ACCESSWIRE
53,2021-03-17 09:13,Watsco (WSO)-Carrier JV to Acquire Temperature Equipment,https://finance.yahoo.com/news/watsco-wso-carrier-jv-acquire-131301056.html,Zacks
54,2021-03-17 03:35,"Calculating The Fair Value Of Comfort Systems USA, Inc. (NYSE:FIX)",https://finance.yahoo.com/news/calculating-fair-value-comfort-systems-073549846.html,Simply Wall St.
55,2021-03-04 11:50,Is Comfort Systems (FIX) a Great Value Stock Right Now?,https://finance.yahoo.com/news/comfort-systems-fix-great-value-165004144.html,Zacks
56,2021-02-26 16:31,Comfort Systems USA Inc (FIX) Q4 2020 Earnings Call Transcript,https://www.fool.com/earnings/call-transcripts/2021/02/26/comfort-systems-usa-inc-fix-q4-2020-earnings-call/?source=eptyholnk0000202&utm_source=yahoo-host&utm_medium=feed&utm_campaign=article,Motley Fool
57,2021-02-26 09:15,"Comfort Systems USA, Inc. to Host Earnings Call",https://finance.yahoo.com/news/comfort-systems-usa-inc-host-141500363.html,ACCESSWIRE
58,2021-02-25 16:14,Comfort Systems USA Reports Fourth Quarter and Full Year 2020 Results,https://finance.yahoo.com/news/comfort-systems-usa-reports-fourth-211400176.html,Business Wire
59,2021-02-25 16:10,Comfort Systems USA Increases Quarterly Dividend,https://finance.yahoo.com/news/comfort-systems-usa-increases-quarterly-211000787.html,Business Wire
60,2021-02-24 10:10,Preview: Comfort Systems USA's Earnings,https://finance.yahoo.com/news/preview-comfort-systems-usas-earnings-151005816.html,Benzinga
61,2021-02-19 16:09,Comfort Systems USA Announces Fourth Quarter 2020 Conference Call and Webcast,https://finance.yahoo.com/news/comfort-systems-usa-announces-fourth-210900287.html,Business Wire
62,2021-02-15 00:36,Investors Who Bought Comfort Systems USA (NYSE:FIX) Shares Five Years Ago Are Now Up 137%,https://finance.yahoo.com/news/investors-bought-comfort-systems-usa-053609830.html,Simply Wall St.
63,2021-02-09 15:16,Comfort Systems USA Trying To Close In On Key Technical Measure,https://www.investors.com/news/comfort-systems-usa-trying-to-close-in-on-key-technical-measure/?src=A00220,Investor's Business Daily
64,2021-01-19 16:07,Investors Business Daily Names Comfort Systems USA as a Top ESG Company,https://finance.yahoo.com/news/investor-business-daily-names-comfort-210700753.html,Business Wire
65,2021-01-07 01:32,"Is It Time To Consider Buying Comfort Systems USA, Inc. (NYSE:FIX)?",https://finance.yahoo.com/news/time-consider-buying-comfort-systems-063239548.html,Simply Wall St.
66,2021-01-05 16:10,Comfort Systems USA Announces Acquisition,https://finance.yahoo.com/news/comfort-systems-usa-announces-acquisition-211000257.html,Business Wire
67,2020-12-11 16:07,Comfort Systems Announces Chief Operating Officer Appointment,https://finance.yahoo.com/news/comfort-systems-announces-chief-operating-210700078.html,Business Wire
68,2020-12-11 16:05,Comfort Systems USA Increases Stock Repurchase Program,https://finance.yahoo.com/news/comfort-systems-usa-increases-stock-210500194.html,Business Wire
69,2020-12-02 01:10,"Is Comfort Systems USA, Inc.'s(NYSE:FIX) Recent Stock Performance Tethered To Its Strong Fundamentals?",https://finance.yahoo.com/news/comfort-systems-usa-inc-nyse-061051168.html,Simply Wall St.
70,2020-11-05 10:17,Understanding Comfort Systems USA's Ex-Dividend Date,https://finance.yahoo.com/news/understanding-comfort-systems-usas-ex-151718467.html,Benzinga
71,2020-11-01 09:11,"Comfort Systems USA, Inc. (NYSE:FIX) Passed Our Checks, And It's About To Pay A US$0.11 Dividend",https://finance.yahoo.com/news/comfort-systems-usa-inc-nyse-141134416.html,Simply Wall St.
72,2020-10-29 11:50,Are Investors Undervaluing Comfort Systems (FIX) Right Now?,https://finance.yahoo.com/news/investors-undervaluing-comfort-systems-fix-155003180.html,Zacks
73,2020-10-27 16:31,Comfort Systems USA Inc (FIX) Q3 2020 Earnings Call Transcript,https://www.fool.com/earnings/call-transcripts/2020/10/27/comfort-systems-usa-inc-fix-q3-2020-earnings-call/?source=eptyholnk0000202&utm_source=yahoo-host&utm_medium=feed&utm_campaign=article,Motley Fool
74,2020-10-26 18:15,Comfort Systems (FIX) Q3 Earnings Surpass Estimates,https://finance.yahoo.com/news/comfort-systems-fix-q3-earnings-221510350.html,Zacks
75,2020-10-26 16:42,Comfort Systems USA Reports Third Quarter 2020 Results,https://finance.yahoo.com/news/comfort-systems-usa-reports-third-204200965.html,Business Wire
76,2020-10-26 16:40,Comfort Systems USA Increases Quarterly Dividend,https://finance.yahoo.com/news/comfort-systems-usa-increases-quarterly-204000913.html,Business Wire
77,2020-10-20 16:12,Comfort Systems USA Announces Third Quarter 2020 Conference Call and Webcast,https://finance.yahoo.com/news/comfort-systems-usa-announces-third-201200155.html,Business Wire
78,2020-10-15 12:31,Comfort Systems (FIX) to Report Q3 Results: Wall Street Expects Earnings Growth,https://finance.yahoo.com/news/comfort-systems-fix-report-q3-163104759.html,Zacks
79,2020-10-07 07:55,Should You Be Adding Comfort Systems USA (NYSE:FIX) To Your Watchlist Today?,https://finance.yahoo.com/news/adding-comfort-systems-usa-nyse-115541035.html,Simply Wall St.
80,2020-10-06 19:46,"Hedge Funds Are Buying Comfort Systems USA, Inc. (FIX)",https://finance.yahoo.com/news/hedge-funds-buying-comfort-systems-234632842.html,Insider Monkey
81,2020-09-23 15:00,Sidoti & Company Virtual Investor Conference,https://finance.yahoo.com/news/sidoti-company-virtual-investor-conference-190000437.html,ACCESSWIRE
82,2020-09-17 10:43,"The Zacks Analyst Blog Highlights: Atlas Air Worldwide, BMC Stock, Central Garden & Pet Company, Comfort Systems USA and DICK'S Sporting Goods",https://finance.yahoo.com/news/zacks-analyst-blog-highlights-atlas-144302750.html,Zacks
83,2020-09-07 12:31,The Comfort Systems USA (NYSE:FIX) Share Price Has Gained 78% And Shareholders Are Hoping For More,https://finance.yahoo.com/news/comfort-systems-usa-nyse-fix-163103735.html,Simply Wall St.
84,2020-08-19 12:00,Here's Why Comfort Systems (FIX) is a Great Momentum Stock to Buy,https://finance.yahoo.com/news/heres-why-comfort-systems-fix-160004046.html,Zacks
85,2020-08-19 10:37,Moving Average Crossover Alert: Comfort Systems USA,https://finance.yahoo.com/news/moving-average-crossover-alert-comfort-143702692.html,Zacks
86,2020-08-19 09:19,Top Ranked Momentum Stocks to Buy for August 19th,https://finance.yahoo.com/news/top-ranked-momentum-stocks-buy-131901030.html,Zacks
87,2020-08-17 18:15,Comfort Systems Usa Inc (FIX) CFO William George Iii Sold $1 million of Shares,https://finance.yahoo.com/news/comfort-systems-usa-inc-fix-221510982.html,GuruFocus.com
88,2020-08-17 12:45,3 Reasons Why Comfort Systems (FIX) Is a Great Growth Stock,https://finance.yahoo.com/news/3-reasons-why-comfort-systems-164504745.html,Zacks
89,2020-08-17 10:03,Why Comfort Systems USA (FIX) Stock Might be a Great Pick?,https://finance.yahoo.com/news/why-comfort-systems-usa-fix-140302831.html,Zacks
90,2020-08-07 09:03,"Comfort Systems USA's Shares March Higher, Can It Continue?",https://finance.yahoo.com/news/comfort-systems-usas-shares-march-130301302.html,Zacks
91,2020-08-06 11:50,Is Comfort Systems (FIX) a Great Value Stock Right Now?,https://finance.yahoo.com/news/comfort-systems-fix-great-value-155003655.html,Zacks
92,2020-08-06 06:38,"Earnings Working Against Comfort Systems USA, Inc.'s (NYSE:FIX) Share Price",https://finance.yahoo.com/news/earnings-working-against-comfort-systems-103835728.html,Simply Wall St.
93,2020-08-03 10:43,My Sane Portfolio Takes It on the Chin,https://finance.yahoo.com/news/sane-portfolio-takes-chin-144337836.html,GuruFocus.com
94,2020-07-31 12:45,Looking for a Growth Stock? 3 Reasons Why Comfort Systems (FIX) is a Solid Choice,https://finance.yahoo.com/news/looking-growth-stock-3-reasons-164504552.html,Zacks
95,2020-07-30 13:50,Registration: Sidoti's 2020 Fall Virtual Investor Conference is Now Open,https://finance.yahoo.com/news/registration-sidotis-2020-fall-virtual-175000608.html,ACCESSWIRE
96,2020-07-30 08:24,"Comfort Systems USA, Inc. Just Recorded A 137% EPS Beat: Here's What Analysts Are Forecasting Next",https://finance.yahoo.com/news/comfort-systems-usa-inc-just-122429761.html,Simply Wall St.
97,2020-07-28 16:01,Comfort Systems USA Inc (FIX) Q2 2020 Earnings Call Transcript,https://www.fool.com/earnings/call-transcripts/2020/07/28/comfort-systems-usa-inc-fix-q2-2020-earnings-call.aspx?source=eptyholnk0000202&utm_source=yahoo-host&utm_medium=feed&utm_campaign=article,Motley Fool
98,2020-07-28 10:23,"Did Hedge Funds Make The Right Call On Comfort Systems USA, Inc. (FIX) ?",https://finance.yahoo.com/news/did-hedge-funds-call-comfort-142312402.html,Insider Monkey
99,2020-07-27 17:55,Comfort Systems (FIX) Surpasses Q2 Earnings and Revenue Estimates,https://finance.yahoo.com/news/comfort-systems-fix-surpasses-q2-215509274.html,Zacks
