,Date,News Headline,Article Link,Source
0,2022-03-05 14:57,10 Stocks That Recently Hit All-Time Highs,https://finance.yahoo.com/news/10-stocks-recently-hit-time-195721666.html,Insider Monkey
1,2022-03-03 12:51,Black Hawk's Monarch Casino unveils lineup of new restaurants it hopes will draw Denverites (Photos),https://www.bizjournals.com/denver/news/2022/03/03/monarch-casino-resort-spa-black-hawk-restaurants.html?ana=yahoo,American City Business Journals
2,2022-03-03 09:40,Is Monarch Casino (MCRI) Outperforming Other Consumer Discretionary Stocks This Year?,https://finance.yahoo.com/news/monarch-casino-mcri-outperforming-other-144002856.html,Zacks
3,2022-02-15 12:00,What Makes Monarch Casino (MCRI) a Strong Momentum Stock: Buy Now?,https://finance.yahoo.com/news/makes-monarch-casino-mcri-strong-170005008.html,Zacks
4,2022-02-15 09:46,"Full Plate: Denver attracts more out-of-state chains including poke, lobster",https://www.bizjournals.com/denver/news/2022/02/15/full-plate-masons-lobster-rolls-pokeworks-monarch.html?ana=yahoo,American City Business Journals
5,2022-02-14 12:45,Looking for a Growth Stock? 3 Reasons Why Monarch Casino (MCRI) is a Solid Choice,https://finance.yahoo.com/news/looking-growth-stock-3-reasons-174505013.html,Zacks
6,2022-02-09 17:35,Monarch Casino (MCRI) Q4 Earnings and Revenues Beat Estimates,https://finance.yahoo.com/news/monarch-casino-mcri-q4-earnings-223510188.html,Zacks
7,2022-02-09 16:03,Monarch Casino & Resort Reports Record 2021 Fourth Quarter Financial Results,https://finance.yahoo.com/news/monarch-casino-resort-reports-record-210300051.html,GlobeNewswire
8,2022-02-08 08:12,"What Does Monarch Casino & Resort, Inc.'s (NASDAQ:MCRI) Share Price Indicate?",https://finance.yahoo.com/news/does-monarch-casino-resort-inc-131236166.html,Simply Wall St.
9,2022-02-04 12:10,Why the Earnings Surprise Streak Could Continue for Monarch Casino (MCRI),https://finance.yahoo.com/news/why-earnings-surprise-streak-could-171005802.html,Zacks
10,2022-01-14 12:00,Monarch Casino (MCRI) Upgraded to Buy: What Does It Mean for the Stock?,https://finance.yahoo.com/news/monarch-casino-mcri-upgraded-buy-170005337.html,Zacks
11,2022-01-10 08:01,Investors Met With Slowing Returns on Capital At Monarch Casino & Resort (NASDAQ:MCRI),https://finance.yahoo.com/news/investors-met-slowing-returns-capital-130132210.html,Simply Wall St.
12,2021-12-27 10:05,"Coming off a surprising record year, Colorado casinos eye more changes in 2022",https://www.bizjournals.com/denver/news/2021/12/27/colorado-casinos-record-proceeds-sports-betting.html?ana=yahoo,American City Business Journals
13,2021-12-02 09:35,Should Value Investors Pick Monarch Casino & Resort Stock?,https://finance.yahoo.com/news/value-investors-pick-monarch-casino-143502753.html,Zacks
14,2021-11-15 11:53,Here's Why We Think Monarch Casino & Resort (NASDAQ:MCRI) Is Well Worth Watching,https://finance.yahoo.com/news/heres-why-think-monarch-casino-165306393.html,Simply Wall St.
15,2021-10-29 09:00,3 Ways This Lesser-Known Casino Stock Is Still Winning,https://www.fool.com/investing/2021/10/29/3-ways-this-lesser-known-casino-stock-is-still-win/?source=eptyholnk0000202&utm_source=yahoo-host&utm_medium=feed&utm_campaign=article,Motley Fool
16,2021-10-25 17:25,Monarch Casino (MCRI) Q3 Earnings and Revenues Beat Estimates,https://finance.yahoo.com/news/monarch-casino-mcri-q3-earnings-212509695.html,Zacks
17,2021-10-25 16:02,Monarch Casino & Resort Reports Record 2021 Third Quarter Financial Results,https://finance.yahoo.com/news/monarch-casino-resort-reports-record-200200613.html,GlobeNewswire
18,2021-10-18 12:05,"Are Investors Undervaluing Monarch Casino & Resort, Inc. (NASDAQ:MCRI) By 43%?",https://finance.yahoo.com/news/investors-undervaluing-monarch-casino-resort-160550730.html,Simply Wall St.
19,2021-10-06 06:10,Got $300? 3 No-Brainer Stocks to Buy in October,https://www.fool.com/investing/2021/10/06/got-300-3-no-brainer-stocks-to-buy-in-october/?source=eptyholnk0000202&utm_source=yahoo-host&utm_medium=feed&utm_campaign=article,Motley Fool
20,2021-10-04 14:00,Monarch Casino & Resort Sees Composite Rating Climb To 97,https://www.investors.com/research/top-rated-stocks-monarch-casino-resort-sees-composite-rating-climb-to-97/?src=A00220,Investor's Business Daily
21,2021-09-28 13:30,Monarch Casino & Resort Earns Membership In 95-Plus Composite Rating Club,https://www.investors.com/research/monarch-casino-resort-earns-membership-in-95-plus-composite-rating-club/?src=A00220,Investor's Business Daily
22,2021-09-16 09:54,Those who invested in Monarch Casino & Resort (NASDAQ:MCRI) five years ago are up 168%,https://finance.yahoo.com/news/those-invested-monarch-casino-resort-135415766.html,Simply Wall St.
23,2021-08-24 20:15,Monarch Casino & Resort Announces Management Changes,https://finance.yahoo.com/news/monarch-casino-resort-announces-management-001500003.html,GlobeNewswire
24,2021-08-16 10:28,"When Should You Buy Monarch Casino & Resort, Inc. (NASDAQ:MCRI)?",https://finance.yahoo.com/news/buy-monarch-casino-resort-inc-142837444.html,Simply Wall St.
25,2021-08-06 08:45,"Why Pushing a Few Chips Onto Monarch Casino & Resort Could Be Risky Short-Term, Profitable Long-Term",https://www.fool.com/investing/2021/08/06/why-pushing-a-few-chips-onto-monarch-casino-resort/?source=eptyholnk0000202&utm_source=yahoo-host&utm_medium=feed&utm_campaign=article,Motley Fool
26,2021-07-28 17:15,Monarch Casino (MCRI) Q2 Earnings and Revenues Top Estimates,https://finance.yahoo.com/news/monarch-casino-mcri-q2-earnings-211509243.html,Zacks
27,2021-07-28 16:03,Monarch Casino & Resort Reports Record 2021 Second Quarter Financial Results,https://finance.yahoo.com/news/monarch-casino-resort-reports-record-200300916.html,GlobeNewswire
28,2021-07-21 15:02,Monarch Casino (MCRI) to Report Q2 Results: Wall Street Expects Earnings Growth,https://finance.yahoo.com/news/monarch-casino-mcri-report-q2-190207554.html,Zacks
29,2021-07-15 03:59,Capital Allocation Trends At Monarch Casino & Resort (NASDAQ:MCRI) Aren't Ideal,https://finance.yahoo.com/news/capital-allocation-trends-monarch-casino-075940884.html,Simply Wall St.
30,2021-07-12 08:32,Monarch Casino (MCRI) Stock Jumps 5.5%: Will It Continue to Soar?,https://finance.yahoo.com/news/monarch-casino-mcri-stock-jumps-123212162.html,Zacks
31,2021-06-18 11:39,"Sunrun is 'most compelling clean energy stock,' analyst argues",https://finance.yahoo.com/video/sunrun-most-compelling-clean-energy-153916770.html,Yahoo Finance Video
32,2021-06-09 04:30,"Is Monarch Casino & Resort, Inc.'s (NASDAQ:MCRI) Recent Stock Performance Influenced By Its Financials In Any Way?",https://finance.yahoo.com/news/monarch-casino-resort-inc-nasdaq-083023671.html,Simply Wall St.
33,2021-05-10 07:02,"Is Monarch Casino & Resort, Inc. (NASDAQ:MCRI) Trading At A 48% Discount?",https://finance.yahoo.com/news/monarch-casino-resort-inc-nasdaq-110257579.html,Simply Wall St.
34,2021-05-01 10:20,10 Best Las Vegas Stocks to Buy Now,https://finance.yahoo.com/news/10-best-las-vegas-stocks-142000170.html,Insider Monkey
35,2021-04-28 18:55,Monarch Casino (MCRI) Q1 Earnings and Revenues Surpass Estimates,https://finance.yahoo.com/news/monarch-casino-mcri-q1-earnings-225510392.html,Zacks
36,2021-04-28 16:03,Monarch Casino & Resort Reports Record Financial Results For 2021 First Quarter,https://finance.yahoo.com/news/monarch-casino-resort-reports-record-200300574.html,GlobeNewswire
37,2021-03-29 04:54,The Monarch Casino & Resort (NASDAQ:MCRI) Share Price Is Up 229% And Shareholders Are Boasting About It,https://finance.yahoo.com/news/monarch-casino-resort-nasdaq-mcri-085457012.html,Simply Wall St.
38,2021-03-10 13:55,Top Casino Stocks for Q2 2021,https://www.investopedia.com/top-casino-stocks-5078278?utm_campaign=quote-yahoo&utm_source=yahoo&utm_medium=referral,Investopedia
39,2021-02-25 02:55,"What Is Monarch Casino & Resort, Inc.'s (NASDAQ:MCRI) Share Price Doing?",https://finance.yahoo.com/news/monarch-casino-resort-inc-nasdaq-075510051.html,Simply Wall St.
40,2021-02-24 16:22,Monarch Casino & Resort: Q4 Earnings Insights,https://finance.yahoo.com/news/monarch-casino-resort-q4-earnings-212210376.html,Benzinga
41,2021-02-24 16:03,"Monarch Casino & Resort Reports Fourth Quarter 2020 Net Revenue of $58.4 Million, Net Income of $15.3 Million and Adjusted EBITDA of $13.9 Million",https://finance.yahoo.com/news/monarch-casino-resort-reports-fourth-210300824.html,GlobeNewswire
42,2021-02-03 07:30,This Fund Doesnt Need Tech Stocks to Stay on Top,https://www.barrons.com/articles/small-cap-mutual-fund-tech-stocks-51612307908?siteid=yhoof2,Barrons.com
43,2021-01-26 02:58,We're Watching These Trends At Monarch Casino & Resort (NASDAQ:MCRI),https://finance.yahoo.com/news/were-watching-trends-monarch-casino-075801467.html,Simply Wall St.
44,2021-01-18 08:01,Wynn Resorts (WYNN) WynnBET Expands Online Betting Presence,https://finance.yahoo.com/news/wynn-resorts-wynn-wynnbet-expands-130101233.html,Zacks
45,2020-12-29 09:39,3 Gaming Stocks Poised to Beat Coronavirus Woes,https://finance.yahoo.com/news/3-gaming-stocks-poised-beat-143902409.html,Zacks
46,2020-12-27 03:51,"Monarch Casino & Resort, Inc. (NASDAQ:MCRI) Stock Is Going Strong But Fundamentals Look Uncertain: What Lies Ahead ?",https://finance.yahoo.com/news/monarch-casino-resort-inc-nasdaq-085115748.html,Simply Wall St.
47,2020-12-24 07:00,Davenport Small Cap Focus (DSCPX) Clobbers the Broader Market,https://finance.yahoo.com/news/davenport-small-cap-focus-dscpx-120003293.html,Kiplinger
48,2020-12-22 13:05,"The Zacks Analyst Blog Highlights: CROX, VSTO, YETI, KTB and MCRI",https://finance.yahoo.com/news/zacks-analyst-blog-highlights-crox-180506612.html,Zacks
49,2020-12-22 12:27,"Zacks.com featured highlights include: MCRI, FCAU, PIPR, NPO and INMD",https://finance.yahoo.com/news/zacks-com-featured-highlights-mcri-172705944.html,Zacks
50,2020-12-21 07:59,5 Stocks With Recent Price Strength as Indexes Hit Record High,https://finance.yahoo.com/news/5-stocks-recent-price-strength-125912470.html,Zacks
51,2020-12-17 05:00,Biden campaign made decisions on probability of a polling error: Annie Duke,https://finance.yahoo.com/video/biden-campaign-made-decisions-probability-100000788.html,Yahoo Finance Video
52,2020-12-17 04:00,Influencers with Andy Serwer: Annie Duke,https://finance.yahoo.com/video/influencers-andy-serwer-annie-duke-090000047.html,Yahoo Finance Video
53,2020-12-10 08:35,Is MCRI A Good Stock To Buy Now?,https://finance.yahoo.com/news/mcri-good-stock-buy-now-133508125.html,Insider Monkey
54,2020-12-01 18:39,Monarch Casino Resort Spa Applauds the Black Hawk City Council for Removing the $100 Limit on Single Bets and Approving Additional Casino Games,https://finance.yahoo.com/news/monarch-casino-resort-spa-applauds-233900708.html,GlobeNewswire
55,2020-11-30 02:00,"A Look At The Intrinsic Value Of Monarch Casino & Resort, Inc. (NASDAQ:MCRI)",https://finance.yahoo.com/news/look-intrinsic-value-monarch-casino-070043705.html,Simply Wall St.
56,2020-11-16 17:15,Phase I of Monarch Casino Resort Spa Black Hawk Expansion to Debut November 19,https://finance.yahoo.com/news/phase-monarch-casino-resort-spa-221500655.html,GlobeNewswire
57,2020-11-02 06:23,"Monarch Casino & Resort, Inc. Just Beat EPS By 199%: Here's What Analysts Think Will Happen Next",https://finance.yahoo.com/news/monarch-casino-resort-inc-just-112324542.html,Simply Wall St.
58,2020-10-30 11:38,MGM Resorts (MGM) Posts Narrower-than-Expected Loss in Q3,https://finance.yahoo.com/news/mgm-resorts-mgm-posts-narrower-153803748.html,Zacks
59,2020-10-29 16:03,Monarch Casino & Resort Reports Third Quarter 2020 Financial Results; Record Setting Quarterly EBITDA of $20.7 Million,https://finance.yahoo.com/news/monarch-casino-resort-reports-third-200300176.html,GlobeNewswire
60,2020-10-21 10:05,How Much is Monarch Casino & Resort's (NASDAQ:MCRI) CEO Getting Paid?,https://finance.yahoo.com/news/much-monarch-casino-resorts-nasdaq-140512742.html,Simply Wall St.
61,2020-09-25 12:24,Did You Miss Monarch Casino & Resort's (NASDAQ:MCRI) Impressive 146% Share Price Gain?,https://finance.yahoo.com/news/did-miss-monarch-casino-resorts-162448635.html,Simply Wall St.
62,2020-08-30 10:01,"Getting In Cheap On Monarch Casino & Resort, Inc. (NASDAQ:MCRI) Might Be Difficult",https://finance.yahoo.com/news/getting-cheap-monarch-casino-resort-140144285.html,Simply Wall St.
63,2020-08-19 09:33,"Zacks Industry Outlook Highlights: Wynn Resorts, Las Vegas Sands, MGM Resorts, International Game Technology, Monarch Casino & Resort and Red Rock Resorts",https://finance.yahoo.com/news/zacks-industry-outlook-highlights-wynn-133301014.html,Zacks
64,2020-08-11 07:13,"Monarch Casino & Resort, Inc. (NASDAQ:MCRI) Not Lagging Market On Growth Or Pricing",https://finance.yahoo.com/news/monarch-casino-resort-inc-nasdaq-111348789.html,Simply Wall St.
65,2020-07-27 07:06,"Monarch Casino & Resort, Inc. (NASDAQ:MCRI) Just Reported And Analysts Have Been Lifting Their Price Targets",https://finance.yahoo.com/news/monarch-casino-resort-inc-nasdaq-110640457.html,Simply Wall St.
66,2020-07-22 16:03,Monarch Casino & Resort Reports Second Quarter 2020 Financial Results,https://finance.yahoo.com/news/monarch-casino-resort-reports-second-200300845.html,GlobeNewswire
67,2020-07-18 03:00,"Looking for a new job in Colorado? Monarch Casino Resort Spa in cool, beautiful Black Hawk is hiring hundreds of new Team Members!",https://finance.yahoo.com/news/looking-job-colorado-monarch-casino-070010632.html,GlobeNewswire
68,2020-07-02 18:54,"3 Casino Stocks to Buy, Despite Covid-19 Concerns",https://www.barrons.com/articles/3-regional-casino-stocks-to-buy-despite-covid-19-concerns-51593715560?siteid=yhoof2,Barrons.com
69,2020-06-27 14:28,"Hedge Funds Are Buying Monarch Casino & Resort, Inc. (MCRI)",https://finance.yahoo.com/news/hedge-funds-buying-monarch-casino-182836370.html,Insider Monkey
70,2020-06-18 11:10,"Is Monarch Casino & Resort, Inc. (NASDAQ:MCRI) Trading At A 36% Discount?",https://finance.yahoo.com/news/monarch-casino-resort-inc-nasdaq-151034006.html,Simply Wall St.
71,2020-06-08 11:48,"Casino stocks skyrocket after reopening, U.S. airlines add flights amid pandemic",https://finance.yahoo.com/video/casino-stocks-skyrocket-reopening-u-154831734.html,Yahoo Finance Video
72,2020-06-03 16:15,Las Vegas revenue to make a full recovery to 2019 levels around 2023: Analyst,https://finance.yahoo.com/video/gaming-sector-outlook-casinos-prep-201537080.html,Yahoo Finance Video
73,2020-05-27 12:28,Why Monarch Casino & Resort's Stock Is Trading Higher Today,https://finance.yahoo.com/news/why-monarch-casino-resorts-stock-162842929.html,Benzinga
74,2020-04-27 11:15,Monarch Casino Stock Breaks Out After Analyst Upgrade,https://www.investopedia.com/monarch-casino-stock-breaks-out-after-analyst-upgrade-4843283?utm_campaign=quote-yahoo&utm_source=yahoo&utm_medium=referral,Investopedia
75,2020-04-22 18:35,Monarch Casino (MCRI) Misses Q1 Earnings and Revenue Estimates,https://finance.yahoo.com/news/monarch-casino-mcri-misses-q1-223510745.html,Zacks
76,2020-04-22 16:03,Monarch Casino & Resort Reports First Quarter 2020 Financial Results,https://finance.yahoo.com/news/monarch-casino-resort-reports-first-200310400.html,GlobeNewswire
77,2020-04-15 12:31,Earnings Preview: Monarch Casino (MCRI) Q1 Earnings Expected to Decline,https://finance.yahoo.com/news/earnings-preview-monarch-casino-mcri-163104344.html,Zacks
78,2020-04-08 14:18,6 Profitable Companies Trading at a Discount,https://finance.yahoo.com/news/6-profitable-companies-trading-discount-181841159.html,GuruFocus.com
79,2020-03-26 09:44,Stranahan's owner plans to build $50 million whiskey resort in Black Hawk,https://www.bizjournals.com/denver/news/2020/03/26/stranahans-lake-gulch-whiskey-resort-black-hawk.html?ana=yahoo,American City Business Journals
80,2020-03-18 14:44,Caesars Entertainment announces temporary shutdown of properties,https://finance.yahoo.com/video/caesars-entertainment-announces-temporary-shutdown-184456849.html,Yahoo Finance Video
81,2020-03-18 12:02,MONARCH CASINO & RESORT TEMPORARILY SUSPENDS OPERATIONS AT ATLANTIS CASINO RESORT SPA,https://finance.yahoo.com/news/monarch-casino-resort-temporarily-suspends-160240433.html,GlobeNewswire
82,2020-03-17 17:09,MONARCH CASINO & RESORT TEMPORARILY SUSPENDS OPERATIONS AT MONARCH CASINO BLACK HAWK,https://finance.yahoo.com/news/monarch-casino-resort-temporarily-suspends-210919253.html,GlobeNewswire
83,2020-03-11 17:55,Monarch Casino (MCRI) Q4 Earnings Surpass Estimates,https://finance.yahoo.com/news/monarch-casino-mcri-q4-earnings-215509196.html,Zacks
84,2020-03-11 16:03,"MONARCH CASINO & RESORT REPORTS FOURTH QUARTER 2019 RECORD NET REVENUE OF $62.1 MILLION, NET INCOME OF $6.2 MILLION AND ADJUSTED EBITDA OF $14.1 MILLION",https://finance.yahoo.com/news/monarch-casino-resort-reports-fourth-200310932.html,GlobeNewswire
85,2020-03-10 10:30,"A Sliding Share Price Has Us Looking At Monarch Casino & Resort, Inc.'s (NASDAQ:MCRI) P/E Ratio",https://finance.yahoo.com/news/sliding-share-price-us-looking-143048304.html,Simply Wall St.
86,2020-03-08 17:58,3 Stocks Growing Capex Fast,https://finance.yahoo.com/news/3-stocks-growing-capex-fast-215805563.html,GuruFocus.com
87,2020-02-28 10:42,"Do Monarch Casino & Resort, Inc.s (NASDAQ:MCRI) Returns On Capital Employed Make The Cut?",https://finance.yahoo.com/news/monarch-casino-resort-inc-nasdaq-154223286.html,Simply Wall St.
88,2020-02-05 09:17,Announcing: Monarch Casino & Resort (NASDAQ:MCRI) Stock Increased An Energizing 220% In The Last Five Years,https://finance.yahoo.com/news/announcing-monarch-casino-resort-nasdaq-141709107.html,Simply Wall St.
89,2020-01-13 10:24,"Does Monarch Casino & Resort, Inc. (NASDAQ:MCRI) Have A Volatile Share Price?",https://finance.yahoo.com/news/does-monarch-casino-resort-inc-152429004.html,Simply Wall St.
90,2019-12-31 17:06,Local charities are the winners this holiday season thanks to donations through Monarch Casino Resort Spa,https://finance.yahoo.com/news/local-charities-winners-holiday-season-220608460.html,GlobeNewswire
91,2019-12-19 21:37,"Hedge Funds Are Betting On Monarch Casino & Resort, Inc. (MCRI)",https://finance.yahoo.com/news/hedge-funds-betting-monarch-casino-023750526.html,Insider Monkey
92,2019-12-19 12:41,"Can Monarch Casino & Resort, Inc. (NASDAQ:MCRI) Improve Its Returns?",https://finance.yahoo.com/news/monarch-casino-resort-inc-nasdaq-174144676.html,Simply Wall St.
93,2019-12-09 08:35,New Strong Sell Stocks for December 9th,https://finance.yahoo.com/news/strong-sell-stocks-december-9th-133501169.html,Zacks
94,2019-11-28 06:43,"Is Monarch Casino & Resort, Inc. (NASDAQ:MCRI) Potentially Undervalued?",https://finance.yahoo.com/news/monarch-casino-resort-inc-nasdaq-114355930.html,Simply Wall St.
95,2019-11-09 19:03,"Were Hedge Funds Right About Souring On Monarch Casino & Resort, Inc. (MCRI)?",https://finance.yahoo.com/news/were-hedge-funds-souring-monarch-000333647.html,Insider Monkey
96,2019-11-08 09:27,"Is There An Opportunity With Monarch Casino & Resort, Inc.'s (NASDAQ:MCRI) 40% Undervaluation?",https://finance.yahoo.com/news/opportunity-monarch-casino-resort-inc-142746841.html,Simply Wall St.
97,2019-10-30 19:35,Monarch Casino (MCRI) Q3 Earnings and Revenues Miss Estimates,https://finance.yahoo.com/news/monarch-casino-mcri-q3-earnings-233511399.html,Zacks
98,2019-10-30 16:03,"Monarch Casino & Resort Reports Third Quarter Net Revenue of $65.6 Million, Net Income of $9.3 Million and Adjusted EBITDA of $17.4 Million",https://finance.yahoo.com/news/monarch-casino-resort-reports-third-200305652.html,GlobeNewswire
99,2019-10-24 14:02,"Does Monarch Casino & Resort, Inc.'s (NASDAQ:MCRI) CEO Salary Compare Well With Others?",https://finance.yahoo.com/news/does-monarch-casino-resort-inc-180254917.html,Simply Wall St.
