,Date,News Headline,Article Link,Source
0,2022-02-17 09:02,Altisource Portfolio Solutions S.A. Schedules Fourth Quarter 2021 Conference Call,https://finance.yahoo.com/news/altisource-portfolio-solutions-schedules-fourth-140200168.html,GlobeNewswire
1,2022-02-06 06:20,Do Insiders Own Lots Of Shares In Altisource Portfolio Solutions S.A. (NASDAQ:ASPS)?,https://finance.yahoo.com/news/insiders-own-lots-shares-altisource-112025740.html,Simply Wall St.
2,2021-12-08 04:45,Analysts Expect Breakeven For Altisource Portfolio Solutions S.A. (NASDAQ:ASPS) Before Long,https://finance.yahoo.com/news/analysts-expect-breakeven-altisource-portfolio-094522324.html,Simply Wall St.
3,2021-12-01 10:38,Altisource Announces the Completion of the Sale of Its Pointillist Subsidiary,https://finance.yahoo.com/news/altisource-announces-completion-sale-pointillist-153800807.html,GlobeNewswire
4,2021-11-29 10:01,SFRhub.com Signs Technology Integration MOU with Altisource Creating SFR Investment Industrys Leading Single-Source Transactional Platform,https://finance.yahoo.com/news/sfrhub-com-signs-technology-integration-150100800.html,Business Wire
5,2021-11-04 19:32,Altisource Portfolio Solutions SA (ASPS) Q3 2021 Earnings Call Transcript,https://www.fool.com/earnings/call-transcripts/2021/11/04/altisource-portfolio-solutions-sa-asps-q3-2021-ear/?source=eptyholnk0000202&utm_source=yahoo-host&utm_medium=feed&utm_campaign=article,Motley Fool
6,2021-11-04 09:15,"Altisource Portfolio Solutions (ASPS) Reports Q3 Loss, Misses Revenue Estimates",https://finance.yahoo.com/news/altisource-portfolio-solutions-asps-reports-131501110.html,Zacks
7,2021-11-04 07:55,Altisource Announces Third Quarter 2021 Financial Results,https://finance.yahoo.com/news/altisource-announces-third-quarter-2021-115500153.html,GlobeNewswire
8,2021-10-26 12:30,Altisource Portfolio Solutions S.A. Schedules Third Quarter 2021 Conference Call,https://finance.yahoo.com/news/altisource-portfolio-solutions-schedules-third-163000032.html,GlobeNewswire
9,2021-10-19 08:50,"Despite Fast-paced Momentum, Altisource Portfolio (ASPS) Is Still a Bargain Stock",https://finance.yahoo.com/news/despite-fast-paced-momentum-altisource-125012752.html,Zacks
10,2021-10-15 09:00,"Tricia Migliazzo Joins Lenders One as Senior Vice President, Origination Sales",https://finance.yahoo.com/news/tricia-migliazzo-joins-lenders-one-130000546.html,GlobeNewswire
11,2021-10-09 08:39,"Altisource Portfolio Solutions (NASDAQ:ASPS) adds US$67m to market cap in the past 7 days, though investors from five years ago are still down 54%",https://finance.yahoo.com/news/altisource-portfolio-solutions-nasdaq-asps-123959494.html,Simply Wall St.
12,2021-10-08 05:36,Strength Seen in Altisource Portfolio (ASPS): Can Its 18.3% Jump Turn into More Strength?,https://finance.yahoo.com/news/strength-seen-altisource-portfolio-asps-093609731.html,Zacks
13,2021-10-07 08:29,Altisource Announces Definitive Agreement to Sell Pointillist Subsidiary,https://finance.yahoo.com/news/altisource-announces-definitive-agreement-sell-122900779.html,GlobeNewswire
14,2021-10-05 09:42,Altisource Offers Cryptocurrency Holders a Game-Changing Way to Buy Real Estate,https://finance.yahoo.com/news/altisource-offers-cryptocurrency-holders-game-134200025.html,GlobeNewswire
15,2021-09-07 18:33,Altisource Is Said to Tap Guggenheim for Lenders One Sale,https://finance.yahoo.com/news/altisource-portfolio-said-tap-guggenheim-182539629.html,Bloomberg
16,2021-08-05 09:00,Lenders One Launches New Solutions and Revenue Opportunities at Annual Summit,https://finance.yahoo.com/news/lenders-one-launches-solutions-revenue-130000931.html,GlobeNewswire
17,2021-07-29 10:15,"Altisource Portfolio Solutions (ASPS) Reports Q2 Loss, Lags Revenue Estimates",https://finance.yahoo.com/news/altisource-portfolio-solutions-asps-reports-141502431.html,Zacks
18,2021-07-29 07:10,Altisource Announces Second Quarter 2021 Financial Results,https://finance.yahoo.com/news/altisource-announces-second-quarter-2021-111000054.html,GlobeNewswire
19,2021-07-26 11:01,Altisource Portfolio Solutions S.A. Schedules Second Quarter 2021 Conference Call,https://finance.yahoo.com/news/altisource-portfolio-solutions-schedules-second-150100437.html,GlobeNewswire
20,2021-07-11 03:18,Here's What Altisource Portfolio Solutions S.A.'s (NASDAQ:ASPS) Shareholder Ownership Structure Looks Like,https://finance.yahoo.com/news/heres-altisource-portfolio-solutions-nasdaq-071825372.html,Simply Wall St.
21,2021-06-25 05:33,Strength Seen in Altisource Portfolio (ASPS): Can Its 19.7% Jump Turn into More Strength?,https://finance.yahoo.com/news/strength-seen-altisource-portfolio-asps-093309189.html,Zacks
22,2021-06-23 10:46,Altisource Signs Revolving Line of Credit Agreement,https://finance.yahoo.com/news/altisource-signs-revolving-line-credit-144600455.html,GlobeNewswire
23,2021-06-13 14:03,Is Altisource Portfolio Solutions (ASPS) A Good Investment?,https://finance.yahoo.com/news/altisource-portfolio-solutions-asps-good-180308344.html,Insider Monkey
24,2021-05-12 01:15,Here's Why It's Unlikely That Altisource Portfolio Solutions S.A.'s (NASDAQ:ASPS) CEO Will See A Pay Rise This Year,https://finance.yahoo.com/news/heres-why-unlikely-altisource-portfolio-051541569.html,Simply Wall St.
25,2021-05-10 17:00,Altisource Portfolio Solutions SA (ASPS) Q1 2021 Earnings Call Transcript,https://www.fool.com/earnings/call-transcripts/2021/05/10/altisource-portfolio-solutions-sa-asps-q1-2021-ear/?source=eptyholnk0000202&utm_source=yahoo-host&utm_medium=feed&utm_campaign=article,Motley Fool
26,2021-05-10 08:50,"Altisource Portfolio Solutions (ASPS) Reports Q1 Loss, Misses Revenue Estimates",https://finance.yahoo.com/news/altisource-portfolio-solutions-asps-reports-125012837.html,Zacks
27,2021-05-10 07:00,Altisource Announces First Quarter 2021 Financial Results,https://finance.yahoo.com/news/altisource-announces-first-quarter-2021-110000688.html,GlobeNewswire
28,2021-05-06 09:11,Altisource extends the term and expands its strategic service provider relationship with Ocwen,https://finance.yahoo.com/news/altisource-extends-term-expands-strategic-131100015.html,GlobeNewswire
29,2021-05-06 06:21,Altisource Portfolio (ASPS) Surges 23.3%: Is This an Indication of Further Gains?,https://finance.yahoo.com/news/altisource-portfolio-asps-surges-23-102110935.html,Zacks
30,2021-05-03 08:13,Altisource Portfolio Solutions S.A. Schedules First Quarter 2021 Conference Call,https://finance.yahoo.com/news/altisource-portfolio-solutions-schedules-first-121300192.html,GlobeNewswire
31,2021-04-22 12:33,Analysts Estimate Altisource Portfolio Solutions (ASPS) to Report a Decline in Earnings: What to Look Out for,https://finance.yahoo.com/news/analysts-estimate-altisource-portfolio-solutions-163304689.html,Zacks
32,2021-03-11 12:30,Altisource Portfolio Solutions SA (ASPS) Q4 2020 Earnings Call Transcript,https://www.fool.com/earnings/call-transcripts/2021/03/11/altisource-portfolio-solutions-sa-asps-q4-2020-ear/?source=eptyholnk0000202&utm_source=yahoo-host&utm_medium=feed&utm_campaign=article,Motley Fool
33,2021-03-11 08:45,"Altisource Portfolio Solutions (ASPS) Reports Q4 Loss, Tops Revenue Estimates",https://finance.yahoo.com/news/altisource-portfolio-solutions-asps-reports-134501915.html,Zacks
34,2021-03-11 07:16,Altisource Portfolio: Q4 Earnings Insights,https://finance.yahoo.com/news/altisource-portfolio-q4-earnings-insights-121615731.html,Benzinga
35,2021-03-11 07:03,Altisource Announces Fourth Quarter and Full Year 2020 Financial Results,https://finance.yahoo.com/news/altisource-announces-fourth-quarter-full-120300093.html,GlobeNewswire
36,2021-03-08 08:50,Altisource Portfolio Solutions S.A. Schedules Fourth Quarter and Full Year 2020 Conference Call,https://finance.yahoo.com/news/altisource-portfolio-solutions-schedules-fourth-135000504.html,GlobeNewswire
37,2021-02-27 01:56,"Could The Berkeley Lights, Inc. (NASDAQ:BLI) Ownership Structure Tell Us Something Useful?",https://finance.yahoo.com/news/could-berkeley-lights-inc-nasdaq-065634905.html,Simply Wall St.
38,2021-02-25 16:05,Berkeley Lights Reports Fourth Quarter and Full Year 2020 Results and Provides Outlook for Full Year 2021,https://finance.yahoo.com/news/berkeley-lights-reports-fourth-quarter-210500607.html,GlobeNewswire
39,2021-02-25 08:05,Berkeley Lights to Participate in the Cowen 41st Annual Healthcare Conference,https://finance.yahoo.com/news/berkeley-lights-participate-cowen-41st-130500280.html,GlobeNewswire
40,2021-02-18 18:28,"Justin Demola, CMB Promoted to Lenders One President",https://finance.yahoo.com/news/justin-demola-cmb-promoted-lenders-232800646.html,GlobeNewswire
41,2021-02-09 09:00,Lenders One Marks 20th Anniversary Year With Growth and Innovative Member Opportunities,https://finance.yahoo.com/news/lenders-one-marks-20th-anniversary-140000163.html,GlobeNewswire
42,2021-02-04 09:00,Altisources The State of the Originations Industry Report Gives Insight Into Lenders Challenges and Strategies,https://finance.yahoo.com/news/altisource-state-originations-industry-report-140000760.html,GlobeNewswire
43,2020-12-28 23:30,Altisource Portfolio Solutions' (NASDAQ:ASPS) Shareholders Are Down 54% On Their Shares,https://finance.yahoo.com/news/altisource-portfolio-solutions-nasdaq-asps-043028468.html,Simply Wall St.
44,2020-12-17 09:00,Granite Risk Management Launches one2one Remote Video Inspection Solution for Construction Projects,https://finance.yahoo.com/news/granite-risk-management-launches-one2one-140000461.html,GlobeNewswire
45,2020-12-02 20:49,Is Altisource Portfolio Solutions (ASPS) A Good Stock To Buy Now?,https://finance.yahoo.com/news/altisource-portfolio-solutions-asps-good-014956795.html,Insider Monkey
46,2020-12-01 09:00,Altisource Poised To Assist Servicers and Borrowers Post Forbearance,https://finance.yahoo.com/news/altisource-poised-assist-servicers-borrowers-140000851.html,GlobeNewswire
47,2020-10-30 07:05,Did Altisource Portfolio Solutions S.A. (NASDAQ:ASPS) Insiders Buy Up More Shares?,https://finance.yahoo.com/news/did-altisource-portfolio-solutions-nasdaq-110524363.html,Simply Wall St.
48,2020-10-30 03:30,Altisource Portfolio Solutions SA (ASPS) Q3 2020 Earnings Call Transcript,https://www.fool.com/earnings/call-transcripts/2020/10/30/altisource-portfolio-solutions-sa-asps-q3-2020-ear/?source=eptyholnk0000202&utm_source=yahoo-host&utm_medium=feed&utm_campaign=article,Motley Fool
49,2020-10-29 08:05,"Altisource Portfolio Solutions (ASPS) Reports Q3 Loss, Tops Revenue Estimates",https://finance.yahoo.com/news/altisource-portfolio-solutions-asps-reports-120512523.html,Zacks
50,2020-10-29 07:44,Recap: Altisource Portfolio Q3 Earnings,https://finance.yahoo.com/news/recap-altisource-portfolio-q3-earnings-114437644.html,Benzinga
51,2020-10-29 06:53,Altisource Announces Third Quarter 2020 Financial Results,https://finance.yahoo.com/news/altisource-announces-third-quarter-2020-105300642.html,GlobeNewswire
52,2020-10-27 09:00,Hubzu Launches New Mobile App,https://finance.yahoo.com/news/hubzu-launches-mobile-app-130000944.html,GlobeNewswire
53,2020-10-23 11:12,Altisource Portfolio Solutions S.A. Schedules Third Quarter 2020 Conference Call,https://finance.yahoo.com/news/altisource-portfolio-solutions-schedules-third-151200770.html,GlobeNewswire
54,2020-10-15 12:32,Analysts Estimate Altisource Portfolio Solutions (ASPS) to Report a Decline in Earnings: What to Look Out for,https://finance.yahoo.com/news/analysts-estimate-altisource-portfolio-solutions-163204984.html,Zacks
55,2020-10-14 11:53,"/C O R R E C T I O N -- Altisource Portfolio Solutions, S.A./",https://finance.yahoo.com/news/altisource-emails-directors-front-yard-171000822.html,PR Newswire
56,2020-10-07 19:01,Bill Erbey Calls on Front Yard Residential to Return Capital to Stockholders via an Orderly Liquidation,https://finance.yahoo.com/news/bill-erbey-calls-front-yard-230100749.html,PR Newswire
57,2020-09-22 09:00,Altisource Expands Its Offerings to Include Business Services Capabilities to Assist Servicers,https://finance.yahoo.com/news/altisource-expands-offerings-business-services-130000100.html,GlobeNewswire
58,2020-09-18 08:30,New Strong Sell Stocks for September 18th,https://finance.yahoo.com/news/strong-sell-stocks-september-18th-123012458.html,Zacks
59,2020-09-04 08:50,New Strong Sell Stocks for September 4th,https://finance.yahoo.com/news/strong-sell-stocks-september-4th-125012099.html,Zacks
60,2020-09-03 09:00,Vendorly Oversight Platform Helps Clients Mitigate Risk of Wire Fraud,https://finance.yahoo.com/news/vendorly-oversight-platform-helps-clients-130000186.html,GlobeNewswire
61,2020-08-27 09:19,New Strong Sell Stocks for August 27th,https://finance.yahoo.com/news/strong-sell-stocks-august-27th-131901512.html,Zacks
62,2020-08-21 16:00,OneSpan and LKQ See Activist Action,https://www.barrons.com/articles/onespan-and-lkq-see-activist-action-51598040000?siteid=yhoof2,Barrons.com
63,2020-08-06 13:15,"Altisource Portfolio Solutions (ASPS) Reports Q2 Loss, Tops Revenue Estimates",https://finance.yahoo.com/news/altisource-portfolio-solutions-asps-reports-171505543.html,Zacks
64,2020-08-06 07:20,Altisource Announces Second Quarter 2020 Financial Results,https://finance.yahoo.com/news/altisource-announces-second-quarter-2020-112000650.html,GlobeNewswire
65,2020-08-03 09:06,Altisource Portfolio Solutions S.A. Schedules Second Quarter 2020 Conference Call,https://finance.yahoo.com/news/altisource-portfolio-solutions-schedules-second-130600817.html,GlobeNewswire
66,2020-07-16 12:32,Analysts Estimate Altisource Portfolio Solutions (ASPS) to Report a Decline in Earnings: What to Look Out for,https://finance.yahoo.com/news/analysts-estimate-altisource-portfolio-solutions-163204274.html,Zacks
67,2020-07-09 09:00,Premium Title adds remote online notarization (RON) to make loan closings more efficient during COVID-19 pandemic and beyond,https://finance.yahoo.com/news/premium-title-adds-remote-online-130010206.html,GlobeNewswire
68,2020-06-30 11:26,Altisource Issues Statement on Front Yard Residential Corporations 2020 Annual Meeting of Shareholders,https://finance.yahoo.com/news/altisource-issues-statement-front-yard-152616592.html,GlobeNewswire
69,2020-06-23 09:00,Hubzu Expands Full Foreclosure Auction Services Into More States,https://finance.yahoo.com/news/hubzu-expands-full-foreclosure-auction-130010687.html,GlobeNewswire
70,2020-06-21 23:15,Hedge Funds Are Warming Up To Altisource Portfolio Solutions S.A. (ASPS),https://finance.yahoo.com/news/hedge-funds-warming-altisource-portfolio-031517273.html,Insider Monkey
71,2020-06-19 11:21,Altisource Suggests 10 Questions for Shareholders to Ask Front Yard Residential Corporation at Its Upcoming 2020 Annual Meeting of Shareholders,https://finance.yahoo.com/news/altisource-suggests-10-questions-shareholders-152152583.html,GlobeNewswire
72,2020-06-08 09:00,Altisource Issues Open Letter to Fellow Shareholders of Front Yard Residential Corporation,https://finance.yahoo.com/news/altisource-issues-open-letter-fellow-130049020.html,GlobeNewswire
73,2020-06-03 12:36,Edited Transcript of ASPS earnings conference call or presentation 30-Apr-20 12:30pm GMT,https://finance.yahoo.com/news/edited-transcript-asps-earnings-conference-042832206.html,Thomson Reuters StreetEvents
74,2020-05-14 09:00,Granite Risk Management Launches Remote Service to Provide Photo Documentation of Construction Projects During Pandemic,https://finance.yahoo.com/news/granite-risk-management-launches-remote-130010422.html,GlobeNewswire
75,2020-05-11 16:49,Altisource to Hold Previously Announced Annual Shareholders Meeting by Virtual Means,https://finance.yahoo.com/news/altisource-hold-previously-announced-annual-204931863.html,GlobeNewswire
76,2020-05-03 08:28,These Analysts Just Made An Incredible Downgrade To Their Altisource Portfolio Solutions S.A. (NASDAQ:ASPS) EPS Forecasts,https://finance.yahoo.com/news/analysts-just-made-incredible-downgrade-122822027.html,Simply Wall St.
77,2020-05-01 01:01,Altisource Portfolio Solutions SA (ASPS) Q1 2020 Earnings Call Transcript,https://www.fool.com/earnings/call-transcripts/2020/05/01/altisource-portfolio-solutions-sa-asps-q1-2020-ear.aspx?source=eptyholnk0000202&utm_source=yahoo-host&utm_medium=feed&utm_campaign=article,Motley Fool
78,2020-04-30 08:15,Altisource Portfolio Solutions (ASPS) Surpasses Q1 Earnings Estimates,https://finance.yahoo.com/news/altisource-portfolio-solutions-asps-surpasses-121512406.html,Zacks
79,2020-04-30 07:13,Recap: Altisource Portfolio Q1 Earnings,https://finance.yahoo.com/news/recap-altisource-portfolio-q1-earnings-111314335.html,Benzinga
80,2020-04-30 06:59,Altisource Announces First Quarter 2020 Financial Results,https://finance.yahoo.com/news/altisource-announces-first-quarter-2020-105957689.html,GlobeNewswire
81,2020-04-27 16:59,Altisource Portfolio Solutions S.A. Schedules First Quarter 2020 Conference Call,https://finance.yahoo.com/news/altisource-portfolio-solutions-schedules-first-205940251.html,GlobeNewswire
82,2020-04-16 12:31,Analysts Estimate Altisource Portfolio Solutions (ASPS) to Report a Decline in Earnings: What to Look Out for,https://finance.yahoo.com/news/analysts-estimate-altisource-portfolio-solutions-163104462.html,Zacks
83,2020-03-11 08:10,"If You Had Bought Altisource Portfolio Solutions (NASDAQ:ASPS) Stock Three Years Ago, You'd Be Sitting On A 70% Loss, Today",https://finance.yahoo.com/news/had-bought-altisource-portfolio-solutions-121058837.html,Simply Wall St.
84,2020-03-10 17:12,Edited Transcript of ASPS earnings conference call or presentation 5-Mar-20 10:00pm GMT,https://finance.yahoo.com/news/edited-transcript-asps-earnings-conference-154136919.html,Thomson Reuters StreetEvents
85,2020-03-05 18:45,Altisource Portfolio Solutions (ASPS) Lags Q4 Earnings Estimates,https://finance.yahoo.com/news/altisource-portfolio-solutions-asps-lags-234511067.html,Zacks
86,2020-03-05 16:03,Altisource Announces Fourth Quarter and Full Year 2019 Financial Results,https://finance.yahoo.com/news/altisource-announces-fourth-quarter-full-210302404.html,GlobeNewswire
87,2020-03-02 13:58,Altisource Portfolio Solutions S.A. Schedules Fourth Quarter and Full Year 2019 Conference Call,https://finance.yahoo.com/news/altisource-portfolio-solutions-schedules-fourth-185855663.html,GlobeNewswire
88,2020-03-02 08:30,"Lenders One Announces Member, Preferred Provider and Capital Markets Growth at Its March Summit",https://finance.yahoo.com/news/lenders-one-announces-member-preferred-133010575.html,GlobeNewswire
89,2020-02-20 10:08,Hubzu Identifies Top 25 Markets for REO Fix-and-Flip Properties,https://finance.yahoo.com/news/hubzu-identifies-top-25-markets-150810726.html,GlobeNewswire
90,2020-02-20 08:15,Altisource Releases Annual Report on the State of the Originations Industry,https://finance.yahoo.com/news/altisource-releases-annual-report-state-131510441.html,GlobeNewswire
91,2020-01-23 12:44,Altisource Releases Annual Report on the State of the Default Servicing Industry,https://finance.yahoo.com/news/altisource-releases-annual-report-state-174435729.html,GlobeNewswire
92,2020-01-13 17:05,Altisource Asset Management Corporation Announces Hiring of Co-Chief Executive Officer,https://finance.yahoo.com/news/altisource-asset-management-corporation-announces-220558997.html,GlobeNewswire
93,2020-01-09 05:18,Calculating The Fair Value Of Altisource Portfolio Solutions S.A. (NASDAQ:ASPS),https://finance.yahoo.com/news/calculating-fair-value-altisource-portfolio-101817478.html,Simply Wall St.
94,2019-12-17 19:20,Do Hedge Funds Love Altisource Portfolio Solutions S.A. (ASPS)?,https://finance.yahoo.com/news/hedge-funds-love-altisource-portfolio-002003900.html,Insider Monkey
95,2019-12-09 09:03,Vendorly Broadens Vendor Management Methodology to Incorporate Third-Party Originators,https://finance.yahoo.com/news/vendorly-broadens-vendor-management-methodology-140310763.html,GlobeNewswire
96,2019-11-07 14:48,Should You Avoid Altisource Portfolio Solutions S.A. (ASPS)?,https://finance.yahoo.com/news/avoid-altisource-portfolio-solutions-asps-194827501.html,Insider Monkey
97,2019-10-30 14:40,Edited Transcript of ASPS earnings conference call or presentation 24-Oct-19 12:30pm GMT,https://finance.yahoo.com/news/edited-transcript-asps-earnings-conference-165704819.html,Thomson Reuters StreetEvents
98,2019-10-24 08:25,Altisource Portfolio Solutions (ASPS) Q3 Earnings and Revenues Miss Estimates,https://finance.yahoo.com/news/altisource-portfolio-solutions-asps-q3-122512928.html,Zacks
99,2019-10-24 07:07,Altisource Announces Third Quarter 2019 Financial Results,https://finance.yahoo.com/news/altisource-announces-third-quarter-2019-110704099.html,GlobeNewswire
