,Date,News Headline,Article Link,Source
0,2022-02-24 16:15,"Gaming and Leisure Properties, Inc. Reports Fourth Quarter 2021 Results",https://finance.yahoo.com/news/gaming-leisure-properties-inc-reports-211500433.html,GlobeNewswire
1,2022-02-24 06:15,Boyd Gaming's (NYSE:BYD) five-year total shareholder returns outpace the underlying earnings growth,https://finance.yahoo.com/news/boyd-gamings-nyse-byd-five-111554207.html,Simply Wall St.
2,2022-02-22 17:19,Boyd Gaming Corporation -- Moody's announces completion of a periodic review of ratings of Boyd Gaming Corporation,https://finance.yahoo.com/news/boyd-gaming-corporation-moodys-announces-221908446.html,Moody's
3,2022-02-13 11:20,DraftKings Isnt the Best Way to Play the Online Gambling Boom. Buy These 6 Stocks Instead.,https://www.barrons.com/articles/online-gambling-stocks-buy-51644615283?siteid=yhoof2,Barrons.com
4,2022-02-11 18:13,6 Stocks to Play the Online Gambling Boom,https://www.barrons.com/articles/online-gambling-stocks-51644615283?siteid=yhoof2,Barrons.com
5,2022-02-11 17:32,6 Stocks to Play the Online Gambling Boom,https://www.barrons.com/articles/6-stocks-to-play-online-gambling-boom-51644618754?siteid=yhoof2,Barrons.com
6,2022-02-11 16:59,"Gambling Stock Boyd Gaming, IBD Stock Of The Day, Races Past Buy Point Ahead Of Super Bowl",https://www.investors.com/research/ibd-stock-of-the-day/gambling-stock-boyd-gaming-ibd-stock-of-the-day-races-past-buy-point-ahead-of-super-bowl/?src=A00220,Investor's Business Daily
7,2022-02-10 11:24,Super Bowl merch: Fanatics founder details built-up demand for Bengals gear,https://finance.yahoo.com/video/super-bowl-merch-fanatics-founder-162405123.html,Yahoo Finance Video
8,2022-02-06 15:27,How Did Hedge Funds Boyd Gaming Corporation (BYD) Bets Fare?,https://finance.yahoo.com/news/did-hedge-funds-boyd-gaming-202737548.html,Insider Monkey
9,2022-02-04 13:15,Boyd Gaming Corporation -- Moody's upgrades Boyd Gaming's CFR to B1; outlook stable,https://finance.yahoo.com/news/boyd-gaming-corporation-moodys-upgrades-181506403.html,Moody's
10,2022-02-04 10:01,Boyd Gaming (BYD) Q4 Earnings & Revenues Beat Estimates,https://finance.yahoo.com/news/boyd-gaming-byd-q4-earnings-150103042.html,Zacks
11,2022-02-03 23:00,Boyd Gaming (BYD) Q4 2021 Earnings Call Transcript,https://www.fool.com/earnings/call-transcripts/2022/02/03/boyd-gaming-byd-q4-2021-earnings-call-transcript/?source=eptyholnk0000202&utm_source=yahoo-host&utm_medium=feed&utm_campaign=article,Motley Fool
12,2022-02-03 18:05,Boyd Gaming (BYD) Beats Q4 Earnings and Revenue Estimates,https://finance.yahoo.com/news/boyd-gaming-byd-beats-q4-230511427.html,Zacks
13,2022-02-03 16:05,"Boyd Gaming Reports Fourth-Quarter, Full-Year 2021 Results",https://finance.yahoo.com/news/boyd-gaming-reports-fourth-quarter-210500993.html,Business Wire
14,2022-02-03 13:38,"Curated Wealth Partners LLC Buys Ares Management Corp, iShares Russell 2000 ETF, Boyd Gaming ...",https://finance.yahoo.com/news/curated-wealth-partners-llc-buys-183840820.html,GuruFocus.com
15,2022-02-03 08:37,Hasbro (HAS) Gears Up for Q4 Earnings: What's in Store?,https://finance.yahoo.com/news/hasbro-gears-q4-earnings-whats-133701728.html,Zacks
16,2022-02-01 12:06,Boyd Gaming (BYD) Gears Up for Q4 Earnings: What's in Store?,https://finance.yahoo.com/news/boyd-gaming-byd-gears-q4-170605308.html,Zacks
17,2022-02-01 11:31,Factors Setting the Tone for Royal Caribbean (RCL) Q4 Earnings,https://finance.yahoo.com/news/factors-setting-tone-royal-caribbean-163104497.html,Zacks
18,2022-02-01 09:38,Cozad Asset Management Inc Buys First Trust Lunt U.S. ...,https://finance.yahoo.com/news/cozad-asset-management-inc-buys-143824769.html,GuruFocus.com
19,2022-01-31 11:59,Vista Outdoor (VSTO) to Post Q3 Earnings: What's in Store?,https://finance.yahoo.com/news/vista-outdoor-vsto-post-q3-165904561.html,Zacks
20,2022-01-31 11:55,What's in Store for OneWater Marine's (ONEW) Q1 Earnings?,https://finance.yahoo.com/news/whats-store-onewater-marines-onew-165504299.html,Zacks
21,2022-01-31 11:09,Top Sports Betting Stocks for Q1 2022,https://www.investopedia.com/top-sports-betting-stocks-5216133?utm_campaign=quote-yahoo&utm_source=yahoo&utm_medium=referral,Investopedia
22,2022-01-31 08:12,Factors Setting the Tone for Penn National (PENN) Q4 Earnings,https://finance.yahoo.com/news/factors-setting-tone-penn-national-131201449.html,Zacks
23,2022-01-28 11:23,Red Rock Resorts (RRR) to Report Q4 Earnings: What's in Store?,https://finance.yahoo.com/news/red-rock-resorts-rrr-report-162304455.html,Zacks
24,2022-01-28 10:57,Boyd Gaming (BYD) Launches Sports Betting in Louisiana,https://finance.yahoo.com/news/boyd-gaming-byd-launches-sports-155703120.html,Zacks
25,2022-01-27 15:01,Boyd Gaming (BYD) Earnings Expected to Grow: Should You Buy?,https://finance.yahoo.com/news/boyd-gaming-byd-earnings-expected-200108603.html,Zacks
26,2022-01-27 10:15,FanDuel Group and Boyd Gaming Launch Mobile and Retail Sports Betting Across Louisiana,https://finance.yahoo.com/news/fanduel-group-boyd-gaming-launch-151500128.html,PR Newswire
27,2022-01-25 10:51,Is Boyd Gaming Corp. (BYD) A Smart Long-Term Buy?,https://finance.yahoo.com/news/boyd-gaming-corp-byd-smart-155110798.html,Insider Monkey
28,2022-01-19 12:10,Can Boyd (BYD) Keep the Earnings Surprise Streak Alive?,https://finance.yahoo.com/news/boyd-byd-keep-earnings-surprise-171005681.html,Zacks
29,2022-01-06 14:00,"Boyd Gaming Donates More Than $180,000 Through Wreaths and Trees of Hope Competitions",https://finance.yahoo.com/news/boyd-gaming-donates-more-180-190000361.html,Business Wire
30,2022-01-05 14:20,Top Casino Stocks for Q1 2022,https://www.investopedia.com/top-casino-stocks-5078278?utm_campaign=quote-yahoo&utm_source=yahoo&utm_medium=referral,Investopedia
31,2022-01-03 09:00,"Boyd Gaming to Report Fourth-Quarter, Full-Year 2021 Results, Host Conference Call and Webcast on February 3",https://finance.yahoo.com/news/boyd-gaming-report-fourth-quarter-140000357.html,Business Wire
32,2021-12-30 18:00,Boyd Gaming (BYD) Gains As Market Dips: What You Should Know,https://finance.yahoo.com/news/boyd-gaming-byd-gains-market-230011505.html,Zacks
33,2021-12-27 13:38,"Zeke Capital Advisors, Llc Buys Boyd Gaming Corp, Amazon.com Inc, Salesforce. ...",https://finance.yahoo.com/news/zeke-capital-advisors-llc-buys-183802357.html,GuruFocus.com
34,2021-12-26 06:39,Should You Be Impressed By Boyd Gaming Corporation's (NYSE:BYD) ROE?,https://finance.yahoo.com/news/impressed-boyd-gaming-corporations-nyse-113922168.html,Simply Wall St.
35,2021-12-24 17:50,Boyd Gaming (BYD) Outpaces Stock Market Gains: What You Should Know,https://finance.yahoo.com/news/boyd-gaming-byd-outpaces-stock-225010615.html,Zacks
36,2021-12-22 18:00,Boyd Gaming (BYD) Gains But Lags Market: What You Should Know,https://finance.yahoo.com/news/boyd-gaming-byd-gains-lags-230011414.html,Zacks
37,2021-12-18 02:38,Morgan Stanley Variable Insurance Fund Inc. ...,https://finance.yahoo.com/news/morgan-stanley-variable-insurance-fund-073803723.html,GuruFocus.com
38,2021-12-17 17:38,"Power Momentum Index VIT Fund Buys Targa Resources Corp, Boyd Gaming Corp, Alliance Data ...",https://finance.yahoo.com/news/power-momentum-index-vit-fund-223803903.html,GuruFocus.com
39,2021-12-13 19:38,"DWS CROCI(R) U.S. Fund Buys SS&C Technologies Holdings Inc, Meta Platforms Inc, Johnson ...",https://finance.yahoo.com/news/dws-croci-r-u-fund-003807601.html,GuruFocus.com
40,2021-12-13 16:38,"Dws Croci(r) U.s. Vip Buys SS&C Technologies Holdings Inc, Meta Platforms Inc, Johnson ...",https://finance.yahoo.com/news/dws-croci-r-u-vip-213804199.html,GuruFocus.com
41,2021-12-08 16:05,Hedge Funds Have Never Been This Bullish On Boyd Gaming Corporation (BYD),https://finance.yahoo.com/news/hedge-funds-never-bullish-boyd-210521538.html,Insider Monkey
42,2021-11-30 14:51,Should Value Investors Consider Boyd Gaming (BYD) Stock?,https://finance.yahoo.com/news/value-investors-consider-boyd-gaming-195107563.html,Zacks
43,2021-11-29 08:04,Here's Why Investor Should Retain Boyd Gaming (BYD) Stock,https://finance.yahoo.com/news/heres-why-investor-retain-boyd-130401060.html,Zacks
44,2021-11-25 11:31,Boyd (BYD) Down 7.9% Since Last Earnings Report: Can It Rebound?,https://finance.yahoo.com/news/boyd-byd-down-7-9-163104166.html,Zacks
45,2021-11-12 06:30,The 10 Largest Gambling Stocks of 2021,https://finance.yahoo.com/news/10-largest-gambling-stocks-2021-113042354.html,Insider Monkey
46,2021-11-04 08:02,MGM Resorts (MGM) Stock Gains on Q3 Earnings & Revenues Beat,https://finance.yahoo.com/news/mgm-resorts-mgm-stock-gains-120212501.html,Zacks
47,2021-11-03 10:42,Red Rock Resorts (RRR) Q3 Earnings & Revenues Top Estimates,https://finance.yahoo.com/news/red-rock-resorts-rrr-q3-144202737.html,Zacks
48,2021-11-02 11:30,Is Boyd Gaming (BYD) Stock Outpacing Its Consumer Discretionary Peers This Year?,https://finance.yahoo.com/news/boyd-gaming-byd-stock-outpacing-153003102.html,Zacks
49,2021-11-02 09:25,New Strong Buy Stocks for November 2nd,https://finance.yahoo.com/news/strong-buy-stocks-november-2nd-132501710.html,Zacks
50,2021-10-29 11:27,New Strong Buy Stocks for October 29th,https://finance.yahoo.com/news/strong-buy-stocks-october-29th-152703004.html,Zacks
51,2021-10-27 11:04,"Boyd Gaming (BYD) Q3 Earnings Beat Estimates, Increase Y/Y",https://finance.yahoo.com/news/boyd-gaming-byd-q3-earnings-150403194.html,Zacks
52,2021-10-27 07:17,Are Investors Undervaluing Boyd Gaming Corporation (NYSE:BYD) By 38%?,https://finance.yahoo.com/news/investors-undervaluing-boyd-gaming-corporation-111739166.html,Simply Wall St.
53,2021-10-26 21:00,Boyd Gaming Corp (BYD) Q3 2021 Earnings Call Transcript,https://www.fool.com/earnings/call-transcripts/2021/10/26/boyd-gaming-corp-byd-q3-2021-earnings-call-transcr/?source=eptyholnk0000202&utm_source=yahoo-host&utm_medium=feed&utm_campaign=article,Motley Fool
54,2021-10-26 17:25,Boyd Gaming (BYD) Beats Q3 Earnings and Revenue Estimates,https://finance.yahoo.com/news/boyd-gaming-byd-beats-q3-212509961.html,Zacks
55,2021-10-26 16:05,Boyd Gaming Reports Third-Quarter 2021 Results,https://finance.yahoo.com/news/boyd-gaming-reports-third-quarter-200500710.html,Business Wire
56,2021-10-25 09:31,Factors Setting the Tone for Boyd Gaming's (BYD) Q3 Earnings,https://finance.yahoo.com/news/factors-setting-tone-boyd-gamings-133101137.html,Zacks
57,2021-10-22 11:50,Is Boyd Gaming (BYD) Stock Undervalued Right Now?,https://finance.yahoo.com/news/boyd-gaming-byd-stock-undervalued-155003573.html,Zacks
58,2021-10-22 10:16,"Rogers Communications (RCI) Q3 Earnings In Line, Revenues Lag",https://finance.yahoo.com/news/rogers-communications-rci-q3-earnings-141602467.html,Zacks
59,2021-10-22 10:00,Boyd Gaming (BYD) is a Top-Ranked Growth Stock: Should You Buy?,https://finance.yahoo.com/news/boyd-gaming-byd-top-ranked-140002477.html,Zacks
60,2021-10-22 09:09,Wall Street Analysts Predict a 25% Upside in Boyd (BYD): Here's What You Should Know,https://finance.yahoo.com/news/wall-street-analysts-predict-25-130901256.html,Zacks
61,2021-10-21 12:00,Here's Why Boyd Gaming (BYD) is a Great Momentum Stock to Buy,https://finance.yahoo.com/news/heres-why-boyd-gaming-byd-160004453.html,Zacks
62,2021-10-21 11:16,Wells Fargo: These 3 Stocks Are Poised to Surge by at Least 40%,https://finance.yahoo.com/news/wells-fargo-3-stocks-poised-151628025.html,TipRanks
63,2021-10-21 09:39,New Strong Buy Stocks for October 21st,https://finance.yahoo.com/news/strong-buy-stocks-october-21st-133901852.html,Zacks
64,2021-10-21 06:56,Looking for Earnings Beat? Play These 5 Stocks,https://finance.yahoo.com/news/looking-earnings-beat-play-5-105610367.html,Zacks
65,2021-10-19 15:01,Boyd Gaming (BYD) Earnings Expected to Grow: What to Know Ahead of Next Week's Release,https://finance.yahoo.com/news/boyd-gaming-byd-earnings-expected-190107641.html,Zacks
66,2021-10-18 12:10,Why Boyd (BYD) is Poised to Beat Earnings Estimates Again,https://finance.yahoo.com/news/why-boyd-byd-poised-beat-161004909.html,Zacks
67,2021-10-18 09:55,"Corsair (CRSR) Issues Preliminary Q3 Results, Trims Guidance",https://finance.yahoo.com/news/corsair-crsr-issues-preliminary-q3-135501744.html,Zacks
68,2021-10-15 11:30,Is Boyd Gaming (BYD) Outperforming Other Consumer Discretionary Stocks This Year?,https://finance.yahoo.com/news/boyd-gaming-byd-outperforming-other-153003548.html,Zacks
69,2021-10-13 16:18,"Dow Jones Erases Losses, Nasdaq Climbs; These Bank Earnings Beat Estimates",https://www.investors.com/market-trend/stock-market-today/dow-jones-erases-losses-nasdaq-climbs-these-bank-earnings-beat-estimates/?src=A00220,Investor's Business Daily
70,2021-10-13 08:04,Aristocrat Gaming and Boyd Gaming Launch Cashless Table Game Field Trial in Nevada,https://finance.yahoo.com/news/aristocrat-gaming-boyd-gaming-launch-120400883.html,PR Newswire
71,2021-10-12 17:28,"Dow Jones Futures Fall On Apple iPhone Woes; Market Rally Fizzles Again Despite Tesla, Upstart",https://www.investors.com/market-trend/stock-market-today/dow-jones-futures-apple-iphone-woes-crispr-trial-market-rally-fizzles-as-tesla-upstart-rise/?src=A00220,Investor's Business Daily
72,2021-10-12 11:58,BYD Breaks Trend Line,https://finance.yahoo.com/video/byd-breaks-trend-line-155846870.html,Investor's Business Daily Video
73,2021-10-11 23:27,Hedge Funds Are Crazy About Boyd Gaming Corporation (BYD),https://finance.yahoo.com/news/hedge-funds-crazy-boyd-gaming-032736821.html,Insider Monkey
74,2021-10-11 07:44,"Zacks.com featured highlights include: Penske Automotive, HCA Healthcare, Applied Materials, Boyd Gaming and General Dynamics",https://finance.yahoo.com/news/zacks-com-featured-highlights-penske-114411935.html,Zacks
75,2021-10-08 13:45,Boyd Gaming Is IBD Stock Of The Day As FanDuel Partnership Fuels Profits,https://www.investors.com/research/ibd-stock-of-the-day/boyd-gaming-stock-near-buy-point-as-fanduel-partnership-fuels-profits/?src=A00220,Investor's Business Daily
76,2021-10-05 11:50,Is Boyd Gaming (BYD) Stock Undervalued Right Now?,https://finance.yahoo.com/news/boyd-gaming-byd-stock-undervalued-155003285.html,Zacks
77,2021-10-05 10:24,MGM Resorts' (MGM) BetMGM Partners With Emerald Queen Casino,https://finance.yahoo.com/news/mgm-resorts-mgm-betmgm-partners-142402943.html,Zacks
78,2021-10-04 13:00,"Boyd Gaming to Report Third-Quarter 2021 Results, Host Conference Call and Webcast on October 26",https://finance.yahoo.com/news/boyd-gaming-report-third-quarter-170000901.html,Business Wire
79,2021-10-04 09:29,MGM Resorts CEO: China casino crackdown doesnt pose a major challenge,https://finance.yahoo.com/news/mgm-resorts-ceo-china-crackdown-doesnt-pose-a-major-challenge-132905176.html,Yahoo Finance
80,2021-10-01 10:17,"Wynn Resorts' (WYNN) WynnBET Expands, Gets Louisiana Approval",https://finance.yahoo.com/news/wynn-resorts-wynn-wynnbet-expands-141702483.html,Zacks
81,2021-09-30 10:59,Boyd Gaming (BYD) Benefits From Online Betting Expansion,https://finance.yahoo.com/news/boyd-gaming-byd-benefits-online-145902919.html,Zacks
82,2021-09-30 06:40,Looking for Earnings Suprise? Play These 5 Stocks,https://finance.yahoo.com/news/looking-earnings-suprise-play-5-104010011.html,Zacks
83,2021-09-28 17:50,Boyd Gaming (BYD) Stock Moves -1.25%: What You Should Know,https://finance.yahoo.com/news/boyd-gaming-byd-stock-moves-215009152.html,Zacks
84,2021-09-28 11:06,MGM Resorts (MGM) to Acquire The Cosmopolitan of Las Vegas,https://finance.yahoo.com/news/mgm-resorts-mgm-acquire-cosmopolitan-150603262.html,Zacks
85,2021-09-27 11:21,Choice Hotels (CHH) Boosts Ascend Line-up With New Hotels,https://finance.yahoo.com/news/choice-hotels-chh-boosts-ascend-152103331.html,Zacks
86,2021-09-22 09:29,"Zacks.com featured highlights include: Nutrien, Boyd Gaming, Signet Jewelers, AutoNation and Onto Innovation",https://finance.yahoo.com/news/zacks-com-featured-highlights-nutrien-132901575.html,Zacks
87,2021-09-21 09:30,5 Stocks Trading Near 52-Week High That Can Scale Higher,https://finance.yahoo.com/news/5-stocks-trading-near-52-133001857.html,Zacks
88,2021-09-21 06:52,Top 5 Consumer Discretionary Stocks Despite Market Meltdown,https://finance.yahoo.com/news/top-5-consumer-discretionary-stocks-105210154.html,Zacks
89,2021-09-20 17:50,Boyd Gaming (BYD) Stock Moves -0.98%: What You Should Know,https://finance.yahoo.com/news/boyd-gaming-byd-stock-moves-215009147.html,Zacks
90,2021-09-20 11:30,Is Boyd Gaming (BYD) Stock Outpacing Its Consumer Discretionary Peers This Year?,https://finance.yahoo.com/news/boyd-gaming-byd-stock-outpacing-153003637.html,Zacks
91,2021-09-20 08:31,5 Stocks With High Net Income Ratio to Scoop Up Today,https://finance.yahoo.com/news/5-stocks-high-net-income-123112557.html,Zacks
92,2021-09-17 11:22,Las Vegas Sands (LVS) Falls 42% in 6 Months: What's Hurting It?,https://finance.yahoo.com/news/las-vegas-sands-lvs-falls-152203372.html,Zacks
93,2021-09-17 10:00,Boyd Gaming (BYD) Recently Broke Out Above the 20-Day Moving Average,https://finance.yahoo.com/news/boyd-gaming-byd-recently-broke-140002896.html,Zacks
94,2021-09-15 10:07,Wynn Resorts (WYNN) Announces Partnership With New York Jets,https://finance.yahoo.com/news/wynn-resorts-wynn-announces-partnership-140702765.html,Zacks
95,2021-09-14 09:58,MGM Resorts' (MGM) BetMGM Collaborates With Everi Holdings,https://finance.yahoo.com/news/mgm-resorts-mgm-betmgm-collaborates-135801208.html,Zacks
96,2021-09-14 09:15,Here's Why Boyd Gaming (BYD) is a Strong Value Stock,https://finance.yahoo.com/news/heres-why-boyd-gaming-byd-131501906.html,Zacks
97,2021-09-13 17:50,Boyd Gaming (BYD) Stock Sinks As Market Gains: What You Should Know,https://finance.yahoo.com/news/boyd-gaming-byd-stock-sinks-215009731.html,Zacks
98,2021-09-07 09:00,"Boyd Gaming Donates $250,000 To Louisiana Relief Efforts",https://finance.yahoo.com/news/boyd-gaming-donates-250-000-130000303.html,PR Newswire
99,2021-09-07 07:44,4 Solid Casino Stocks to Buy on a Thriving Gambling Industry,https://finance.yahoo.com/news/4-solid-casino-stocks-buy-114411573.html,Zacks
