,Date,News Headline,Article Link,Source
0,2022-02-17 16:45,ProPetro Announces Executive Chairmans Continued Transition,https://finance.yahoo.com/news/propetro-announces-executive-chairman-continued-214500444.html,Business Wire
1,2022-02-15 15:01,ProPetro Holding (PUMP) May Report Negative Earnings: Know the Trend Ahead of Next Week's Release,https://finance.yahoo.com/news/propetro-holding-pump-may-report-200108385.html,Zacks
2,2022-01-31 09:40,Are These Oils-Energy Stocks Undervalued Right Now?,https://finance.yahoo.com/news/oils-energy-stocks-undervalued-now-144002071.html,Zacks
3,2022-01-24 09:40,Are These Oils-Energy Stocks a Great Value Stocks Right Now?,https://finance.yahoo.com/news/oils-energy-stocks-great-value-144002004.html,Zacks
4,2022-01-20 17:00,ProPetro Announces Fourth Quarter 2021 Earnings Call,https://finance.yahoo.com/news/propetro-announces-fourth-quarter-2021-220000743.html,Business Wire
5,2022-01-17 09:21,Investors ignore increasing losses at ProPetro Holding (NYSE:PUMP) as stock jumps 11% this past week,https://finance.yahoo.com/news/investors-ignore-increasing-losses-propetro-142154367.html,Simply Wall St.
6,2021-12-02 11:31,Why Is ProPetro (PUMP) Down 15.8% Since Last Earnings Report?,https://finance.yahoo.com/news/why-propetro-pump-down-15-163104276.html,Zacks
7,2021-12-01 15:39,ProPetro (PUMP) Stock Down 14.2% Since Wider Loss Posted for Q3,https://finance.yahoo.com/news/propetro-pump-stock-down-14-203908275.html,Zacks
8,2021-11-22 17:28,"ProPetro, U.S. SEC settle charges on ex-CEO's undisclosed perks",https://finance.yahoo.com/news/propetro-u-sec-settle-charges-222857502.html,Reuters
9,2021-11-22 16:44,"UPDATE 3-ProPetro, U.S. SEC settle charges on ex-CEO's undisclosed perks",https://finance.yahoo.com/news/1-propetro-ex-ceo-settle-214407057.html,Reuters
10,2021-11-22 16:42,ProPetro Announces Settlement of Previously Disclosed Securities and Exchange Commission Matter,https://finance.yahoo.com/news/propetro-announces-settlement-previously-disclosed-214200516.html,Business Wire
11,2021-11-03 14:00,Propetro Holding Corp (PUMP) Q3 2021 Earnings Call Transcript,https://www.fool.com/earnings/call-transcripts/2021/11/03/propetro-holding-corp-pump-q3-2021-earnings-call-t/?source=eptyholnk0000202&utm_source=yahoo-host&utm_medium=feed&utm_campaign=article,Motley Fool
12,2021-11-02 20:24,CORRECTING and REPLACING ProPetro Reports Financial Results for the Third Quarter of 2021,https://finance.yahoo.com/news/propetro-reports-financial-results-third-201500750.html,Business Wire
13,2021-11-02 17:55,"ProPetro Holding (PUMP) Reports Q3 Loss, Tops Revenue Estimates",https://finance.yahoo.com/news/propetro-holding-pump-reports-q3-215509313.html,Zacks
14,2021-10-26 15:02,Will ProPetro Holding (PUMP) Report Negative Earnings Next Week? What You Should Know,https://finance.yahoo.com/news/propetro-holding-pump-report-negative-190207474.html,Zacks
15,2021-10-06 13:05,ProPetro (PUMP) Orders 50 Tier IV DGB Pumping Unit for $74M,https://finance.yahoo.com/news/propetro-pump-orders-50-tier-170505583.html,Zacks
16,2021-10-05 06:30,ProPetro Announces Third Quarter 2021 Earnings Call,https://finance.yahoo.com/news/propetro-announces-third-quarter-2021-103000035.html,Business Wire
17,2021-09-29 06:30,ProPetro Announces Pricing Improvements and Additional Dual-Gas Lower Emissions Conversions,https://finance.yahoo.com/news/propetro-announces-pricing-improvements-additional-103000599.html,Business Wire
18,2021-09-02 11:31,ProPetro (PUMP) Up 12.2% Since Last Earnings Report: Can It Continue?,https://finance.yahoo.com/news/propetro-pump-12-2-since-153103456.html,Zacks
19,2021-08-19 12:54,ProPetro (PUMP) Stock Down 11.8% Since Wider Loss Posted for Q2,https://finance.yahoo.com/news/propetro-pump-stock-down-11-165404985.html,Zacks
20,2021-08-04 17:31,Propetro Holding Corp (PUMP) Q2 2021 Earnings Call Transcript,https://www.fool.com/earnings/call-transcripts/2021/08/04/propetro-holding-corp-pump-q2-2021-earnings-call-t/?source=eptyholnk0000202&utm_source=yahoo-host&utm_medium=feed&utm_campaign=article,Motley Fool
21,2021-08-03 18:25,"ProPetro Holding (PUMP) Reports Q2 Loss, Tops Revenue Estimates",https://finance.yahoo.com/news/propetro-holding-pump-reports-q2-222510428.html,Zacks
22,2021-08-03 16:10,ProPetro Reports Financial Results for the Second Quarter of 2021,https://finance.yahoo.com/news/propetro-reports-financial-results-second-201000012.html,Business Wire
23,2021-07-29 15:53,Here is What Hedge Funds Think About ProPetro Holding Corp. (PUMP),https://finance.yahoo.com/news/hedge-funds-think-propetro-holding-195330725.html,Insider Monkey
24,2021-07-27 18:31,ProPetro appoints Sam Sledge as chief executive officer,https://finance.yahoo.com/news/propetro-appoints-sam-sledge-chief-223111953.html,Reuters
25,2021-07-27 17:30,ProPetro Announces Next Steps in Planned Executive Leadership Transition,https://finance.yahoo.com/news/propetro-announces-next-steps-planned-213000581.html,Business Wire
26,2021-07-27 15:03,ProPetro Holding (PUMP) Expected to Beat Earnings Estimates: Can the Stock Move Higher?,https://finance.yahoo.com/news/propetro-holding-pump-expected-beat-190307540.html,Zacks
27,2021-07-19 08:54,Does This Valuation Of ProPetro Holding Corp. (NYSE:PUMP) Imply Investors Are Overpaying?,https://finance.yahoo.com/news/does-valuation-propetro-holding-corp-125430142.html,Simply Wall St.
28,2021-07-06 16:15,ProPetro Schedules Second Quarter 2021 Earnings Release Date and Conference Call,https://finance.yahoo.com/news/propetro-schedules-second-quarter-2021-201500156.html,Business Wire
29,2021-06-03 11:31,Why Is ProPetro (PUMP) Up 11.8% Since Last Earnings Report?,https://finance.yahoo.com/news/why-propetro-pump-11-8-153103343.html,Zacks
30,2021-06-03 05:13,Strength Seen in ProPetro (PUMP): Can Its 8.3% Jump Turn into More Strength?,https://finance.yahoo.com/news/strength-seen-propetro-pump-8-091309361.html,Zacks
31,2021-05-12 13:18,"ProPetro's (PUMP) Q1 Loss Wider Than Expected, Sales Miss",https://finance.yahoo.com/news/propetros-pump-q1-loss-wider-171805785.html,Zacks
32,2021-05-05 16:30,ProPetro Holding Corp. (PUMP) Q1 2021 Earnings Call Transcript,https://www.fool.com/earnings/call-transcripts/2021/05/05/propetro-holding-corp-pump-q1-2021-earnings-call-t/?source=eptyholnk0000202&utm_source=yahoo-host&utm_medium=feed&utm_campaign=article,Motley Fool
33,2021-05-05 07:15,ProPetro Holding Corp. to Host Earnings Call,https://finance.yahoo.com/news/propetro-holding-corp-host-earnings-111500735.html,ACCESSWIRE
34,2021-05-04 17:35,"ProPetro Holding (PUMP) Reports Q1 Loss, Lags Revenue Estimates",https://finance.yahoo.com/news/propetro-holding-pump-reports-q1-213509921.html,Zacks
35,2021-05-04 16:15,ProPetro Reports Financial Results for the First Quarter of 2021,https://finance.yahoo.com/news/propetro-reports-financial-results-first-201500607.html,Business Wire
36,2021-04-20 16:15,ProPetro Schedules First Quarter 2021 Earnings Release Date and Conference Call,https://finance.yahoo.com/news/propetro-schedules-first-quarter-2021-201500781.html,Business Wire
37,2021-04-05 17:14,ProPetro Provides Leadership Team Update,https://finance.yahoo.com/news/propetro-provides-leadership-team-211400691.html,Business Wire
38,2021-03-25 11:30,Why Is ProPetro (PUMP) Down 8.2% Since Last Earnings Report?,https://finance.yahoo.com/news/why-propetro-pump-down-8-153003741.html,Zacks
39,2021-03-25 06:30,"ProPetro Holding Corp., Fluid Energy Group, and Solnexus Chemical Announce New Partnership for Enviro-Syn® Modified Acid and Synthetic Acid Technology in the Permian Basin",https://finance.yahoo.com/news/propetro-holding-corp-fluid-energy-103000413.html,Business Wire
40,2021-03-01 08:59,"ProPetro's (PUMP) Q4 Loss Narower Than Expected, Sales Miss",https://finance.yahoo.com/news/propetros-pump-q4-loss-narower-135901094.html,Zacks
41,2021-02-24 15:00,ProPetro Holding Corp. (PUMP) Q4 2020 Earnings Call Transcript,https://www.fool.com/earnings/call-transcripts/2021/02/24/propetro-holding-corp-pump-q4-2020-earnings-call-t/?source=eptyholnk0000202&utm_source=yahoo-host&utm_medium=feed&utm_campaign=article,Motley Fool
42,2021-02-24 07:15,ProPetro Holding Corp. to Host Earnings Call,https://finance.yahoo.com/news/propetro-holding-corp-host-earnings-121500815.html,ACCESSWIRE
43,2021-02-24 07:15,PPD Inc to Host Earnings Call,https://finance.yahoo.com/news/ppd-inc-host-earnings-call-121500561.html,ACCESSWIRE
44,2021-02-23 16:37,ProPetro Reports Full Year and Fourth Quarter 2020 Results,https://finance.yahoo.com/news/propetro-reports-full-fourth-quarter-213700441.html,Business Wire
45,2021-02-22 10:18,Earnings Outlook For ProPetro Holding,https://finance.yahoo.com/news/earnings-outlook-propetro-holding-151826632.html,Benzinga
46,2021-02-15 04:19,Are Insiders Buying ProPetro Holding Corp. (NYSE:PUMP) Stock?,https://finance.yahoo.com/news/insiders-buying-propetro-holding-corp-091957352.html,Simply Wall St.
47,2021-01-21 10:43,ProPetro (PUMP) Provides Fourth-Quarter Preliminary Update,https://finance.yahoo.com/news/propetro-pump-provides-fourth-quarter-154303667.html,Zacks
48,2021-01-20 06:30,ProPetro Announces Preliminary Selected Unaudited Financial Data for Fourth Quarter 2020 and Investments in Lower Emissions Technology,https://finance.yahoo.com/news/propetro-announces-preliminary-selected-unaudited-113000968.html,Business Wire
49,2020-12-21 17:00,"ProPetro Names Adam Muñoz as Successor to David Sledge, Chief Operating Officer",https://finance.yahoo.com/news/propetro-names-adam-mu-oz-220000649.html,Business Wire
50,2020-12-21 17:00,ProPetro Announces New Appointment to Board of Directors,https://finance.yahoo.com/news/propetro-announces-appointment-board-directors-220000988.html,Business Wire
51,2020-12-17 14:49,Is PUMP A Good Stock To Buy Now?,https://finance.yahoo.com/news/pump-good-stock-buy-now-194937888.html,Insider Monkey
52,2020-12-15 08:05,RigNet's Intelie to Continue to Optimize Fracturing Operations at ProPetro Under New Contract Extension,https://finance.yahoo.com/news/rignets-intelie-continue-optimize-fracturing-130500647.html,PR Newswire
53,2020-12-02 11:30,ProPetro (PUMP) Up 50.7% Since Last Earnings Report: Can It Continue?,https://finance.yahoo.com/news/propetro-pump-50-7-since-163004900.html,Zacks
54,2020-11-17 01:50,How Much Did ProPetro Holding's(NYSE:PUMP) Shareholders Earn From Share Price Movements Over The Last Three Years?,https://finance.yahoo.com/news/much-did-propetro-holdings-nyse-065053315.html,Simply Wall St.
55,2020-11-06 10:33,ProPetro (PUMP) Down 7.4% on Wider-Than-Expected Q3 Loss,https://finance.yahoo.com/news/propetro-pump-down-7-4-153303597.html,Zacks
56,2020-11-03 07:15,ProPetro Holding Corp. to Host Earnings Call,https://finance.yahoo.com/news/propetro-holding-corp-host-earnings-121500301.html,ACCESSWIRE
57,2020-11-02 17:55,"ProPetro Holding (PUMP) Reports Q3 Loss, Lags Revenue Estimates",https://finance.yahoo.com/news/propetro-holding-pump-reports-q3-225510842.html,Zacks
58,2020-11-02 17:03,ProPetro Holding: Q3 Earnings Insights,https://finance.yahoo.com/news/propetro-holding-q3-earnings-insights-220352424.html,Benzinga
59,2020-11-02 16:15,ProPetro Reports Results for the Third Quarter 2020,https://finance.yahoo.com/news/propetro-reports-results-third-quarter-211500292.html,Business Wire
60,2020-10-26 16:15,ProPetro Schedules Third Quarter 2020 Earnings Release Date and Conference Call,https://finance.yahoo.com/news/propetro-schedules-third-quarter-2020-201500787.html,Business Wire
61,2020-10-26 16:15,ProPetro Appoints David Schorlemer as Chief Financial Officer,https://finance.yahoo.com/news/propetro-appoints-david-schorlemer-chief-201500637.html,Business Wire
62,2020-10-14 14:34,Should I Buy ProPetro Holding Corp. (PUMP)?,https://finance.yahoo.com/news/buy-propetro-holding-corp-pump-183443763.html,Insider Monkey
63,2020-09-03 11:31,ProPetro (PUMP) Up 1.3% Since Last Earnings Report: Can It Continue?,https://finance.yahoo.com/news/propetro-pump-1-3-since-153103122.html,Zacks
64,2020-08-27 08:31,"The Director of ProPetro Holding Corp. (NYSE:PUMP), Mark Berg, Just Bought A Few More Shares",https://finance.yahoo.com/news/director-propetro-holding-corp-nyse-123122942.html,Simply Wall St.
65,2020-08-17 12:25,ProPetro (PUMP) Rallies 13.4% Despite Missing on Q2 Earnings,https://finance.yahoo.com/news/propetro-pump-rallies-13-4-162504790.html,Zacks
66,2020-08-04 17:45,"ProPetro Holding (PUMP) Reports Q2 Loss, Lags Revenue Estimates",https://finance.yahoo.com/news/propetro-holding-pump-reports-q2-214509186.html,Zacks
67,2020-08-04 17:23,ProPetro Holding: Q2 Earnings Insights,https://finance.yahoo.com/news/propetro-holding-q2-earnings-insights-212327642.html,Benzinga
68,2020-08-04 16:30,ProPetro Reports Results for the Second Quarter 2020,https://finance.yahoo.com/news/propetro-reports-results-second-quarter-203000936.html,Business Wire
69,2020-07-28 12:33,ProPetro Holding (PUMP) Expected to Beat Earnings Estimates: Can the Stock Move Higher?,https://finance.yahoo.com/news/propetro-holding-pump-expected-beat-163304734.html,Zacks
70,2020-07-22 07:00,ProPetro Schedules Second Quarter 2020 Earnings Release Date and Conference Call,https://finance.yahoo.com/news/propetro-schedules-second-quarter-2020-110000455.html,Business Wire
71,2020-07-02 07:10,ProPetro Files Quarterly Report for First Quarter 2020 and Becomes Current in SEC Filings,https://finance.yahoo.com/news/propetro-files-quarterly-report-first-111000888.html,Business Wire
72,2020-07-01 11:30,ProPetro (PUMP) Up 6.6% Since Last Earnings Report: Can It Continue?,https://finance.yahoo.com/news/propetro-pump-6-6-since-153003099.html,Zacks
73,2020-06-30 16:35,Did Hedge Funds Drop The Ball On ProPetro Holding Corp. (PUMP)?,https://finance.yahoo.com/news/did-hedge-funds-drop-ball-203537166.html,Insider Monkey
74,2020-06-25 08:45,Implied Volatility Surging for ProPetro (PUMP) Stock Options,https://finance.yahoo.com/news/implied-volatility-surging-propetro-pump-124512633.html,Zacks
75,2020-06-22 06:12,ProPetro Completes Review Process and Files Formerly Delinquent 2019 Annual and Quarterly Reports,https://finance.yahoo.com/news/propetro-completes-review-process-files-101200188.html,Business Wire
76,2020-06-08 07:34,The Consensus EPS Estimates For ProPetro Holding Corp. (NYSE:PUMP) Just Fell Dramatically,https://finance.yahoo.com/news/consensus-eps-estimates-propetro-holding-113438090.html,Simply Wall St.
77,2020-06-06 09:00,Kaskela Law LLC Announces Investigation of ProPetro Holding Corp. (PUMP) and Encourages Long-Term PUMP Investors to Contact the Firm,https://finance.yahoo.com/news/kaskela-law-llc-announces-investigation-130000710.html,PR Newswire
78,2020-06-05 22:50,"PROPETRO INVESTIGATION CONTINUED by Former Louisiana Attorney General: Kahn Swick & Foti, LLC Continues to Investigate the Officers and Directors of ProPetro Holding Corp. - PUMP",https://finance.yahoo.com/news/propetro-investigation-continued-former-louisiana-025000808.html,Business Wire
79,2020-06-03 10:51,"ProPetro (PUMP) Q1 Earnings Top Estimates, Revenues Fall Y/Y",https://finance.yahoo.com/news/propetro-pump-q1-earnings-top-145102550.html,Zacks
80,2020-06-02 23:30,ProPetro Holding Corp. (PUMP) Q1 2020 Earnings Call Transcript,https://www.fool.com/earnings/call-transcripts/2020/06/02/propetro-holding-corp-pump-q1-2020-earnings-call-t.aspx?source=eptyholnk0000202&utm_source=yahoo-host&utm_medium=feed&utm_campaign=article,Motley Fool
81,2020-06-02 01:28,ProPetro Investors: Company Investigated by the Portnoy Law Firm,https://finance.yahoo.com/news/propetro-investors-company-investigated-portnoy-052800556.html,GlobeNewswire
82,2020-06-01 17:35,ProPetro Holding (PUMP) Beats Q1 Earnings Estimates,https://finance.yahoo.com/news/propetro-holding-pump-beats-q1-213509717.html,Zacks
83,2020-06-01 16:15,ProPetro Reports Preliminary Unaudited Financial Results for the First Quarter 2020,https://finance.yahoo.com/news/propetro-reports-preliminary-unaudited-financial-201500030.html,Business Wire
84,2020-05-29 22:50,"PROPETRO INVESTIGATION CONTINUED BY FORMER LOUISIANA ATTORNEY GENERAL:  Kahn Swick & Foti, LLC Continues to Investigate the Officers and Directors of ProPetro Holding Corp. - PUMP",https://finance.yahoo.com/news/propetro-investigation-continued-former-louisiana-025000494.html,PR Newswire
85,2020-05-29 09:52,Is a Beat in the Cards for ProPetro (PUMP) in Q1 Earnings?,https://finance.yahoo.com/news/beat-cards-propetro-pump-q1-135201256.html,Zacks
86,2020-05-29 08:31,Is a Surprise Coming for ProPetro (PUMP) This Earnings Season?,https://finance.yahoo.com/news/surprise-coming-propetro-pump-earnings-123112869.html,Zacks
87,2020-05-25 12:30,ProPetro Holding (PUMP) Expected to Beat Earnings Estimates: What to Know Ahead of Q1 Release,https://finance.yahoo.com/news/propetro-holding-pump-expected-beat-163004025.html,Zacks
88,2020-05-24 09:08,What Is ProPetro Holding's (NYSE:PUMP) P/E Ratio After Its Share Price Rocketed?,https://finance.yahoo.com/news/propetro-holdings-nyse-pump-p-130832647.html,Simply Wall St.
89,2020-05-20 08:31,Implied Volatility Surging for ProPetro (PUMP) Stock Options,https://finance.yahoo.com/news/implied-volatility-surging-propetro-pump-123112803.html,Zacks
90,2020-05-11 07:00,ProPetro Schedules First Quarter 2020 Earnings Release Date and Conference Call,https://finance.yahoo.com/news/propetro-schedules-first-quarter-2020-110000023.html,Business Wire
91,2020-05-06 09:55,Were Hedge Funds Right About ProPetro Holding Corp. (PUMP)?,https://finance.yahoo.com/news/were-hedge-funds-propetro-holding-135530123.html,Insider Monkey
92,2020-04-30 11:30,Why Is ProPetro (PUMP) Up 101.4% Since Last Earnings Report?,https://finance.yahoo.com/news/why-propetro-pump-101-4-153003045.html,Zacks
93,2020-04-28 12:33,Analysts Estimate ProPetro Holding (PUMP) to Report a Decline in Earnings: What to Look Out for,https://finance.yahoo.com/news/analysts-estimate-propetro-holding-pump-163304345.html,Zacks
94,2020-04-25 22:00,STOCKHOLDER ALERT: Kaskela Law LLC Announces Stockholder Investigation of ProPetro Holding Corp. (PUMP) and Encourages Current Stockholders to Contact the Firm,https://finance.yahoo.com/news/stockholder-alert-kaskela-law-llc-020000158.html,ACCESSWIRE
95,2020-04-24 22:50,"PROPETRO INVESTIGATION CONTINUED by Former Louisiana Attorney General: Kahn Swick & Foti, LLC Continues to Investigate the Officers and Directors of ProPetro Holding Corp. - PUMP",https://finance.yahoo.com/news/propetro-investigation-continued-former-louisiana-025000370.html,Business Wire
96,2020-04-17 09:47,"The Zacks Analyst Blog Highlights: Schlumberger, Halliburton, Core Laboratories, ProPetro and Oceaneering International",https://finance.yahoo.com/news/zacks-analyst-blog-highlights-schlumberger-134701527.html,Zacks
97,2020-04-14 08:10,ProPetro Adopts Short-Term Stockholder Rights Plan,https://finance.yahoo.com/news/propetro-adopts-short-term-stockholder-121000378.html,Business Wire
98,2020-04-13 11:58,ProPetro to Slash 20% Management Pay Amid Coronavirus Havoc,https://finance.yahoo.com/news/propetro-slash-20-management-pay-155803861.html,Zacks
99,2020-04-11 14:22,Kaskela Law LLC Announces Investigation of ProPetro Holding Corp. (PUMP) and Encourages Current Stockholders to Contact the Firm,https://finance.yahoo.com/news/kaskela-law-llc-announces-investigation-182207689.html,GlobeNewswire
