,Date,News Headline,Article Link,Source
0,2022-02-24 10:36,UPDATE 3-Brazil's Petrobras adopts wait-and-see pricing strategy after Ukraine invasion,https://finance.yahoo.com/news/2-brazils-petrobras-adopts-wait-153649643.html,Reuters
1,2022-02-23 18:07,UPDATE 2-Brazil's Petrobras smashes all-time profit record amid Brent bonanza,https://finance.yahoo.com/news/1-brazils-petrobras-hits-quarterly-230730575.html,Reuters
2,2022-02-23 17:54,Brazil's Petrobras smashes all-time profit record amid Brent bonanza,https://finance.yahoo.com/news/brazils-petrobras-hits-quarterly-profit-225413672.html,Reuters
3,2022-02-22 10:55,"As Russia moves into Ukraine, here are the oil stocks that might benefit the most",https://www.marketwatch.com/story/as-russia-moves-into-ukraine-here-are-the-oil-stocks-that-might-benefit-the-most-11645545304?siteid=yhoof2,MarketWatch
4,2022-02-22 08:15,Petrobras (PBR) to Sell Its Stake in Gulf of Mexico Assets,https://finance.yahoo.com/news/petrobras-pbr-sell-stake-gulf-131501942.html,Zacks
5,2022-02-21 07:10,15 Most Valuable Government-Owned Companies in the World,https://finance.yahoo.com/news/15-most-valuable-government-owned-121054438.html,Insider Monkey
6,2022-02-18 09:36,Are Petrobras' (PBR) Q4 Earnings Poised to Exceed Estimates?,https://finance.yahoo.com/news/petrobras-pbr-q4-earnings-poised-143602385.html,Zacks
7,2022-02-15 18:00,Petrobras (PBR) Stock Sinks As Market Gains: What You Should Know,https://finance.yahoo.com/news/petrobras-pbr-stock-sinks-market-230011054.html,Zacks
8,2022-02-14 17:14,"Brazil's Petrobras closely monitoring situation in Ukraine, CEO says",https://finance.yahoo.com/news/brazils-petrobras-closely-monitoring-situation-221432285.html,Reuters
9,2022-02-14 06:57,Petrobras (PBR) Registers Record Pre-Salt Production in '21,https://finance.yahoo.com/news/petrobras-pbr-registers-record-pre-115711425.html,Zacks
10,2022-02-14 06:03,Exclusive-Brazil has oil. Exxon can't seem to find it,https://finance.yahoo.com/news/exclusive-brazil-oil-exxon-cant-110335286.html,Reuters
11,2022-02-11 08:27,MC Brazil Downstream Trading S.A.R.L. -- Moody's announces completion of a periodic review of ratings of MC Brazil Downstream Trading S.A.R.L.,https://finance.yahoo.com/news/mc-brazil-downstream-trading-r-132708293.html,Moody's
12,2022-02-11 08:07,"Oil is the hottest sector, and Wall Street analysts see upside of up to 48% for favored stocks",https://www.marketwatch.com/story/oil-is-the-hottest-sector-and-wall-street-analysts-see-upside-of-up-to-48-for-favored-stocks-11644584875?siteid=yhoof2,MarketWatch
13,2022-02-10 17:27,Guara Norte S.a r.l. -- Moody's announces completion of a periodic review of ratings of Guara Norte S.a r.l.,https://finance.yahoo.com/news/guara-norte-r-l-moodys-222708022.html,Moody's
14,2022-02-10 17:26,MC Brazil Downstream Trading S.A.R.L. -- Moody's announces completion of a periodic review of ratings of MC Brazil Downstream Trading S.A.R.L.,https://finance.yahoo.com/news/mc-brazil-downstream-trading-r-222606107.html,Moody's
15,2022-02-09 18:00,Petrobras (PBR) Gains But Lags Market: What You Should Know,https://finance.yahoo.com/news/petrobras-pbr-gains-lags-market-230011828.html,Zacks
16,2022-02-09 15:50,Transportadora Associada de Gas S.A. -- Moody's announces completion of a periodic review of ratings of Transportadora Associada de Gas S.A.,https://finance.yahoo.com/news/transportadora-associada-gas-moodys-announces-205006948.html,Moody's
17,2022-02-09 15:44,Transportadora Associada de Gas S.A. -- Moody's announces completion of a periodic review of ratings of Transportadora Associada de Gas S.A.,https://finance.yahoo.com/news/transportadora-associada-gas-moodys-announces-204408252.html,Moody's
18,2022-02-09 10:00,Lulas Cheap-Fuel Pledge Threatens Petrobrass Billion-Dollar Dividend Windfall,https://finance.yahoo.com/news/lula-cheap-fuel-pledge-threatens-150016272.html,Bloomberg
19,2022-02-09 09:56,Petrobras (PBR) Sells Stake in Alagoas Fields for $300M,https://finance.yahoo.com/news/petrobras-pbr-sells-stake-alagoas-145602934.html,Zacks
20,2022-02-08 09:38,"Intercontinental Wealth Advisors, LLC Buys PowerShares QQQ Trust Ser 1, Tesla Inc, ProShares ...",https://finance.yahoo.com/news/intercontinental-wealth-advisors-llc-buys-143806905.html,GuruFocus.com
21,2022-02-07 09:40,Should Value Investors Buy These Oils-Energy Stocks?,https://finance.yahoo.com/news/value-investors-buy-oils-energy-144002400.html,Zacks
22,2022-02-04 15:20,Brazil's Petrobras says refineries reached 90% capacity in early-Feb.,https://finance.yahoo.com/news/brazils-petrobras-says-refineries-reached-202032700.html,Reuters
23,2022-02-04 12:41,UPDATE 3-Russia's Acron to buy fertilizer plant from Brazil's Petrobras,https://finance.yahoo.com/news/1-russias-acron-buy-fertilizer-174138246.html,Reuters
24,2022-02-04 09:40,Has Petrobras (PBR) Outpaced Other Oils-Energy Stocks This Year?,https://finance.yahoo.com/news/petrobras-pbr-outpaced-other-oils-144002224.html,Zacks
25,2022-02-04 09:38,"Hosking Partners LLP Buys ConocoPhillips, Charles Schwab Corp, D-MARKET Electronic Services ...",https://finance.yahoo.com/news/hosking-partners-llp-buys-conocophillips-143809037.html,GuruFocus.com
26,2022-02-04 07:09,Petrobras (PBR) Signs Contract to Offload Potiguar Fields,https://finance.yahoo.com/news/petrobras-pbr-signs-contract-offload-120912683.html,Zacks
27,2022-02-03 21:38,"JGP Global Gestao de Recursos Ltda. Buys Meta Platforms Inc, Petroleo Brasileiro SA Petrobras, ...",https://finance.yahoo.com/news/jgp-global-gestao-recursos-ltda-023810216.html,GuruFocus.com
28,2022-02-03 21:38,"Contrarius Investment Management Ltd Buys ViacomCBS Inc, Discovery Inc, Coinbase Global Inc, ...",https://finance.yahoo.com/news/contrarius-investment-management-ltd-buys-023804495.html,GuruFocus.com
29,2022-02-03 18:00,Petrobras (PBR) Stock Moves -1.4%: What You Should Know,https://finance.yahoo.com/news/petrobras-pbr-stock-moves-1-230011302.html,Zacks
30,2022-02-02 17:38,"Matthews International Capital Management Llc Buys Atlassian Corporation PLC, Pinduoduo Inc, ...",https://finance.yahoo.com/news/matthews-international-capital-management-llc-223826048.html,GuruFocus.com
31,2022-02-01 08:05,Petrobras (PBR) Postpones Offering of Its Stake in Braskem,https://finance.yahoo.com/news/petrobras-pbr-postpones-offering-stake-130501695.html,Zacks
32,2022-01-31 13:38,"State of New Jersey Common Pension Fund D Buys Canadian Pacific Railway, Airbnb Inc, Lucid ...",https://finance.yahoo.com/news/state-jersey-common-pension-fund-183808056.html,GuruFocus.com
33,2022-01-31 12:00,Are You Looking for a Top Momentum Pick? Why Petrobras (PBR) is a Great Choice,https://finance.yahoo.com/news/looking-top-momentum-pick-why-170005257.html,Zacks
34,2022-01-31 09:38,"ARGA Investment Management, LP Buys Petroleo Brasileiro SA Petrobras, Trip. ...",https://finance.yahoo.com/news/arga-investment-management-lp-buys-143804512.html,GuruFocus.com
35,2022-01-31 06:00,7 Best Cheap Stocks to Buy for February,https://finance.yahoo.com/news/7-best-cheap-stocks-buy-110004859.html,InvestorPlace
36,2022-01-28 18:31,Petrobras estimates that proven reserves reached 9.88 bln boe in 2021,https://finance.yahoo.com/news/petrobras-estimates-proven-reserves-reached-233135272.html,Reuters
37,2022-01-28 16:13,Brazil's Petrobras says board approved sale of 22 concessions in Bacia Potiguar,https://finance.yahoo.com/news/brazils-petrobras-says-board-approved-211353721.html,Reuters
38,2022-01-28 09:34,"Petrobras, Novonor Pull Billion-Dollar Braskem Share Sale",https://finance.yahoo.com/news/petrobras-novonor-said-mull-postponing-223538722.html,Bloomberg
39,2022-01-28 07:25,"UPDATE 2-Shares in Brazil's Braskem soar as Petrobras, Novonor delay offering",https://finance.yahoo.com/news/1-brazils-petrobras-novonor-postpone-122504685.html,Reuters
40,2022-01-27 18:00,Petrobras (PBR) Gains As Market Dips: What You Should Know,https://finance.yahoo.com/news/petrobras-pbr-gains-market-dips-230011718.html,Zacks
41,2022-01-27 17:37,"Novonor, Petrobras postpone Braskem share offering after lackluster demand -sources",https://finance.yahoo.com/news/novonor-petrobras-postpone-braskem-share-223758216.html,Reuters
42,2022-01-27 06:39,TechnipFMC (FTI) Wins Large EPCI Contract in Buzios Field,https://finance.yahoo.com/news/technipfmc-fti-wins-large-epci-113911687.html,Zacks
43,2022-01-21 18:00,Petrobras (PBR) Gains As Market Dips: What You Should Know,https://finance.yahoo.com/news/petrobras-pbr-gains-market-dips-230011508.html,Zacks
44,2022-01-20 15:12,Oil Giant BP Stock Shows Rising Relative Strength To 93,https://www.investors.com/news/bp-stock-shows-rising-relative-strength-to-93/?src=A00220,Investor's Business Daily
45,2022-01-19 18:15,Petrobras (PBR) Gains As Market Dips: What You Should Know,https://finance.yahoo.com/news/petrobras-pbr-gains-market-dips-231511252.html,Zacks
46,2022-01-19 17:38,"Hudock, Inc. Buys Lockheed Martin Corp, Dominion Energy Inc, VanEck Vectors Semiconductor ETF, ...",https://finance.yahoo.com/news/hudock-inc-buys-lockheed-martin-223804857.html,GuruFocus.com
47,2022-01-19 13:38,"Spinnaker Capital LTD Buys Petroleo Brasileiro SA Petrobras, Sells iShares J.P. ...",https://finance.yahoo.com/news/spinnaker-capital-ltd-buys-petroleo-183825694.html,GuruFocus.com
48,2022-01-19 07:53,Petrobras (PBR) Cuts Production Forecasts for 2022 and Beyond,https://finance.yahoo.com/news/petrobras-pbr-cuts-production-forecasts-125312109.html,Zacks
49,2022-01-18 15:36,"Tonga Eruption Gets Blame for Peru Oil Spill 6,800 Miles Away",https://finance.yahoo.com/news/tonga-eruption-gets-blame-peru-203633670.html,Bloomberg
50,2022-01-18 09:38,"Ritholtz Wealth Management Buys Apple Inc, Prologis Inc, Microsoft Corp, Sells iShares iBonds ...",https://finance.yahoo.com/news/ritholtz-wealth-management-buys-apple-143819958.html,GuruFocus.com
51,2022-01-17 09:32,"Petrobras, Novonor to Sell $1.5 Billion Braskem Stake",https://finance.yahoo.com/news/petrobras-novonor-sell-1-5-143234339.html,Bloomberg
52,2022-01-15 13:00,"Latin American Oil Giants Struggle With Fuel Costs, Debt, And Pipeline Explosion",https://finance.yahoo.com/news/latin-american-oil-giants-struggle-180000435.html,Oilprice.com
53,2022-01-12 15:25,Brazil's Petrobras increases LNG imports by 200% in 2021,https://finance.yahoo.com/news/brazils-petrobras-increases-lng-imports-202555558.html,Reuters
54,2022-01-07 18:00,Petrobras (PBR) Gains As Market Dips: What You Should Know,https://finance.yahoo.com/news/petrobras-pbr-gains-market-dips-230011826.html,Zacks
55,2022-01-07 07:14,Oil & Gas Stock Roundup Headlined by ExxonMobil & HollyFrontier,https://finance.yahoo.com/news/oil-gas-stock-roundup-headlined-121412678.html,Zacks
56,2022-01-06 18:15,Petrobras (PBR) Gains As Market Dips: What You Should Know,https://finance.yahoo.com/news/petrobras-pbr-gains-market-dips-231511313.html,Zacks
57,2022-01-05 18:01,"Petrobras, Novonor Pick Banks for $1.5 Billion Braskem Share Sale",https://finance.yahoo.com/news/petrobras-novonor-pick-banks-1-230115792.html,Bloomberg
58,2021-12-30 17:50,Petrobras (PBR) Gains As Market Dips: What You Should Know,https://finance.yahoo.com/news/petrobras-pbr-gains-market-dips-225010162.html,Zacks
59,2021-12-30 17:38,"Brazilian elections will not affect Petrobras pricing, CEO pledges",https://finance.yahoo.com/news/brazilian-elections-not-affect-petrobras-223818644.html,Reuters
60,2021-12-29 13:59,Petrobras (PBR) to Sell Carmopolis Cluster to Carmo Energy,https://finance.yahoo.com/news/petrobras-pbr-sell-carmopolis-cluster-185906480.html,Zacks
61,2021-12-28 11:34,Brazil's Petrobras partners with Vibra Energia to test new renewable diesel,https://finance.yahoo.com/news/brazils-petrobras-partners-vibra-energia-163402651.html,Reuters
62,2021-12-27 23:38,"Advisors' Inner Circle Fund III Buys Baidu Inc, Petroleo Brasileiro SA Petrobras, Banco do ...",https://finance.yahoo.com/news/advisors-inner-circle-fund-iii-043811936.html,GuruFocus.com
63,2021-12-27 23:38,"Advisors' Inner Circle Fund III Buys Petroleo Brasileiro SA Petrobras, Devon Energy Corp, ...",https://finance.yahoo.com/news/advisors-inner-circle-fund-iii-043810601.html,GuruFocus.com
64,2021-12-27 23:38,"Advisors' Inner Circle Fund III Buys Petroleo Brasileiro SA Petrobras, Gazprom PJSC, Roche ...",https://finance.yahoo.com/news/advisors-inner-circle-fund-iii-043809097.html,GuruFocus.com
65,2021-12-27 23:38,"Advisors' Inner Circle Fund III Buys Tencent Holdings, LONGi Green Energy Technology Co, SK ...",https://finance.yahoo.com/news/advisors-inner-circle-fund-iii-043808422.html,GuruFocus.com
66,2021-12-24 18:00,Brazil Rushes Ahead With Key Oil Projects As Prices Remain Elevated,https://finance.yahoo.com/news/brazil-rushes-ahead-key-oil-230000350.html,Oilprice.com
67,2021-12-23 08:28,Jim Simons Renaissance Technologies Portfolio: 10 Dividend Stocks With Over 15% Yield,https://finance.yahoo.com/news/jim-simons-renaissance-technologies-portfolio-132850998.html,Insider Monkey
68,2021-12-17 16:09,TotalEnergies and Shell Stand Out in Brazilian Oil Auction,https://finance.yahoo.com/news/totalenergies-shell-win-rights-brazil-143751750.html,Bloomberg
69,2021-12-16 12:57,Exxon prepares to bid for new oil blocks in Brazil -sources,https://finance.yahoo.com/news/exclusive-exxon-prepares-bid-oil-175720020.html,Reuters
70,2021-12-16 07:30,Big Oil Gets a Second Chance for Giant Offshore Fields in Brazil,https://finance.yahoo.com/news/big-oil-gets-second-chance-123000585.html,Bloomberg
71,2021-12-15 06:13,Exclusive: Brazil bribery probe expands to four JPMorgan fuel deals -documents and sources,https://finance.yahoo.com/news/exclusive-brazil-bribery-probe-expands-111342361.html,Reuters
72,2021-12-14 13:47,Exclusive-Brazil's Petrobras higher price demands delay refineries sales- sources,https://finance.yahoo.com/news/exclusive-brazils-petrobras-higher-price-184738525.html,Reuters
73,2021-12-13 11:01,10 High Dividend Stocks with Over 12% Yield,https://finance.yahoo.com/news/10-high-dividend-stocks-over-160106878.html,Insider Monkey
74,2021-12-11 18:25,Hedge Funds Are Souring On Petroleo Brasileiro S.A.  Petrobras (PBR),https://finance.yahoo.com/news/hedge-funds-souring-petroleo-brasileiro-232534831.html,Insider Monkey
75,2021-12-10 13:36,TechnipFMC (FTI) Secures 3 Pipe Frame Agreements From Petrobras,https://finance.yahoo.com/news/technipfmc-fti-secures-3-pipe-183606729.html,Zacks
76,2021-12-09 16:15,TechnipFMC Awarded Flexible Pipe Frame Agreements by Petrobras in Brazil,https://finance.yahoo.com/news/technipfmc-awarded-flexible-pipe-frame-211500658.html,Business Wire
77,2021-12-09 07:17,Braskem shares plunge on delayed Petrobras disposal,https://finance.yahoo.com/news/brazils-petrobras-yet-decide-date-121751355.html,Reuters
78,2021-12-07 15:00,Oil Prices Bounce Back As Omicron Fears Fade,https://finance.yahoo.com/news/oil-prices-bounce-back-omicron-200000275.html,Oilprice.com
79,2021-12-07 12:58,Bolsonaro Gets a Step Closer to Controlling Brazils Fuel Prices,https://finance.yahoo.com/news/bolsonaro-gets-step-closer-controlling-175853439.html,Bloomberg
80,2021-12-07 09:53,"UPDATE 1-Brazilian unit of Credit Suisse names Monteiro, Chilov as interim co-CEOs",https://finance.yahoo.com/news/1-brazilian-unit-credit-suisse-145339213.html,Reuters
81,2021-12-06 09:37,"EMERGING MARKETS-Latam FX muted as Omicron, China property concerns weigh",https://finance.yahoo.com/news/emerging-markets-latam-fx-muted-143705330.html,Reuters
82,2021-12-06 07:29,Brazil's Petrobras denies anticipating fuel price decisions,https://finance.yahoo.com/news/brazils-petrobras-denies-anticipating-fuel-122913476.html,Reuters
83,2021-12-01 09:56,"EMERGING MARKETS-Latam FX, stocks on higher commodity prices and weaker dollar",https://finance.yahoo.com/news/emerging-markets-latam-fx-stocks-145637491.html,Reuters
84,2021-12-01 08:51,Are Options Traders Betting on a Big Move in Petrobras (PBR) Stock?,https://finance.yahoo.com/news/options-traders-betting-big-move-135101410.html,Zacks
85,2021-12-01 08:47,"The Zacks Analyst Blog Highlights: TC Energy, Petrobras, ConocoPhillips, Eni SpA and Royal Dutch Shell",https://finance.yahoo.com/news/zacks-analyst-blog-highlights-tc-134701852.html,Zacks
86,2021-11-30 05:34,Oil & Gas Stock Roundup Headlined by TC Energy & Petrobras,https://finance.yahoo.com/news/oil-gas-stock-roundup-headlined-103410956.html,Zacks
87,2021-11-29 10:00,How Much Upside is Left in Petrobras (PBR)? Wall Street Analysts Think 40%,https://finance.yahoo.com/news/much-upside-left-petrobras-pbr-150003192.html,Zacks
88,2021-11-26 10:19,ExxonMobil (XOM) Signs Deal to Commercialize Low-Carbon Biofuels,https://finance.yahoo.com/news/exxonmobil-xom-signs-deal-commercialize-151903150.html,Zacks
89,2021-11-26 10:04,Petrobras (PBR) Revises Production Guidance for 2022-2026,https://finance.yahoo.com/news/petrobras-pbr-revises-production-guidance-150403673.html,Zacks
90,2021-11-25 09:53,UPDATE 3-Brazil's Petrobras boosts payouts and spending under new plan,https://finance.yahoo.com/news/1-brazils-petrobras-boosts-payouts-145301216.html,Reuters
91,2021-11-25 05:52,Brazil's Petrobras announces new dividend policy after hitting debt target,https://finance.yahoo.com/news/brazils-petrobras-announces-dividend-policy-105229548.html,Reuters
92,2021-11-24 19:12,"UPDATE 1-Brazil's Petrobras raises investment plan to $68 bln, lowers 2022 production forecast",https://finance.yahoo.com/news/1-brazils-petrobras-raises-investment-001256808.html,Reuters
93,2021-11-19 07:35,UPDATE 1-Petrobras says likely to raise 2022-2026 capex to $60-70 bln,https://finance.yahoo.com/news/1-petrobras-says-likely-raise-123524019.html,Reuters
94,2021-11-19 06:56,Petrobras says likely to raise 2022-2026 capex to $60-70 bln,https://finance.yahoo.com/news/petrobras-says-likely-raise-2022-115631613.html,Reuters
95,2021-11-18 09:04,Talos Energy (TALO) to Develop CCS Facility on US Gulf Coast,https://finance.yahoo.com/news/talos-energy-talo-develop-ccs-140402204.html,Zacks
96,2021-11-16 18:51,"Brazil Senate panel calls hearing on rising fuel prices with ministers, Petrobras CEO",https://finance.yahoo.com/news/brazil-senate-panel-calls-hearing-235153454.html,Reuters
97,2021-11-16 07:38,Petrobras (PBR) Stock Barely Moves Since Q3 Earnings Miss,https://finance.yahoo.com/news/petrobras-pbr-stock-barely-moves-123812986.html,Zacks
98,2021-11-10 13:39,UPDATE 1-Brazil Oct inflation highest in almost 20 years as fuel costs rise,https://finance.yahoo.com/news/1-brazil-oct-inflation-highest-183952231.html,Reuters
99,2021-11-08 20:00,What Would Happen If Brazil Privatized Its National Oil Company?,https://finance.yahoo.com/news/happen-brazil-privatized-national-oil-010000195.html,Oilprice.com
