,Date,News Headline,Article Link,Source
0,2022-02-15 17:18,"Marriott Stock, Hyatt Run Through Buy Zones Amid Travel Rally; Wyndham Falls Late",https://www.investors.com/news/marriott-stock-rises-near-buy-point-with-5-hotel-earnings-on-tap/?src=A00220,Investor's Business Daily
1,2022-02-15 17:14,"Wyndham Hotels, IBD Stock Of The Day, Near Buy Point As Earnings Spike 886%",https://www.investors.com/research/ibd-stock-of-the-day/wyndham-hotels-stock-nears-buy-point-with-earnings-on-tap/?src=A00220,Investor's Business Daily
2,2022-02-15 17:00,"Airbnb First-Quarter Earnings Beat Estimates, As Does Outlook",https://www.investors.com/news/technology/airbnb-stock-jumps-ahead-of-fourth-quarter-earnings/?src=A00220,Investor's Business Daily
3,2022-02-15 16:38,Dow Jones Ends 3-Day Losing Streak With Strong Gains; These Travel Stocks Jump On Earnings,https://www.investors.com/market-trend/stock-market-today/dow-jones-nasdaq-hold-strong-gains-these-travel-stocks-jump-on-earnings/?src=A00220,Investor's Business Daily
4,2022-02-15 16:32,Why Marriott International Stock Was Up 5.8% Today,https://www.fool.com/investing/2022/02/15/why-marriott-international-stock-was-up-58-today/?source=eptyholnk0000202&utm_source=yahoo-host&utm_medium=feed&utm_campaign=article,Motley Fool
5,2022-02-15 15:25,Marriott reports minimal effects from Omicron on its 2021 recovery,https://www.bizjournals.com/washington/news/2022/02/15/marriott-optimistic-about-recovery-omicron-covid.html?ana=yahoo,American City Business Journals
6,2022-02-15 14:56,"Marriott's 2021 workforce declined by 1,000 employees, has dropped 31% in two years",https://www.marketwatch.com/story/marriotts-2021-workforce-declined-by-1000-employees-has-dropped-31-in-two-years-2022-02-15?siteid=yhoof2,MarketWatch
7,2022-02-15 14:48,"Nvidia Leads the Nasdaq Higher, But This Winner's More of a Surprise",https://www.fool.com/investing/2022/02/15/nvidia-leads-the-nasdaq-higher-but-this-winners-mo/?source=eptyholnk0000202&utm_source=yahoo-host&utm_medium=feed&utm_campaign=article,Motley Fool
8,2022-02-15 13:44,Stock Market Gains As Tensions On Ukraine Ease And As Travel Gets A Boost,https://www.investors.com/market-trend/stock-market-today/stock-market-gains-on-easing-ukraine-tensions-covid/?src=A00220,Investor's Business Daily
9,2022-02-15 11:56,Marriott reports strong Q4 earnings amid Omicron wave,https://finance.yahoo.com/video/marriott-reports-strong-q4-earnings-165608020.html,Yahoo Finance Video
10,2022-02-15 11:55,"Stock Market Adds Gains As Nasdaq Rallies 2%, Investors Shrug Off Inflation",https://www.investors.com/market-trend/stock-market-today/stock-market-rises-more-than-1-on-ukraine-news-inflation-again-heats-up/?src=A00220,Investor's Business Daily
11,2022-02-15 10:14,"Russia Says It's Pulled Troops Back, Lessening Pressure on Stocks",https://www.investopedia.com/russia-says-it-s-pulled-troops-back-lessening-pressure-on-stocks-5219114?utm_campaign=quote-yahoo&utm_source=yahoo&utm_medium=referral,Investopedia
12,2022-02-15 09:28,"Marriott (MAR) Q4 Earnings & Revenues Beat Estimates, Stock Up",https://finance.yahoo.com/news/marriott-mar-q4-earnings-revenues-142802632.html,Zacks
13,2022-02-15 08:32,Shares of Hotel Giant Marriott Rise on Q4 Earnings Beat,https://finance.yahoo.com/news/shares-hotel-giant-marriott-rise-133234747.html,FX Empire
14,2022-02-15 08:15,Marriott International (MAR) Tops Q4 Earnings and Revenue Estimates,https://finance.yahoo.com/news/marriott-international-mar-tops-q4-131501340.html,Zacks
15,2022-02-15 07:18,"UPDATE 1-Marriott posts profit as vaccinations, holiday traffic boost hotel occupancy",https://finance.yahoo.com/news/1-marriott-posts-profit-vaccinations-121805859.html,Reuters
16,2022-02-15 07:16,"Marriott results top estimates as vaccinations, holiday traffic boost hotel occupancy",https://finance.yahoo.com/news/marriott-posts-profit-vaccinations-holiday-121612290.html,Reuters
17,2022-02-15 07:13,Marriott's stock rallies into record territory after revenue more than doubles to beat expectations,https://www.marketwatch.com/story/marriotts-stock-rallies-into-record-territory-after-revenue-more-than-doubles-to-beat-expectations-2022-02-15?siteid=yhoof2,MarketWatch
18,2022-02-15 03:53,"Marriott Gains on Doubling Revenue, Prospects of Payouts Returning",https://finance.yahoo.com/news/marriott-gains-doubling-revenue-prospects-085351929.html,Investing.com
19,2022-02-15 02:56,"Marriott, Intel, Rivian Rise Premarket; Weber, Gap Fall",https://finance.yahoo.com/news/marriott-intel-rivian-rise-premarket-075651062.html,Investing.com
20,2022-02-14 15:28,Marriott International announces leadership changes,https://www.bizjournals.com/washington/news/2022/02/14/marriott-announces-leadership-changes.html?ana=yahoo,American City Business Journals
21,2022-02-14 11:00,THE LUXURY COLLECTION DEBUTS IN DOMINICAN REPUBLIC'S NORTHERN COAST,https://finance.yahoo.com/news/luxury-collection-debuts-dominican-republics-160000802.html,PR Newswire
22,2022-02-14 10:45,"Airbnb Earnings, Marriott Outlook, Producer Prices: 3 Things to Watch",https://finance.yahoo.com/news/airbnb-earnings-marriott-outlook-producer-154514705.html,Investing.com
23,2022-02-14 10:36,Marriott Is Well Worth Watching Ahead of Q4 Earnings,https://finance.yahoo.com/news/marriott-well-worth-watching-ahead-153627571.html,FX Empire
24,2022-02-14 08:39,Marriott Chairman J.W. Marriott Jr. to retire in May; David S. Marriott named successor,https://www.marketwatch.com/story/marriott-chairman-jw-marriott-jr-to-retire-in-may-david-s-marriott-named-successor-2022-02-14?siteid=yhoof2,MarketWatch
25,2022-02-14 08:30,Marriott International Board of Directors Announces Board Leadership Transition and New Director,https://finance.yahoo.com/news/marriott-international-board-directors-announces-133000685.html,PR Newswire
26,2022-02-14 06:40,Russia-Ukraine Tensions May Help the Fed Engineer a Soft Landing,https://www.barrons.com/articles/things-to-know-today-51644834355?siteid=yhoof2,Barrons.com
27,2022-02-12 00:03,The Hidden Ways Companies Raise Prices,https://www.wsj.com/articles/companies-hidden-inflation-consumer-price-index-11644549254?siteid=yhoof2,The Wall Street Journal
28,2022-02-11 17:42,United Airlines offers its loyal flyers a surprise,https://www.bizjournals.com/sanfrancisco/news/2022/02/11/united-airlines-offers-its-loyal-flyers-a-special.html?ana=yahoo,American City Business Journals
29,2022-02-11 13:55,"Top Stock Reports for Eli Lilly, Union Pacific & Freeport-McMoRan",https://finance.yahoo.com/news/top-stock-reports-eli-lilly-185506279.html,Zacks
30,2022-02-11 09:11,Marriott (MAR) Gears Up for Q4 Earnings: What's in Store?,https://finance.yahoo.com/news/marriott-mar-gears-q4-earnings-141102430.html,Zacks
31,2022-02-11 04:02,Marriott Bonvoy Portfolio of Resorts in Bali Teams Up with Bali.com to Provide Guests with a Seamless Travel Experience for the Re-Opening of Bali,https://finance.yahoo.com/news/marriott-bonvoy-portfolio-resorts-bali-090200746.html,PR Newswire
32,2022-02-10 03:59,MARRIOTT INTERNATIONAL PLANS FURTHER ASIA PACIFIC EXPANSION WITH 1000TH PROPERTY ANTICIPATED TO OPEN IN 2022,https://finance.yahoo.com/news/marriott-international-plans-further-asia-085900935.html,PR Newswire
33,2022-02-09 19:18,Marriott marks U.S. first with W Apartments in downtown Cleveland,https://www.bizjournals.com/cleveland/news/2022/02/09/erieview-tower-to-host-marriotts-w-apartments.html?ana=yahoo,American City Business Journals
34,2022-02-09 09:57,"Travel outlook: Labor shortages will be 'determining' as demand rebounds, Trivago CEO says",https://finance.yahoo.com/video/travel-outlook-labor-shortages-determining-145753057.html,Yahoo Finance Video
35,2022-02-08 15:00,Marriott International (MAR) Earnings Expected to Grow: What to Know Ahead of Next Week's Release,https://finance.yahoo.com/news/marriott-international-mar-earnings-expected-200008262.html,Zacks
36,2022-02-08 07:13,Cary hotel remains atop elite list of best in North Carolina,https://www.bizjournals.com/triangle/news/2022/02/08/us-news-best-hotels-the-umstead-cary-best-in-nc.html?ana=yahoo,American City Business Journals
37,2022-02-07 21:38,"Prime Capital Investment Advisors, LLC Buys Consumer Discretionary Select Sector SPDR, Walmart ...",https://finance.yahoo.com/news/prime-capital-investment-advisors-llc-023814038.html,GuruFocus.com
38,2022-02-07 09:38,"St. Louis Trust Co Buys O'Reilly Automotive Inc, Cerner Corp, Apple Inc, Sells Abbott ...",https://finance.yahoo.com/news/st-louis-trust-co-buys-143825981.html,GuruFocus.com
39,2022-02-04 13:38,"Broad Peak Investment Holdings Ltd. Buys International Game Technology PLC, Pershing Square ...",https://finance.yahoo.com/news/broad-peak-investment-holdings-ltd-183812804.html,GuruFocus.com
40,2022-02-03 09:38,"Brighton Jones Llc Buys T-Mobile US Inc, Lam Research Corp, Dimensional US Core Equity Market ...",https://finance.yahoo.com/news/brighton-jones-llc-buys-t-143817260.html,GuruFocus.com
41,2022-02-01 17:38,"TFG Advisers LLC Buys Eli Lilly and Co, Colgate-Palmolive Co, Air Products & Chemicals Inc, ...",https://finance.yahoo.com/news/tfg-advisers-llc-buys-eli-223812190.html,GuruFocus.com
42,2022-02-01 03:27,Top Consumer Discretionary Stocks for February 2022,https://www.investopedia.com/investing/consumer-cyclical-stocks/?utm_campaign=quote-yahoo&utm_source=yahoo&utm_medium=referral,Investopedia
43,2022-01-31 16:30,"BJs Restaurants, Inc. Appoints Julius W. Robinson, Jr. to its Board of Directors",https://finance.yahoo.com/news/bj-restaurants-inc-appoints-julius-213000122.html,GlobeNewswire
44,2022-01-31 14:55,"Carroll buys former Triad Macy's building for $8 million, plans new uses",https://www.bizjournals.com/triad/news/2022/01/31/carroll-plans-new-uses-for-macys-building.html?ana=yahoo,American City Business Journals
45,2022-01-31 13:38,"Ledyard National Bank Buys Schwab US Dividend Equity ETF, Vanguard Ultra-Short Bond ETF, ASML ...",https://finance.yahoo.com/news/ledyard-national-bank-buys-schwab-183832174.html,GuruFocus.com
46,2022-01-31 13:38,"Ardevora Asset Management LLP Buys Abbott Laboratories, Teradyne Inc, Palo Alto Networks Inc, ...",https://finance.yahoo.com/news/ardevora-asset-management-llp-buys-183822112.html,GuruFocus.com
47,2022-01-31 13:38,"Westhampton Capital, LLC Buys Zimmer Biomet Holdings Inc, Marriott International Inc, Ingersoll ...",https://finance.yahoo.com/news/westhampton-capital-llc-buys-zimmer-183815357.html,GuruFocus.com
48,2022-01-27 17:38,"Wright Investors Service Inc Buys Tesla Inc, Marriott International Inc, Caterpillar Inc, Sells ...",https://finance.yahoo.com/news/wright-investors-inc-buys-tesla-223812802.html,GuruFocus.com
49,2022-01-26 17:38,"GAM Holding AG Buys Seagate Technology Holdings PLC, Accenture PLC, Akamai Technologies Inc, ...",https://finance.yahoo.com/news/gam-holding-ag-buys-seagate-223826625.html,GuruFocus.com
50,2022-01-24 18:00,AEG to sell stake in L.A. Live hotels as the lodging industry recovers,https://finance.yahoo.com/news/aeg-sell-stake-l-live-230017810.html,LA Times
51,2022-01-24 17:31,Starwood Hotels & Resorts Worldwide Inc. -- Moody's revises Marriott's outlook to stable; affirms Baa3 unsecured rating,https://finance.yahoo.com/news/starwood-hotels-resorts-worldwide-inc-223107455.html,Moody's
52,2022-01-21 16:15,MARRIOTT INTERNATIONAL ANNOUNCES RELEASE DATE FOR FOURTH QUARTER 2021 EARNINGS,https://finance.yahoo.com/news/marriott-international-announces-release-date-211500462.html,PR Newswire
53,2022-01-21 10:44,"Marriott (MAR) on Expansion Spree, Signs 599 Agreements in 2021",https://finance.yahoo.com/news/marriott-mar-expansion-spree-signs-154403119.html,Zacks
54,2022-01-20 14:57,AC HOTELS BY MARRIOT® CHARLOTTE BALLANTYNE LOCATION NOW OPEN,https://finance.yahoo.com/news/ac-hotels-marriot-charlotte-ballantyne-195700794.html,PR Newswire
55,2022-01-20 12:10,Will Marriott (MAR) Beat Estimates Again in Its Next Earnings Report?,https://finance.yahoo.com/news/marriott-mar-beat-estimates-again-171005749.html,Zacks
56,2022-01-20 09:34,"THE RITZ-CARLTON, DALLAS DEBUTS MULTIMILLION DOLLAR SPA RENOVATION",https://finance.yahoo.com/news/ritz-carlton-dallas-debuts-multimillion-143400683.html,PR Newswire
57,2022-01-20 07:24,Marriott International Provides an Update on Development Progress in 2021 and Overview of Key Trends Currently Shaping Hospitality Development,https://finance.yahoo.com/news/marriott-international-provides-development-progress-122400386.html,PR Newswire
58,2022-01-19 11:11,Sonder becoming latest boutique apartment-hotel hospitality short-term rental company to boom,https://finance.yahoo.com/video/sonder-becoming-latest-boutique-apartment-161146245.html,Yahoo Finance Video
59,2022-01-18 13:38,"CMH Wealth Management LLC Buys Blackstone Inc, BTC iShares Cohen & Steers REIT ETF, ...",https://finance.yahoo.com/news/cmh-wealth-management-llc-buys-183811988.html,GuruFocus.com
60,2022-01-13 17:38,"Canandaigua National Corp Buys Amazon.com Inc, American Express Co, S&P Global Inc, Sells ...",https://finance.yahoo.com/news/canandaigua-national-corp-buys-amazon-223806269.html,GuruFocus.com
61,2022-01-13 15:18,"Market check: Nasdaq poised to end three-day streak, tech and health care lag",https://finance.yahoo.com/video/market-check-nasdaq-poised-end-201853245.html,Yahoo Finance Video
62,2022-01-12 17:38,"Stonnington Group, Llc Buys Microsoft Corp, The Home Depot Inc, UnitedHealth Group Inc, Sells ...",https://finance.yahoo.com/news/stonnington-group-llc-buys-microsoft-223814089.html,GuruFocus.com
63,2022-01-12 10:52,Four hotels ready to debut amid robust South Bay hospitality scene,https://www.bizjournals.com/sanfrancisco/news/2022/01/12/hotels-santa-clara-opening-construction-bay.html?ana=yahoo,American City Business Journals
64,2022-01-12 08:00,Profit Is About To Go Through The Roof At 7 Companies,https://www.investors.com/etfs-and-funds/sectors/sp500-profit-is-about-to-go-through-the-roof-at-companies/?src=A00220,Investor's Business Daily
65,2022-01-11 16:33,7 Travel and Tourism Stocks to Reserve Now for a Rebound in 2022,https://finance.yahoo.com/news/7-travel-tourism-stocks-now-213324543.html,InvestorPlace
66,2022-01-10 14:27,Top Hotel Stocks for Q1 2022,https://www.investopedia.com/top-hotel-stocks-5078914?utm_campaign=quote-yahoo&utm_source=yahoo&utm_medium=referral,Investopedia
67,2022-01-07 01:30,Marriott Gives a Peek Into Its New R&D Lab for Post-Pandemic Travel,https://finance.yahoo.com/news/marriott-gives-peek-r-d-063000387.html,Skift
68,2022-01-06 15:16,"Ritz-Carlton developer, local investment group plan two residential towers",https://www.bizjournals.com/nashville/news/2022/01/06/sobro-land-sale-lafayette-street.html?ana=yahoo,American City Business Journals
69,2022-01-06 08:15,Marriott to launch research and development lab in its new Bethesda headquarters,https://www.bizjournals.com/washington/news/2022/01/06/marriott-to-launch-marriott-design-lab-in-new-hq.html?ana=yahoo,American City Business Journals
70,2022-01-06 08:00,Tesla is 'giving cover to the Chinese government' by doing business in Xinjiang: senator,https://finance.yahoo.com/news/tesla-is-giving-cover-to-the-chinese-government-by-doing-business-in-xinjiang-oregon-senator-130023948.html,Yahoo Finance
71,2022-01-05 23:14,MARRIOTT INTERNATIONAL CONTINUES TO EXPAND FOOTPRINT IN MALAYSIA WITH THE INTRODUCTION OF THE LE MÉRIDIEN BRAND TO PENANG,https://finance.yahoo.com/news/marriott-international-continues-expand-footprint-041400826.html,PR Newswire
72,2022-01-05 16:00,Leisure travel is four times the size' of business travel: Marriott International President,https://finance.yahoo.com/video/leisure-travel-four-times-size-210032283.html,Yahoo Finance Video
73,2022-01-04 15:02,4 Surprise Nasdaq Stock Winners on a Tough Tuesday,https://www.fool.com/investing/2022/01/04/4-surprise-nasdaq-stock-winners-on-a-tough-tuesday/?source=eptyholnk0000202&utm_source=yahoo-host&utm_medium=feed&utm_campaign=article,Motley Fool
74,2021-12-28 14:57,Construction on Aloft Hotel in Fort Lauderdale scheduled to begin next month,https://www.bizjournals.com/southflorida/news/2021/12/28/aloft-hotel-coming-to-fort-lauderdale.html?ana=yahoo,American City Business Journals
75,2021-12-28 10:02,"Market check: Stocks higher at open, mega caps under pressure",https://finance.yahoo.com/video/market-check-stocks-higher-open-150217951.html,Yahoo Finance Video
76,2021-12-28 10:00,"AMC, Tesla, GameStop lead Yahoo Finances most-searched tickers in 2021",https://finance.yahoo.com/video/amc-tesla-gamestop-among-yahoo-150021152.html,Yahoo Finance Video
77,2021-12-27 16:39,Marriott International Inc Insiders are Selling; Investors Should Take Notice,https://finance.yahoo.com/news/marriott-international-inc-insiders-selling-213909024.html,GuruFocus.com
78,2021-12-27 15:51,Cutera Inc Insiders are Buying; Investors Should Take Notice,https://finance.yahoo.com/news/cutera-inc-insiders-buying-investors-205104906.html,GuruFocus.com
79,2021-12-27 15:23,Two D.C. hotels sell to investor group tied to Marriott family members,https://www.bizjournals.com/washington/news/2021/12/27/douglas-development-sales-close-ahead-of-2022.html?ana=yahoo,American City Business Journals
80,2021-12-25 12:38,"Usgi Global Luxury Goods Fund Buys Christian Dior SE, Goldman Sachs Group Inc, Starbucks Corp, ...",https://finance.yahoo.com/news/usgi-global-luxury-goods-fund-173802036.html,GuruFocus.com
81,2021-12-23 14:32,Hotels are being forced to 'close off sections of rooms because they don't have the labor': Industry CEO,https://finance.yahoo.com/video/hotels-being-forced-close-off-193234402.html,Yahoo Finance Video
82,2021-12-22 18:00,"Hotels in tight spot handling JPM refunds, frustrating some conferencegoers",https://www.bizjournals.com/sanfrancisco/news/2021/12/22/jpm-virtual-hotel-refund-deposit-omicron.html?ana=yahoo,American City Business Journals
83,2021-12-22 10:03,"Market check: Stocks open mixed, bond volatility settles",https://finance.yahoo.com/video/market-check-stocks-open-mixed-150312079.html,Yahoo Finance Video
84,2021-12-21 21:00,Melco Announces Partnership with Marriott International to Develop The First W Hotel at Studio City Phase Two in Macau,https://finance.yahoo.com/news/melco-announces-partnership-marriott-international-020000458.html,GlobeNewswire
85,2021-12-21 21:00,Marriott International Signs Agreement with Melco Resorts & Entertainment to Bring Macau's First W Hotel,https://finance.yahoo.com/news/marriott-international-signs-agreement-melco-020000206.html,PR Newswire
86,2021-12-21 12:29,Stocks rebound after Omicron concerns rattle markets,https://finance.yahoo.com/video/stocks-rebound-omicron-concerns-rattle-172957687.html,Yahoo Finance Video
87,2021-12-21 08:48,Marriott (MAR) Boosts Luxury Collection Line-up in Australia,https://finance.yahoo.com/news/marriott-mar-boosts-luxury-collection-134801728.html,Zacks
88,2021-12-20 13:39,Here's a look inside Marriott International's flagship Bethesda hotel,https://www.bizjournals.com/washington/news/2021/12/20/inside-marriotts-flagship-bethesda-hotel.html?ana=yahoo,American City Business Journals
89,2021-12-20 09:03,"THE LUXURY COLLECTION DEBUTS IN AUSTRALIA WITH THE OPENING OF THE TASMAN, A LUXURY COLLECTION HOTEL, HOBART",https://finance.yahoo.com/news/luxury-collection-debuts-australia-opening-140300861.html,PR Newswire
90,2021-12-16 21:00,"THE LUXURY COLLECTION DEBUTS IN AUSTRALIA WITH THE OPENING OF THE TASMAN, A LUXURY COLLECTION HOTEL, HOBART",https://finance.yahoo.com/news/luxury-collection-debuts-australia-opening-020000584.html,PR Newswire
91,2021-12-16 20:38,"Fidelity Hastings Street Trust Buys Universal Music Group NV, SAP SE, Glencore PLC, Sells BHP ...",https://finance.yahoo.com/news/fidelity-hastings-street-trust-buys-013801902.html,GuruFocus.com
92,2021-12-15 17:48,J.P. Morgan conference pivot to virtual is a worrying sign for S.F. hospitality,https://www.bizjournals.com/sanfrancisco/news/2021/12/15/jpm-22-virtual-precedent-sf-conferences-omicron.html?ana=yahoo,American City Business Journals
93,2021-12-15 12:25,Carnival Corporation CEO: We are seeing strong demand,https://finance.yahoo.com/news/carnival-corporation-ceo-we-are-seeing-strong-demand-172535546.html,Yahoo Finance
94,2021-12-15 03:13,Marriott International Introduces New Website In Bahasa Indonesia For Domestic Travelers,https://finance.yahoo.com/news/marriott-international-introduces-website-bahasa-081300350.html,PR Newswire
95,2021-12-15 01:38,"VIP Mid Cap Portfolio Buys GXO Logistics Inc, Telos Corp, OGE Energy Corp, Sells Knight-Swift ...",https://finance.yahoo.com/news/vip-mid-cap-portfolio-buys-063809212.html,GuruFocus.com
96,2021-12-14 10:30,The Luxury Collection Announces New Global Explorer Caroline de Maigret,https://finance.yahoo.com/news/luxury-collection-announces-global-explorer-153000992.html,PR Newswire
97,2021-12-14 04:08,MARRIOTT BONVOY DRAWS 2021 TO A CLOSE WITH GRATITUDE,https://finance.yahoo.com/news/marriott-bonvoy-draws-2021-close-090800195.html,PR Newswire
98,2021-12-13 10:38,"Market check: Tesla shares fall, travel stocks under pressure",https://finance.yahoo.com/video/market-check-tesla-shares-fall-153825301.html,Yahoo Finance Video
99,2021-12-13 07:45,Marriott's in the Metaverse: Will More Hotel Brands Take the Virtual Plunge?,https://www.fool.com/real-estate/2021/12/13/marriotts-in-the-metaverse-will-more-hotels-join/?source=eptyholnk0000202&utm_source=yahoo-host&utm_medium=feed&utm_campaign=article,Motley Fool
