,Date,News Headline,Article Link,Source
0,2022-01-28 11:08,Hilltop Holdings (HTH) Beats on Q4 Earnings as Costs Decline,https://finance.yahoo.com/news/hilltop-holdings-hth-beats-q4-160804998.html,Zacks
1,2022-01-27 16:00,Hancock Whitney Corporation Announces Quarterly Dividend,https://finance.yahoo.com/news/hancock-whitney-corporation-announces-quarterly-210000113.html,Business Wire
2,2022-01-24 12:20,Surging Earnings Estimates Signal Upside for Hancock Whitney (HWC) Stock,https://finance.yahoo.com/news/surging-earnings-estimates-signal-upside-172005559.html,Zacks
3,2022-01-24 06:30,Best Income Stocks to Buy for January 24th,https://finance.yahoo.com/news/best-income-stocks-buy-january-113011729.html,Zacks
4,2022-01-19 16:07,10 Key Earnings Reports from The Financial Sector,https://finance.yahoo.com/news/10-key-earnings-reports-financial-210739114.html,Insider Monkey
5,2022-01-19 10:19,"Hancock Whitney (HWC) Q4 Earnings Beat Estimates, Revenues Lag",https://finance.yahoo.com/news/hancock-whitney-hwc-q4-earnings-151903668.html,Zacks
6,2022-01-19 09:38,"TruWealth Advisors, LLC Buys Accenture PLC, iShares Core MSCI Total International Stock ETF, ...",https://finance.yahoo.com/news/truwealth-advisors-llc-buys-accenture-143816086.html,GuruFocus.com
7,2022-01-19 02:00,Hancock Whitney Corporation (HWC) Q4 2021 Earnings Call Transcript,https://www.fool.com/earnings/call-transcripts/2022/01/19/hancock-whitney-corporation-hwc-q4-2021-earnings-c/?source=eptyholnk0000202&utm_source=yahoo-host&utm_medium=feed&utm_campaign=article,Motley Fool
8,2022-01-18 18:15,Hancock Whitney (HWC) Surpasses Q4 Earnings Estimates,https://finance.yahoo.com/news/hancock-whitney-hwc-surpasses-q4-231511752.html,Zacks
9,2022-01-18 16:00,Hancock Whitney Reports Fourth Quarter 2021 EPS of $1.55,https://finance.yahoo.com/news/hancock-whitney-reports-fourth-quarter-210000986.html,Business Wire
10,2022-01-14 16:56,Hancock Whitney Corporation -- Moody's announces completion of a periodic review of ratings of Hancock Whitney Corporation,https://finance.yahoo.com/news/hancock-whitney-corporation-moodys-announces-215608248.html,Moody's
11,2022-01-14 12:51,"Washington Federal (WAFD) Q1 Earnings Beat Estimates, Stock Up",https://finance.yahoo.com/news/washington-federal-wafd-q1-earnings-175105684.html,Zacks
12,2022-01-11 15:00,Hancock Whitney (HWC) Earnings Expected to Grow: What to Know Ahead of Next Week's Release,https://finance.yahoo.com/news/hancock-whitney-hwc-earnings-expected-200008001.html,Zacks
13,2022-01-10 12:00,What Makes Hancock Whitney (HWC) a Strong Momentum Stock: Buy Now?,https://finance.yahoo.com/news/makes-hancock-whitney-hwc-strong-170005320.html,Zacks
14,2021-12-28 09:15,Hancock Whitney Corporation to Announce Fourth Quarter 2021 Financial Results and Host Conference Call January 18,https://finance.yahoo.com/news/hancock-whitney-corporation-announce-fourth-141500079.html,Business Wire
15,2021-12-23 09:16,5 Bank Stocks Poised to Continue Their Winning Streaks in 2022,https://finance.yahoo.com/news/5-bank-stocks-poised-continue-141602181.html,Zacks
16,2021-12-17 18:24,Hedge Funds Are Warming Up To Hancock Whitney Corporation (HWC),https://finance.yahoo.com/news/hedge-funds-warming-hancock-whitney-232446983.html,Insider Monkey
17,2021-12-03 07:31,"The Zacks Analyst Blog Highlights: Southside Bancshares, Hancock Whitney Corp and HomeStreet",https://finance.yahoo.com/news/zacks-analyst-blog-highlights-southside-123112125.html,Zacks
18,2021-12-02 08:57,3 Bank Picks As Powell Soothes Market Concerns Over Taper Moves,https://finance.yahoo.com/news/3-bank-picks-powell-soothes-135701723.html,Zacks
19,2021-11-30 09:12,6 Reasons to Invest in Hancock Whitney (HWC) Stock Right Now,https://finance.yahoo.com/news/6-reasons-invest-hancock-whitney-141202414.html,Zacks
20,2021-11-18 11:30,Hancock Whitney (HWC) Up 0.5% Since Last Earnings Report: Can It Continue?,https://finance.yahoo.com/news/hancock-whitney-hwc-0-5-163004058.html,Zacks
21,2021-11-16 12:20,Can Hancock Whitney (HWC) Run Higher on Rising Earnings Estimates?,https://finance.yahoo.com/news/hancock-whitney-hwc-run-higher-172005237.html,Zacks
22,2021-10-29 09:15,Hancock Whitney Corporation Announces Quarterly Dividend,https://finance.yahoo.com/news/hancock-whitney-corporation-announces-quarterly-131500388.html,Business Wire
23,2021-10-28 16:00,Hancock Whitney Appoints Pérez and Lane to Its Holding Company Board,https://finance.yahoo.com/news/hancock-whitney-appoints-p-rez-200000768.html,Business Wire
24,2021-10-28 11:03,"Prosperity Bancshares (PB) Q3 Earnings Beat, Stock Dips 2.8%",https://finance.yahoo.com/news/prosperity-bancshares-pb-q3-earnings-150303989.html,Zacks
25,2021-10-27 09:24,"CIT Group (CIT) Q3 Earnings Beat, Revenues & Costs Decline Y/Y",https://finance.yahoo.com/news/cit-group-cit-q3-earnings-132401937.html,Zacks
26,2021-10-26 12:00,Are You Looking for a Top Momentum Pick? Why Hancock Whitney (HWC) is a Great Choice,https://finance.yahoo.com/news/looking-top-momentum-pick-why-160004030.html,Zacks
27,2021-10-25 15:14,Is Hancock Whitney Corporation (HWC) Going to Burn These Hedge Funds?,https://finance.yahoo.com/news/hancock-whitney-corporation-hwc-going-191413211.html,Insider Monkey
28,2021-10-25 11:49,Best Momentum Stocks to Buy for October 25th,https://finance.yahoo.com/news/best-momentum-stocks-buy-october-154903527.html,Zacks
29,2021-10-25 10:39,Best Income Stocks to Buy for October 25th,https://finance.yahoo.com/news/best-income-stocks-buy-october-143902588.html,Zacks
30,2021-10-22 10:49,"Bank OZK (OZK) Q3 Earnings Beat, Revenues & Costs Rise Y/Y",https://finance.yahoo.com/news/bank-ozk-ozk-q3-earnings-144902050.html,Zacks
31,2021-10-20 08:39,"Hancock Whitney (HWC) Q3 Earnings & Revenues Beat, Costs Down",https://finance.yahoo.com/news/hancock-whitney-hwc-q3-earnings-123912312.html,Zacks
32,2021-10-19 20:00,Hancock Whitney Corporation (HWC) Q3 2021 Earnings Call Transcript,https://www.fool.com/earnings/call-transcripts/2021/10/19/hancock-whitney-corporation-hwc-q3-2021-earnings-c/?source=eptyholnk0000202&utm_source=yahoo-host&utm_medium=feed&utm_campaign=article,Motley Fool
33,2021-10-19 17:25,Hancock Whitney (HWC) Q3 Earnings and Revenues Surpass Estimates,https://finance.yahoo.com/news/hancock-whitney-hwc-q3-earnings-212509092.html,Zacks
34,2021-10-19 16:00,Hancock Whitney Reports Third Quarter 2021 EPS of $1.46,https://finance.yahoo.com/news/hancock-whitney-reports-third-quarter-200000866.html,Business Wire
35,2021-10-12 15:00,Hancock Whitney (HWC) Reports Next Week: Wall Street Expects Earnings Growth,https://finance.yahoo.com/news/hancock-whitney-hwc-reports-next-190007967.html,Zacks
36,2021-09-28 09:45,Hancock Whitney Corporation to Announce Third Quarter 2021 Financial Results and Host Conference Call October 19,https://finance.yahoo.com/news/hancock-whitney-corporation-announce-third-134500950.html,Business Wire
37,2021-09-02 16:00,"Hancock Whitney Commits $2.5 Million to Ida Relief, Opens 40 Percent of Affected Locations",https://finance.yahoo.com/news/hancock-whitney-commits-2-5-200000794.html,Business Wire
38,2021-08-30 16:40,Hancock Whitney Corporation Shares Update on Post-Hurricane Ida Response in Affected Areas,https://finance.yahoo.com/news/hancock-whitney-corporation-shares-post-204000024.html,Business Wire
39,2021-08-25 08:17,Hancock Whitney's (NASDAQ:HWC) investors will be pleased with their stellar 129% return over the last year,https://finance.yahoo.com/news/hancock-whitneys-nasdaq-hwc-investors-121732197.html,Simply Wall St.
40,2021-08-19 11:30,Hancock Whitney (HWC) Up 2.2% Since Last Earnings Report: Can It Continue?,https://finance.yahoo.com/news/hancock-whitney-hwc-2-2-153003181.html,Zacks
41,2021-08-02 16:35,ATTENTION NORTHSTAR FINANCIAL SERVICES (BERMUDA) INVESTORS: The Securities Arbitration Law Firm of KlaymanToskes Commences Investigation of Potential Claims on Behalf of HANCOCK WHITNEY INVESTMENT SERVICES CUSTOMERS,https://finance.yahoo.com/news/attention-northstar-financial-services-bermuda-203500024.html,GlobeNewswire
42,2021-07-30 09:15,Hancock Whitney Corporation Announces Quarterly Dividend,https://finance.yahoo.com/news/hancock-whitney-corporation-announces-quarterly-131500479.html,Business Wire
43,2021-07-29 08:32,New York Community (NYCB) Up 9.6% as Q2 Earnings Beat Estimates,https://finance.yahoo.com/news/york-community-nycb-9-6-123212567.html,Zacks
44,2021-07-22 10:40,Why Hancock Whitney (HWC) is a Top Growth Stock for the Long-Term,https://finance.yahoo.com/news/why-hancock-whitney-hwc-top-144002095.html,Zacks
45,2021-07-21 07:56,"Hancock Whitney (HWC) Q2 Earnings & Revenue Beat, Expenses Up",https://finance.yahoo.com/news/hancock-whitney-hwc-q2-earnings-115611006.html,Zacks
46,2021-07-20 20:00,Hancock Whitney Corporation (HWC) Q2 2021 Earnings Call Transcript,https://www.fool.com/earnings/call-transcripts/2021/07/20/hancock-whitney-corporation-hwc-q2-2021-earnings-c/?source=eptyholnk0000202&utm_source=yahoo-host&utm_medium=feed&utm_campaign=article,Motley Fool
47,2021-07-20 17:45,Hancock Whitney (HWC) Q2 Earnings and Revenues Top Estimates,https://finance.yahoo.com/news/hancock-whitney-hwc-q2-earnings-214509501.html,Zacks
48,2021-07-20 16:00,Hancock Whitney Reports Second Quarter 2021 EPS of $1.00,https://finance.yahoo.com/news/hancock-whitney-reports-second-quarter-200000545.html,Business Wire
49,2021-07-16 08:34,Should You Buy Hancock Whitney (HWC) Ahead of Earnings?,https://finance.yahoo.com/news/buy-hancock-whitney-hwc-ahead-123412369.html,Zacks
50,2021-07-13 15:00,Hancock Whitney (HWC) Reports Next Week: Wall Street Expects Earnings Growth,https://finance.yahoo.com/news/hancock-whitney-hwc-reports-next-190007801.html,Zacks
51,2021-06-30 09:15,Hancock Whitney Corporation to Announce Second Quarter 2021 Financial Results and Host Conference Call July 20,https://finance.yahoo.com/news/hancock-whitney-corporation-announce-second-131500875.html,Business Wire
52,2021-06-15 16:05,Hancock Whitney Corporation Redeems Subordinated Notes,https://finance.yahoo.com/news/hancock-whitney-corporation-redeems-subordinated-200500909.html,Business Wire
53,2021-05-27 17:15,Hancock Whitney Corporation Announces Quarterly Dividend,https://finance.yahoo.com/news/hancock-whitney-corporation-announces-quarterly-211500829.html,Business Wire
54,2021-05-27 05:31,What Kind Of Shareholders Hold The Majority In Hancock Whitney Corporation's (NASDAQ:HWC) Shares?,https://finance.yahoo.com/news/kind-shareholders-hold-majority-hancock-093124783.html,Simply Wall St.
55,2021-05-20 11:30,Hancock Whitney (HWC) Up 10.3% Since Last Earnings Report: Can It Continue?,https://finance.yahoo.com/news/hancock-whitney-hwc-10-3-153003966.html,Zacks
56,2021-05-14 09:34,Top Ranked Income Stocks to Buy for May 14th,https://finance.yahoo.com/news/top-ranked-income-stocks-buy-133401033.html,Zacks
57,2021-05-14 07:36,New Strong Buy Stocks for May 14th,https://finance.yahoo.com/news/strong-buy-stocks-may-14th-113611950.html,Zacks
58,2021-05-13 09:32,"Hancock Whitney's (HWC) Shares March Higher, Can It Continue?",https://finance.yahoo.com/news/hancock-whitneys-hwc-shares-march-133201033.html,Zacks
59,2021-05-11 07:54,"Zacks.com featured highlights include: LG Display Co, Dow, Eagle Bulk Shipping, Hancock Whitney Corp and Franchise Group",https://finance.yahoo.com/news/zacks-com-featured-highlights-lg-115411134.html,Zacks
60,2021-05-10 09:32,These High Earnings Yield Stocks Could Yield Huge Returns,https://finance.yahoo.com/news/high-earnings-yield-stocks-could-133201332.html,Zacks
61,2021-04-26 11:03,New Strong Buy Stocks for April 26th,https://finance.yahoo.com/news/strong-buy-stocks-april-26th-150303462.html,Zacks
62,2021-04-26 10:14,Top Ranked Momentum Stocks to Buy for April 26th,https://finance.yahoo.com/news/top-ranked-momentum-stocks-buy-141402026.html,Zacks
63,2021-04-22 05:05,Hancock Whitney (HWC) Surges 9%: Is This an Indication of Further Gains?,https://finance.yahoo.com/news/hancock-whitney-hwc-surges-9-090509524.html,Zacks
64,2021-04-21 14:13,Hancock Whitney (HWC) Up 2.1% on Q1 Earnings & Revenue Beat,https://finance.yahoo.com/news/hancock-whitney-hwc-2-1-181306814.html,Zacks
65,2021-04-21 03:00,Hancock Whitney Corporation (HWC) Q1 2021 Earnings Call Transcript,https://www.fool.com/earnings/call-transcripts/2021/04/21/hancock-whitney-corporation-hwc-q1-2021-earnings-c/?source=eptyholnk0000202&utm_source=yahoo-host&utm_medium=feed&utm_campaign=article,Motley Fool
66,2021-04-20 17:15,Hancock Whitney (HWC) Surpasses Q1 Earnings and Revenue Estimates,https://finance.yahoo.com/news/hancock-whitney-hwc-surpasses-q1-211509304.html,Zacks
67,2021-04-20 16:00,Hancock Whitney Reports First Quarter 2021 EPS of $1.21,https://finance.yahoo.com/news/hancock-whitney-reports-first-quarter-200000612.html,Business Wire
68,2021-04-20 15:45,Hancock Whitney Corp. to Host Earnings Call,https://finance.yahoo.com/news/hancock-whitney-corp-host-earnings-194500616.html,ACCESSWIRE
69,2021-04-19 08:38,Why Earnings Season Could Be Great for Hancock Whitney (HWC),https://finance.yahoo.com/news/why-earnings-season-could-great-123812276.html,Zacks
70,2021-04-13 12:30,Hancock Whitney (HWC) Reports Next Week: Wall Street Expects Earnings Growth,https://finance.yahoo.com/news/hancock-whitney-hwc-reports-next-163004835.html,Zacks
71,2021-03-30 09:25,Hancock Whitney Corporation to Announce First Quarter 2021 Financial Results and Host Conference Call April 20,https://finance.yahoo.com/news/hancock-whitney-corporation-announce-first-132500573.html,Business Wire
72,2021-03-04 11:40,HWC vs. SNV: Which Stock Is the Better Value Option?,https://finance.yahoo.com/news/hwc-vs-snv-stock-better-164004943.html,Zacks
73,2021-03-04 10:15,Understanding Hancock Whitney's Ex-Dividend Date,https://finance.yahoo.com/news/understanding-hancock-whitneys-ex-dividend-151548901.html,Benzinga
74,2021-02-26 01:34,Hancock Whitney (NASDAQ:HWC) Has Compensated Shareholders With A Respectable 75% Return On Their Investment,https://finance.yahoo.com/news/hancock-whitney-nasdaq-hwc-compensated-063429398.html,Simply Wall St.
75,2021-02-25 16:00,Hancock Whitney Corporation Announces Quarterly Dividend,https://finance.yahoo.com/news/hancock-whitney-corporation-announces-quarterly-210000725.html,Business Wire
76,2021-02-05 12:10,Top Ranked Income Stocks to Buy for February 5th,https://finance.yahoo.com/news/top-ranked-income-stocks-buy-171005016.html,Zacks
77,2021-02-01 10:33,Top Ranked Value Stocks to Buy for February 1st,https://finance.yahoo.com/news/top-ranked-value-stocks-buy-153303584.html,Zacks
78,2021-01-28 12:20,Surging Earnings Estimates Signal Upside for Hancock Whitney (HWC) Stock,https://finance.yahoo.com/news/surging-earnings-estimates-signal-upside-172005140.html,Zacks
79,2021-01-25 11:40,HWC vs. FBNC: Which Stock Should Value Investors Buy Now?,https://finance.yahoo.com/news/hwc-vs-fbnc-stock-value-164004825.html,Zacks
80,2021-01-21 08:38,"Hancock Whitney (HWC) Q4 Earnings Beat, Revenues Rise Y/Y",https://finance.yahoo.com/news/hancock-whitney-hwc-q4-earnings-133801417.html,Zacks
81,2021-01-20 17:15,Hancock Whitney (HWC) Q4 Earnings and Revenues Surpass Estimates,https://finance.yahoo.com/news/hancock-whitney-hwc-q4-earnings-221510237.html,Zacks
82,2021-01-20 16:05,Hancock Whitney: Q4 Earnings Insights,https://finance.yahoo.com/news/hancock-whitney-q4-earnings-insights-210559392.html,Benzinga
83,2021-01-20 16:00,Hancock Whitney Reports Fourth Quarter 2020 EPS Of $1.17,https://finance.yahoo.com/news/hancock-whitney-reports-fourth-quarter-210000045.html,Business Wire
84,2021-01-20 15:15,Hancock Whitney Corp. to Host Earnings Call,https://finance.yahoo.com/news/hancock-whitney-corp-host-earnings-201500437.html,ACCESSWIRE
85,2021-01-13 12:30,Hancock Whitney (HWC) Expected to Beat Earnings Estimates: Can the Stock Move Higher?,https://finance.yahoo.com/news/hancock-whitney-hwc-expected-beat-173005152.html,Zacks
86,2021-01-06 16:00,Hancock Whitney Corporation to Announce Fourth Quarter 2020 Financial Results and Host Conference Call January 20,https://finance.yahoo.com/news/hancock-whitney-corporation-announce-fourth-210000546.html,Business Wire
87,2020-11-28 02:10,Do These 3 Checks Before Buying Hancock Whitney Corporation (NASDAQ:HWC) For Its Upcoming Dividend,https://finance.yahoo.com/news/3-checks-buying-hancock-whitney-071001695.html,Simply Wall St.
88,2020-11-19 16:30,Hancock Whitney Corporation Announces Quarterly Dividend,https://finance.yahoo.com/news/hancock-whitney-corporation-announces-quarterly-213000851.html,GlobeNewswire
89,2020-11-19 11:30,Hancock Whitney (HWC) Up 22.3% Since Last Earnings Report: Can It Continue?,https://finance.yahoo.com/news/hancock-whitney-hwc-22-3-163004821.html,Zacks
90,2020-10-30 10:04,How Does Hancock Whitney's (NASDAQ:HWC) CEO Pay Compare With Company Performance?,https://finance.yahoo.com/news/does-hancock-whitneys-nasdaq-hwc-140441480.html,Simply Wall St.
91,2020-10-22 13:30,Hancock Whitney Appoints Suzette Kent to Its Holding Company Board,https://finance.yahoo.com/news/hancock-whitney-appoints-suzette-kent-173000023.html,GlobeNewswire
92,2020-10-21 08:02,Hancock Whitney (HWC) Stock Up on Q3 Earnings & Revenue Beat,https://finance.yahoo.com/news/hancock-whitney-hwc-stock-q3-120212116.html,Zacks
93,2020-10-20 23:30,Hancock Whitney Corporation (HWC) Q3 2020 Earnings Call Transcript,https://www.fool.com/earnings/call-transcripts/2020/10/20/hancock-whitney-corporation-hwc-q3-2020-earnings-c/?source=eptyholnk0000202&utm_source=yahoo-host&utm_medium=feed&utm_campaign=article,Motley Fool
94,2020-10-20 17:25,Hancock Whitney (HWC) Tops Q3 Earnings and Revenue Estimates,https://finance.yahoo.com/news/hancock-whitney-hwc-tops-q3-212509294.html,Zacks
95,2020-10-20 16:43,Hancock Whitney: Q3 Earnings Insights,https://finance.yahoo.com/news/hancock-whitney-q3-earnings-insights-204311165.html,Benzinga
96,2020-10-20 16:05,Hancock Whitney reports third quarter 2020 EPS of $.90,https://finance.yahoo.com/news/hancock-whitney-reports-third-quarter-200500475.html,GlobeNewswire
97,2020-10-20 15:00,Hancock Whitney Corp. to Host Earnings Call,https://finance.yahoo.com/news/hancock-whitney-corp-host-earnings-190000296.html,ACCESSWIRE
98,2020-10-13 12:30,Earnings Preview: Hancock Whitney (HWC) Q3 Earnings Expected to Decline,https://finance.yahoo.com/news/earnings-preview-hancock-whitney-hwc-163004953.html,Zacks
99,2020-10-06 22:38,Do Hedge Funds Love Hancock Whitney Corporation (HWC)?,https://finance.yahoo.com/news/hedge-funds-love-hancock-whitney-023815753.html,Insider Monkey
