,Date,News Headline,Article Link,Source
0,2022-01-27 17:38,"Bordeaux Wealth Advisors LLC Buys Upstart Holdings Inc, Apple Inc, iShares Core S&P 500 ...",https://finance.yahoo.com/news/bordeaux-wealth-advisors-llc-buys-223813887.html,GuruFocus.com
1,2022-01-27 16:23,Fidelity Joins Invesco and Schwab in Adding China Warnings to Funds,https://finance.yahoo.com/news/fidelity-joins-invesco-schwab-adding-212356773.html,Bloomberg
2,2022-01-27 12:26,"Retail Traders More Roiled Than Investors, Schwabs Sonders Says",https://finance.yahoo.com/news/retail-traders-more-roiled-investors-172603880.html,Bloomberg
3,2022-01-27 09:38,"Bridgecreek Investment Management, LLC Buys SoFi Technologies Inc, SoFi Technologies Inc, D.R. ...",https://finance.yahoo.com/news/bridgecreek-investment-management-llc-buys-143814898.html,GuruFocus.com
4,2022-01-26 17:38,"Trust Co Of Virginia  Buys Realty Income Corp, Berkshire Hathaway Inc, Markel Corp, Sells ...",https://finance.yahoo.com/news/trust-co-virginia-buys-realty-223818897.html,GuruFocus.com
5,2022-01-26 17:17,Schwab raises quarterly dividend by 11%,https://www.marketwatch.com/story/schwab-raises-quarterly-dividend-by-11-271643235433?siteid=yhoof2,MarketWatch
6,2022-01-26 16:51,Schwab Declares 11% Increase in Quarterly Common Stock Dividend and Declares Preferred Stock Dividends,https://finance.yahoo.com/news/schwab-declares-11-increase-quarterly-215100765.html,Business Wire
7,2022-01-26 12:17,Retail stock trading slower but still above pre-pandemic levels: Study,https://finance.yahoo.com/news/retail-stocks-trading-slower-but-still-above-pre-pandemic-levels-study-171759768.html,Yahoo Finance
8,2022-01-25 17:38,"Moseley Investment Management Inc Buys Berkshire Hathaway Inc, Liberty Broadband Corp, ...",https://finance.yahoo.com/news/moseley-investment-management-inc-buys-223807044.html,GuruFocus.com
9,2022-01-25 17:38,"Burleson & Company, LLC Buys Block Inc, ARK Innovation ETF, Twitter Inc, Sells Airbnb Inc, ...",https://finance.yahoo.com/news/burleson-company-llc-buys-block-223805021.html,GuruFocus.com
10,2022-01-25 13:38,"Montecito Bank & Trust Buys Financial Select Sector SPDR, iShares MSCI Emerging Markets ex ...",https://finance.yahoo.com/news/montecito-bank-trust-buys-financial-183806232.html,GuruFocus.com
11,2022-01-25 09:38,"PDS Planning, Inc Buys Apple Inc, iShares Core U.S. ...",https://finance.yahoo.com/news/pds-planning-inc-buys-apple-143811223.html,GuruFocus.com
12,2022-01-24 17:38,"Citizens & Northern Corp Buys AmerisourceBergen Corp, PPL Corp, Cisco Systems Inc, Sells ...",https://finance.yahoo.com/news/citizens-northern-corp-buys-amerisourcebergen-223802577.html,GuruFocus.com
13,2022-01-24 08:00,These Are The Best Online Stock Brokers For Beginners,https://www.investors.com/news/best-online-stock-broker-beginner-investors/?src=A00220,Investor's Business Daily
14,2022-01-24 08:00,These Are The Best Options Trading Platforms,https://www.investors.com/news/best-options-trading-platforms-2022/?src=A00220,Investor's Business Daily
15,2022-01-24 08:00,"If You Don't Love Your Online Broker, Now's The Time To Switch",https://www.investors.com/news/best-online-broker-overview-survey-ibd/?src=A00220,Investor's Business Daily
16,2022-01-24 08:00,Charles Schwab Excels Once Again On Consistency And Customer Focus,https://www.investors.com/news/charles-schwab-excels-best-online-broker-consistency-customer-focus/?src=A00220,Investor's Business Daily
17,2022-01-24 06:20,Is Schwab Fundamental U.S. Large Company Index ETF (FNDX) a Strong ETF Right Now?,https://finance.yahoo.com/news/schwab-fundamental-u-large-company-112011204.html,Zacks
18,2022-01-21 11:56,7 Stocks to Buy for a Year Full of Volatility and Rate Hikes,https://finance.yahoo.com/news/7-stocks-buy-full-volatility-165614472.html,InvestorPlace
19,2022-01-21 09:38,"BLB&B Advisors, LLC Buys Charles Schwab Corp, Barclays Bank PLC ZC SP REDEEM 12/06/2036 USD ...",https://finance.yahoo.com/news/blb-b-advisors-llc-buys-143819655.html,GuruFocus.com
20,2022-01-20 17:38,"Sheets Smith Wealth Management Buys iShares Short-Term National Muni Bond ETF, iShares National ...",https://finance.yahoo.com/news/sheets-smith-wealth-management-buys-223822113.html,GuruFocus.com
21,2022-01-20 17:38,"Chapman Investment Management, LLC Buys Charles Schwab Corp, Tesla Inc, KLA Corp, Sells ...",https://finance.yahoo.com/news/chapman-investment-management-llc-buys-223804833.html,GuruFocus.com
22,2022-01-20 09:00,Uptick in Charitable Giving Spurs Opportunity for Advisors,https://www.barrons.com/advisor/articles/schwab-charitable-giving-2021-51642685584?siteid=yhoof2,Barrons.com
23,2022-01-19 16:07,10 Key Earnings Reports from The Financial Sector,https://finance.yahoo.com/news/10-key-earnings-reports-financial-210739114.html,Insider Monkey
24,2022-01-19 15:21,Charles Schwab to renovate Germantown office,https://www.bizjournals.com/memphis/news/2022/01/19/charles-schwab-to-renovate-germantown-office.html?ana=yahoo,American City Business Journals
25,2022-01-19 13:38,"Benin Management Corp Buys Ford Motor Co, Invesco Financial Preferred ETF, Amgen Inc, Sells ...",https://finance.yahoo.com/news/benin-management-corp-buys-ford-183816319.html,GuruFocus.com
26,2022-01-19 11:47,Schwab CEO Sees Brokerage of the Future Looking More Like Uber,https://finance.yahoo.com/news/schwab-ceo-sees-brokerage-future-164743267.html,Bloomberg
27,2022-01-19 11:44,"Interactive Brokers (IBKR) Q4 Earnings Beat, Expenses Rise Y/Y",https://finance.yahoo.com/news/interactive-brokers-ibkr-q4-earnings-164404919.html,Zacks
28,2022-01-19 09:47,"Company News for Jan 19, 2022",https://finance.yahoo.com/news/company-news-jan-19-2022-144702743.html,Zacks
29,2022-01-19 09:38,"Purus Wealth Management, LLC Buys First Trust SMID Cap Rising Dividend Achievers ETF, First ...",https://finance.yahoo.com/news/purus-wealth-management-llc-buys-143820225.html,GuruFocus.com
30,2022-01-19 08:33,Is it a Good Choice to Invest in Charles Schwab (SCHW)?,https://finance.yahoo.com/news/good-choice-invest-charles-schwab-133340827.html,Insider Monkey
31,2022-01-19 08:00,Independent Advisors Expect Continued Growth Over the Next Five Years and Most See It Coming From New-to-Firm Clients,https://finance.yahoo.com/news/independent-advisors-expect-continued-growth-130000564.html,Business Wire
32,2022-01-18 16:53,Nasdaq Leads Downward Spiral As Stocks Dive And Yields Rise; Goldman And Microsoft Fall,https://www.investors.com/market-trend/stock-market-today/stock-market-dives-as-yields-rise-goldman-microsoft-fall/?src=A00220,Investor's Business Daily
33,2022-01-18 16:24,"Earnings Season Is Here, And Option Trades Can Help With Expected Moves",https://www.investors.com/research/options/earnings-season-is-here-and-option-trades-can-help-with-expected-moves/?src=A00220,Investor's Business Daily
34,2022-01-18 16:20,"Goldman Sachs Dives, Charles Schwab Slides As Earnings Miss",https://www.investors.com/news/bank-stocks-goldman-sachs-charles-schwab-earnings/?src=A00220,Investor's Business Daily
35,2022-01-18 16:16,"Stock Market Today: Bond Yields, Goldman a One-Two Punch for the Bears",https://finance.yahoo.com/news/stock-market-today-bond-yields-211636314.html,Kiplinger
36,2022-01-18 13:49,"Dow Jones Plummets 600 Points, Nasdaq Leads Downside; These Oil Stocks Score Breakouts As Energy Prices Rise",https://www.investors.com/market-trend/stock-market-today/dow-jones-plummets-600-points-nasdaq-leads-downside-these-oil-stocks-score-breakouts-as-energy-prices-rise/?src=A00220,Investor's Business Daily
37,2022-01-18 11:53,"Stock Market Sinks As Techs, Financials Slide; 3 Energy Stocks Top Buy Points",https://www.investors.com/market-trend/stock-market-today/stock-market-slides-as-yields-keep-rising-3-stocks-in-energy-sector-top-buy-points/?src=A00220,Investor's Business Daily
38,2022-01-18 10:05,The Charles Schwab Corporation (SCHW) Q4 Earnings and Revenues Lag Estimates,https://finance.yahoo.com/news/charles-schwab-corporation-schw-q4-150503743.html,Zacks
39,2022-01-18 09:38,"Leith Wheeler Investment Counsel Ltd. Buys Booz Allen Hamilton Holding Corp, Henry Schein Inc, ...",https://finance.yahoo.com/news/leith-wheeler-investment-counsel-ltd-143810149.html,GuruFocus.com
40,2022-01-18 09:38,"M&g Investment Management Ltd Buys Linde PLC, Charles Schwab Corp, REE Automotive, Sells ...",https://finance.yahoo.com/news/m-g-investment-management-ltd-143809193.html,GuruFocus.com
41,2022-01-18 09:38,"IFM Investors Pty Ltd Buys Pfizer Inc, Salesforce. ...",https://finance.yahoo.com/news/ifm-investors-pty-ltd-buys-143803058.html,GuruFocus.com
42,2022-01-18 08:59,"Charles Schwab Q4 profit rises, but falls short of estimate",https://www.marketwatch.com/story/charles-schwab-q4-profit-rises-but-falls-short-of-estimate-2022-01-18?siteid=yhoof2,MarketWatch
43,2022-01-18 08:45,Schwab Reports Record Quarterly and Full-Year Earnings Per Share,https://finance.yahoo.com/news/schwab-reports-record-quarterly-full-134500015.html,Business Wire
44,2022-01-17 08:06,"The Zacks Analyst Blog Highlights: The Charles Schwab Corp., J.B. Hunt Transport Services Inc. CSX Corp., Schlumberger Ltd. and BOK Financial Corp",https://finance.yahoo.com/news/zacks-analyst-blog-highlights-charles-130601860.html,Zacks
45,2022-01-14 14:45,7 Earnings Reports to Watch the Week of January 17,https://finance.yahoo.com/news/7-earnings-reports-watch-week-194507874.html,InvestorPlace
46,2022-01-14 14:05,Young workers wonder: When should I start saving for retirement?,https://www.marketwatch.com/story/young-workers-wonder-when-should-i-start-saving-for-retirement-11642116944?siteid=yhoof2,MarketWatch
47,2022-01-14 12:25,"The Zacks Analyst Blog Highlights: Exxon Mobil Corp., STMicroelectronics N.V., The Charles Schwab Corp., Albemarle Corp. and Interactive Brokers Group Inc",https://finance.yahoo.com/news/zacks-analyst-blog-highlights-exxon-172505745.html,Zacks
48,2022-01-14 11:01,Top 10 Stock Picks of John Armitages Egerton Capital,https://finance.yahoo.com/news/top-10-stock-picks-john-160135129.html,Insider Monkey
49,2022-01-14 07:00,Why This Top Schwab Portfolio Underweights Tesla,https://www.investors.com/etfs-and-funds/mutual-funds/best-mutual-funds-why-this-top-portfolio-underweights-tesla/?src=A00220,Investor's Business Daily
50,2022-01-14 06:27,Buy 5 Stocks That Are Set to Beat Earnings Results Next Week,https://finance.yahoo.com/news/buy-5-stocks-set-beat-112711818.html,Zacks
51,2022-01-13 12:53,Top-Ranked Value ETFs to Focus on Fed Rate Hike Worries,https://finance.yahoo.com/news/top-ranked-value-etfs-focus-175305130.html,Zacks
52,2022-01-13 10:41,Decent Client Activity to Aid Schwab (SCHW) in Q4 Earnings,https://finance.yahoo.com/news/decent-client-activity-aid-schwab-154103667.html,Zacks
53,2022-01-13 06:22,Top 5 Momentum Picks for January Despite Market Volatility,https://finance.yahoo.com/news/top-5-momentum-picks-january-112211702.html,Zacks
54,2022-01-13 06:20,Should Schwab U.S. LargeCap Value ETF (SCHV) Be on Your Investing Radar?,https://finance.yahoo.com/news/schwab-u-largecap-value-etf-112011836.html,Zacks
55,2022-01-12 18:15,The Charles Schwab Corporation (SCHW) Outpaces Stock Market Gains: What You Should Know,https://finance.yahoo.com/news/charles-schwab-corporation-schw-outpaces-231511817.html,Zacks
56,2022-01-12 12:05,Wells Fargo Breaks Out Before Earnings,https://www.investopedia.com/wells-fargo-breaks-out-before-earnings-5215714?utm_campaign=quote-yahoo&utm_source=yahoo&utm_medium=referral,Investopedia
57,2022-01-12 08:43,Should You Buy Schwab (SCHW) Ahead of Earnings?,https://finance.yahoo.com/news/buy-schwab-schw-ahead-earnings-134301958.html,Zacks
58,2022-01-12 06:20,Is Schwab Fundamental U.S. Small Company Index ETF (FNDA) a Strong ETF Right Now?,https://finance.yahoo.com/news/schwab-fundamental-u-small-company-112011089.html,Zacks
59,2022-01-11 15:00,The Charles Schwab Corporation (SCHW) Reports Next Week: Wall Street Expects Earnings Growth,https://finance.yahoo.com/news/charles-schwab-corporation-schw-reports-200008032.html,Zacks
60,2022-01-11 08:02,Best Momentum Stocks to Buy for January 11th,https://finance.yahoo.com/news/best-momentum-stocks-buy-january-130201229.html,Zacks
61,2022-01-11 06:20,Is Schwab Fundamental Emerging Markets Large Company Index ETF (FNDE) a Strong ETF Right Now?,https://finance.yahoo.com/news/schwab-fundamental-emerging-markets-large-112011662.html,Zacks
62,2022-01-10 18:53,BlackRock Underperforms Surging Financial Sector,https://www.investopedia.com/blackrock-underperforms-surging-financial-sector-5215528?utm_campaign=quote-yahoo&utm_source=yahoo&utm_medium=referral,Investopedia
63,2022-01-10 16:16,"Super Bowl ad spend keeps going up and up, Mekanism CEO says",https://finance.yahoo.com/video/super-bowl-ad-spend-keeps-211620610.html,Yahoo Finance Video
64,2022-01-10 15:07,7 Hot Stocks to Buy on Any Dip This Year,https://finance.yahoo.com/news/7-hot-stocks-buy-dip-200743221.html,InvestorPlace
65,2022-01-10 14:45,Fort Worth's office market surged in fourth quarter,https://www.bizjournals.com/dallas/news/2022/01/10/transwestern-fort-worth-office-q4.html?ana=yahoo,American City Business Journals
66,2022-01-10 12:00,The Charles Schwab Corporation (SCHW) Is Up 9.08% in One Week: What You Should Know,https://finance.yahoo.com/news/charles-schwab-corporation-schw-9-170005636.html,Zacks
67,2022-01-10 10:41,"The Zacks Analyst Blog Highlights: Microsoft Corp., UnitedHealth Group Inc., and The Charles Schwab Corp.",https://finance.yahoo.com/news/zacks-analyst-blog-highlights-microsoft-154103994.html,Zacks
68,2022-01-10 07:14,Big Money Invests in Charles Schwab,https://finance.yahoo.com/news/big-money-invests-charles-schwab-121441822.html,FX Empire
69,2022-01-07 17:30,Robinhoods latest executive hire seen as getting a spare CEO,https://www.bizjournals.com/sanfrancisco/news/2022/01/07/robinhood-s-latest-executive-hire-seen-as-getting.html?ana=yahoo,American City Business Journals
70,2022-01-07 13:08,"Top Stock Reports for Microsoft, UnitedHealth & Schwab",https://finance.yahoo.com/news/top-stock-reports-microsoft-unitedhealth-180806783.html,Zacks
71,2022-01-07 11:40,GS vs. SCHW: Which Stock Should Value Investors Buy Now?,https://finance.yahoo.com/news/gs-vs-schw-stock-value-164004759.html,Zacks
72,2022-01-07 04:30,Schwab Intelligent Income vs. an Annuity: Which Is Better?,https://finance.yahoo.com/news/schwab-intelligent-income-vs-annuity-093007082.html,Kiplinger
73,2022-01-06 12:10,Why The Charles Schwab Corporation (SCHW) Could Beat Earnings Estimates Again,https://finance.yahoo.com/news/why-charles-schwab-corporation-schw-171005909.html,Zacks
74,2022-01-05 18:00,The Charles Schwab Corporation (SCHW) Stock Moves -0.72%: What You Should Know,https://finance.yahoo.com/news/charles-schwab-corporation-schw-stock-230011872.html,Zacks
75,2022-01-05 17:21,Why Charles Schwabs Stock Price Rose 58.6% in 2021,https://www.fool.com/investing/2022/01/05/why-charles-schwabs-stock-price-rose-586-in-2021/?source=eptyholnk0000202&utm_source=yahoo-host&utm_medium=feed&utm_campaign=article,Motley Fool
76,2022-01-05 11:30,5 Small-Cap ETFs to Profit From the January Effect,https://finance.yahoo.com/news/5-small-cap-etfs-profit-163004630.html,Zacks
77,2022-01-05 06:20,Should Schwab U.S. MidCap ETF (SCHM) Be on Your Investing Radar?,https://finance.yahoo.com/news/schwab-u-midcap-etf-schm-112011824.html,Zacks
78,2022-01-04 14:58,Bet on Growth ETFs to Ride the US Market Optimism,https://finance.yahoo.com/news/bet-growth-etfs-ride-us-195807150.html,Zacks
79,2022-01-04 13:35,10 Finance Stocks to Buy According to Billionaire Ray Dalio,https://finance.yahoo.com/news/10-finance-stocks-buy-according-183502451.html,Insider Monkey
80,2022-01-04 11:40,Smart Compensation Practices Can Make Wealth Management Hiring Easier. Heres How.,https://www.barrons.com/advisor/articles/compensation-practices-wealth-management-hiring-51641314341?siteid=yhoof2,Barrons.com
81,2022-01-04 09:38,"Park National Corp  Buys Charles Schwab Corp, PayPal Holdings Inc, Halliburton Co, Sells 3M Co, ...",https://finance.yahoo.com/news/park-national-corp-buys-charles-143802324.html,GuruFocus.com
82,2022-01-04 07:45,3 Charts That Show Me Coinbase Is Set Up for a Big Year Ahead,https://www.fool.com/investing/2022/01/04/3-charts-that-show-me-coinbase-is-set-up-for-a-big/?source=eptyholnk0000202&utm_source=yahoo-host&utm_medium=feed&utm_campaign=article,Motley Fool
83,2022-01-04 07:00,Is SWCAX a Strong Bond Fund Right Now?,https://finance.yahoo.com/news/swcax-strong-bond-fund-now-120012602.html,Zacks
84,2022-01-03 18:15,The Charles Schwab Corporation (SCHW) Outpaces Stock Market Gains: What You Should Know,https://finance.yahoo.com/news/charles-schwab-corporation-schw-outpaces-231511073.html,Zacks
85,2022-01-03 15:24,Morgan Stanley (MS) to Pay $60M Penalty Over Data Breach Suit,https://finance.yahoo.com/news/morgan-stanley-ms-pay-60m-202408256.html,Zacks
86,2021-12-30 07:00,Is Schwab International Core Equity (SICNX) a Strong Mutual Fund Pick Right Now?,https://finance.yahoo.com/news/schwab-international-core-equity-sicnx-120012052.html,Zacks
87,2021-12-30 07:00,Is Schwab Global Real Estate (SWASX) a Strong Mutual Fund Pick Right Now?,https://finance.yahoo.com/news/schwab-global-real-estate-swasx-120012171.html,Zacks
88,2021-12-30 06:20,Should Schwab U.S. SmallCap ETF (SCHA) Be on Your Investing Radar?,https://finance.yahoo.com/news/schwab-u-smallcap-etf-scha-112011126.html,Zacks
89,2021-12-29 13:48,Is Schwab Fundamental International Large Company Index ETF (FNDF) a Strong ETF Right Now?,https://finance.yahoo.com/news/schwab-fundamental-international-large-company-184806372.html,Zacks
90,2021-12-29 13:46,Should Schwab U.S. LargeCap Growth ETF (SCHG) Be on Your Investing Radar?,https://finance.yahoo.com/news/schwab-u-largecap-growth-etf-184606323.html,Zacks
91,2021-12-29 13:46,Should Schwab U.S. Dividend Equity ETF (SCHD) Be on Your Investing Radar?,https://finance.yahoo.com/news/schwab-u-dividend-equity-etf-184606232.html,Zacks
92,2021-12-29 07:00,Is Schwab MarketTrack Growth Investor (SWHGX) a Strong Mutual Fund Pick Right Now?,https://finance.yahoo.com/news/schwab-markettrack-growth-investor-swhgx-120012879.html,Zacks
93,2021-12-28 09:22,4 Reasons to Add Schwab (SCHW) Stock to Your Portfolio Now,https://finance.yahoo.com/news/4-reasons-add-schwab-schw-142202625.html,Zacks
94,2021-12-28 01:38,"Mairs and Power Growth Fund Buys Amazon.com Inc, Sysco Corp, Charles Schwab Corp, Sells 3M Co, ...",https://finance.yahoo.com/news/mairs-power-growth-fund-buys-063804337.html,GuruFocus.com
95,2021-12-27 21:38,"GraniteShares ETF Trust Buys Visa Inc, Comcast Corp, PepsiCo Inc, Sells Tesla Inc, JPMorgan ...",https://finance.yahoo.com/news/graniteshares-etf-trust-buys-visa-023806041.html,GuruFocus.com
96,2021-12-23 16:38,"Harris Associates Investment Trust Buys Charles Schwab Corp, Humana Inc, Bunge, Sells Bank of ...",https://finance.yahoo.com/news/harris-associates-investment-trust-buys-213801052.html,GuruFocus.com
97,2021-12-23 06:20,Should Schwab Fundamental U.S. Large Company Index ETF (FNDX) Be on Your Investing Radar?,https://finance.yahoo.com/news/schwab-fundamental-u-large-company-112011698.html,Zacks
98,2021-12-21 14:44,UBS Group (UBS) Appeals Against French Court's Verdict,https://finance.yahoo.com/news/ubs-group-ubs-appeals-against-194407263.html,Zacks
99,2021-12-21 06:20,Should Schwab U.S. LargeCap ETF (SCHX) Be on Your Investing Radar?,https://finance.yahoo.com/news/schwab-u-largecap-etf-schx-112011228.html,Zacks
