,Date,News Headline,Article Link,Source
0,2022-01-27 13:44,Several Pittsburgh companies named best places to work for LGBTQ+ equality,https://www.bizjournals.com/pittsburgh/news/2022/01/27/several-pgh-companies-best-places-lgbtq-2022.html?ana=yahoo,American City Business Journals
1,2022-01-26 17:38,"Johnson Midwest Financial, LLC Buys SPDR Dow Jones Industrial Average ETF, FS KKR Capital Corp, ...",https://finance.yahoo.com/news/johnson-midwest-financial-llc-buys-223812100.html,GuruFocus.com
2,2022-01-25 17:17,Why Im Happy About Todays Selloff,https://finance.yahoo.com/news/why-m-happy-today-selloff-221718215.html,InvestorPlace
3,2022-01-25 09:38,"Hennessy Advisors Inc Buys ONEOK Inc, ArcBest Corp, Alcoa Corp, Sells Vista Outdoor Inc, LPL ...",https://finance.yahoo.com/news/hennessy-advisors-inc-buys-oneok-143806201.html,GuruFocus.com
4,2022-01-24 17:38,"New York State Teachers Retirement System Buys EPAM Systems Inc, Tandem Diabetes Care Inc, ...",https://finance.yahoo.com/news/york-state-teachers-retirement-system-223810678.html,GuruFocus.com
5,2022-01-24 13:38,"Carolina Wealth Advisors, LLC Buys Schwab U.S. ...",https://finance.yahoo.com/news/carolina-wealth-advisors-llc-buys-183811415.html,GuruFocus.com
6,2022-01-24 13:38,"Cedar Mountain Advisors, LLC Buys ARK Innovation ETF, Berkshire Hathaway Inc, Ford Motor Co, ...",https://finance.yahoo.com/news/cedar-mountain-advisors-llc-buys-183806983.html,GuruFocus.com
7,2022-01-24 11:34,"The Zacks Analyst Blog Highlights: J.B. Hunt Transport Services, BankUnited, PacWest Bancorp and Alcoa",https://finance.yahoo.com/news/zacks-analyst-blog-highlights-j-163404421.html,Zacks
8,2022-01-23 03:56,Saudis State-Controlled Miner Names Fourth CEO in Two Years,https://finance.yahoo.com/news/saudi-state-controlled-miner-names-085608742.html,Bloomberg
9,2022-01-21 17:38,"Golden Green, Inc. Buys Xilinx Inc, Pfizer Inc, NVIDIA Corp, Sells Moderna Inc, Novavax Inc, ...",https://finance.yahoo.com/news/golden-green-inc-buys-xilinx-223808736.html,GuruFocus.com
10,2022-01-21 16:35,"Stocks close lower after tough week on Wall Street, bitcoin price falls below $39,000",https://finance.yahoo.com/video/stocks-close-lower-tough-week-213522701.html,Yahoo Finance Video
11,2022-01-20 21:38,"Retirement Systems of Alabama Buys Applied Materials Inc, Broadcom Inc, Johnson & Johnson, ...",https://finance.yahoo.com/news/retirement-systems-alabama-buys-applied-023817796.html,GuruFocus.com
12,2022-01-20 16:10,Alcoa Earnings Crush Estimates; AA Stock Rises,https://www.investors.com/news/alcoa-earnings-on-tap-as-aa-stock-miners-hold-strong/?src=A00220,Investor's Business Daily
13,2022-01-20 15:47,10 Notable Earnings Reports to Watch,https://finance.yahoo.com/news/10-notable-earnings-reports-watch-204741299.html,Insider Monkey
14,2022-01-20 09:40,Are These Industrial Products Stocks a Great Value Stocks Right Now?,https://finance.yahoo.com/news/industrial-products-stocks-great-value-144002756.html,Zacks
15,2022-01-20 08:50,Fast-paced Momentum Stock Alcoa (AA) Is Still Trading at a Bargain,https://finance.yahoo.com/news/fast-paced-momentum-stock-alcoa-135001833.html,Zacks
16,2022-01-20 08:02,Alcoa Earnings Were Solid. Here Are the Numbers That Matter.,https://www.barrons.com/articles/alcoa-stock-price-earnings-51642630827?siteid=yhoof2,Barrons.com
17,2022-01-20 03:48,"Travelers, Alcoa Rise in Premarket; United Falls on Weak Forecast",https://finance.yahoo.com/news/travelers-alcoa-rise-premarket-united-084839003.html,Investing.com
18,2022-01-19 18:35,Alcoa Warns Russia-Ukraine Conflict Could Hit Aluminum Supply,https://finance.yahoo.com/news/alcoa-warns-russia-ukraine-conflict-233508303.html,Bloomberg
19,2022-01-19 18:17,Alcoa sees loss in Q4 but record year for earnings in 2021 overall,https://www.bizjournals.com/pittsburgh/news/2022/01/19/alcoa-loss-q4-record-year-2021.html?ana=yahoo,American City Business Journals
20,2022-01-19 17:38,"Searle & Co. Buys The Chemours Co, Wells Fargo, HireRight Holdings Corp, Sells CareDx Inc, ...",https://finance.yahoo.com/news/searle-co-buys-chemours-co-223829263.html,GuruFocus.com
21,2022-01-19 17:25,Alcoa (AA) Q4 Earnings and Revenues Surpass Estimates,https://finance.yahoo.com/news/alcoa-aa-q4-earnings-revenues-222510385.html,Zacks
22,2022-01-19 17:21,Alcoa Posts Solid Earnings. Here Are the Numbers That Matter.,https://www.barrons.com/articles/alcoa-stock-earnings-51642630827?siteid=yhoof2,Barrons.com
23,2022-01-19 16:10,Alcoa Corporation Reports Fourth Quarter and Full Year 2021 Results,https://finance.yahoo.com/news/alcoa-corporation-reports-fourth-quarter-211000689.html,Business Wire
24,2022-01-19 13:38,"JCIC Asset Management Inc. Buys Cenovus Energy Inc, Franco-Nevada Corp, Shopify Inc, Sells ...",https://finance.yahoo.com/news/jcic-asset-management-inc-buys-183819568.html,GuruFocus.com
25,2022-01-19 13:38,"New Mexico Educational Retirement Board Buys Alcoa Corp, EPAM Systems Inc, Bruker Corp, Sells ...",https://finance.yahoo.com/news/mexico-educational-retirement-board-buys-183803791.html,GuruFocus.com
26,2022-01-18 17:38,"CAPROCK Group, Inc. Buys The Home Depot Inc, Logistics Innovation Technologies Corp, Arthur J. ...",https://finance.yahoo.com/news/caprock-group-inc-buys-home-223804546.html,GuruFocus.com
27,2022-01-14 17:45,Alcoa (AA) Outpaces Stock Market Gains: What You Should Know,https://finance.yahoo.com/news/alcoa-aa-outpaces-stock-market-224510363.html,Zacks
28,2022-01-14 15:39,Alcoa appoints two new executives,https://www.bizjournals.com/pittsburgh/news/2022/01/14/alcoa-appoints-two-new-executives.html?ana=yahoo,American City Business Journals
29,2022-01-14 14:10,Alcoa Appoints Two Members to Its Executive Leadership Team,https://finance.yahoo.com/news/alcoa-appoints-two-members-executive-191000019.html,Business Wire
30,2022-01-14 13:38,"Louisiana State Employees Retirement System Buys Airbnb Inc, Lucid Group Inc, Fortinet Inc, ...",https://finance.yahoo.com/news/louisiana-state-employees-retirement-system-183809378.html,GuruFocus.com
31,2022-01-14 08:39,How Alcoa (AA) Stock Stands Out in a Strong Industry,https://finance.yahoo.com/news/alcoa-aa-stock-stands-strong-133901658.html,Zacks
32,2022-01-13 13:38,Several Pittsburgh companies make 2022 JUST Capital rankings,https://www.bizjournals.com/pittsburgh/news/2022/01/13/pgh-companies-just-capital-rankings-2022.html?ana=yahoo,American City Business Journals
33,2022-01-13 13:38,"Activest Wealth Management Buys Invesco S&P 500 Equal Weight ETF, Principal Spectrum ...",https://finance.yahoo.com/news/activest-wealth-management-buys-invesco-183820561.html,GuruFocus.com
34,2022-01-12 17:38,"State of Alaska, Department of Revenue Buys Realty Income Corp, Bio-Rad Laboratories Inc, ...",https://finance.yahoo.com/news/state-alaska-department-revenue-buys-223817283.html,GuruFocus.com
35,2022-01-12 15:00,Alcoa (AA) Reports Next Week: Wall Street Expects Earnings Growth,https://finance.yahoo.com/news/alcoa-aa-reports-next-week-200008839.html,Zacks
36,2022-01-11 17:50,Alcoa (AA) Outpaces Stock Market Gains: What You Should Know,https://finance.yahoo.com/news/alcoa-aa-outpaces-stock-market-225010262.html,Zacks
37,2022-01-10 17:38,"Crossmark Global Holdings, Inc. Buys Cigna Corp, Honda Motor Co, Crown Castle International ...",https://finance.yahoo.com/news/crossmark-global-holdings-inc-buys-223808351.html,GuruFocus.com
38,2022-01-05 18:36,"South32, Alcoa to restart Alumar aluminium smelter in Brazil",https://finance.yahoo.com/news/south32-alcoa-restart-alumar-aluminium-233633741.html,Reuters
39,2022-01-05 17:45,Alcoa (AA) Gains As Market Dips: What You Should Know,https://finance.yahoo.com/news/alcoa-aa-gains-market-dips-224510252.html,Zacks
40,2022-01-03 15:52,Top Materials Stocks for January 2022,https://www.investopedia.com/top-materials-stocks-4582152?utm_campaign=quote-yahoo&utm_source=yahoo&utm_medium=referral,Investopedia
41,2021-12-31 15:00,Soaring Natural Gas Prices Are Weighing On Global Aluminum Production,https://finance.yahoo.com/news/soaring-natural-gas-prices-weighing-200000916.html,Oilprice.com
42,2021-12-30 17:45,Alcoa (AA) Dips More Than Broader Markets: What You Should Know,https://finance.yahoo.com/news/alcoa-aa-dips-more-broader-224510431.html,Zacks
43,2021-12-30 13:20,"Aluminum Climbs With Output Facing Pressure in Europe, China",https://finance.yahoo.com/news/aluminum-climbs-output-facing-pressure-095124457.html,Bloomberg
44,2021-12-30 09:44,Alcoa temporarily curtailing San Ciprián smelter,https://www.bizjournals.com/pittsburgh/news/2021/12/30/alcoa-temporarily-curtailing-san-ciprian-smelter.html?ana=yahoo,American City Business Journals
45,2021-12-29 16:49,Alcoa to Curb Aluminum Output in Spain as Energy Costs Soar,https://finance.yahoo.com/news/alcoa-curb-aluminum-output-spain-214929190.html,Bloomberg
46,2021-12-29 16:15,Alcoa Reaches Agreement on Future of San Ciprián Smelter,https://finance.yahoo.com/news/alcoa-reaches-agreement-future-san-211500493.html,Business Wire
47,2021-12-29 16:10,Alcoa Schedules Fourth Quarter and Full Year 2021 Earnings Release and Conference Call,https://finance.yahoo.com/news/alcoa-schedules-fourth-quarter-full-211000206.html,Business Wire
48,2021-12-29 12:53,Alcoa to halt primary aluminium production in Spain for two years,https://finance.yahoo.com/news/alcoa-halt-primary-aluminium-production-175344164.html,Reuters
49,2021-12-23 17:45,Alcoa (AA) Gains But Lags Market: What You Should Know,https://finance.yahoo.com/news/alcoa-aa-gains-lags-market-224510025.html,Zacks
50,2021-12-23 13:38,"MainStay VP Natural Resources Portfolio Buys Exxon Mobil Corp, Alcoa Corp, Nutrien, Sells ...",https://finance.yahoo.com/news/mainstay-vp-natural-resources-portfolio-183802685.html,GuruFocus.com
51,2021-12-21 23:47,Top Stocks for January 2022,https://www.investopedia.com/top-stocks-4581225?utm_campaign=quote-yahoo&utm_source=yahoo&utm_medium=referral,Investopedia
52,2021-12-19 11:38,"LVIP Delaware Mid Cap Value Fund Buys Louisiana-Pacific Corp, Alcoa Corp, Spirit Realty Capital ...",https://finance.yahoo.com/news/lvip-delaware-mid-cap-value-163802139.html,GuruFocus.com
53,2021-12-18 20:38,"Pioneer VCT Mid Cap Value Fund Buys Syneos Health Inc, Pioneer Natural Resources Co, Organon, ...",https://finance.yahoo.com/news/pioneer-vct-mid-cap-value-013803112.html,GuruFocus.com
54,2021-12-16 17:05,Why Shares in Alcoa Surged This Week,https://www.fool.com/investing/2021/12/16/why-shares-in-alcoa-surged-this-week/?source=eptyholnk0000202&utm_source=yahoo-host&utm_medium=feed&utm_campaign=article,Motley Fool
55,2021-12-16 16:27,IBD Stock Of The Day: Alcoa Leads Post-Fed Rally As AA Stock Clears Buy Point,https://www.investors.com/research/ibd-stock-of-the-day/alcoa-leads-post-fed-rally-as-aa-stock-clears-buy-point/?src=A00220,Investor's Business Daily
56,2021-12-16 08:38,"VIP Materials Portfolio Buys The Mosaic Co, Alcoa Corp, Sells Linde PLC, Lundin Mining Corp, ...",https://finance.yahoo.com/news/vip-materials-portfolio-buys-mosaic-133802600.html,GuruFocus.com
57,2021-12-15 17:45,Alcoa (AA) Gains But Lags Market: What You Should Know,https://finance.yahoo.com/news/alcoa-aa-gains-lags-market-224510989.html,Zacks
58,2021-12-14 17:02,These 3 Stocks Have What Investors Want Today,https://www.fool.com/investing/2021/12/14/these-3-stocks-have-what-investors-want-today/?source=eptyholnk0000202&utm_source=yahoo-host&utm_medium=feed&utm_campaign=article,Motley Fool
59,2021-12-14 16:10,Alcoa Further De-Risks Certain U.S. Pension Plans Through Additional Annuity Contracts,https://finance.yahoo.com/news/alcoa-further-risks-certain-u-211000397.html,Business Wire
60,2021-12-14 13:51,Alcoa permanently shuttering smelter in Washington,https://www.bizjournals.com/pittsburgh/news/2021/12/14/alcoa-permanently-shuttering-smelter-in-washington.html?ana=yahoo,American City Business Journals
61,2021-12-13 19:20,Alcoa Set to Join S&P MidCap 400,https://finance.yahoo.com/news/alcoa-set-join-p-midcap-002000598.html,PR Newswire
62,2021-12-13 17:44,Alcoa Corp. to move to S&P midcap index next week,https://www.marketwatch.com/story/alcoa-corp-to-move-to-sp-midcap-index-next-week-2021-12-13?siteid=yhoof2,MarketWatch
63,2021-12-13 16:10,Alcoa Announces Closure of Wenatchee Smelter in Washington State,https://finance.yahoo.com/news/alcoa-announces-closure-wenatchee-smelter-211000519.html,Business Wire
64,2021-12-12 06:09,Calculating The Fair Value Of Alcoa Corporation (NYSE:AA),https://finance.yahoo.com/news/calculating-fair-value-alcoa-corporation-110914167.html,Simply Wall St.
65,2021-12-10 12:39,Why Alcoa Stock Popped This Week,https://www.fool.com/investing/2021/12/10/why-alcoa-stock-popped-this-week/?source=eptyholnk0000202&utm_source=yahoo-host&utm_medium=feed&utm_campaign=article,Motley Fool
66,2021-12-08 11:56,Several Pittsburgh names make list of 'most responsible companies',https://www.bizjournals.com/pittsburgh/news/2021/12/08/several-pgh-names-most-responsible-companies-list.html?ana=yahoo,American City Business Journals
67,2021-12-07 13:25,Alcoa Corporation (AA) Fell Out Of Favor With Hedge Funds?,https://finance.yahoo.com/news/alcoa-corporation-aa-fell-favor-182559640.html,Insider Monkey
68,2021-12-03 17:45,Alcoa (AA) Dips More Than Broader Markets: What You Should Know,https://finance.yahoo.com/news/alcoa-aa-dips-more-broader-224510267.html,Zacks
69,2021-11-23 08:30,"William F. Oplinger, Alcoas EVP and CFO, to Participate in Conference Hosted by Citi",https://finance.yahoo.com/news/william-f-oplinger-alcoa-evp-133000832.html,Business Wire
70,2021-11-19 14:40,"U.S. Steel, Alcoa make changes that will add charges in 4Q",https://www.bizjournals.com/pittsburgh/news/2021/11/19/u-s-steel-alcoa-make-changes.html?ana=yahoo,American City Business Journals
71,2021-11-19 09:14,4 Stocks Insiders Are Selling,https://finance.yahoo.com/news/4-stocks-insiders-selling-141456322.html,Benzinga
72,2021-11-18 15:27,Supply Chain in the Steel City: How Pittsburgh manufacturers are faring,https://www.bizjournals.com/pittsburgh/news/2021/11/18/how-pittsburgh-manufacturers-are-faring.html?ana=yahoo,American City Business Journals
73,2021-11-17 10:18,10 Best Mining Stocks To Buy Now,https://finance.yahoo.com/news/10-best-mining-stocks-buy-151826142.html,Insider Monkey
74,2021-11-17 08:46,Alcoa to transfer $1 billion in pension obligations to Athene Holding,https://www.marketwatch.com/story/alcoa-to-transfer-1-billion-in-pension-obligations-to-athene-holding-2021-11-17?siteid=yhoof2,MarketWatch
75,2021-11-17 08:31,Alcoa Purchases Group Annuity Contracts for Certain U.S. Pension Plans,https://finance.yahoo.com/news/alcoa-purchases-group-annuity-contracts-133100145.html,Business Wire
76,2021-11-16 16:10,Alcoa Recognized for ESG Leadership by the Dow Jones Sustainability Indices,https://finance.yahoo.com/news/alcoa-recognized-esg-leadership-dow-211000494.html,Business Wire
77,2021-11-16 08:43,Century Aluminum (CENX) & Qair Agree Over Wind Power Supply,https://finance.yahoo.com/news/century-aluminum-cenx-qair-agree-134301011.html,Zacks
78,2021-11-11 14:23,Why Metals Stocks Are Red-Hot Today,https://www.fool.com/investing/2021/11/11/why-metals-stocks-are-red-hot-today/?source=eptyholnk0000202&utm_source=yahoo-host&utm_medium=feed&utm_campaign=article,Motley Fool
79,2021-11-10 11:06,Were Hedge Funds Right About Buying Alcoa Corporation (AA)?,https://finance.yahoo.com/news/were-hedge-funds-buying-alcoa-160635070.html,Insider Monkey
80,2021-11-10 08:33,"William F. Oplinger, Alcoas EVP and CFO, to Participate in Conference Hosted by Goldman Sachs",https://finance.yahoo.com/news/william-f-oplinger-alcoa-evp-133300940.html,Business Wire
81,2021-11-08 16:10,Alcoa Announces Technology Roadmap to Support Its Vision to Reinvent the Aluminum Industry for a Sustainable Future,https://finance.yahoo.com/news/alcoa-announces-technology-roadmap-support-211000061.html,Business Wire
82,2021-11-08 14:23,Alcoa restarting curtailed aluminum smelting capacity in Australia,https://www.bizjournals.com/pittsburgh/news/2021/11/08/alcoa-restarting-aluminum-smelting-australia.html?ana=yahoo,American City Business Journals
83,2021-11-08 11:30,Has Alcoa (AA) Outpaced Other Industrial Products Stocks This Year?,https://finance.yahoo.com/news/alcoa-aa-outpaced-other-industrial-163004764.html,Zacks
84,2021-11-08 08:00,Alcoa Pledges Low Carbon Emissions for Future Aluminum Mills,https://finance.yahoo.com/news/alcoa-pledges-low-carbon-emissions-130000039.html,Bloomberg
85,2021-11-07 18:23,Alcoa to Restart Aluminum Lines in Australia Idled Since 2009,https://finance.yahoo.com/news/alcoa-restart-aluminum-lines-australia-232325246.html,Bloomberg
86,2021-11-07 18:21,Alcoa to restart long idled capacity at Australian aluminium smelter,https://finance.yahoo.com/news/alcoa-restart-long-idled-capacity-232143441.html,Reuters
87,2021-11-07 17:00,Alcoa Plans to Restart Curtailed Aluminum Smelting Capacity at Portland Aluminium in Australia,https://finance.yahoo.com/news/alcoa-plans-restart-curtailed-aluminum-220000205.html,Business Wire
88,2021-11-05 07:25,"Century Aluminum (CENX) Q3 Earnings Beat, Sales Lag Estimates",https://finance.yahoo.com/news/century-aluminum-cenx-q3-earnings-112511055.html,Zacks
89,2021-11-04 15:33,Public docs link Dallas firm to purchase of old Alcoa plant in Milam County,https://www.bizjournals.com/austin/news/2021/11/04/rockdale-alcoa-plant-sale.html?ana=yahoo,American City Business Journals
90,2021-11-02 10:28,"Zebra (ZBRA) Q3 Earnings & Revenues Beat Estimates, Up Y/Y",https://finance.yahoo.com/news/zebra-zbra-q3-earnings-revenues-142802826.html,Zacks
91,2021-11-02 05:46,Alcoa Stock Lifted to Buy as Jefferies Sees Improved Outlook,https://www.thestreet.com/investing/alcoa-stock-rises-on-jefferies-upgrade-to-buy-boost-price-target?puc=yahoo&cm_ven=YAHOO,TheStreet.com
92,2021-11-01 14:30,Alcoa sells site of former Rockdale smelter in Texas,https://www.bizjournals.com/pittsburgh/news/2021/11/01/alcoa-sells-site-former-rockdale-smelter-texas.html?ana=yahoo,American City Business Journals
93,2021-11-01 08:30,Alcoa Sells Former Rockdale Industrial Site for $240 Million,https://finance.yahoo.com/news/alcoa-sells-former-rockdale-industrial-123000467.html,Business Wire
94,2021-10-27 10:11,"O-I Glass (OI) Q3 Earnings Beat Estimates, Raises '21 View",https://finance.yahoo.com/news/o-glass-oi-q3-earnings-141102505.html,Zacks
95,2021-10-25 08:50,Looking for a Fast-paced Momentum Stock at a Bargain? Consider Alcoa (AA),https://finance.yahoo.com/news/looking-fast-paced-momentum-stock-125012992.html,Zacks
96,2021-10-22 11:30,Is Alcoa (AA) Outperforming Other Industrial Products Stocks This Year?,https://finance.yahoo.com/news/alcoa-aa-outperforming-other-industrial-153003634.html,Zacks
97,2021-10-22 09:00,"Alcoa to Host Virtual Investor Day on November 9, 2021",https://finance.yahoo.com/news/alcoa-host-virtual-investor-day-130000211.html,Business Wire
98,2021-10-22 05:15,Magnesium Buyers Warn Crunch Threatens Millions of European Jobs,https://finance.yahoo.com/news/magnesium-buyers-warn-crunch-threatens-091504344.html,Bloomberg
99,2021-10-19 10:50,Top Ranked Momentum Stocks to Buy for October 19th,https://finance.yahoo.com/news/top-ranked-momentum-stocks-buy-145002451.html,Zacks
