,Date,News Headline,Article Link,Source
0,2022-02-16 07:32,Hess Corporation (NYSE:HES) Has A ROE Of 13%,https://finance.yahoo.com/news/hess-corporation-nyse-hes-roe-123209332.html,Simply Wall St.
1,2022-02-11 15:26,"Hess Announces First Production from Liza Phase 2 Development, Offshore Guyana",https://finance.yahoo.com/news/hess-announces-first-production-liza-202600687.html,Business Wire
2,2022-02-09 10:58,New Yorks Pension Fund Plans to Restrict Its Investments in Oil and Gas Companies,https://finance.yahoo.com/news/york-pension-fund-plans-restrict-155815888.html,Bloomberg
3,2022-02-09 10:42,"Zacks Industry Outlook Highlights ConocoPhillips, Occidental Petroleum, Hess Corp and Marathon Oil Corp",https://finance.yahoo.com/news/zacks-industry-outlook-highlights-conocophillips-154203572.html,Zacks
4,2022-02-08 14:36,Hess Could Trade Higher as Oil Prices Rise,https://finance.yahoo.com/news/hess-could-trade-higher-oil-193646962.html,GuruFocus.com
5,2022-02-08 08:15,4 US Integrated Oil Stocks to Gain From the Prospering Industry,https://finance.yahoo.com/news/4-us-integrated-oil-stocks-131501531.html,Zacks
6,2022-02-07 19:38,"Colrain Capital Llc Buys Dow Inc, Newmont Corp, Comcast Corp, Sells Hess Corp, Sylvamo Corp",https://finance.yahoo.com/news/colrain-capital-llc-buys-dow-003803957.html,GuruFocus.com
7,2022-02-07 18:38,"Keybank National Association Buys Invitation Homes Inc, AvidXchange Holdings Inc, Vanguard ...",https://finance.yahoo.com/news/keybank-national-association-buys-invitation-233808186.html,GuruFocus.com
8,2022-02-02 06:55,"Oil & Gas Stock Roundup: Q4 Earnings From XOM, CVX, PSX, VLO & HES",https://finance.yahoo.com/news/oil-gas-stock-roundup-q4-115511463.html,Zacks
9,2022-02-01 09:00,"Hess Recognized for Diversity, Equity and Inclusion",https://finance.yahoo.com/news/hess-recognized-diversity-equity-inclusion-140000912.html,Business Wire
10,2022-01-30 15:00,Oil Majors Expected To Post Strong Earnings Next Week,https://finance.yahoo.com/news/oil-majors-expected-post-strong-200000549.html,Oilprice.com
11,2022-01-27 11:33,Hess (HES) Q4 Earnings Beat Estimates on Surging Oil Prices,https://finance.yahoo.com/news/hess-hes-q4-earnings-beat-163304552.html,Zacks
12,2022-01-26 17:38,"Kercheville Advisors, LLC Buys The Carlyle Group Inc, Hess Midstream LP, Consumer Staples ...",https://finance.yahoo.com/news/kercheville-advisors-llc-buys-carlyle-223821887.html,GuruFocus.com
13,2022-01-26 10:00,Guyanas Oil Production To Increase Three-Fold Next Month,https://finance.yahoo.com/news/guyana-oil-production-increase-three-150000492.html,Oilprice.com
14,2022-01-26 08:45,Hess (HES) Q4 Earnings and Revenues Surpass Estimates,https://finance.yahoo.com/news/hess-hes-q4-earnings-revenues-134501452.html,Zacks
15,2022-01-26 07:36,Hess profit sails past estimates on surging oil prices,https://finance.yahoo.com/news/hess-posts-quarterly-profit-surging-123601912.html,Reuters
16,2022-01-26 07:30,Hess Reports Estimated Results for the Fourth Quarter of 2021,https://finance.yahoo.com/news/hess-reports-estimated-results-fourth-123000664.html,Business Wire
17,2022-01-25 08:32,"UPDATE 2-Hess Corp expects higher capital spending, production in 2022",https://finance.yahoo.com/news/1-hess-expects-higher-capital-133249924.html,Reuters
18,2022-01-25 08:09,"Hess Corp sees higher capital spending, production in 2022",https://finance.yahoo.com/news/hess-raises-production-capital-budget-130948591.html,Reuters
19,2022-01-25 08:00,Hess Announces 2022 E&P Capital and Exploratory Budget,https://finance.yahoo.com/news/hess-announces-2022-e-p-130000421.html,Business Wire
20,2022-01-24 08:50,Why Hess (HES) Might Surprise This Earnings Season,https://finance.yahoo.com/news/why-hess-hes-might-surprise-135001563.html,Zacks
21,2022-01-21 09:38,"Trust Co Of Oklahoma Buys Lowe's Inc, Duke Energy Corp, Lam Research Corp, Sells Hess Corp, ...",https://finance.yahoo.com/news/trust-co-oklahoma-buys-lowes-143831832.html,GuruFocus.com
22,2022-01-19 15:01,Hess (HES) Reports Next Week: Wall Street Expects Earnings Growth,https://finance.yahoo.com/news/hess-hes-reports-next-week-200108454.html,Zacks
23,2022-01-19 13:38,"JCIC Asset Management Inc. Buys Cenovus Energy Inc, Franco-Nevada Corp, Shopify Inc, Sells ...",https://finance.yahoo.com/news/jcic-asset-management-inc-buys-183819568.html,GuruFocus.com
24,2022-01-12 17:38,"Adams Asset Advisors, LLC Buys ViacomCBS Inc, Altria Group Inc, AT&T Inc, Sells Wells ...",https://finance.yahoo.com/news/adams-asset-advisors-llc-buys-223808793.html,GuruFocus.com
25,2022-01-06 13:58,UPDATE 2-Hess will switch to 'return of capital mode' - CEO,https://finance.yahoo.com/news/1-hess-switch-return-capital-185834670.html,Reuters
26,2022-01-05 12:34,Hess (HES) Surges 9.6% YTD: More Room For Upside Left?,https://finance.yahoo.com/news/hess-hes-surges-9-6-173405811.html,Zacks
27,2022-01-05 08:36,Hess Announces Two Discoveries Offshore Guyana,https://finance.yahoo.com/news/hess-announces-two-discoveries-offshore-133600074.html,Business Wire
28,2022-01-04 16:00,Hess Schedules Earnings Release Conference Call,https://finance.yahoo.com/news/hess-schedules-earnings-release-conference-210000711.html,Business Wire
29,2022-01-04 15:04,Hess to Participate in Goldman Sachs Global Energy and Clean Technology Conference,https://finance.yahoo.com/news/hess-participate-goldman-sachs-global-200400226.html,Business Wire
30,2021-12-27 09:34,Global 2021 Oil and Gas Finds to Hit Rock-Bottom in Decades,https://finance.yahoo.com/news/global-2021-oil-gas-finds-143402133.html,Zacks
31,2021-12-15 08:59,10 Oil Stocks in Billionaire Ken Fishers Portfolio,https://finance.yahoo.com/news/10-oil-stocks-billionaire-ken-135932678.html,Insider Monkey
32,2021-12-13 08:38,Hess Achieves CDP Climate Change Leadership Status,https://finance.yahoo.com/news/hess-achieves-cdp-climate-change-133800446.html,Business Wire
33,2021-12-11 18:19,Here is What Hedge Funds Think About Hess Corporation (HES),https://finance.yahoo.com/news/hedge-funds-think-hess-corporation-231921200.html,Insider Monkey
34,2021-12-10 13:56,REFILE-Exxon proposing to build supply depot for Guyana project,https://finance.yahoo.com/news/exxon-proposing-build-supply-depot-185627182.html,Reuters
35,2021-12-10 13:38,"Forethought Variable Insurance Trust Buys Agilent Technologies Inc, NetApp Inc, CrowdStrike ...",https://finance.yahoo.com/news/forethought-variable-insurance-trust-buys-183803495.html,GuruFocus.com
36,2021-12-08 16:47,"Hess CEO: Shale was the major culprit for lower oil prices, less upstream investment",https://www.bizjournals.com/houston/news/2021/12/08/john-hess-shale-upstream-underinvestment.html?ana=yahoo,American City Business Journals
37,2021-12-08 09:15,7 F-Rated Dividend Stocks You Shouldnt Get Suckered Into,https://finance.yahoo.com/news/7-f-rated-dividend-stocks-141538312.html,InvestorPlace
38,2021-12-01 16:15,Hess Announces Regular Quarterly Dividend On Common Stock,https://finance.yahoo.com/news/hess-announces-regular-quarterly-dividend-211500516.html,Business Wire
39,2021-12-01 14:16,26 cheap stocks to buy now that Omicron has hammered markets: Wells Fargo,https://finance.yahoo.com/news/26-cheap-stocks-to-buy-now-that-omicron-has-hammered-markets-wells-fargo-191634430.html,Yahoo Finance
40,2021-11-30 20:00,Can Libya Become A Global Oil And Gas Power Once Again?,https://finance.yahoo.com/news/libya-become-global-oil-gas-010000115.html,Oilprice.com
41,2021-11-24 08:54,ConocoPhillips (COP) to Acquire Additional Waha Assets in Libya,https://finance.yahoo.com/news/conocophillips-cop-acquire-additional-waha-135401679.html,Zacks
42,2021-11-19 07:08,Investing in Hess (NYSE:HES) a year ago would have delivered you a 74% gain,https://finance.yahoo.com/news/investing-hess-nyse-hes-ago-120843614.html,Simply Wall St.
43,2021-11-16 13:09,Hess Recognized for Sustainability Performance,https://finance.yahoo.com/news/hess-recognized-sustainability-performance-180900073.html,Business Wire
44,2021-11-15 08:14,10 Best Crude Oil Stocks to Buy Today,https://finance.yahoo.com/news/10-best-crude-oil-stocks-131431257.html,Insider Monkey
45,2021-11-12 13:12,Hess to Participate in Bank of America Securities 2021 Global Energy Conference,https://finance.yahoo.com/news/hess-participate-bank-america-securities-181200565.html,Business Wire
46,2021-11-11 11:22,Exclusive-Exxon in talks to build fourth oil production rig for Guyana,https://finance.yahoo.com/news/exclusive-exxon-talks-build-fourth-162254414.html,Reuters
47,2021-11-02 15:53,Mexico Said to Lock In $60-$65 in Annual Oil Hedge,https://finance.yahoo.com/news/mexico-actively-hedging-oil-output-191728834.html,Bloomberg
48,2021-10-31 22:00,Why These 10 Stocks Moved This Week,https://finance.yahoo.com/news/why-10-stocks-moved-week-020016489.html,Insider Monkey
49,2021-10-27 15:31,Hess Corporation (HES) Q3 2021 Earnings Call Transcript,https://www.fool.com/earnings/call-transcripts/2021/10/27/hess-corporation-hes-q3-2021-earnings-call-transcr/?source=eptyholnk0000202&utm_source=yahoo-host&utm_medium=feed&utm_campaign=article,Motley Fool
50,2021-10-27 11:12,Hess (HES) Q3 Earnings Miss Estimates on Lower Production,https://finance.yahoo.com/news/hess-hes-q3-earnings-miss-151203648.html,Zacks
51,2021-10-27 08:45,Hess (HES) Q3 Earnings Lag Estimates,https://finance.yahoo.com/news/hess-hes-q3-earnings-lag-124512246.html,Zacks
52,2021-10-27 07:39,UPDATE 2-Hess beats profit estimates on surging crude and gas prices,https://finance.yahoo.com/news/1-hess-posts-quarterly-profit-113940033.html,Reuters
53,2021-10-27 07:30,Hess Reports Estimated Results for the Third Quarter of 2021,https://finance.yahoo.com/news/hess-reports-estimated-results-third-113000273.html,Business Wire
54,2021-10-26 09:37,"Energy Stock Q3 Earnings Roster for Oct 27: HES, EQT, AR, SU",https://finance.yahoo.com/news/energy-stock-q3-earnings-roster-133701583.html,Zacks
55,2021-10-22 08:11,Hess (HES) Gears Up for Q3 Earnings: What's in the Cards?,https://finance.yahoo.com/news/hess-hes-gears-q3-earnings-121112211.html,Zacks
56,2021-10-20 15:02,Hess (HES) Earnings Expected to Grow: What to Know Ahead of Next Week's Release,https://finance.yahoo.com/news/hess-hes-earnings-expected-grow-190207130.html,Zacks
57,2021-10-18 11:45,Hedge Funds Are Betting On Hess Corporation (HES),https://finance.yahoo.com/news/hedge-funds-betting-hess-corporation-154509930.html,Insider Monkey
58,2021-10-12 10:00,Here's Why Hess (HES) is a Strong Momentum Stock,https://finance.yahoo.com/news/heres-why-hess-hes-strong-140002499.html,Zacks
59,2021-10-11 13:30,Hess Schedules Earnings Release Conference Call,https://finance.yahoo.com/news/hess-schedules-earnings-release-conference-173000894.html,Business Wire
60,2021-10-11 09:00,MSCI Upgrades Hess to AAA in Annual ESG Rating Assessment,https://finance.yahoo.com/news/msci-upgrades-hess-aaa-annual-130000451.html,Business Wire
61,2021-10-08 14:40,Why These 10 Stocks Are on the Move on Friday,https://finance.yahoo.com/news/why-10-stocks-move-friday-184033316.html,Insider Monkey
62,2021-10-07 11:31,Why Seasoned Investors are Retaining Hess Corp. (HES) Stock,https://finance.yahoo.com/news/why-seasoned-investors-retaining-hess-153103303.html,Zacks
63,2021-10-07 08:50,UPDATE 2-Exxon raises Guyana resource estimate after new discovery,https://finance.yahoo.com/news/1-exxon-mobil-raises-estimate-125043544.html,Reuters
64,2021-10-07 08:34,"Hess Announces Increase in Recoverable Resource Estimate for Stabroek Block and Significant Discovery at Cataback, Offshore Guyana",https://finance.yahoo.com/news/hess-announces-increase-recoverable-estimate-123400941.html,Business Wire
65,2021-09-29 07:09,"Zacks Industry Outlook Highlights: Occidental Petroleum, Hess Corp, Marathon Oil, DT Midstream and PHX Minerals",https://finance.yahoo.com/news/zacks-industry-outlook-highlights-occidental-110911410.html,Zacks
66,2021-09-27 12:00,Hess: Massive Underinvestment In New Production Is A Major Wildcard For Oil,https://finance.yahoo.com/news/hess-massive-underinvestment-production-major-160000640.html,Oilprice.com
67,2021-09-26 23:12,"Hess sees tight oil market in near term, underinvestment risk ahead",https://finance.yahoo.com/news/appec-hess-sees-oil-demand-031214026.html,Reuters
68,2021-09-15 11:23,Hess (HES) Up 55.9% in a Year: More Growth On the Horizon?,https://finance.yahoo.com/news/hess-hes-55-9-more-152303834.html,Zacks
69,2021-09-10 15:36,Read This Before Considering Hess Corporation (NYSE:HES) For Its Upcoming US$0.25 Dividend,https://finance.yahoo.com/news/read-considering-hess-corporation-nyse-193643914.html,Simply Wall St.
70,2021-09-09 12:20,"Hess Announces Oil Discovery at Pinktail, Offshore Guyana",https://finance.yahoo.com/news/hess-announces-oil-discovery-pinktail-113500384.html,Business Wire
71,2021-09-09 06:20,Hess (NYSE:HES) Has Announced A Dividend Of US$0.25,https://finance.yahoo.com/news/hess-nyse-hes-announced-dividend-102026261.html,Simply Wall St.
72,2021-09-02 09:22,Hess (HES) Completes Divestment of Denmark Interests to Ineos,https://finance.yahoo.com/news/hess-hes-completes-divestment-denmark-132201937.html,Zacks
73,2021-09-01 16:15,Hess Announces Regular Quarterly Dividend On Common Stock,https://finance.yahoo.com/news/hess-announces-regular-quarterly-dividend-201500141.html,Business Wire
74,2021-09-01 10:03,Hess to Participate in Barclays CEO Energy-Power Conference,https://finance.yahoo.com/news/hess-participate-barclays-ceo-energy-140300314.html,Business Wire
75,2021-08-30 09:02,Hess Completes Sale of Interests in Denmark,https://finance.yahoo.com/news/hess-completes-sale-interests-denmark-130200031.html,Business Wire
76,2021-08-27 11:31,Why Is Hess (HES) Down 13.2% Since Last Earnings Report?,https://finance.yahoo.com/news/why-hess-hes-down-13-153103839.html,Zacks
77,2021-08-17 10:18,Eni (E) Begins Production From Cuica Field Offshore Angola,https://finance.yahoo.com/news/eni-e-begins-production-cuica-141802784.html,Zacks
78,2021-08-17 10:00,"After Plunging 8.4% in 4 Weeks, Here's Why the Trend Might Reverse for Hess (HES)",https://finance.yahoo.com/news/plunging-8-4-4-weeks-140002065.html,Zacks
79,2021-08-13 10:24,Continental (CLR) Jumps 12.4% Since Reporting Q2 Earnings Beat,https://finance.yahoo.com/news/continental-clr-jumps-12-4-142402757.html,Zacks
80,2021-08-10 09:31,Phillips 66 (PSX) to Acquire 16% NOVONIX Stake for $150M,https://finance.yahoo.com/news/phillips-66-psx-acquire-16-133101024.html,Zacks
81,2021-08-02 07:07,4 Must-Buy Efficient Stocks to Build a Powerful Portfolio,https://finance.yahoo.com/news/4-must-buy-efficient-stocks-110711313.html,Zacks
82,2021-07-31 05:34,Hess Corporation (NYSE:HES) On The Verge Of Breaking Even,https://finance.yahoo.com/news/hess-corporation-nyse-hes-verge-093402587.html,Simply Wall St.
83,2021-07-28 16:31,Hess Corporation (HES) Q2 2021 Earnings Call Transcript,https://www.fool.com/earnings/call-transcripts/2021/07/28/hess-corporation-hes-q2-2021-earnings-call-transcr/?source=eptyholnk0000202&utm_source=yahoo-host&utm_medium=feed&utm_campaign=article,Motley Fool
84,2021-07-28 12:00,Exxon Makes Another Major Oil Discovery Offshore Guyana,https://finance.yahoo.com/news/exxon-makes-another-major-oil-160000024.html,Oilprice.com
85,2021-07-28 11:20,"Hess (HES) Beats on Q2 Earnings, Discovers New Oil in Guyana",https://finance.yahoo.com/news/hess-hes-beats-q2-earnings-152003950.html,Zacks
86,2021-07-28 08:55,Hess (HES) Surpasses Q2 Earnings and Revenue Estimates,https://finance.yahoo.com/news/hess-hes-surpasses-q2-earnings-125512452.html,Zacks
87,2021-07-28 08:09,"UPDATE 2-Hess Corp to add rig in Bakken basin, beats profit estimates",https://finance.yahoo.com/news/1-hess-corp-add-rig-120920511.html,Reuters
88,2021-07-28 07:30,Hess Reports Estimated Results for the Second Quarter Of 2021,https://finance.yahoo.com/news/hess-reports-estimated-results-second-113000732.html,Business Wire
89,2021-07-28 07:03,"Hess Announces Oil Discovery at Whiptail, Offshore Guyana",https://finance.yahoo.com/news/hess-announces-oil-discovery-whiptail-110300714.html,Business Wire
90,2021-07-23 06:52,Top 6 High-Flying Energy Stocks Set to Beat on Q2 Earnings,https://finance.yahoo.com/news/top-6-high-flying-energy-105210038.html,Zacks
91,2021-07-23 06:07,Is a Beat in the Cards for Hess (HES) This Earnings Season?,https://finance.yahoo.com/news/beat-cards-hess-hes-earnings-100710299.html,Zacks
92,2021-07-22 10:36,Exxon (XOM) Signs MoU to Join Acorn CCS Project in Scotland,https://finance.yahoo.com/news/exxon-xom-signs-mou-join-143602220.html,Zacks
93,2021-07-21 15:02,Hess (HES) Earnings Expected to Grow: Should You Buy?,https://finance.yahoo.com/news/hess-hes-earnings-expected-grow-190207138.html,Zacks
94,2021-07-21 14:21,"Hess Corporation Sets New Emission Reduction Targets, Demonstrates Industry Leading ESG Performance in Newly Released Annual Sustainability Report",https://finance.yahoo.com/news/hess-corporation-sets-emission-reduction-182100443.html,Business Wire
95,2021-07-13 08:51,Is Hess Corporation (HES) Going to Burn These Hedge Funds?,https://finance.yahoo.com/news/hess-corporation-hes-going-burn-125114192.html,Insider Monkey
96,2021-07-12 16:46,10 Stocks Stanley Druckenmiller is Selling,https://finance.yahoo.com/news/10-stocks-stanley-druckenmiller-selling-204645667.html,Insider Monkey
97,2021-07-12 06:39,Hess Corp (HES) Sees Hammer Chart Pattern: Time to Buy?,https://finance.yahoo.com/news/hess-corp-hes-sees-hammer-103910552.html,Zacks
98,2021-07-09 13:44,Hess Schedules Earnings Release Conference Call,https://finance.yahoo.com/news/hess-schedules-earnings-release-conference-174400934.html,Business Wire
99,2021-07-08 11:10,10 Top-Ranked Stocks Powering S&P 500 ETF,https://finance.yahoo.com/news/10-top-ranked-stocks-powering-151003086.html,Zacks
