,Date,News Headline,Article Link,Source
0,2022-02-04 16:33,How Did Hedge Funds State Street Corporation (STT) Bets Fare?,https://finance.yahoo.com/news/did-hedge-funds-state-street-213352441.html,Insider Monkey
1,2022-02-03 15:29,10 Best Dividend Stocks According to Tiger Cub Rob Citrone,https://finance.yahoo.com/news/10-best-dividend-stocks-according-202919287.html,Insider Monkey
2,2022-02-02 09:00,Charles River® Appoints Nidhi Singh as Chief Product Officer,https://finance.yahoo.com/news/charles-river-appoints-nidhi-singh-140000806.html,Business Wire
3,2022-02-01 13:38,"Tiaa, Fsb Buys iShares MBS ETF, Palo Alto Networks Inc, Oracle Corp, Sells Altria Group Inc, ...",https://finance.yahoo.com/news/tiaa-fsb-buys-ishares-mbs-183829024.html,GuruFocus.com
4,2022-01-28 14:40,10 Best Dividend Paying Stocks To Buy According to David Hardings Winton Capital Management,https://finance.yahoo.com/news/10-best-dividend-paying-stocks-194059251.html,Insider Monkey
5,2022-01-28 13:38,"American Research & Management Co. Buys Kyndryl Holdings Inc, FedEx Corp, United Parcel ...",https://finance.yahoo.com/news/american-research-management-co-buys-183822256.html,GuruFocus.com
6,2022-01-26 18:07,State Street Announces Chief Financial Officer to Participate in Credit Suisses 23rd Annual Financial Services Forum,https://finance.yahoo.com/news/state-street-announces-chief-financial-230700902.html,Business Wire
7,2022-01-25 09:38,"Private Ocean, LLC Buys Regal Rexnord Corp, T-Mobile US Inc, Vanguard Total Bond Market ETF, ...",https://finance.yahoo.com/news/private-ocean-llc-buys-regal-143812335.html,GuruFocus.com
8,2022-01-21 10:04,AM Best Affirms Credit Ratings of Federated Underwriting Company,https://finance.yahoo.com/news/am-best-affirms-credit-ratings-150400427.html,Business Wire
9,2022-01-21 09:38,"Carnegie Capital Asset Management, LLC Buys Coinbase Global Inc, GXO Logistics Inc, Upstart ...",https://finance.yahoo.com/news/carnegie-capital-asset-management-llc-143812484.html,GuruFocus.com
10,2022-01-21 09:13,If You Like EPS Growth Then Check Out State Street (NYSE:STT) Before It's Too Late,https://finance.yahoo.com/news/eps-growth-then-check-state-141316647.html,Simply Wall St.
11,2022-01-20 15:47,10 Notable Earnings Reports to Watch,https://finance.yahoo.com/news/10-notable-earnings-reports-watch-204741299.html,Insider Monkey
12,2022-01-20 11:45,Why State Street Corporation (STT) is a Great Dividend Stock Right Now,https://finance.yahoo.com/news/why-state-street-corporation-stt-164504828.html,Zacks
13,2022-01-19 14:00,"BlackRock, State Street Alums Map Plan to Disrupt Junk-Debt ETFs",https://finance.yahoo.com/news/blackrock-state-street-alums-map-190029784.html,Bloomberg
14,2022-01-19 13:48,"Stocks Inch Higher, Oil's Rally Continues",https://www.investopedia.com/stocks-inch-higher-oil-rally-continues-5216419?utm_campaign=quote-yahoo&utm_source=yahoo&utm_medium=referral,Investopedia
15,2022-01-19 12:31,State Streets Fund Unit CEO Taraporevala Is Retiring in 2022,https://finance.yahoo.com/news/state-street-fund-unit-ceo-132015500.html,Bloomberg
16,2022-01-19 10:53,"Bank Stocks: Whats Moving BAC, MS, USB and STT Today?",https://finance.yahoo.com/news/bank-stocks-moving-bac-ms-155350600.html,InvestorPlace
17,2022-01-19 10:26,State Street stock extends pullback from near 4-year high after revenue comes up shy of expectations,https://www.marketwatch.com/story/state-street-stock-extends-pullback-from-near-4-year-high-after-revenue-comes-up-shy-of-expectations-2022-01-19?siteid=yhoof2,MarketWatch
18,2022-01-19 09:41,State Street (STT) Q4 Earnings Beat on Rise in Fee Income,https://finance.yahoo.com/news/state-street-stt-q4-earnings-144102316.html,Zacks
19,2022-01-19 08:55,State Street Corporation (STT) Q4 Earnings and Revenues Beat Estimates,https://finance.yahoo.com/news/state-street-corporation-stt-q4-135501435.html,Zacks
20,2022-01-19 08:49,"State Streets Profit Rises 30% on New Business, Market Gains",https://www.wsj.com/articles/state-streets-profit-rises-30-on-new-business-market-gains-11642600175?mod=itp_wsj,The Wall Street Journal
21,2022-01-19 07:45,State Street Announces Planned Retirement of Cyrus Taraporevala,https://finance.yahoo.com/news/state-street-announces-planned-retirement-124500920.html,Business Wire
22,2022-01-19 07:32,State Street Reports Fourth-Quarter and Full-Year 2021 Financial Results,https://finance.yahoo.com/news/state-street-reports-fourth-quarter-123200759.html,Business Wire
23,2022-01-18 10:30,State Street Secures Mandate for Raytheon Technologies Corporations U.S.-Based Defined Contribution Assets,https://finance.yahoo.com/news/state-street-secures-mandate-raytheon-153000663.html,Business Wire
24,2022-01-17 13:38,"T Rowe Price Equity Income Fund Buys The Walt Disney Co, Citigroup Inc, State Street ...",https://finance.yahoo.com/news/t-rowe-price-equity-income-183802480.html,GuruFocus.com
25,2022-01-17 08:22,State Street on Track to Beat Earnings Estimates Again; Target Price $132 in Best Case,https://finance.yahoo.com/news/state-street-track-beat-earnings-132212642.html,FX Empire
26,2022-01-14 12:27,State Street Bank and Trust Company -- Moody's announces completion of a periodic review of ratings of State Street Corporation,https://finance.yahoo.com/news/state-street-bank-trust-company-172705616.html,Moody's
27,2022-01-14 11:16,Why is Earnings Beat Less Likely for State Street (STT) in Q4?,https://finance.yahoo.com/news/why-earnings-beat-less-likely-161604688.html,Zacks
28,2022-01-12 17:03,UPDATE 1-State Street calls for women on corporate boards worldwide,https://finance.yahoo.com/news/1-state-street-calls-women-220313775.html,Reuters
29,2022-01-12 15:00,State Street Corporation (STT) Reports Next Week: Wall Street Expects Earnings Growth,https://finance.yahoo.com/news/state-street-corporation-stt-reports-200008047.html,Zacks
30,2022-01-12 14:22,State Street calls for women on corporate boards worldwide,https://finance.yahoo.com/news/state-street-calls-women-corporate-192203778.html,Reuters
31,2022-01-11 08:30,State Street Global Advisors Launches Three SPDR® ETFs to Enhance ESG Portfolio Construction,https://finance.yahoo.com/news/state-street-global-advisors-launches-133000807.html,Business Wire
32,2022-01-07 12:26,SEI Investments (SEIC) Enhances Key Technology Offerings,https://finance.yahoo.com/news/sei-investments-seic-enhances-key-172605320.html,Zacks
33,2022-01-05 12:41,NFTs are 'for momentum investors on large doses of steroids': bond king Jeffrey Gundlach,https://finance.yahoo.com/news/nf-ts-are-for-momentum-investors-on-large-doses-of-steroids-bond-king-jeffrey-gundlach-174135650.html,Yahoo Finance
34,2022-01-04 16:30,State Street Corporation Announces Date for Release of Fourth-Quarter and Full-Year 2021 Financial Results and Conference Call Webcast,https://finance.yahoo.com/news/state-street-corporation-announces-date-213000162.html,Business Wire
35,2022-01-04 11:11,Bond king Jeffrey Gundlach: The yield curve may be sending a recessionary signal,https://finance.yahoo.com/news/bond-king-jeffrey-gundlach-the-yield-curve-may-be-sending-a-recessionary-signal-160935243.html,Yahoo Finance
36,2021-12-28 09:11,"State Street, BNP Paribas Make Bids for BBVA's Custody Unit",https://finance.yahoo.com/news/state-street-bnp-paribas-bids-141102844.html,Zacks
37,2021-12-25 06:38,"Morgan Stanley Institutional Fund Trust Buys Lumen Technologies Inc, Reynolds Consumer Products ...",https://finance.yahoo.com/news/morgan-stanley-institutional-fund-trust-113803880.html,GuruFocus.com
38,2021-12-23 15:25,"BNP, State Street vying to snap up BBVA's custody business sources",https://finance.yahoo.com/news/bnp-state-street-vying-snap-202530538.html,Reuters
39,2021-12-23 03:38,"Mainstay Vp Funds Trust Buys Cigna Corp, Dominion Energy Inc, Siemens AG, Sells PNC Financial ...",https://finance.yahoo.com/news/mainstay-vp-funds-trust-buys-083802711.html,GuruFocus.com
40,2021-12-20 06:00,State Street and LSEG Expand Relationship,https://finance.yahoo.com/news/state-street-lseg-expand-relationship-110000314.html,Business Wire
41,2021-12-17 22:38,"Goldman Sachs Variable Insurance Trust Mid Cap Value Fund Buys PPG Industries Inc, State Street ...",https://finance.yahoo.com/news/goldman-sachs-variable-insurance-trust-033802251.html,GuruFocus.com
42,2021-12-17 13:06,Vanguard Cuts Bond ETF Fees After Aggressive State Street Move,https://finance.yahoo.com/news/vanguard-cuts-bond-etf-fees-180628336.html,Bloomberg
43,2021-12-16 16:30,State Street Corporation Declares Fourth-Quarter Dividend on Its Common Stock,https://finance.yahoo.com/news/state-street-corporation-declares-fourth-213000204.html,Business Wire
44,2021-12-16 10:28,This is what greenwashing looks like for BlackRock,https://qz.com/2103077/how-does-blackrock-vote-on-climate-shareholder-resolutions/?utm_source=YPL,Quartz
45,2021-12-16 08:30,State Street Survey Finds Private Markets to Experience Significant Momentum in the Next Three to Five Years,https://finance.yahoo.com/news/state-street-survey-finds-private-133000270.html,Business Wire
46,2021-12-15 10:14,10 Financial Stocks to Buy According to Ken Griffins Citadel Investment Group,https://finance.yahoo.com/news/10-financial-stocks-buy-according-151435671.html,Insider Monkey
47,2021-12-13 10:49,ETFs Post a Record $1 Trillion of Inflows in 2021,https://www.investopedia.com/etfs-post-a-record-usd1-trillion-of-inflows-in-2021-5212935?utm_campaign=quote-yahoo&utm_source=yahoo&utm_medium=referral,Investopedia
48,2021-12-12 05:30,ETF Inflows Top $1 Trillion for First Time,https://www.wsj.com/articles/etf-inflows-top-1-trillion-for-first-time-11639257534?siteid=yhoof2,The Wall Street Journal
49,2021-12-11 05:38,"Penn Series Mid Cap Value Fund Buys Analog Devices Inc, Coterra Energy Inc, State Street ...",https://finance.yahoo.com/news/penn-series-mid-cap-value-103813610.html,GuruFocus.com
50,2021-12-09 05:29,State Street to lose more revenue from BlackRock move than first projected,https://www.bizjournals.com/boston/news/2021/12/09/blackrock-inc-moving-assets-state-street.html?ana=yahoo,American City Business Journals
51,2021-12-08 10:53,BlackRock (BLK) Diversifies U.S. iShares ETF Service Providers,https://finance.yahoo.com/news/blackrock-blk-diversifies-u-ishares-155303255.html,Zacks
52,2021-12-08 10:35,Jefferies reiterates buy rating on State Street after reduction of Black Rock ETF servicing business,https://www.marketwatch.com/story/jefferies-reiterates-buy-rating-on-state-street-after-reduction-of-black-rock-etf-servicing-business-2021-12-08?siteid=yhoof2,MarketWatch
53,2021-12-08 08:14,BlackRock Tanks $2 Trillion Out of State Street,https://www.thestreet.com/investing/blackrock-pulls-etfs-from-state-street?puc=yahoo&cm_ven=YAHOO,TheStreet.com
54,2021-12-07 19:19,UPDATE 1-BlackRock spreads iShares custody work across Wall Street,https://finance.yahoo.com/news/1-blackrock-spreads-ishares-custody-001928138.html,Reuters
55,2021-12-07 18:54,BlackRock to Pull Bulk of U.S. ETF Assets From State Street,https://finance.yahoo.com/news/blackrock-pull-bulk-etf-assets-230000838.html,Bloomberg
56,2021-12-07 18:06,BlackRock Strengthens ETF Operating Platform by Diversifying Post-Trade Service Providers,https://finance.yahoo.com/news/blackrock-strengthens-etf-operating-platform-230600179.html,Business Wire
57,2021-12-07 18:05,BlackRock spreads iShares custody work across Wall Street,https://finance.yahoo.com/news/blackrock-spreads-ishares-custody-across-230500836.html,Reuters
58,2021-12-07 18:00,BlackRock to Pull $2 Trillion in Assets From State Street,https://www.wsj.com/articles/blackrock-to-pull-2-trillion-in-assets-from-state-street-11638918001?siteid=yhoof2,The Wall Street Journal
59,2021-12-07 10:33,Is State Street Corporation (STT) Going to Burn These Hedge Funds?,https://finance.yahoo.com/news/state-street-corporation-stt-going-153309691.html,Insider Monkey
60,2021-12-06 08:30,"State Street Digital, Vanguard and Symbiont Complete First Live Trade for Foreign Exchange Forward Contracts Leveraging Revolutionary Blockchain Technology and Smart Contracts",https://finance.yahoo.com/news/state-street-digital-vanguard-symbiont-133000985.html,Business Wire
61,2021-12-02 14:34,"Fearless Girl Statue Faces Another Move, NFT Future",https://finance.yahoo.com/news/fearless-girl-statue-faces-another-193423779.html,Bloomberg
62,2021-12-02 08:32,State Street Cuts Fees to 0.04% to Grab More Bond ETF Flows,https://finance.yahoo.com/news/state-street-tiny-fee-cut-214404003.html,Bloomberg
63,2021-11-30 16:22,Former consumer watchdog Richard Cordray in mix for top regulatory role at Fed: Sen. Brown,https://finance.yahoo.com/news/former-consumer-watchdog-richard-cordray-in-mix-for-top-regulatory-role-at-fed-sen-brown-212216069.html,Yahoo Finance
64,2021-11-30 09:00,Federated Hermes Equity Strategies Now Live on Charles River® Investment Management Solution on Microsoft® Azure,https://finance.yahoo.com/news/federated-hermes-equity-strategies-now-140000450.html,Business Wire
65,2021-11-29 14:46,State Streets Fearless Girl statue faces uncertain future in NYC,https://www.bizjournals.com/boston/news/2021/11/29/state-street-s-fearless-girl-statue-faces-uncert.html?ana=yahoo,American City Business Journals
66,2021-11-29 09:30,State Street Global Advisors and the University of California Innovate on Retirement Income Strategy with Launch to Participants,https://finance.yahoo.com/news/state-street-global-advisors-university-143000791.html,Business Wire
67,2021-11-21 16:50,Bank of England Officials Add to Questions on December Rate Rise,https://finance.yahoo.com/news/bank-england-officials-add-questions-215059154.html,Bloomberg
68,2021-11-21 00:00,"BOE Divides Goldman Asset, State Street in Bets on U.K. Markets",https://finance.yahoo.com/news/boe-divides-goldman-asset-state-050001009.html,Bloomberg
69,2021-11-19 09:00,State Street Hires Veteran-Owned Firms to Underwrite 2027 Senior Notes Offering,https://finance.yahoo.com/news/state-street-hires-veteran-owned-140000552.html,Business Wire
70,2021-11-18 08:00,State Street Alpha Announces Strategic Partnership with RIMES to Enhance Index and Benchmark Services,https://finance.yahoo.com/news/state-street-alpha-announces-strategic-130000954.html,Business Wire
71,2021-11-17 11:30,State Street Corporation (STT) Up 1.6% Since Last Earnings Report: Can It Continue?,https://finance.yahoo.com/news/state-street-corporation-stt-1-163004519.html,Zacks
72,2021-11-17 08:30,"State Street Announces Partnerships with MITs Antionette Schoar, Harvards Robin Greenwood to Advance Cryptocurrency and Macroeconomic Research Initiatives",https://finance.yahoo.com/news/state-street-announces-partnerships-mit-133000061.html,Business Wire
73,2021-11-15 10:30,State Street Global Advisors Introduces I&D Focused Share Class within Cash Management Suite,https://finance.yahoo.com/news/state-street-global-advisors-introduces-153000003.html,Business Wire
74,2021-11-12 16:30,State Street Announces Chairman & Chief Executive Officer and Chief Financial Officer to Participate in the Goldman Sachs 2021 US Financial Services Conference,https://finance.yahoo.com/news/state-street-announces-chairman-chief-213000487.html,Business Wire
75,2021-11-10 10:15,Report: One Of Worlds Largest Investment Firms Need Permission To Hire White Men  But Financial Giant Denies The Claims,https://finance.yahoo.com/news/report-one-world-largest-investment-151546727.html,Black Enterprise
76,2021-11-10 09:30,"Charles River® IMS Integrates with MTS BondsPro ATS, Enabling All-to-All Access Across Global Fixed Income Markets",https://finance.yahoo.com/news/charles-river-ims-integrates-mts-143000081.html,Business Wire
77,2021-11-08 08:47,3 Undervalued Stocks You Can Buy Today,https://www.fool.com/investing/2021/11/08/3-undervalued-stocks-you-can-buy-today/?source=eptyholnk0000202&utm_source=yahoo-host&utm_medium=feed&utm_campaign=article,Motley Fool
78,2021-11-01 06:30,Charles River® Appoints Caroline OShaughnessy as New EMEA Head,https://finance.yahoo.com/news/charles-river-appoints-caroline-o-103000868.html,Business Wire
79,2021-10-25 15:37,State Street To Appoint Brad Hu to Chief Risk Officer,https://finance.yahoo.com/news/state-street-appoint-brad-hu-193700466.html,Business Wire
80,2021-10-21 16:30,State Street Announces Chief Financial Officer to Participate in the BancAnalysts Association of Boston Conference,https://finance.yahoo.com/news/state-street-announces-chief-financial-203000204.html,Business Wire
81,2021-10-20 16:30,"State Street Corporation Declares Dividends on Its Non-Cumulative Perpetual Preferred Stock Series ""D"", ""F"", ""G"" and ""H""",https://finance.yahoo.com/news/state-street-corporation-declares-dividends-203000319.html,Business Wire
82,2021-10-20 12:09,10 Earnings Reports Everyone is Talking About,https://finance.yahoo.com/news/10-earnings-reports-everyone-talking-160906138.html,Insider Monkey
83,2021-10-20 09:30,State Street Announces First Transaction Under Peer-to-Peer Repo Program,https://finance.yahoo.com/news/state-street-announces-first-transaction-133000311.html,Business Wire
84,2021-10-19 10:35,State Street Stock Flashing Renewed Technical Strength With Rising RS,https://www.investors.com/research/stocks-flashing-renewed-technical-strength-state-street-2/?src=A00220,Investor's Business Daily
85,2021-10-19 09:25,"Company News for Oct 19, 2021",https://finance.yahoo.com/news/company-news-oct-19-2021-132501084.html,Zacks
86,2021-10-18 14:39,State Street CEO addresses reports of M&A talks around investment unit,https://www.bizjournals.com/boston/news/2021/10/18/state-street-ceo-addresses-reports-of-m-a-talks-ar.html?ana=yahoo,American City Business Journals
87,2021-10-18 14:36,"State Street Profit Increases 29% on More Assets, Market Gains",https://www.wsj.com/articles/state-street-profit-increases-29-on-more-assets-market-gains-11634582188?mod=itp_wsj,The Wall Street Journal
88,2021-10-18 11:45,Why State Street Corporation (STT) is a Top Dividend Stock for Your Portfolio,https://finance.yahoo.com/news/why-state-street-corporation-stt-154503010.html,Zacks
89,2021-10-18 09:19,State Street (STT) Stock Up on Q3 Earnings & Revenue Beat,https://finance.yahoo.com/news/state-street-stt-stock-q3-131901107.html,Zacks
90,2021-10-18 08:55,State Street Corporation (STT) Tops Q3 Earnings and Revenue Estimates,https://finance.yahoo.com/news/state-street-corporation-stt-tops-125512964.html,Zacks
91,2021-10-18 07:55,State Street net income rises by 29%,https://www.marketwatch.com/story/state-street-net-income-rises-by-29-2021-10-18?siteid=yhoof2,MarketWatch
92,2021-10-18 07:32,State Street Reports Third-Quarter 2021 Financial Results,https://finance.yahoo.com/news/state-street-reports-third-quarter-113200158.html,Business Wire
93,2021-10-18 04:28,"5 Stocks To Watch For October 18, 2021",https://finance.yahoo.com/news/5-stocks-watch-october-18-082828136.html,Benzinga
94,2021-10-15 09:48,What's in the Cards for State Street (STT) in Q3 Earnings?,https://finance.yahoo.com/news/whats-cards-state-street-stt-134801561.html,Zacks
95,2021-10-14 08:00,State Street Digital Appointed by Digital Securities Depository Corporation (DSDC),https://finance.yahoo.com/news/state-street-digital-appointed-digital-120000209.html,Business Wire
96,2021-10-12 20:28,Hedge Funds Are Buying State Street Corporation (STT),https://finance.yahoo.com/news/hedge-funds-buying-state-street-002822332.html,Insider Monkey
97,2021-10-12 08:55,"State Street (STT) Rides on Strategic Buyouts, Low Rates a Woe",https://finance.yahoo.com/news/state-street-stt-rides-strategic-125512311.html,Zacks
98,2021-10-12 08:30,State Street Announces Expansion of Direct Access Lending,https://finance.yahoo.com/news/state-street-announces-expansion-direct-123000607.html,Business Wire
99,2021-10-11 15:00,State Street Corporation (STT) Earnings Expected to Grow: Should You Buy?,https://finance.yahoo.com/news/state-street-corporation-stt-earnings-190007199.html,Zacks
